question,answer,contexts,ground_truths,reference
¿A quién se le aplica el Estatuto de los Trabajadores (en adelante ET)?," El Estatuto de los Trabajadores (ET) se aplica a los empleados. Sin embargo, en caso de una disputa, las empresas contratistas y subcontratistas que comparten un centro de trabajo pueden tener una representación legal para los trabajadores y usar locales de comunicación con ellos. Los convenios colectivos resultan del acuerdo libre entre los representantes de los trabajadores y los empleadores y en su ámbito correspondiente, los trabajadores y los empleadores están sujetos a determinadas disposiciones generales sobre la negociación colectiva y los convenios colectivos.","['sindical, la opción corresponderá siempre a este. De no efectuar la opción, se entenderá que \nlo hace por la readmisión. Cuando la opción, expresa o presunta, sea en favor de la \nreadmisión, esta será obligada. Tanto si opta por la indemnización como si lo hace por la \nreadmisión, tendrá derecho a los salarios de tramitación a los que se refiere el apartado 2.\n5. Cuando la sentencia que declare la improcedencia del despido se dicte transcurridos \nmás de noventa días hábiles desde la fecha en que se presentó la demanda, el empresario \npodrá reclamar del Estado el abono de la percepción económica a la que se refiere el \napartado 2, correspondiente al tiempo que exceda de dichos noventa días hábiles.\nEn los casos de despido en que, con arreglo a este apartado, sean por cuenta del \nEstado los salarios de tramitación, serán con cargo al mismo las cuotas de la Seguridad \nSocial correspondientes a dichos salarios.\nSección 5.ª Procedimiento concursal\nArtículo 57.  Procedimiento concursal.'
 'adecuado en el que puedan desarrollar sus actividades y comunicarse con los trabajadores, \nasí como uno o varios tablones de anuncios. La representación legal de los trabajadores de \nlas empresas contratistas y subcontratistas que compartan de forma continuada centro de \ntrabajo podrán hacer uso de dichos locales en los términos que acuerden con la empresa. \nLas posibles discrepancias se resolverán por la autoridad laboral, previo informe de la \nInspección de Trabajo y Seguridad Social.\nTÍTULO III\nDe la negociación colectiva y de los convenios colectivos\nCAPÍTULO I\nDisposiciones generales\nSección 1.ª Naturaleza y efectos de los convenios\nArtículo 82.  Concepto y eficacia.\n1. Los convenios colectivos, como resultado de la negociación desarrollada por los \nrepresentantes de los trabajadores y de los empresarios, constituyen la expresión del \nacuerdo libremente adoptado por ellos en virtud de su autonomía colectiva.\n2. Mediante los convenios colectivos, y en su ámbito correspondiente, los trabajadores y'
 'Esta excepción no abarca aquellos datos que tengan relación con el volumen de empleo \nen la empresa.\n5. La impugnación de las decisiones de la empresa de atribuir carácter reservado o de \nno comunicar determinadas informaciones a los representantes de los trabajadores se \ntramitará conforme al proceso de conflictos colectivos regulado en el capítulo VIII del título II \ndel libro segundo de la Ley 36/2011, de 10 de octubre, reguladora de la Jurisdicción Social.\nAsimismo, se tramitarán conforme a este proceso los litigios relativos al cumplimiento por \nlos representantes de los trabajadores y por los expertos que les asistan de su obligación de \nsigilo.\nLo dispuesto en este apartado se entiende sin perjuicio de lo previsto en el texto \nrefundido de la Ley sobre Infracciones y Sanciones en el Orden Social, aprobado por el Real \nDecreto Legislativo 5/2000, de 4 de agosto, para los casos de negativa injustificada de la \ninformación a que tienen derecho los representantes de los trabajadores.']","['Esta ley será de aplicación a los trabajadores que voluntariamente presten sus servicios retribuidos por cuenta ajena y dentro del ámbito de organización y dirección de otra persona, física o jurídica']","Esta ley será de aplicación a los trabajadores que voluntariamente presten sus servicios retribuidos por cuenta ajena y dentro del ámbito de organización y dirección de otra persona, física o jurídica, denominada empleador o empresario."
¿Qué se considera un empresario en la legislación laboral?," Un empresario, según la legislación laboral en este contexto, es una persona que contrata a trabajadores para realizar actividades económicas definidas por los códigos de la Clasificación Nacional de Actividades Económicas (CNAE). Este empresario puede utilizar contratos a tiempo completo o parcial y debe cumplir con las reglas establecidas en el artículo 8.2 y posteriores, tales como el formalizar el contrato por escrito y especificar la jornada de trabajo. Además, si no hay un convenio colectivo específico para la empresa, se aplicará el del sector de la actividad desarrollada en la contrata o subcontrata. Las personas trabajadoras de las empresas contratistas y subcontratistas tienen derecho a formular reclamaciones relativas a las condiciones de ejecución de la actividad laboral a través de su representación legal, salvo que haya otra representación en la empresa principal.","['2. Excepcionalmente, con el objetivo de alcanzar la igualdad real y efectiva entre mujeres \ny hombres coadyuvando a superar la segregación ocupacional por género, el límite del \napartado anterior podrá rebajarse hasta la edad ordinaria de jubilación fijada por la normativa \nde Seguridad Social cuando la tasa de ocupación de las mujeres trabajadoras por cuenta \najena afiliadas a la Seguridad Social en alguna de las actividades económicas \ncorrespondientes al ámbito funcional del convenio sea inferior al 20 por ciento de las \npersonas ocupadas en las mismas.\nLas actividades económicas que se tomarán como referencia para determinar el \ncumplimiento de esta condición estará definida por los códigos de la Clasificación Nacional \nde Actividades Económicas (CNAE) en vigor en cada momento, incluidos en el ámbito del \nconvenio aplicable según los datos facilitados al realizar su inscripción en el Registro y \ndepósito de convenios y acuerdos colectivos de trabajo y planes de igualdad (REGCON), de'
 'A efectos de lo dispuesto en el párrafo anterior, se entenderá por «trabajador a tiempo \ncompleto comparable» a un trabajador a tiempo completo de la misma empresa y centro de \ntrabajo, con el mismo tipo de contrato de trabajo y que realice un trabajo idéntico o similar. Si \nen la empresa no hubiera ningún trabajador comparable a tiempo completo, se considerará \nla jornada a tiempo completo prevista en el convenio colectivo de aplicación o, en su defecto, \nla jornada máxima legal.\n2. El contrato a tiempo parcial podrá concertarse por tiempo indefinido o por duración \ndeterminada en los supuestos en los que legalmente se permita la utilización de esta \nmodalidad de contratación.\n3. (Derogado)\n4. El contrato a tiempo parcial se regirá por las siguientes reglas:\na) El contrato, conforme a lo dispuesto en el artículo 8.2, se deberá formalizar \nnecesariamente por escrito. En el contrato deberá figurar el número de horas ordinarias de'
 '6. El convenio colectivo de aplicación para las empresas contratistas y subcontratistas \nserá el del sector de la actividad desarrollada en la contrata o subcontrata, con \nindependencia de su objeto social o forma jurídica, salvo que exista otro convenio sectorial \naplicable conforme a lo dispuesto en el título III.\nNo obstante, cuando la empresa contratista o subcontratista cuente con un convenio \npropio, se aplicará este, en los términos que resulten del artículo 84.\n7. Las personas trabajadoras de las empresas contratistas y subcontratistas, cuando no \ntengan representación legal, tendrán derecho a formular a la representación legal de \npersonas trabajadoras de la empresa principal cuestiones relativas a las condiciones de \nejecución de la actividad laboral, mientras compartan centro de trabajo y carezcan de \nrepresentación.\nLo dispuesto en el párrafo anterior no será de aplicación a las reclamaciones de la \npersona trabajadora respecto de la empresa de la que depende.']","['Serán empresarios todas las personas, físicas o jurídicas, o comunidades de bienes que reciban la prestación de servicios de las personas referidas en el apartado anterior, así como de las personas contratadas para ser cedidas a empresas usuarias por empresas de trabajo temporal legalmente constituidas.']","A los efectos de esta ley, serán empresarios todas las personas, físicas o jurídicas, o comunidades de bienes que reciban la prestación de servicios de las personas referidas en el apartado anterior, así como de las personas contratadas para ser cedidas a empresas usuarias por empresas de trabajo temporal legalmente constituidas."
¿Qué relaciones laborales se excluyen de la aplicación del ET?," Las relaciones laborales excluidas de la aplicación del ET incluyen las siguientes:

* El límite del apartado anterior puede rebajarse hasta la edad ordinaria de jubilación cuando la tasa de ocupación de mujeres trabajadoras por cuenta ajena sea inferior al 20% en actividades económicas definidas por los códigos de la Clasificación Nacional de Actividades Económicas (CNAE).
* Los preceptos reglamentarios, cláusulas de los convenios colectivos, pactos individuales y decisiones unilaterales del empresario que trabajan a turnos.
* La adaptación al ámbito de la empresa del sistema de clasificación profesional de las personas trabajadoras en caso de no existir acuerdo o convenio colectivo específico sobre el asunto.
* Las medidas que dispongan los acuerdos y convenios colectivos a que se refiere el artículo 83.2 pero no podrán disponer de la prioridad aplicativa prevista en este apartado.

Las personas trabajadoras fijas-discontinuas tienen consideración de colectivo prioritario para el acceso a las iniciativas de formación del sistema de formación profesional para el empleo en el ámbito laboral durante los periodos de inactividad.","['2. Excepcionalmente, con el objetivo de alcanzar la igualdad real y efectiva entre mujeres \ny hombres coadyuvando a superar la segregación ocupacional por género, el límite del \napartado anterior podrá rebajarse hasta la edad ordinaria de jubilación fijada por la normativa \nde Seguridad Social cuando la tasa de ocupación de las mujeres trabajadoras por cuenta \najena afiliadas a la Seguridad Social en alguna de las actividades económicas \ncorrespondientes al ámbito funcional del convenio sea inferior al 20 por ciento de las \npersonas ocupadas en las mismas.\nLas actividades económicas que se tomarán como referencia para determinar el \ncumplimiento de esta condición estará definida por los códigos de la Clasificación Nacional \nde Actividades Económicas (CNAE) en vigor en cada momento, incluidos en el ámbito del \nconvenio aplicable según los datos facilitados al realizar su inscripción en el Registro y \ndepósito de convenios y acuerdos colectivos de trabajo y planes de igualdad (REGCON), de'
 'proporcionalidad y transparencia.\n7. La empresa deberá informar a las personas fijas-discontinuas y a la representación \nlegal de las personas trabajadoras sobre la existencia de puestos de trabajo vacantes de \ncarácter fijo ordinario, de manera que aquellas puedan formular solicitudes de conversión \nvoluntaria, de conformidad con los procedimientos que establezca el convenio colectivo \nsectorial o, en su defecto, el acuerdo de empresa.\n8. Las personas trabajadoras fijas-discontinuas tendrán la consideración de colectivo \nprioritario para el acceso a las iniciativas de formación del sistema de formación profesional \npara el empleo en el ámbito laboral durante los periodos de inactividad.\nSección 2.ª Derechos y deberes derivados del contrato\nArtículo 17.  No discriminación en las relaciones laborales.\n1. Se entenderán nulos y sin efecto los preceptos reglamentarios, las cláusulas de los \nconvenios colectivos, los pactos individuales y las decisiones unilaterales del empresario que'
 'trabajo a turnos.\nb) El horario y la distribución del tiempo de trabajo, el régimen de trabajo a turnos y la \nplanificación anual de las vacaciones.\nc) La adaptación al ámbito de la empresa del sistema de clasificación profesional de las \npersonas trabajadoras.\nd) La adaptación de los aspectos de las modalidades de contratación que se atribuyen \npor esta ley a los convenios de empresa.\ne) Las medidas para favorecer la corresponsabilidad y la conciliación entre la vida \nlaboral, familiar y personal.\nf) Aquellas otras que dispongan los acuerdos y convenios colectivos a que se refiere el \nartículo 83.2.\nIgual prioridad aplicativa tendrán en estas materias los convenios colectivos para un \ngrupo de empresas o una pluralidad de empresas vinculadas por razones organizativas o \nproductivas y nominativamente identificadas a que se refiere el artículo 87.1.\nLos acuerdos y convenios colectivos a que se refiere el artículo 83.2 no podrán disponer \nde la prioridad aplicativa prevista en este apartado.']","['Se excluyen del ámbito regulado por esta ley:\na) La relación de servicio de los funcionarios públicos, que se regirá por las correspon-dientes normas legales y reglamentarias, así como la del personal al servicio de las Administraciones Públicas y demás entes, organismos y entidades del sector público, cuando, al amparo de una ley, dicha relación se regule por normas administrativas o estatutarias.\nb) Las prestaciones personales obligatorias.\nc) La actividad que se limite, pura y simplemente, al mero desempeño del cargo de consejero o miembro de los órganos de administración en las empresas que revistan la forma jurídica de sociedad y siempre que su actividad en la empresa solo comporte la realización de cometidos inherentes a tal cargo.\nd) Los trabajos realizados a título de amistad, benevolencia o buena vecindad.\ne) Los trabajos familiares, salvo que se demuestre la condición de asalariados de quienes los llevan a cabo. Se considerarán familiares, a estos efectos, siempre que convivan con el empresario, el cónyuge, los descendientes, ascendientes y demás parientes por consanguinidad o afinidad, hasta el segundo grado inclusive y, en su caso, por adop-ción.\nf) La actividad de las personas que intervengan en operaciones mercantiles por cuenta de uno o más empresarios, siempre que queden personalmente obligados a responder del buen fin de la operación asumiendo el riesgo y ventura de la misma.\ng) En general, todo trabajo que se efectúe en desarrollo de relación distinta de la que define el apartado 1.\nA tales efectos se entenderá excluida del ámbito laboral la actividad de las personas prestadoras del servicio de transporte al amparo de autorizaciones administrativas de las que sean titulares, realizada, mediante el correspondiente precio, con vehículos comerciales de servicio público cuya propiedad o poder directo de disposición osten-ten, aun cuando dichos servicios se realicen de forma continuada para un mismo cargador o comercializador']","Se excluyen del ámbito regulado por esta ley:
a) La relación de servicio de los funcionarios públicos, que se regirá por las correspondientes normas legales y reglamentarias, así como la del personal al servicio de las Administraciones Públicas y demás entes, organismos y entidades del sector público, cuando, al amparo de una ley, dicha relación se regule por normas administrativas o estatutarias.
b) Las prestaciones personales obligatorias.
c) La actividad que se limite, pura y simplemente, al mero desempeño del cargo de consejero o miembro de los órganos de administración en las empresas que revistan la forma jurídica de sociedad y siempre que su actividad en la empresa solo comporte la realización de cometidos inherentes a tal cargo.
d) Los trabajos realizados a título de amistad, benevolencia o buena vecindad.
e) Los trabajos familiares, salvo que se demuestre la condición de asalariados de quienes los llevan a cabo. Se considerarán familiares, a estos efectos, siempre que convivan con el empresario, el cónyuge, los descendientes, ascendientes y demás parientes por consanguinidad o afinidad, hasta el segundo grado inclusive y, en su caso, por adop-ción.
f) La actividad de las personas que intervengan en operaciones mercantiles por cuenta de uno o más empresarios, siempre que queden personalmente obligados a responder del buen fin de la operación asumiendo el riesgo y ventura de la misma.
g) En general, todo trabajo que se efectúe en desarrollo de relación distinta de la que define el apartado 1.
A tales efectos se entenderá excluida del ámbito laboral la actividad de las personas prestadoras del servicio de transporte al amparo de autorizaciones administrativas de las que sean titulares, realizada, mediante el correspondiente precio, con vehículos comerciales de servicio público cuya propiedad o poder directo de disposición ostenten, aun cuando dichos servicios se realicen de forma continuada para un mismo cargador o comercializador"
"Si tengo una empresa española, ¿Se aplican los derechos económicos de la legislación española laboral a los trabajadores españoles contratados en España?"," Si tienes una empresa con actividad en España y otro Estado miembro de la Unión Europea, los derechos económicos de la legislación española laboral aplicarían solo a los trabajadores españoles que ejerzan o han ejercido habitualmente su trabajo en España en caso de no cumplirse todas las circunstancias descritas en el artículo 9. Si se da cualquiera de esas circunstancias, la regulación de dichas relaciones laborales respetará los derechos básicos reconocidos por la Constitución. En caso de procedimiento concursal solicitado en España sobre una empresa que tenga actividad en otro Estado miembro además de España, el Fondo de Garantía Salarial estaría obligado a proporcionar información sobre los créditos pendientes de pago a la institución de garantía del Estado donde trabajadores de la empresa ejercen habitualmente su trabajo.","['8. El Fondo de Garantía Salarial tendrá la consideración de parte en la tramitación de los \nprocedimientos arbitrales, a efectos de asumir las obligaciones previstas en este artículo.\n9. El Fondo de Garantía Salarial dispensará la protección regulada en este artículo en \nrelación con los créditos impagados de los trabajadores que ejerzan o hayan ejercido \nhabitualmente su trabajo en España cuando pertenezcan a una empresa con actividad en el \nterritorio de al menos dos Estados miembros de la Unión Europea, uno de los cuales sea \nEspaña, cuando concurran, conjuntamente, las siguientes circunstancias:\na) Que se haya solicitado la apertura de un procedimiento colectivo basado en la \ninsolvencia del empresario en un Estado miembro distinto de España, previsto por sus \ndisposiciones legales y administrativas, que implique el desapoderamiento parcial o total del \nempresario y el nombramiento de un síndico o persona que ejerza una función similar.'
 'f) La de las personas que intervengan en operaciones mercantiles por cuenta de uno o \nmás empresarios sin asumir el riesgo y ventura de aquellas.\ng) La de los trabajadores con discapacidad que presten sus servicios en los centros \nespeciales de empleo.\nh) (Derogada)\ni) La de los menores sometidos a la ejecución de medidas de internamiento para el \ncumplimiento de su responsabilidad penal.\nj) La de residencia para la formación de especialistas en Ciencias de la Salud.\nk) La de los abogados que prestan servicios en despachos de abogados, individuales o \ncolectivos.\nl) Cualquier otro trabajo que sea expresamente declarado como relación laboral de \ncarácter especial por una ley.\n2. En todos los supuestos señalados en el apartado anterior, la regulación de dichas \nrelaciones laborales respetará los derechos básicos reconocidos por la Constitución.\nArtículo 3.  Fuentes de la relación laboral.\n1. Los derechos y obligaciones concernientes a la relación laboral se regulan:'
 'como para conseguir el reembolso de dichas cantidades.\n10. En el supuesto de procedimiento concursal solicitado en España en relación con una \nempresa con actividad en el territorio de al menos otro Estado miembro de la Unión Europea, \nademás de España, el Fondo de Garantía Salarial estará obligado a proporcionar \ninformación a la institución de garantía del Estado en cuyo territorio los trabajadores de la \nempresa en estado de insolvencia hayan ejercido o ejerzan habitualmente su trabajo, en \nparticular, poniendo en su conocimiento los créditos pendientes de pago de los trabajadores, \nasí como los satisfechos por el propio Fondo de Garantía Salarial.\nAsimismo, el Fondo de Garantía Salarial prestará a la institución de garantía competente \nla colaboración que le sea requerida en relación con su intervención en el procedimiento y \ncon el reembolso de las cantidades abonadas a los trabajadores.\n11. El Fondo procederá a la instrucción de un expediente para la comprobación de la']",['La legislación laboral española será de aplicación al trabajo que presten los trabajadores españoles contratados en España al servicio de empresas españolas en el extranjero'],"La legislación laboral española será de aplicación al trabajo que presten los trabajadores españoles contratados en España al servicio de empresas españolas en el extranjero, sin perjuicio de las normas de orden público aplicables en el lugar de trabajo. Dichos trabajadores tendrán, al menos, los derechos económicos que les corresponderían de trabajar en territorio español."
¿Qué es un centro de trabajo?," Un centro de trabajo es un lugar donde se realiza la actividad laboral y donde las personas trabajadoras están empleadas. Una empresa puede trasladar o cambiar el centro de trabajo de sus empleados cuando tiene vacantes en otros centros, durante un período inicial de seis a doce meses. Después de este período, las personas trabajadoras pueden optar por regresar a su puesto anterior, permanecer en el nuevo o extender su contrato con una indemnización.","['preferente a ocupar otro puesto de trabajo, del mismo grupo profesional o categoría \nequivalente, que la empresa tenga vacante en cualquier otro de sus centros de trabajo.\nEn tales supuestos, la empresa estará obligada a comunicar a las personas trabajadoras \nlas vacantes existentes en dicho momento o las que se pudieran producir en el futuro.\nEl traslado o el cambio de centro de trabajo tendrá una duración inicial de entre seis y \ndoce meses, durante los cuales la empresa tendrá la obligación de reservar el puesto de \ntrabajo que anteriormente ocupaban las personas trabajadoras.\nTerminado este periodo, las personas trabajadoras podrán optar entre el regreso a su \npuesto de trabajo anterior o la continuidad en el nuevo, decayendo en este caso la obligación \nde reserva, o la extinción de su contrato, percibiendo una indemnización de veinte días de \nsalario por año de servicio, prorrateándose por meses los periodos de tiempo inferiores a un \naño y con un máximo de doce mensualidades.'
 'territoriales, para incrementar las oportunidades de colocación de los trabajadores en \nsituación de desempleo.\n3. No se tendrá en cuenta, a efectos de la duración máxima de la jornada ordinaria \nlaboral, ni para el cómputo del número máximo de las horas extraordinarias autorizadas, el \nexceso de las trabajadas para prevenir o reparar siniestros y otros daños extraordinarios y \nurgentes, sin perjuicio de su compensación como horas extraordinarias.\n4. La prestación de trabajo en horas extraordinarias será voluntaria, salvo que su \nrealización se haya pactado en convenio colectivo o contrato individual de trabajo, dentro de \nlos límites del apartado 2.\n5. A efectos del cómputo de horas extraordinarias, la jornada de cada trabajador se \nregistrará día a día y se totalizará en el periodo fijado para el abono de las retribuciones, \nentregando copia del resumen al trabajador en el recibo correspondiente.\nArtículo 36.  Trabajo nocturno, trabajo a turnos y ritmo de trabajo.'
 'produzcan cambios, entre otros, en el ámbito de los sistemas y métodos de trabajo del \npersonal o en el modo de organizar la producción; y causas productivas cuando se \nproduzcan cambios, entre otros, en la demanda de los productos o servicios que la empresa \npretende colocar en el mercado.\n3. El procedimiento, que será aplicable cualquiera que sea el número de personas \ntrabajadoras de la empresa y el número de personas afectadas por la reducción o por la \nsuspensión, se iniciará mediante comunicación a la autoridad laboral competente y la \napertura simultánea de un periodo de consultas con la representación legal de las personas \ntrabajadoras de duración no superior a quince días.\nEn el supuesto de empresas de menos de cincuenta personas de plantilla, la duración \ndel periodo de consultas no será superior a siete días.\nLa consulta se llevará a cabo en una única comisión negociadora, si bien, de existir \nvarios centros de trabajo, quedará circunscrita a los centros afectados por el procedimiento.']","['se considera centro de trabajo la unidad productiva con organización específica, que sea dada de alta, como tal, ante la autoridad laboral.']","A efectos de esta ley se considera centro de trabajo la unidad productiva con organización específica, que sea dada de alta, como tal, ante la autoridad laboral.
En la actividad de trabajo en el mar se considerará como centro de trabajo el buque, entendiéndose situado en la provincia donde radique su puerto de base."
¿Hay relaciones laborales de carácter especial?," Existen relaciones laborales especiales en los contratos, como la promoción económica según el artículo 25, y la no discriminación según el artículo 17. Además, se puede establecer prioridades de permanencia a favor de trabajadores con cargas familiares, mayores de edad o personas con discapacidad. También hay modificaciones sustanciales de las condiciones de trabajo en caso de probadas razones económicas, técnicas, organizativas o de producción, tal como se establece en el artículo 41.","['como indirecta, entre mujeres y hombres, pudiendo establecerse medidas de acción positiva \ndirigidas a eliminar o compensar situaciones de discriminación.\nArtículo 25.  Promoción económica.\n1. El trabajador, en función del trabajo desarrollado, podrá tener derecho a una \npromoción económica en los términos fijados en convenio colectivo o contrato individual.\n2. Lo dispuesto en el apartado anterior se entiende sin perjuicio de los derechos \nadquiridos o en curso de adquisición en el tramo temporal correspondiente.BOLETÍN OFICIAL DEL ESTADO\nLEGISLACIÓN CONSOLIDADA\nPágina 27'
 'proporcionalidad y transparencia.\n7. La empresa deberá informar a las personas fijas-discontinuas y a la representación \nlegal de las personas trabajadoras sobre la existencia de puestos de trabajo vacantes de \ncarácter fijo ordinario, de manera que aquellas puedan formular solicitudes de conversión \nvoluntaria, de conformidad con los procedimientos que establezca el convenio colectivo \nsectorial o, en su defecto, el acuerdo de empresa.\n8. Las personas trabajadoras fijas-discontinuas tendrán la consideración de colectivo \nprioritario para el acceso a las iniciativas de formación del sistema de formación profesional \npara el empleo en el ámbito laboral durante los periodos de inactividad.\nSección 2.ª Derechos y deberes derivados del contrato\nArtículo 17.  No discriminación en las relaciones laborales.\n1. Se entenderán nulos y sin efecto los preceptos reglamentarios, las cláusulas de los \nconvenios colectivos, los pactos individuales y las decisiones unilaterales del empresario que'
 'los puestos de trabajo a que se refiere este artículo. Mediante convenio colectivo o acuerdo \nalcanzado durante el periodo de consultas se podrán establecer prioridades de permanencia \na favor de trabajadores de otros colectivos, tales como trabajadores con cargas familiares, \nmayores de determinada edad o personas con discapacidad.\nArtículo 41.  Modificaciones sustanciales de condiciones de trabajo.\n1. La dirección de la empresa podrá acordar modificaciones sustanciales de las \ncondiciones de trabajo cuando existan probadas razones económicas, técnicas, \norganizativas o de producción. Se considerarán tales las que estén relacionadas con la \ncompetitividad, productividad u organización técnica o del trabajo en la empresa.\nTendrán la consideración de modificaciones sustanciales de las condiciones de trabajo, \nentre otras, las que afecten a las siguientes materias:\na) Jornada de trabajo.\nb) Horario y distribución del tiempo de trabajo.\nc) Régimen de trabajo a turnos.']","['a) La del personal de alta dirección no incluido en el artículo 1.3.c\nb) La del servicio del hogar familiar. \nc) La de los penados en las instituciones penitenciarias. \nd) La de los deportistas profesionales.\ne) La de los artistas en espectáculos públicos.\nf) La de las personas que intervengan en operaciones mercantiles por cuenta de uno o más empresarios sin asumir el riesgo y ventura de aquellas. \ng) La de los trabajadores con discapacidad que presten sus servicios en los centros especiales de empleo. \ni)  La de los menores sometidos a la ejecución de medidas de internamiento para el cumplimiento de su responsabilidad penal. \nj)   La de residencia para la formación de especialistas en Ciencias de la Salud.\nk) La de los abogados que prestan servicios en despachos de abogados, individuales o colectivos.']","Se considerarán relaciones laborales de carácter especial:
a) La del personal de alta dirección no incluido en el artículo 1.3.c): La actividad que se limite, pura y simplemente, al mero desempeño del cargo de consejero o miembro de los órganos de administración en las empresas que revistan la forma jurídica de socie-dad y siempre que su actividad en la empresa solo comporte la realización de cometi-dos inherentes a tal cargo. R.D. 1382/1985, de 1 de agosto, por el que se regula la relación laboral de carácter especial del personal de Alta Dirección
b) La del servicio del hogar familiar. Artículo 250 del R.D. Legislativo 8/2015, de 30 de octubre, por el que se aprueba el texto refundido de la Ley General de la Seguridad Social
c) La de los penados en las instituciones penitenciarias. R.D. 782/2001, 6 julio, por el que se regula la relación laboral de carácter especial de los penados que realicen activida-des laborales en talleres penitenciarios y la protección de Seguridad Social de los sometidos a penas de trabajo en beneficio de la comunidad
d) La de los deportistas profesionales. R.D. 1006/1985, de 26 de junio, por el que se regula la relación laboral especial de los deportistas profesionales
e) La de los artistas en espectáculos públicos. R.D. 1435/1985, de 1 de agosto, por el que se regula la relación laboral especial de los artistas en espectáculos públicos.
f) La de las personas que intervengan en operaciones mercantiles por cuenta de uno o más empresarios sin asumir el riesgo y ventura de aquellas. R.D. 1438/1985, de 1 de agosto, por el que se regula la relación laboral de carácter especial de las personas que intervengan en operaciones mercantiles por cuenta de uno o más empresarios, sin asumir el riesgo y ventura de aquéllas.
g) La de los trabajadores con discapacidad que presten sus servicios en los centros especiales de empleo. R.D. 1368/1985, de 17 de julio, por el que se regula la relación laboral de carácter especial de los minusválidos que trabajen en los centros especiales de empleo. R.D. 290/2004, de 20 de febrero, por el que se regulan los enclaves labora-les como medida de fomento del empleo de las personas con discapacidad.
i)  La de los menores sometidos a la ejecución de medidas de internamiento para el cumplimiento de su responsabilidad penal. 
j)   La de residencia para la formación de especialistas en Ciencias de la Salud. R.D. 1146/2006, de 6 de octubre, por el que se regula la relación laboral especial de residencia para la formación de especialistas en Ciencias de la Salud.
k) La de los abogados que prestan servicios en despachos de abogados, individuales o colectivos. R.D. 1331/2006, de 17 de noviembre, por el que se regula la relación laboral de carácter especial de los abogados que prestan servicios en despachos de abogados, individuales o colectivos
l) Cualquier otro trabajo que sea expresamente declarado como relación laboral de carácter especial por una ley."
¿Cuál es el marco legal al que están sujetas las relaciones laborales de carácter especial?," Las relaciones laborales de carácter especial están sujetas al marco legal del derecho laboral, que se basa en la proporcionalidad y transparencia. Esto incluye la información sobre puestos de trabajo vacantes, el derecho a formación profesional durante periodos de inactividad y la no discriminación entre trabajadores. Además, los derechos y obligaciones laborales están reglamentados por las leyes y convenios colectivos nacionales, con prioridad en la jerarquía normativa.","['proporcionalidad y transparencia.\n7. La empresa deberá informar a las personas fijas-discontinuas y a la representación \nlegal de las personas trabajadoras sobre la existencia de puestos de trabajo vacantes de \ncarácter fijo ordinario, de manera que aquellas puedan formular solicitudes de conversión \nvoluntaria, de conformidad con los procedimientos que establezca el convenio colectivo \nsectorial o, en su defecto, el acuerdo de empresa.\n8. Las personas trabajadoras fijas-discontinuas tendrán la consideración de colectivo \nprioritario para el acceso a las iniciativas de formación del sistema de formación profesional \npara el empleo en el ámbito laboral durante los periodos de inactividad.\nSección 2.ª Derechos y deberes derivados del contrato\nArtículo 17.  No discriminación en las relaciones laborales.\n1. Se entenderán nulos y sin efecto los preceptos reglamentarios, las cláusulas de los \nconvenios colectivos, los pactos individuales y las decisiones unilaterales del empresario que'
 '2. Excepcionalmente, con el objetivo de alcanzar la igualdad real y efectiva entre mujeres \ny hombres coadyuvando a superar la segregación ocupacional por género, el límite del \napartado anterior podrá rebajarse hasta la edad ordinaria de jubilación fijada por la normativa \nde Seguridad Social cuando la tasa de ocupación de las mujeres trabajadoras por cuenta \najena afiliadas a la Seguridad Social en alguna de las actividades económicas \ncorrespondientes al ámbito funcional del convenio sea inferior al 20 por ciento de las \npersonas ocupadas en las mismas.\nLas actividades económicas que se tomarán como referencia para determinar el \ncumplimiento de esta condición estará definida por los códigos de la Clasificación Nacional \nde Actividades Económicas (CNAE) en vigor en cada momento, incluidos en el ámbito del \nconvenio aplicable según los datos facilitados al realizar su inscripción en el Registro y \ndepósito de convenios y acuerdos colectivos de trabajo y planes de igualdad (REGCON), de'
 '1. Los derechos y obligaciones concernientes a la relación laboral se regulan:\na) Por las disposiciones legales y reglamentarias del Estado.\nb) Por los convenios colectivos.\nc) Por la voluntad de las partes, manifestada en el contrato de trabajo, siendo su objeto \nlícito y sin que en ningún caso puedan establecerse en perjuicio del trabajador condiciones \nmenos favorables o contrarias a las disposiciones legales y convenios colectivos antes \nexpresados.\nd) Por los usos y costumbres locales y profesionales.\n2. Las disposiciones legales y reglamentarias se aplicarán con sujeción estricta al \nprincipio de jerarquía normativa. Las disposiciones reglamentarias desarrollarán los \npreceptos que establecen las normas de rango superior, pero no podrán establecer \ncondiciones de trabajo distintas a las establecidas por las leyes a desarrollar.BOLETÍN OFICIAL DEL ESTADO\nLEGISLACIÓN CONSOLIDADA\nPágina 10']",['respetará los derechos básicos reconocidos por la Constitución.'],"En todos los supuestos señalados en el apartado anterior, la regulación de dichas relaciones laborales respetará los derechos básicos reconocidos por la Constitución."
¿Dónde se regulan los derechos y obligaciones de la relación laboral? ¿Dónde tengo que acudir para conocer los derechos de las relaciones laborales?," La regulación de las relaciones laborales están en los apartados señalados en el contexto, en particular, la ley que regula las relaciones laborales es la f) y la ley que regula las relaciones laborales de carácter especial son el apartado l).

Los derechos y obligaciones concernientes a la relación laboral se regulan por los artículos 1, 3 y la Sección 2ª Derechos y deberes derivados del contrato.

Para conocer los derechos de las relaciones laborales puedes consultar estas leyes o acudir al Ministerio del Trabajo o a alguna organización sindical para conseguir más información.","['f) La de las personas que intervengan en operaciones mercantiles por cuenta de uno o \nmás empresarios sin asumir el riesgo y ventura de aquellas.\ng) La de los trabajadores con discapacidad que presten sus servicios en los centros \nespeciales de empleo.\nh) (Derogada)\ni) La de los menores sometidos a la ejecución de medidas de internamiento para el \ncumplimiento de su responsabilidad penal.\nj) La de residencia para la formación de especialistas en Ciencias de la Salud.\nk) La de los abogados que prestan servicios en despachos de abogados, individuales o \ncolectivos.\nl) Cualquier otro trabajo que sea expresamente declarado como relación laboral de \ncarácter especial por una ley.\n2. En todos los supuestos señalados en el apartado anterior, la regulación de dichas \nrelaciones laborales respetará los derechos básicos reconocidos por la Constitución.\nArtículo 3.  Fuentes de la relación laboral.\n1. Los derechos y obligaciones concernientes a la relación laboral se regulan:'
 'proporcionalidad y transparencia.\n7. La empresa deberá informar a las personas fijas-discontinuas y a la representación \nlegal de las personas trabajadoras sobre la existencia de puestos de trabajo vacantes de \ncarácter fijo ordinario, de manera que aquellas puedan formular solicitudes de conversión \nvoluntaria, de conformidad con los procedimientos que establezca el convenio colectivo \nsectorial o, en su defecto, el acuerdo de empresa.\n8. Las personas trabajadoras fijas-discontinuas tendrán la consideración de colectivo \nprioritario para el acceso a las iniciativas de formación del sistema de formación profesional \npara el empleo en el ámbito laboral durante los periodos de inactividad.\nSección 2.ª Derechos y deberes derivados del contrato\nArtículo 17.  No discriminación en las relaciones laborales.\n1. Se entenderán nulos y sin efecto los preceptos reglamentarios, las cláusulas de los \nconvenios colectivos, los pactos individuales y las decisiones unilaterales del empresario que'
 'trabajo a turnos.\nb) El horario y la distribución del tiempo de trabajo, el régimen de trabajo a turnos y la \nplanificación anual de las vacaciones.\nc) La adaptación al ámbito de la empresa del sistema de clasificación profesional de las \npersonas trabajadoras.\nd) La adaptación de los aspectos de las modalidades de contratación que se atribuyen \npor esta ley a los convenios de empresa.\ne) Las medidas para favorecer la corresponsabilidad y la conciliación entre la vida \nlaboral, familiar y personal.\nf) Aquellas otras que dispongan los acuerdos y convenios colectivos a que se refiere el \nartículo 83.2.\nIgual prioridad aplicativa tendrán en estas materias los convenios colectivos para un \ngrupo de empresas o una pluralidad de empresas vinculadas por razones organizativas o \nproductivas y nominativamente identificadas a que se refiere el artículo 87.1.\nLos acuerdos y convenios colectivos a que se refiere el artículo 83.2 no podrán disponer \nde la prioridad aplicativa prevista en este apartado.']","['disposiciones legales y reglamentarias del Estado.\nconvenios colectivos.\nvoluntad de las partes, manifestada en el contrato de trabajo, siendo su objeto lícito y sin que en ningún caso puedan establecerse en perjuicio del trabajador condiciones menos favorables o contrarias a las disposiciones legales y convenios colectivos  \nusos y costumbres.']","a) Por las disposiciones legales y reglamentarias del Estado.
b) Por los convenios colectivos.
c) Por la voluntad de las partes, manifestada en el contrato de trabajo, siendo su objeto lícito y sin que en ningún caso puedan establecerse en perjuicio del trabajador condiciones menos favorables o contrarias a las disposiciones legales y convenios colectivos antes expresados.
d) Por los usos y costumbres."
¿Bajo qué principio se aplicarán las disposiciones legales y reglamentarias?," Las disposiciones legales y reglamentarias se aplicarán bajo el principio de jerarquía normativa, con sujeción estricta al mismo. Además, los convenios colectivos tendrán que expresar ciertos requisitos mínimos para ser válidos. La voluntad de las partes, manifestada en el contrato de trabajo, deberá ser lícita y no perjudicial para el trabajador. Ninguna de estas disposiciones podrá establecer condiciones de trabajo menos favorables o contrarias a las disposiciones legales y convenios colectivos antes expresados.","['1. Los derechos y obligaciones concernientes a la relación laboral se regulan:\na) Por las disposiciones legales y reglamentarias del Estado.\nb) Por los convenios colectivos.\nc) Por la voluntad de las partes, manifestada en el contrato de trabajo, siendo su objeto \nlícito y sin que en ningún caso puedan establecerse en perjuicio del trabajador condiciones \nmenos favorables o contrarias a las disposiciones legales y convenios colectivos antes \nexpresados.\nd) Por los usos y costumbres locales y profesionales.\n2. Las disposiciones legales y reglamentarias se aplicarán con sujeción estricta al \nprincipio de jerarquía normativa. Las disposiciones reglamentarias desarrollarán los \npreceptos que establecen las normas de rango superior, pero no podrán establecer \ncondiciones de trabajo distintas a las establecidas por las leyes a desarrollar.BOLETÍN OFICIAL DEL ESTADO\nLEGISLACIÓN CONSOLIDADA\nPágina 10'
 '3. Sin perjuicio de la libertad de contratación a que se refieren los apartados anteriores, \nlos convenios colectivos habrán de expresar como contenido mínimo lo siguiente:\na) Determinación de las partes que los conciertan.\nb) Ámbito personal, funcional, territorial y temporal.\nc) Procedimientos para solventar de manera efectiva las discrepancias que puedan \nsurgir para la no aplicación de las condiciones de trabajo a que se refiere el artículo 82.3, \nadaptando, en su caso, los procedimientos que se establezcan a este respecto en los \nacuerdos interprofesionales de ámbito estatal o autonómico conforme a lo dispuesto en tal \nartículo.\nd) Forma y condiciones de denuncia del convenio, así como plazo mínimo para dicha \ndenuncia antes de finalizar su vigencia.\ne) Designación de una comisión paritaria de la representación de las partes \nnegociadoras para entender de aquellas cuestiones establecidas en la ley y de cuantas otras'
 'Disposición transitoria primera.  Contratos celebrados antes de la entrada en vigor de esta \nley.\nContinuarán siendo de aplicación a los contratos celebrados antes de la entrada en vigor \nde esta ley las normas específicas aplicables a cada una de las modalidades contractuales \nque estuvieran vigentes en el momento en que dichos contratos se concertaron, salvo que \notra cosa se hubiera establecido legalmente.\nDisposición transitoria segunda.  Contratos para la formación y el aprendizaje.\n1. (Derogado).\n2. Las referencias realizadas en las disposiciones legales, reglamentarias o en los \nconvenios colectivos al contrato para la formación deberán entenderse realizadas, a partir \ndel 31 de agosto de 2011, al contrato para la formación y el aprendizaje a que se refiere el \nartículo 11.2 en la medida en que no se opongan o contradigan lo establecido en el mismo.\nDisposición transitoria tercera.  Contratos a tiempo parcial por jubilación parcial y de \nrelevo y edad de jubilación.']",['sujeción estricta al principio de jerarquía normativa.'],"Las disposiciones legales y reglamentarias se aplicarán con sujeción estricta al principio de jerarquía normativa. Las disposiciones reglamentarias desarrollarán los preceptos que establecen las normas de rango superior, pero no podrán establecer condiciones de trabajo distintas a las establecidas por las leyes a desarrollar."
¿Qué sucede si hay preceptos contradictorios de dos o más normas laborales?," En caso de que haya preceptos contradictorios entre dos o más normas laborales, se resolverán mediante la aplicación del que sea más favorable para el trabajador en cuanto al derecho de trabajo. Los conflictos son resueltos en anual, respecto de los conceptos cuantificables. En caso de no encontrar normas legales, reglamentarias o contractuales, se pueden aplicar las usos y costumbres locales y profesionales, pero solo si cuentan con una recepción o remisión expresa.","['1. Los derechos y obligaciones concernientes a la relación laboral se regulan:\na) Por las disposiciones legales y reglamentarias del Estado.\nb) Por los convenios colectivos.\nc) Por la voluntad de las partes, manifestada en el contrato de trabajo, siendo su objeto \nlícito y sin que en ningún caso puedan establecerse en perjuicio del trabajador condiciones \nmenos favorables o contrarias a las disposiciones legales y convenios colectivos antes \nexpresados.\nd) Por los usos y costumbres locales y profesionales.\n2. Las disposiciones legales y reglamentarias se aplicarán con sujeción estricta al \nprincipio de jerarquía normativa. Las disposiciones reglamentarias desarrollarán los \npreceptos que establecen las normas de rango superior, pero no podrán establecer \ncondiciones de trabajo distintas a las establecidas por las leyes a desarrollar.BOLETÍN OFICIAL DEL ESTADO\nLEGISLACIÓN CONSOLIDADA\nPágina 10'
 '3. Los conflictos originados entre los preceptos de dos o más normas laborales, tanto \nestatales como pactadas, que deberán respetar en todo caso los mínimos de derecho \nnecesario, se resolverán mediante la aplicación de lo más favorable para el trabajador \napreciado en su conjunto, y en cómputo anual, respecto de los conceptos cuantificables.\n4. Los usos y costumbres solo se aplicarán en defecto de disposiciones legales, \nconvencionales o contractuales, a no ser que cuenten con una recepción o remisión expresa.\n5. Los trabajadores no podrán disponer válidamente, antes o después de su adquisición, \nde los derechos que tengan reconocidos por disposiciones legales de derecho necesario. \nTampoco podrán disponer válidamente de los derechos reconocidos como indisponibles por \nconvenio colectivo.\nSección 2.ª Derechos y deberes laborales básicos\nArtículo 4.  Derechos laborales.\n1. Los trabajadores tienen como derechos básicos, con el contenido y alcance que para'
 'Disposición transitoria primera.  Contratos celebrados antes de la entrada en vigor de esta \nley.\nContinuarán siendo de aplicación a los contratos celebrados antes de la entrada en vigor \nde esta ley las normas específicas aplicables a cada una de las modalidades contractuales \nque estuvieran vigentes en el momento en que dichos contratos se concertaron, salvo que \notra cosa se hubiera establecido legalmente.\nDisposición transitoria segunda.  Contratos para la formación y el aprendizaje.\n1. (Derogado).\n2. Las referencias realizadas en las disposiciones legales, reglamentarias o en los \nconvenios colectivos al contrato para la formación deberán entenderse realizadas, a partir \ndel 31 de agosto de 2011, al contrato para la formación y el aprendizaje a que se refiere el \nartículo 11.2 en la medida en que no se opongan o contradigan lo establecido en el mismo.\nDisposición transitoria tercera.  Contratos a tiempo parcial por jubilación parcial y de \nrelevo y edad de jubilación.']","['se resolverán mediante la aplicación de lo más favorable para el trabajador apreciado en su conjunto, y en cómputo anual, respecto de los conceptos cuantificables.']","Los conflictos originados entre los preceptos de dos o más normas laborales, tanto estatales como pactadas, que deberán respetar en todo caso los mínimos de derecho necesario, se resolverán mediante la aplicación de lo más favorable para el trabajador apreciado en su conjunto, y en cómputo anual, respecto de los conceptos cuantificables."
¿Qué valor tienen los usos y costumbres?,"Los usos y costumbres se aplican en defecto de disposiciones legales, convencionales o contractuales. Son relevantes solo si cuentan con una recepción o remisión expresa. No tienen derecho a disponer de los derechos reconocidos por las leyes de derecho necesario ni por convenio colectivo. Los usos y costumbres no pueden establecer condiciones de trabajo distintas a las establecidas por las disposiciones legales o convencionales antes expresadas.","['1. Los derechos y obligaciones concernientes a la relación laboral se regulan:\na) Por las disposiciones legales y reglamentarias del Estado.\nb) Por los convenios colectivos.\nc) Por la voluntad de las partes, manifestada en el contrato de trabajo, siendo su objeto \nlícito y sin que en ningún caso puedan establecerse en perjuicio del trabajador condiciones \nmenos favorables o contrarias a las disposiciones legales y convenios colectivos antes \nexpresados.\nd) Por los usos y costumbres locales y profesionales.\n2. Las disposiciones legales y reglamentarias se aplicarán con sujeción estricta al \nprincipio de jerarquía normativa. Las disposiciones reglamentarias desarrollarán los \npreceptos que establecen las normas de rango superior, pero no podrán establecer \ncondiciones de trabajo distintas a las establecidas por las leyes a desarrollar.BOLETÍN OFICIAL DEL ESTADO\nLEGISLACIÓN CONSOLIDADA\nPágina 10'
 'el empleo, así como sobre la producción y ventas, incluido el programa de producción.\nc) Sobre las previsiones del empresario de celebración de nuevos contratos, con \nindicación del número de estos y de las modalidades y tipos que serán utilizados, incluidos \nlos contratos a tiempo parcial, la realización de horas complementarias por los trabajadores \ncontratados a tiempo parcial y de los supuestos de subcontratación.BOLETÍN OFICIAL DEL ESTADO\nLEGISLACIÓN CONSOLIDADA\nPágina 66'
 '3. Los conflictos originados entre los preceptos de dos o más normas laborales, tanto \nestatales como pactadas, que deberán respetar en todo caso los mínimos de derecho \nnecesario, se resolverán mediante la aplicación de lo más favorable para el trabajador \napreciado en su conjunto, y en cómputo anual, respecto de los conceptos cuantificables.\n4. Los usos y costumbres solo se aplicarán en defecto de disposiciones legales, \nconvencionales o contractuales, a no ser que cuenten con una recepción o remisión expresa.\n5. Los trabajadores no podrán disponer válidamente, antes o después de su adquisición, \nde los derechos que tengan reconocidos por disposiciones legales de derecho necesario. \nTampoco podrán disponer válidamente de los derechos reconocidos como indisponibles por \nconvenio colectivo.\nSección 2.ª Derechos y deberes laborales básicos\nArtículo 4.  Derechos laborales.\n1. Los trabajadores tienen como derechos básicos, con el contenido y alcance que para']","['usos y costumbres solo se aplicarán en defecto de disposiciones legales, convencionales o contractuales, a no ser que cuenten con una recepción o remisión expresa.']","Los usos y costumbres solo se aplicarán en defecto de disposiciones legales, convencionales o contractuales, a no ser que cuenten con una recepción o remisión expresa."
¿Son renunciables los derechos laborales reconocidos? ¿Se puede disponer de los derechos del trabajador? ¿Se puede compensar económicamente los derechos de los trabajadores? ¿Podrán renunciar de alguno de sus derechos los trabajadores?,"1. Los derechos laborales son irrenunciables.
2. No se puede disponer de los derechos del trabajador antes o después de su adquisición, excepto que estén reconocidos como disponibles en normas legales de derecho necesario o convencionales.
3. No se pueden compensar económicamente los derechos laborales.
4. Los trabajadores no pueden renunciar a alguno de sus derechos laborales reconocidos.","['3. Los conflictos originados entre los preceptos de dos o más normas laborales, tanto \nestatales como pactadas, que deberán respetar en todo caso los mínimos de derecho \nnecesario, se resolverán mediante la aplicación de lo más favorable para el trabajador \napreciado en su conjunto, y en cómputo anual, respecto de los conceptos cuantificables.\n4. Los usos y costumbres solo se aplicarán en defecto de disposiciones legales, \nconvencionales o contractuales, a no ser que cuenten con una recepción o remisión expresa.\n5. Los trabajadores no podrán disponer válidamente, antes o después de su adquisición, \nde los derechos que tengan reconocidos por disposiciones legales de derecho necesario. \nTampoco podrán disponer válidamente de los derechos reconocidos como indisponibles por \nconvenio colectivo.\nSección 2.ª Derechos y deberes laborales básicos\nArtículo 4.  Derechos laborales.\n1. Los trabajadores tienen como derechos básicos, con el contenido y alcance que para'
 'transmisión conserve su autonomía, el cambio de titularidad del empresario no extinguirá por \nsí mismo el mandato de los representantes legales de los trabajadores, que seguirán \nejerciendo sus funciones en los mismos términos y bajo las mismas condiciones que regían \ncon anterioridad.\n6. El cedente y el cesionario deberán informar a los representantes legales de sus \ntrabajadores respectivos afectados por el cambio de titularidad, de los siguientes extremos:\na) Fecha prevista de la transmisión.\nb) Motivos de la transmisión.\nc) Consecuencias jurídicas, económicas y sociales, para los trabajadores, de la \ntransmisión.\nd) Medidas previstas respecto de los trabajadores.\n7. De no haber representantes legales de los trabajadores, el cedente y el cesionario \ndeberán facilitar la información mencionada en el apartado anterior a los trabajadores que \npudieren resultar afectados por la transmisión.\n8. El cedente vendrá obligado a facilitar la información mencionada en los apartados'
 'ordenación del tiempo de trabajo que se utilicen en la empresa. También tendrán derecho a \nrealizar su trabajo total o parcialmente a distancia o a dejar de hacerlo si este fuera el \nsistema establecido, siempre en ambos casos que esta modalidad de prestación de servicios \nsea compatible con el puesto y funciones desarrolladas por la persona.\nEstos derechos se podrán ejercitar en los términos que para estos supuestos concretos \nse establezcan en los convenios colectivos o en los acuerdos entre la empresa y los \nrepresentantes legales de las personas trabajadoras, o conforme al acuerdo entre la \nempresa y las personas trabajadoras afectadas. En su defecto, la concreción de estos \nderechos corresponderá a estas, siendo de aplicación las reglas establecidas en el apartado \nanterior, incluidas las relativas a la resolución de discrepancias.\n9. La persona trabajadora tendrá derecho a ausentarse del trabajo por causa de fuerza']",['trabajadores no podrán disponer válidamente \nderechos que tengan reconocidos por disposiciones legales de derecho necesario. Tampoco podrán disponer válidamente de los derechos reconocidos como indisponibles por convenio colectivo.'],"Los trabajadores no podrán disponer válidamente, antes o después de su adquisición, de los derechos que tengan reconocidos por disposiciones legales de derecho necesario. Tampoco podrán disponer válidamente de los derechos reconocidos como indisponibles por convenio colectivo."
¿Cuáles son los derechos laborales básicos? ¿Cuáles son los derechos básicos del trabajador?,"1. Los derechos básicos laborales incluyen la igualdad de remuneración por razón de sexo, no discriminación en las relaciones laborales, salario mínimo interprofesional, información clara sobre los salarios y condiciones laborales, acceso a formación profesional y derechos para las personas trabajadoras fijas-discontinuas.
2. Los derechos básicos del trabajador están garantizados en los artículos 17 y 28 de la Ley Orgánica de Estatuto Laboral, así como en otros artículos relacionados con el salario y las garantías salariales.
3. No se especificó otro contexto, por lo tanto, no hay información adicional sobre los derechos laborales básicos.","['Artículo 28.  Igualdad de remuneración por razón de sexo.\n1. El empresario está obligado a pagar por la prestación de un trabajo de igual valor la \nmisma retribución, satisfecha directa o indirectamente, y cualquiera que sea la naturaleza de \nla misma, salarial o extrasalarial, sin que pueda producirse discriminación alguna por razón \nde sexo en ninguno de los elementos o condiciones de aquella.\nUn trabajo tendrá igual valor que otro cuando la naturaleza de las funciones o tareas \nefectivamente encomendadas, las condiciones educativas, profesionales o de formación \nexigidas para su ejercicio, los factores estrictamente relacionados con su desempeño y las \ncondiciones laborales en las que dichas actividades se llevan a cabo en realidad sean \nequivalentes.\n2. El empresario está obligado a llevar un registro con los valores medios de los salarios, \nlos complementos salariales y las percepciones extrasalariales de su plantilla, desagregados'
 'proporcionalidad y transparencia.\n7. La empresa deberá informar a las personas fijas-discontinuas y a la representación \nlegal de las personas trabajadoras sobre la existencia de puestos de trabajo vacantes de \ncarácter fijo ordinario, de manera que aquellas puedan formular solicitudes de conversión \nvoluntaria, de conformidad con los procedimientos que establezca el convenio colectivo \nsectorial o, en su defecto, el acuerdo de empresa.\n8. Las personas trabajadoras fijas-discontinuas tendrán la consideración de colectivo \nprioritario para el acceso a las iniciativas de formación del sistema de formación profesional \npara el empleo en el ámbito laboral durante los periodos de inactividad.\nSección 2.ª Derechos y deberes derivados del contrato\nArtículo 17.  No discriminación en las relaciones laborales.\n1. Se entenderán nulos y sin efecto los preceptos reglamentarios, las cláusulas de los \nconvenios colectivos, los pactos individuales y las decisiones unilaterales del empresario que'
 'Sección 4.ª Salarios y garantías salariales\nArtículo 26.  Del salario.\n1. Se considerará salario la totalidad de las percepciones económicas de los \ntrabajadores, en dinero o en especie, por la prestación profesional de los servicios laborales \npor cuenta ajena, ya retribuyan el trabajo efectivo, cualquiera que sea la forma de \nremuneración, o los periodos de descanso computables como de trabajo.\nEn ningún caso, incluidas las relaciones laborales de carácter especial a que se refiere el \nartículo 2, el salario en especie podrá superar el treinta por ciento de las percepciones \nsalariales del trabajador, ni dar lugar a la minoración de la cuantía íntegra en dinero del \nsalario mínimo interprofesional.\n2. No tendrán la consideración de salario las cantidades percibidas por el trabajador en \nconcepto de indemnizaciones o suplidos por los gastos realizados como consecuencia de su \nactividad laboral, las prestaciones e indemnizaciones de la Seguridad Social y las']","['a) Trabajo y libre elección de profesión u oficio.\nb) Libre sindicación.\nc) Negociación colectiva.\nd) Adopción de medidas de conflicto colectivo.\ne) Huelga.\nf) Reunión.\ng) Información, consulta y participación en la empresa.']","Los trabajadores tienen como derechos básicos, con el contenido y alcance que para cada uno de los mismos disponga su específica normativa, los de:
a) Trabajo y libre elección de profesión u oficio.
b) Libre sindicación.
c) Negociación colectiva.
d) Adopción de medidas de conflicto colectivo.
e) Huelga.
f) Reunión.
g) Información, consulta y participación en la empresa."
¿Cuáles son los derechos laborales del trabajador en relación con el trabajo? ¿Qué derechos laborales son reclamables por el trabajador?," Los derechos laborales reclamables por el trabajador en relación con el trabajo incluyen:

1. El salario completo como la totalidad de las percepciones económicas en dinero o en especie, no superando el 30% del total de las percepciones salariales en concepto de salario en especie.
2. La horario y distribución del tiempo de trabajo, el régimen de trabajo a turnos y la planificación anual de vacaciones.
3. La adaptación al ámbito de la empresa del sistema de clasificación profesional de las personas trabajadoras.
4. La adaptación de los aspectos de las modalidades de contratación que se atribuyen por esta ley a los convenios de empresa.
5. Las medidas para favorecer la corresponsabilidad y la conciliación entre la vida laboral, familiar y personal.
6. Aquellas otras que dispongan los acuerdos y convenios colectivos a que se refiere el artículo 83.2.
7. Igual prioridad aplicativa tendrán en estas materias los convenios colectivos para un grupo de empresas o una pluralidad de empresas vinculadas por razones organizativas o productivas y nominativamente identificadas a que se refiere el artículo 87.1.
8. Los acuerdos y convenios colectivos a que se refiere el artículo 83.2 no podrán disponer de la prioridad aplicativa prevista en este apartado.
9. La empresa deberá informar a las personas fijas-discontinuas y a la representación legal de las personas trabajadoras sobre la existencia de puestos de trabajo vacantes de carácter fijo ordinario, de manera que aquellas puedan formular solicitudes de conversión voluntaria.
10. Las personas trabajadoras fijas-discontinuas tendrán la consideración de colectivo prioritario para el acceso a las iniciativas de formación del sistema de formación profesional para el empleo en el ámbito laboral durante los periodos de inactividad.
11. No discriminación en las relaciones laborales.","['Sección 4.ª Salarios y garantías salariales\nArtículo 26.  Del salario.\n1. Se considerará salario la totalidad de las percepciones económicas de los \ntrabajadores, en dinero o en especie, por la prestación profesional de los servicios laborales \npor cuenta ajena, ya retribuyan el trabajo efectivo, cualquiera que sea la forma de \nremuneración, o los periodos de descanso computables como de trabajo.\nEn ningún caso, incluidas las relaciones laborales de carácter especial a que se refiere el \nartículo 2, el salario en especie podrá superar el treinta por ciento de las percepciones \nsalariales del trabajador, ni dar lugar a la minoración de la cuantía íntegra en dinero del \nsalario mínimo interprofesional.\n2. No tendrán la consideración de salario las cantidades percibidas por el trabajador en \nconcepto de indemnizaciones o suplidos por los gastos realizados como consecuencia de su \nactividad laboral, las prestaciones e indemnizaciones de la Seguridad Social y las'
 'trabajo a turnos.\nb) El horario y la distribución del tiempo de trabajo, el régimen de trabajo a turnos y la \nplanificación anual de las vacaciones.\nc) La adaptación al ámbito de la empresa del sistema de clasificación profesional de las \npersonas trabajadoras.\nd) La adaptación de los aspectos de las modalidades de contratación que se atribuyen \npor esta ley a los convenios de empresa.\ne) Las medidas para favorecer la corresponsabilidad y la conciliación entre la vida \nlaboral, familiar y personal.\nf) Aquellas otras que dispongan los acuerdos y convenios colectivos a que se refiere el \nartículo 83.2.\nIgual prioridad aplicativa tendrán en estas materias los convenios colectivos para un \ngrupo de empresas o una pluralidad de empresas vinculadas por razones organizativas o \nproductivas y nominativamente identificadas a que se refiere el artículo 87.1.\nLos acuerdos y convenios colectivos a que se refiere el artículo 83.2 no podrán disponer \nde la prioridad aplicativa prevista en este apartado.'
 'proporcionalidad y transparencia.\n7. La empresa deberá informar a las personas fijas-discontinuas y a la representación \nlegal de las personas trabajadoras sobre la existencia de puestos de trabajo vacantes de \ncarácter fijo ordinario, de manera que aquellas puedan formular solicitudes de conversión \nvoluntaria, de conformidad con los procedimientos que establezca el convenio colectivo \nsectorial o, en su defecto, el acuerdo de empresa.\n8. Las personas trabajadoras fijas-discontinuas tendrán la consideración de colectivo \nprioritario para el acceso a las iniciativas de formación del sistema de formación profesional \npara el empleo en el ámbito laboral durante los periodos de inactividad.\nSección 2.ª Derechos y deberes derivados del contrato\nArtículo 17.  No discriminación en las relaciones laborales.\n1. Se entenderán nulos y sin efecto los preceptos reglamentarios, las cláusulas de los \nconvenios colectivos, los pactos individuales y las decisiones unilaterales del empresario que']","['a) A la ocupación efectiva.\nb) A la promoción y formación profesional en el trabajo, i\nc) A no ser discriminados directa o indirectamente para el empleo, \nd) A su integridad física y a una adecuada política de prevención de riesgos laborales.\ne) Al respeto de su intimidad y a la consideración debida a su dignidad, \nf) A la percepción puntual de la remuneración pactada o legalmente establecida.\ng) Al ejercicio individual de las acciones derivadas de su contrato de trabajo.\nh) A cuantos otros se deriven específicamente del contrato de trabajo.']","En la relación de trabajo, los trabajadores tienen derecho:
a) A la ocupación efectiva.
b) A la promoción y formación profesional en el trabajo, incluida la dirigida a su adaptación a las modificaciones operadas en el puesto de trabajo, así como al desarro-llo de planes y acciones formativas tendentes a favorecer su mayor empleabilidad.
c) A no ser discriminados directa o indirectamente para el empleo, o una vez empleados, por razones de sexo, estado civil, edad dentro de los límites marcados por esta ley, origen racial o étnico, condición social, religión o convicciones, ideas políticas, orientación sexual, afiliación o no a un sindicato, así como por razón de lengua, dentro del Estado español.
Tampoco podrán ser discriminados por razón de discapacidad, siempre que se hallasen en condiciones de aptitud para desempeñar el trabajo o empleo de que se trate.
d) A su integridad física y a una adecuada política de prevención de riesgos laborales.
e) Al respeto de su intimidad y a la consideración debida a su dignidad, comprendida la protección frente al acoso por razón de origen racial o étnico, religión o conviccio-nes, discapacidad, edad u orientación sexual, y frente al acoso sexual y al acoso por razón de sexo.
f) A la percepción puntual de la remuneración pactada o legalmente establecida.
g) Al ejercicio individual de las acciones derivadas de su contrato de trabajo.
h) A cuantos otros se deriven específicamente del contrato de trabajo."
¿Cuáles son los deberes laborales de los trabajadores? ¿Cuáles son las obligaciones de los trabajadores? ¿Qué es exigible por parte del trabajador?," Los trabajadores tienen como deberes laborales básicos cumplir con las obligaciones concretas de su puesto de trabajo, observando las medidas de prevención de riesgos laborales y cumpliendo las órdenes e instrucciones del empresario. También deben contribuir a la mejora de la productividad y cumplir cualquier otro deber que deriva específicamente de su contrato de trabajo. Además, los trabajadores no deben concurrir con la actividad de la empresa en términos fijados por esta ley. Los derechos y obligaciones en cuanto a la relación laboral se regulan según las fuentes establecidas por la Constitución y la ley. El empresario está obligado a pagar por el trabajo de igual valor la misma retribución, sin discriminación alguna por razón de sexo.","['Artículo 28.  Igualdad de remuneración por razón de sexo.\n1. El empresario está obligado a pagar por la prestación de un trabajo de igual valor la \nmisma retribución, satisfecha directa o indirectamente, y cualquiera que sea la naturaleza de \nla misma, salarial o extrasalarial, sin que pueda producirse discriminación alguna por razón \nde sexo en ninguno de los elementos o condiciones de aquella.\nUn trabajo tendrá igual valor que otro cuando la naturaleza de las funciones o tareas \nefectivamente encomendadas, las condiciones educativas, profesionales o de formación \nexigidas para su ejercicio, los factores estrictamente relacionados con su desempeño y las \ncondiciones laborales en las que dichas actividades se llevan a cabo en realidad sean \nequivalentes.\n2. El empresario está obligado a llevar un registro con los valores medios de los salarios, \nlos complementos salariales y las percepciones extrasalariales de su plantilla, desagregados'
 'f) La de las personas que intervengan en operaciones mercantiles por cuenta de uno o \nmás empresarios sin asumir el riesgo y ventura de aquellas.\ng) La de los trabajadores con discapacidad que presten sus servicios en los centros \nespeciales de empleo.\nh) (Derogada)\ni) La de los menores sometidos a la ejecución de medidas de internamiento para el \ncumplimiento de su responsabilidad penal.\nj) La de residencia para la formación de especialistas en Ciencias de la Salud.\nk) La de los abogados que prestan servicios en despachos de abogados, individuales o \ncolectivos.\nl) Cualquier otro trabajo que sea expresamente declarado como relación laboral de \ncarácter especial por una ley.\n2. En todos los supuestos señalados en el apartado anterior, la regulación de dichas \nrelaciones laborales respetará los derechos básicos reconocidos por la Constitución.\nArtículo 3.  Fuentes de la relación laboral.\n1. Los derechos y obligaciones concernientes a la relación laboral se regulan:'
 'g) Al ejercicio individual de las acciones derivadas de su contrato de trabajo.\nh) A cuantos otros se deriven específicamente del contrato de trabajo.\nArtículo 5.  Deberes laborales.\nLos trabajadores tienen como deberes básicos:\na) Cumplir con las obligaciones concretas de su puesto de trabajo, de conformidad con \nlas reglas de la buena fe y diligencia.\nb) Observar las medidas de prevención de riesgos laborales que se adopten.\nc) Cumplir las órdenes e instrucciones del empresario en el ejercicio regular de sus \nfacultades directivas.\nd) No concurrir con la actividad de la empresa, en los términos fijados en esta ley.\ne) Contribuir a la mejora de la productividad.\nf) Cuantos se deriven, en su caso, de los respectivos contratos de trabajo.BOLETÍN OFICIAL DEL ESTADO\nLEGISLACIÓN CONSOLIDADA\nPágina 11']","['a) Cumplir con las obligaciones concretas de su puesto de trabajo, de conformidad con las reglas de la buena fe y diligencia.\nb) Observar las medidas de prevención de riesgos laborales que se adopten.\nc) Cumplir las órdenes e instrucciones del empresario en el ejercicio regular de sus facultades directivas.\nd) No concurrir con la actividad de la empresa, en los términos fijados en esta ley.\ne) Contribuir a la mejora de la productividad.\nf) Cuantos se deriven, en su caso, de los respectivos contratos de trabajo.']","Los trabajadores tienen como deberes básicos:
a) Cumplir con las obligaciones concretas de su puesto de trabajo, de conformidad con las reglas de la buena fe y diligencia.
b) Observar las medidas de prevención de riesgos laborales que se adopten.
c) Cumplir las órdenes e instrucciones del empresario en el ejercicio regular de sus facultades directivas.
d) No concurrir con la actividad de la empresa, en los términos fijados en esta ley.
e) Contribuir a la mejora de la productividad.
f) Cuantos se deriven, en su caso, de los respectivos contratos de trabajo."
¿Cuál es la edad mínima para trabajar?," La edad mínima para trabajar se puede rebajarse hasta la edad ordinaria de jubilación, establecida por la normativa de Seguridad Social, siempre que la tasa de ocupación de las mujeres en las actividades económicas específicas sea inferior al 20% de las personas ocupadas en esas mismas actividades.","['2. Excepcionalmente, con el objetivo de alcanzar la igualdad real y efectiva entre mujeres \ny hombres coadyuvando a superar la segregación ocupacional por género, el límite del \napartado anterior podrá rebajarse hasta la edad ordinaria de jubilación fijada por la normativa \nde Seguridad Social cuando la tasa de ocupación de las mujeres trabajadoras por cuenta \najena afiliadas a la Seguridad Social en alguna de las actividades económicas \ncorrespondientes al ámbito funcional del convenio sea inferior al 20 por ciento de las \npersonas ocupadas en las mismas.\nLas actividades económicas que se tomarán como referencia para determinar el \ncumplimiento de esta condición estará definida por los códigos de la Clasificación Nacional \nde Actividades Económicas (CNAE) en vigor en cada momento, incluidos en el ámbito del \nconvenio aplicable según los datos facilitados al realizar su inscripción en el Registro y \ndepósito de convenios y acuerdos colectivos de trabajo y planes de igualdad (REGCON), de'
 'g) A la finalización del contrato la persona trabajadora tendrá derecho a la certificación \ndel contenido de la práctica realizada.\nh) Las personas contratadas con contrato de formación para la obtención de práctica \nprofesional no podrán realizar horas extraordinarias, salvo en el supuesto previsto en el \nartículo 35.3.\ni) La retribución por el tiempo de trabajo efectivo será la fijada en el convenio colectivo \naplicable en la empresa para estos contratos o en su defecto la del grupo profesional y nivel \nretributivo correspondiente a las funciones desempeñadas. En ningún caso la retribución \npodrá ser inferior a la retribución mínima establecida para el contrato para la formación en \nalternancia ni al salario mínimo interprofesional en proporción al tiempo de trabajo efectivo.\nj) Reglamentariamente se desarrollará el alcance de la formación correspondiente al \ncontrato de formación para la obtención de prácticas profesionales, particularmente, en el'
 'Disposición adicional décima.  Cláusulas de los convenios colectivos referidas al \ncumplimiento de la edad ordinaria de jubilación.\n1. En aras de favorecer la prolongación de la vida laboral, los convenios colectivos \npodrán establecer cláusulas que posibiliten la extinción del contrato de trabajo por el \ncumplimiento por el trabajador de una edad igual o superior a 68 años, siempre que cumplan \nlos siguientes requisitos:\na) La persona trabajadora afectada por la extinción del contrato de trabajo deberá reunir \nlos requisitos exigidos por la normativa de Seguridad Social para tener derecho al cien por \nciento de la pensión ordinaria de jubilación en su modalidad contributiva.\nb) La medida deberá vincularse, como objetivo coherente de política de empleo \nexpresado en el convenio colectivo, al relevo generacional a través de la contratación \nindefinida y a tiempo completo de, al menos, un nuevo trabajador o trabajadora.\n2. Excepcionalmente, con el objetivo de alcanzar la igualdad real y efectiva entre mujeres']",['Se prohíbe la admisión al trabajo a los menores de dieciséis años.'],Se prohíbe la admisión al trabajo a los menores de dieciséis años.
¿Qué restricciones tienen los mayores de 16 años y menores de 18 años?,"1. La edad mínima para trabajar es 16 años.
2. Los menores de 18 años no pueden realizar trabajos nocturnos, y aquellas actividades o puestos de trabajo que establezcan limitaciones a su contratación conforme a la Ley Prevención de Riesgos Laborales y las normas reglamentarias.
3. Se prohíbe realizar horas extraordinarias a los menores de 18 años.
4. La intervención de menores de 16 años en espectáculos públicos solo se autorizará en casos excepcionales por la autoridad laboral, siempre que no suponga peligro para su salud ni para su formación profesional y humana.
5. Los menores de 16 años tienen los mismos derechos que las personas con contratos de duración indefinida, sin perjuicio de las particularidades específicas de cada una de las modalidades contractuales en materia de extinción del contrato y de aquellas expresamente previstas en la ley.","['c) Incapacidad temporal de los trabajadores.\nd) Nacimiento, adopción, guarda con fines de adopción o acogimiento, de conformidad \ncon el Código Civil o las leyes civiles de las comunidades autónomas que lo regulen, de \nmenores de seis años o de menores de edad mayores de seis años con discapacidad o que \npor sus circunstancias y experiencias personales o por provenir del extranjero, tengan \nespeciales dificultades de inserción social y familiar debidamente acreditadas por los \nservicios sociales competentes.\ne) Riesgo durante el embarazo y riesgo durante la lactancia natural de un menor de \nnueve meses.\nf) Ejercicio de cargo público representativo.\ng) Privación de libertad del trabajador, mientras no exista sentencia condenatoria.\nh) Suspensión de empleo y sueldo, por razones disciplinarias.\ni) Fuerza mayor temporal.\nj) Causas económicas, técnicas, organizativas o de producción.\nk) Excedencia forzosa.\nl) Ejercicio del derecho de huelga.\nm) Cierre legal de la empresa.'
 'Asimismo, adquirirá la condición de fija la persona que ocupe un puesto de trabajo que \nhaya estado ocupado con o sin solución de continuidad, durante más de dieciocho meses en \nun periodo de veinticuatro meses mediante contratos por circunstancias de la producción, \nincluidos los contratos de puesta a disposición realizados con empresas de trabajo temporal.\n6. Las personas con contratos temporales y de duración determinada tendrán los \nmismos derechos que las personas con contratos de duración indefinida, sin perjuicio de las \nparticularidades específicas de cada una de las modalidades contractuales en materia de \nextinción del contrato y de aquellas expresamente previstas en la ley en relación con los \ncontratos formativos. Cuando corresponda en atención a su naturaleza, tales derechos serán \nreconocidos en las disposiciones legales y reglamentarias y en los convenios colectivos de \nmanera proporcional, en función del tiempo trabajado.'
 'Sección 3.ª Elementos y eficacia del contrato de trabajo\nArtículo 6.  Trabajo de los menores.\n1. Se prohíbe la admisión al trabajo a los menores de dieciséis años.\n2. Los trabajadores menores de dieciocho años no podrán realizar trabajos nocturnos ni \naquellas actividades o puestos de trabajo respecto a los que se establezcan limitaciones a \nsu contratación conforme a lo dispuesto en la Ley 31/1995, de 8 de noviembre, de \nPrevención de Riesgos Laborales, y en las normas reglamentarias aplicables.\n3. Se prohíbe realizar horas extraordinarias a los menores de dieciocho años.\n4. La intervención de los menores de dieciséis años en espectáculos públicos solo se \nautorizará en casos excepcionales por la autoridad laboral, siempre que no suponga peligro \npara su salud ni para su formación profesional y humana. El permiso deberá constar por \nescrito y para actos determinados.\nArtículo 7.  Capacidad para contratar.\nPodrán contratar la prestación de su trabajo:']",['2. Los trabajadores menores de dieciocho años no podrán realizar trabajos nocturnos ni aquellas actividades o puestos de trabajo respecto a los que se establezcan limitaciones a su contratación \n3. Se prohíbe realizar horas extraordinarias a los menores de dieciocho años.'],"2. Los trabajadores menores de dieciocho años no podrán realizar trabajos nocturnos ni aquellas actividades o puestos de trabajo respecto a los que se establezcan limitaciones a su contratación conforme a lo dispuesto en la Ley 31/1995, de 8 de noviembre, de Prevención de Riesgos Laborales, y en las normas reglamentarias aplicables.
3. Se prohíbe realizar horas extraordinarias a los menores de dieciocho años."
¿Pueden los menores de 16 años intervenir en espectáculos públicos?," Los menores de 16 años no pueden trabajar normalmente en espectáculos públicos. Sin embargo, se puede autorizar su intervención en casos excepcionales por la autoridad laboral, siempre que no suponga peligro para su salud ni para su formación profesional y humana. El permiso deberá constar por escrito y para actos determinados.","['Sección 3.ª Elementos y eficacia del contrato de trabajo\nArtículo 6.  Trabajo de los menores.\n1. Se prohíbe la admisión al trabajo a los menores de dieciséis años.\n2. Los trabajadores menores de dieciocho años no podrán realizar trabajos nocturnos ni \naquellas actividades o puestos de trabajo respecto a los que se establezcan limitaciones a \nsu contratación conforme a lo dispuesto en la Ley 31/1995, de 8 de noviembre, de \nPrevención de Riesgos Laborales, y en las normas reglamentarias aplicables.\n3. Se prohíbe realizar horas extraordinarias a los menores de dieciocho años.\n4. La intervención de los menores de dieciséis años en espectáculos públicos solo se \nautorizará en casos excepcionales por la autoridad laboral, siempre que no suponga peligro \npara su salud ni para su formación profesional y humana. El permiso deberá constar por \nescrito y para actos determinados.\nArtículo 7.  Capacidad para contratar.\nPodrán contratar la prestación de su trabajo:'
 'f) La de las personas que intervengan en operaciones mercantiles por cuenta de uno o \nmás empresarios sin asumir el riesgo y ventura de aquellas.\ng) La de los trabajadores con discapacidad que presten sus servicios en los centros \nespeciales de empleo.\nh) (Derogada)\ni) La de los menores sometidos a la ejecución de medidas de internamiento para el \ncumplimiento de su responsabilidad penal.\nj) La de residencia para la formación de especialistas en Ciencias de la Salud.\nk) La de los abogados que prestan servicios en despachos de abogados, individuales o \ncolectivos.\nl) Cualquier otro trabajo que sea expresamente declarado como relación laboral de \ncarácter especial por una ley.\n2. En todos los supuestos señalados en el apartado anterior, la regulación de dichas \nrelaciones laborales respetará los derechos básicos reconocidos por la Constitución.\nArtículo 3.  Fuentes de la relación laboral.\n1. Los derechos y obligaciones concernientes a la relación laboral se regulan:'
 'año y con un máximo de doce mensualidades.\n5. Para hacer efectivo su derecho de protección a la salud, los trabajadores con \ndiscapacidad que acrediten la necesidad de recibir fuera de su localidad un tratamiento de BOLETÍN OFICIAL DEL ESTADO\nLEGISLACIÓN CONSOLIDADA\nPágina 41']","['solo se autorizará en casos excepcionales por la autoridad laboral, siempre que no suponga peligro para su salud ni para su formación profesional y humana.\ndeberá constar por escrito']","La intervención de los menores de dieciséis años en espectáculos públicos solo se autorizará en casos excepcionales por la autoridad laboral, siempre que no suponga peligro para su salud ni para su formación profesional y humana. El permiso deberá constar por escrito y para actos determinados."
¿Quién tiene capacidad para contratar la prestación de su trabajo?," La capacidad para contratar la prestación de su trabajo se tiene:

a) Por aquellos que tengan plena capacidad de obrar conforme al Código Civil.
b) Por los menores de dieciocho y mayores de dieciséis años, viviendo independientes con el consentimiento de sus padres o tutores, o autorización de la persona o institución que los tenga a su cargo.
c) Por extranjeros, de acuerdo con lo dispuesto en la legislación específica sobre la materia.

Si es una persona de capacidad limitada y su representante legal la autoriza para realizar un trabajo, esta también está autorizada para ejercitar los derechos y cumplir los deberes que se derivan de su contrato y para su cesación.","['Artículo 7.  Capacidad para contratar.\nPodrán contratar la prestación de su trabajo:\na) Quienes tengan plena capacidad de obrar conforme a lo dispuesto en el Código Civil.\nb) Los menores de dieciocho y mayores de dieciséis años, que vivan de forma \nindependiente, con consentimiento de sus padres o tutores, o con autorización de la persona \no institución que les tenga a su cargo.\nSi el representante legal de una persona de capacidad limitada la autoriza expresa o \ntácitamente para realizar un trabajo, queda esta también autorizada para ejercitar los \nderechos y cumplir los deberes que se derivan de su contrato y para su cesación.\nc) Los extranjeros, de acuerdo con lo dispuesto en la legislación específica sobre la \nmateria.\nArtículo 8.  Forma del contrato.\n1. El contrato de trabajo se podrá celebrar por escrito o de palabra. Se presumirá \nexistente entre todo el que presta un servicio por cuenta y dentro del ámbito de organización \ny dirección de otro y el que lo recibe a cambio de una retribución a aquel.'
 'preferencia a elegir turno de trabajo y a acceder al trabajo a distancia, si tal es el régimen \ninstaurado en la empresa, y el puesto o funciones son compatibles con esta forma de \nrealización del trabajo, cuando curse con regularidad estudios para la obtención de un título \nacadémico o profesional.\nb) A la adaptación de la jornada ordinaria de trabajo para la asistencia a cursos de \nformación profesional.\nc) A la concesión de los permisos oportunos de formación o perfeccionamiento \nprofesional con reserva del puesto de trabajo.\nd) A la formación necesaria para su adaptación a las modificaciones operadas en el \npuesto de trabajo. La misma correrá a cargo de la empresa, sin perjuicio de la posibilidad de \nobtener a tal efecto los créditos destinados a la formación. El tiempo destinado a la \nformación se considerará en todo caso tiempo de trabajo efectivo.\n2. En la negociación colectiva se pactarán los términos del ejercicio de estos derechos,'
 'a los estudios universitarios no se considerarán la misma titulación, salvo que al ser \ncontratado por primera vez mediante un contrato para la realización de práctica profesional \nla persona trabajadora estuviera ya en posesión del título superior de que se trate.\ne) Se podrá establecer un periodo de prueba que en ningún caso podrá exceder de un \nmes, salvo lo dispuesto en convenio colectivo.\nf) El puesto de trabajo deberá permitir la obtención de la práctica profesional adecuada al \nnivel de estudios o de formación objeto del contrato. La empresa elaborará el plan formativo \nindividual en el que se especifique el contenido de la práctica profesional, y asignará tutor o \ntutora que cuente con la formación o experiencia adecuadas para el seguimiento del plan y \nel correcto cumplimiento del objeto del contrato.BOLETÍN OFICIAL DEL ESTADO\nLEGISLACIÓN CONSOLIDADA\nPágina 15']","['a) Quienes tengan plena capacidad de obrar \nb) Los menores de dieciocho y mayores de dieciséis años, que vivan de forma independiente, con consentimiento de sus padres o tutores, o con autorización de la persona o institución que les tenga a su cargo.\nc) Los extranjeros, de acuerdo con lo dispuesto en la legislación específica sobre la materia.']","a) Quienes tengan plena capacidad de obrar conforme a lo dispuesto en el Código Civil.
b) Los menores de dieciocho y mayores de dieciséis años, que vivan de forma independiente, con consentimiento de sus padres o tutores, o con autorización de la persona o institución que les tenga a su cargo.
Si el representante legal de una persona de capacidad limitada la autoriza expresa o tácitamente para realizar un trabajo, queda esta también autorizada para ejercitar los derechos y cumplir los deberes que se derivan de su contrato y para su cesación.
c) Los extranjeros, de acuerdo con lo dispuesto en la legislación específica sobre la materia."
¿Puede ser verbal un contrato de trabajo?," Sí, un contrato de trabajo puede ser verbal, pero debe constar por escrito en ciertos casos como se establece en la ley. Los contratos a tiempo parcial, prácticas y para la formación y el aprendizaje, los contratos a tiempo determinado superior a cuatro semanas, los contratos de los pescadores, de los trabajadores que trabajen a distancia y de los trabajadores contratados en España al servicio de empresas españolas en el extranjero, deben constar por escrito. Si no se cumple la exigencia de forma escrita, el contrato se presumirá celebrado por tiempo indefinido y a jornada completa, salvo prueba en contrario que acredite su naturaleza temporal o el carácter a tiempo parcial de los servicios.","['contraprestaciones establecidas en la parte no válida del contrato, el órgano de la \njurisdicción social que a instancia de parte declare la nulidad hará el debido pronunciamiento \nsobre la subsistencia o supresión en todo o en parte de dichas condiciones o retribuciones.\n2. En caso de que el contrato resultase nulo, el trabajador podrá exigir, por el trabajo que \nya hubiese prestado, la remuneración consiguiente a un contrato válido.\n3. En caso de nulidad por discriminación salarial por razón de sexo, el trabajador tendrá \nderecho a la retribución correspondiente al trabajo igual o de igual valor.\nSección 4.ª Modalidades del contrato de trabajo\nArtículo 10.  Trabajo en común y contrato de grupo.\n1. Si el empresario diera un trabajo en común a un grupo de sus trabajadores, \nconservará respecto de cada uno, individualmente, sus derechos y deberes.\n2. Si el empresario hubiese celebrado un contrato con un grupo de trabajadores'
 'y dirección de otro y el que lo recibe a cambio de una retribución a aquel.\n2. Deberán constar por escrito los contratos de trabajo cuando así lo exija una \ndisposición legal y, en todo caso, los de prácticas y para la formación y el aprendizaje, los \ncontratos a tiempo parcial, fijos-discontinuos y de relevo y los contratos para la realización de \nuna obra o servicio determinado; también constarán por escrito los contratos por tiempo \ndeterminado cuya duración sea superior a cuatro semanas.\nDeberán constar igualmente por escrito los contratos de trabajo de los pescadores, de \nlos trabajadores que trabajen a distancia y de los trabajadores contratados en España al \nservicio de empresas españolas en el extranjero.\nDe no observarse la exigencia de forma escrita, el contrato de trabajo se presumirá \ncelebrado por tiempo indefinido y a jornada completa, salvo prueba en contrario que acredite \nsu naturaleza temporal o el carácter a tiempo parcial de los servicios.'
 'A efectos de lo dispuesto en el párrafo anterior, se entenderá por «trabajador a tiempo \ncompleto comparable» a un trabajador a tiempo completo de la misma empresa y centro de \ntrabajo, con el mismo tipo de contrato de trabajo y que realice un trabajo idéntico o similar. Si \nen la empresa no hubiera ningún trabajador comparable a tiempo completo, se considerará \nla jornada a tiempo completo prevista en el convenio colectivo de aplicación o, en su defecto, \nla jornada máxima legal.\n2. El contrato a tiempo parcial podrá concertarse por tiempo indefinido o por duración \ndeterminada en los supuestos en los que legalmente se permita la utilización de esta \nmodalidad de contratación.\n3. (Derogado)\n4. El contrato a tiempo parcial se regirá por las siguientes reglas:\na) El contrato, conforme a lo dispuesto en el artículo 8.2, se deberá formalizar \nnecesariamente por escrito. En el contrato deberá figurar el número de horas ordinarias de']",['El contrato de trabajo se podrá celebrar por escrito o de palabra.'],El contrato de trabajo se podrá celebrar por escrito o de palabra. Se presumirá existente entre todo el que presta un servicio por cuenta y dentro del ámbito de organización y dirección de otro y el que lo recibe a cambio de una retribución a aquel.
¿Qué contratos tienen que estar por escrito obligatoriamente?," Los contratos que tienen que estar por escrito obligatoriamente incluyen los siguientes tipos de contratos:
1. Contratos de trabajo cuando así lo exija una disposición legal y, en todo caso, los de prácticas, para la formación y el aprendizaje, los contratos a tiempo parcial, fijos-discontinuos y de relevo y los contratos para la realización de una obra o servicio determinado.
2. Contratos por tiempo determinado cuya duración sea superior a cuatro semanas.
3. Contratos de trabajo de los pescadores, de los trabajadores que trabajen a distancia y de los trabajadores contratados en España al servicio de empresas españolas en el extranjero.
La exigencia de forma escrita no se cumple, el contrato de trabajo se presumirá celebrado por tiempo indefinido y a jornada completa, salvo prueba en contrario que acredite su naturaleza temporal o el carácter a tiempo parcial de los servicios.
El empresario está obligado a comunicar a la oficina pública de empleo la información del contenido de los contratos de trabajo celebrados y las prórrogas de estos, exceptuando los contratos de relación laboral especial de alta dirección.
El empresario también entrega una copia básica de todos los contratos que deban celebrarse por escrito a la representación legal de los trabajadores.","['y dirección de otro y el que lo recibe a cambio de una retribución a aquel.\n2. Deberán constar por escrito los contratos de trabajo cuando así lo exija una \ndisposición legal y, en todo caso, los de prácticas y para la formación y el aprendizaje, los \ncontratos a tiempo parcial, fijos-discontinuos y de relevo y los contratos para la realización de \nuna obra o servicio determinado; también constarán por escrito los contratos por tiempo \ndeterminado cuya duración sea superior a cuatro semanas.\nDeberán constar igualmente por escrito los contratos de trabajo de los pescadores, de \nlos trabajadores que trabajen a distancia y de los trabajadores contratados en España al \nservicio de empresas españolas en el extranjero.\nDe no observarse la exigencia de forma escrita, el contrato de trabajo se presumirá \ncelebrado por tiempo indefinido y a jornada completa, salvo prueba en contrario que acredite \nsu naturaleza temporal o el carácter a tiempo parcial de los servicios.'
 'su naturaleza temporal o el carácter a tiempo parcial de los servicios.\nCualquiera de las partes podrá exigir que el contrato se formalice por escrito, incluso \ndurante el transcurso de la relación laboral.\n3. El empresario está obligado a comunicar a la oficina pública de empleo, en el plazo de \nlos diez días siguientes a su concertación y en los términos que reglamentariamente se \ndeterminen, el contenido de los contratos de trabajo que celebre o las prórrogas de los \nmismos, deban o no formalizarse por escrito.\n4. El empresario entregará a la representación legal de los trabajadores una copia básica \nde todos los contratos que deban celebrarse por escrito, a excepción de los contratos de \nrelación laboral especial de alta dirección sobre los que se establece el deber de notificación \na la representación legal de los trabajadores.\nCon el fin de comprobar la adecuación del contenido del contrato a la legalidad vigente, \nesta copia básica contendrá todos los datos del contrato a excepción del número del'
 'el empleo, así como sobre la producción y ventas, incluido el programa de producción.\nc) Sobre las previsiones del empresario de celebración de nuevos contratos, con \nindicación del número de estos y de las modalidades y tipos que serán utilizados, incluidos \nlos contratos a tiempo parcial, la realización de horas complementarias por los trabajadores \ncontratados a tiempo parcial y de los supuestos de subcontratación.BOLETÍN OFICIAL DEL ESTADO\nLEGISLACIÓN CONSOLIDADA\nPágina 66']","['cuando así lo exija una disposición legal y, en todo caso, los de prácticas y para la formación y el aprendizaje, los contratos a tiempo parcial, fijos-discontinuos y de relevo, los contratos para la realización de una obra o servicio determinado, los de los trabajadores que trabajen a distancia y los contratados en España al servicio de empresas españolas en el extranjero. \nlos contratos por tiempo determinado cuya duración sea superior a cuatro semanas. De no observarse tal exigencia, el contrato se presumirá celebrado por tiempo indefinido y a jornada completa, salvo prueba en contrario']","Deberán constar por escrito los contratos de trabajo cuando así lo exija una disposición legal y, en todo caso, los de prácticas y para la formación y el aprendizaje, los contratos a tiempo parcial, fijos-discontinuos y de relevo, los contratos para la realización de una obra o servicio determinado, los de los trabajadores que trabajen a distancia y los contratados en España al servicio de empresas españolas en el extranjero. Igualmente constarán por escrito los contratos por tiempo determinado cuya duración sea superior a cuatro semanas. De no observarse tal exigencia, el contrato se presumirá celebrado por tiempo indefinido y a jornada completa, salvo prueba en contrario que acredite su naturaleza temporal o el carácter a tiempo parcial de los servicios.

Cualquiera de las partes podrá exigir que el contrato se formalice por escrito, incluso durante el transcurso de la relación laboral."
¿Debe comunicar el empresario la contratación de un trabajador?," El empresario debe comunicar la extinción del contrato al trabajador y, si es el caso, a un representante legal de los trabajadores. La liquidación de las cantidades adeudadas debe acompañar la notificación. Si el trabajo se realiza para diversos empresarios, no hay concurrencia desleal solo si se pacta plena dedicación económicamente compensada y cumplen los requisitos necesarios. El pacto de no competencia solo puede tener una duración superior a dos años para técnicos y seis meses para otros trabajadores. En caso de compensación económica por plena dedicación, el trabajador puede rescindir el acuerdo y recuperar su libertad de trabajo siempre que lo indique en escrito al empresario con un preaviso de treinta días.

Causas justificadas para que el trabajador solicite la extinción del contrato incluyen modificaciones sustanciales en las condiciones de trabajo, falta de pago o retrasos continuados en el abono del salario y cualquier otro incumplimiento grave por parte del empresario.","['i) Por despido colectivo fundado en causas económicas, técnicas, organizativas o de \nproducción.\nj) Por voluntad del trabajador, fundamentada en un incumplimiento contractual del \nempresario.\nk) Por despido del trabajador.\nl) Por causas objetivas legalmente procedentes.\nm) Por decisión de la trabajadora que se vea obligada a abandonar definitivamente su \npuesto de trabajo como consecuencia de ser víctima de violencia de género o de violencia \nsexual.\n2. El empresario, con ocasión de la extinción del contrato, al comunicar a los \ntrabajadores la denuncia, o, en su caso, el preaviso de la extinción del mismo, deberá \nacompañar una propuesta del documento de liquidación de las cantidades adeudadas.\nEl trabajador podrá solicitar la presencia de un representante legal de los trabajadores en \nel momento de proceder a la firma del recibo del finiquito, haciéndose constar en el mismo el \nhecho de su firma en presencia de un representante legal de los trabajadores, o bien que el'
 'digitales.\nArtículo 21.  Pacto de no concurrencia y de permanencia en la empresa.\n1. No podrá efectuarse la prestación laboral de un trabajador para diversos empresarios \ncuando se estime concurrencia desleal o cuando se pacte la plena dedicación mediante \ncompensación económica expresa, en los términos que al efecto se convengan.\n2. El pacto de no competencia para después de extinguido el contrato de trabajo, que no \npodrá tener una duración superior a dos años para los técnicos y de seis meses para los \ndemás trabajadores, solo será válido si concurren los requisitos siguientes:\na) Que el empresario tenga un efectivo interés industrial o comercial en ello.\nb) Que se satisfaga al trabajador una compensación económica adecuada.\n3. En el supuesto de compensación económica por la plena dedicación, el trabajador \npodrá rescindir el acuerdo y recuperar su libertad de trabajo en otro empleo, comunicándolo \npor escrito al empresario con un preaviso de treinta días, perdiéndose en este caso la'
 'hecho de su firma en presencia de un representante legal de los trabajadores, o bien que el \ntrabajador no ha hecho uso de esta posibilidad. Si el empresario impidiese la presencia del \nrepresentante en el momento de la firma, el trabajador podrá hacerlo constar en el propio \nrecibo, a los efectos oportunos.\nArtículo 50.  Extinción por voluntad del trabajador.\n1. Serán causas justas para que el trabajador pueda solicitar la extinción del contrato:\na) Las modificaciones sustanciales en las condiciones de trabajo llevadas a cabo sin \nrespetar lo previsto en el artículo 41 y que redunden en menoscabo de la dignidad del \ntrabajador.\nb) La falta de pago o retrasos continuados en el abono del salario pactado.\nc) Cualquier otro incumplimiento grave de sus obligaciones por parte del empresario, \nsalvo los supuestos de fuerza mayor, así como la negativa del mismo a reintegrar al \ntrabajador en sus anteriores condiciones de trabajo en los supuestos previstos en los']","['El empresario está obligado a comunicar a la oficina pública de empleo, en el plazo de los diez días siguientes a su concertación']","El empresario está obligado a comunicar a la oficina pública de empleo, en el plazo de los diez días siguientes a su concertación y en los términos que reglamentariamente se determinen, el contenido de los contratos de trabajo que celebre o las prórrogas de los mismos, deban o no formalizarse por escrito."
¿Es obligatorio entregar una copia básica de los contratos a los trabajadores?," Sí, el empleador está obligado a entregar una copia básica de todos los contratos que deben celebrarse por escrito a la representación legal de los trabajadores, con excepción de los contratos de relación laboral especial de alta dirección. Esta copia básica contendrá todos los datos del contrato a excepción del número del empleo y de la información relativa a la producción y ventas.","['su naturaleza temporal o el carácter a tiempo parcial de los servicios.\nCualquiera de las partes podrá exigir que el contrato se formalice por escrito, incluso \ndurante el transcurso de la relación laboral.\n3. El empresario está obligado a comunicar a la oficina pública de empleo, en el plazo de \nlos diez días siguientes a su concertación y en los términos que reglamentariamente se \ndeterminen, el contenido de los contratos de trabajo que celebre o las prórrogas de los \nmismos, deban o no formalizarse por escrito.\n4. El empresario entregará a la representación legal de los trabajadores una copia básica \nde todos los contratos que deban celebrarse por escrito, a excepción de los contratos de \nrelación laboral especial de alta dirección sobre los que se establece el deber de notificación \na la representación legal de los trabajadores.\nCon el fin de comprobar la adecuación del contenido del contrato a la legalidad vigente, \nesta copia básica contendrá todos los datos del contrato a excepción del número del'
 'el empleo, así como sobre la producción y ventas, incluido el programa de producción.\nc) Sobre las previsiones del empresario de celebración de nuevos contratos, con \nindicación del número de estos y de las modalidades y tipos que serán utilizados, incluidos \nlos contratos a tiempo parcial, la realización de horas complementarias por los trabajadores \ncontratados a tiempo parcial y de los supuestos de subcontratación.BOLETÍN OFICIAL DEL ESTADO\nLEGISLACIÓN CONSOLIDADA\nPágina 66'
 'proporcionalidad y transparencia.\n7. La empresa deberá informar a las personas fijas-discontinuas y a la representación \nlegal de las personas trabajadoras sobre la existencia de puestos de trabajo vacantes de \ncarácter fijo ordinario, de manera que aquellas puedan formular solicitudes de conversión \nvoluntaria, de conformidad con los procedimientos que establezca el convenio colectivo \nsectorial o, en su defecto, el acuerdo de empresa.\n8. Las personas trabajadoras fijas-discontinuas tendrán la consideración de colectivo \nprioritario para el acceso a las iniciativas de formación del sistema de formación profesional \npara el empleo en el ámbito laboral durante los periodos de inactividad.\nSección 2.ª Derechos y deberes derivados del contrato\nArtículo 17.  No discriminación en las relaciones laborales.\n1. Se entenderán nulos y sin efecto los preceptos reglamentarios, las cláusulas de los \nconvenios colectivos, los pactos individuales y las decisiones unilaterales del empresario que']","['El empresario entregará a la representación legal de los trabajadores una copia básica de todos los contratos que deban celebrarse por escrito, a excepción de los contratos de relación laboral especial de alta dirección']","El empresario entregará a la representación legal de los trabajadores una copia básica de todos los contratos que deban celebrarse por escrito, a excepción de los contratos de relación laboral especial de alta dirección sobre los que se establece el deber de notificación a la representación legal de los trabajadores."
¿Cuáles son los efectos de la nulidad de un contrato de trabajo?,"1. El efecto de la nulidad de un contrato de trabajo depende del momento en que se inició el expediente de regulación de empleo. Si el expediente comenzó a partir del 12 de febrero de 2012, la indemnización por despido será estipulada en la normativa vigente en ese momento. Si el expediente ya estaba en vigencia antes del 12 de febrero de 2012, la indemnización por despido se calculará a razón de cuarenta y cinco días.

2. La empresa debe comunicar al autoridad laboral las personas trabajadoras incluidas en el expediente, así como el período dentro del cual se llevará a cabo la suspensión o reducción de jornada, el tipo de medida aplicar a cada trabajador y el porcentaje máximo de reducción de jornada o el número máximo de días de suspensión de contrato.

3. Durante el periodo de aplicación del expediente, la empresa podrá desafectar y afectar a las personas trabajadoras en función de las alteraciones de las circunstancias, pero esto será siempre voluntario para el trabajador. Además, el trabajador no puede ser despedido ni sufrir ningún otro tipo de sanción o efecto perjudicial por rechazar esta conversión, a menos que se adoptasen medidas en conformidad con lo dispuesto en los artículos 51 y 52.c) por causas económicas, técnicas, organizativas o de producción.

4. Para facilitar la movilidad voluntaria en el trabajo a tiempo parcial, la empresa debe informar a los trabajadores sobre la existencia de puestos de trabajo vacantes y los trabajadores pueden formular solicitudes de conversión voluntaria de un trabajo a tiempo completo en un trabajo a tiempo parcial y viceversa, o para el incremento del tiempo de trabajo de los trabajadores a tiempo parcial.","['1. Los expedientes de regulación de empleo para la extinción o suspensión de los \ncontratos de trabajo  o para la reducción de jornada que estuvieran en tramitación a 12 de \nfebrero de 2012 se regirán por la normativa vigente en el momento de su inicio.\n2. Los expedientes de regulación de empleo para la extinción o la suspensión de los \ncontratos de trabajo o para la reducción de jornada resueltos por la autoridad laboral y con \nvigencia en su aplicación a 12 de febrero de 2012 se regirán por la normativa en vigor \ncuando se dictó la resolución del expediente.\nDisposición transitoria undécima.  Indemnizaciones por despido improcedente.\n1. La indemnización por despido prevista en el artículo 56.1 será de aplicación a los \ncontratos suscritos a partir del 12 de febrero de 2012.\n2. La indemnización por despido improcedente de los contratos formalizados con \nanterioridad al 12 de febrero de 2012 se calculará a razón de cuarenta y cinco días de'
 'b) La empresa junto con la notificación, comunicación o solicitud, según proceda, a la \nautoridad laboral sobre su decisión de reducir la jornada de trabajo o suspender los contratos \nde trabajo, a que se refieren los apartados 3, 4, 5 y 6, comunicará, a través de los \nprocedimientos automatizados que se establezcan:\n1.º El período dentro del cual se va a llevar a cabo la aplicación de la suspensión del \ncontrato o la reducción de jornada.\n2.º La identificación de las personas trabajadoras incluidas en el expediente de \nregulación temporal de empleo.\n3.º El tipo de medida a aplicar respecto de cada una de las personas trabajadoras y el \nporcentaje máximo de reducción de jornada o el número máximo de días de suspensión de \ncontrato a aplicar.\nc) Durante el periodo de aplicación del expediente, la empresa podrá desafectar y afectar \na las personas trabajadoras en función de las alteraciones de las circunstancias señaladas'
 'tendrá siempre carácter voluntario para el trabajador y no se podrá imponer de forma \nunilateral o como consecuencia de una modificación sustancial de condiciones de trabajo al \namparo de lo dispuesto en el artículo 41.1.a). El trabajador no podrá ser despedido ni sufrir \nningún otro tipo de sanción o efecto perjudicial por el hecho de rechazar esta conversión, sin \nperjuicio de las medidas que, de conformidad con lo dispuesto en los artículos 51 y 52.c), \npuedan adoptarse por causas económicas, técnicas, organizativas o de producción.\nA fin de posibilitar la movilidad voluntaria en el trabajo a tiempo parcial, el empresario \ndeberá informar a los trabajadores de la empresa sobre la existencia de puestos de trabajo \nvacantes, de manera que aquellos puedan formular solicitudes de conversión voluntaria de \nun trabajo a tiempo completo en un trabajo a tiempo parcial y viceversa, o para el incremento \ndel tiempo de trabajo de los trabajadores a tiempo parcial, todo ello de conformidad con los']","['Si resultase nula solo una parte del contrato de trabajo, este permanecerá válido en lo restante, y se entenderá completado con los preceptos jurídicos adecuados conforme a lo dispuesto en el artículo 3.1.\nEn caso de que el contrato resultase nulo, el trabajador podrá exigir, por el trabajo que ya hubiese prestado, la remuneración consiguiente a un contrato válido.']","Si resultase nula solo una parte del contrato de trabajo, este permanecerá válido en lo restante, y se entenderá completado con los preceptos jurídicos adecuados conforme a lo dispuesto en el artículo 3.1.

Si el trabajador tuviera asignadas condiciones o retribuciones especiales en virtud de contraprestaciones establecidas en la parte no válida del contrato, el órgano de la jurisdicción social que a instancia de parte declare la nulidad hará el debido pronunciamiento sobre la subsistencia o supresión en todo o en parte de dichas condiciones o retribuciones.

En caso de que el contrato resultase nulo, el trabajador podrá exigir, por el trabajo que ya hubiese prestado, la remuneración consiguiente a un contrato válido."
¿Qué obligaciones genera al empresario un trabajo en común?," El trabajo en común no genera obligaciones individuales para el empresario frente a cada uno de sus miembros, sino que este representará a todos. Sin embargo, si un trabajador asocia a su trabajo a un auxiliar o ayudante, el empresario lo será también de este.","['2. Si el empresario hubiese celebrado un contrato con un grupo de trabajadores \nconsiderado en su totalidad, no tendrá frente a cada uno de sus miembros los derechos y \ndeberes que como tal le competen. El jefe del grupo ostentará la representación de los que \nlo integren, respondiendo de las obligaciones inherentes a dicha representación.\n3. Si el trabajador, conforme a lo pactado por escrito, asociare a su trabajo un auxiliar o \nayudante, el empresario de aquel lo será también de este.\nArtículo 11.  Contrato formativo.\n1. El contrato formativo tendrá por objeto la formación en alternancia con el trabajo \nretribuido por cuenta ajena en los términos establecidos en el apartado 2, o el desempeño de \nuna actividad laboral destinada a adquirir una práctica profesional adecuada a los \ncorrespondientes niveles de estudios, en los términos establecidos en el apartado 3.\n2. El contrato de formación en alternancia, que tendrá por objeto compatibilizar la'
 'contraprestaciones establecidas en la parte no válida del contrato, el órgano de la \njurisdicción social que a instancia de parte declare la nulidad hará el debido pronunciamiento \nsobre la subsistencia o supresión en todo o en parte de dichas condiciones o retribuciones.\n2. En caso de que el contrato resultase nulo, el trabajador podrá exigir, por el trabajo que \nya hubiese prestado, la remuneración consiguiente a un contrato válido.\n3. En caso de nulidad por discriminación salarial por razón de sexo, el trabajador tendrá \nderecho a la retribución correspondiente al trabajo igual o de igual valor.\nSección 4.ª Modalidades del contrato de trabajo\nArtículo 10.  Trabajo en común y contrato de grupo.\n1. Si el empresario diera un trabajo en común a un grupo de sus trabajadores, \nconservará respecto de cada uno, individualmente, sus derechos y deberes.\n2. Si el empresario hubiese celebrado un contrato con un grupo de trabajadores'
 '2. En todo caso, se entiende que se incurre en la cesión ilegal de trabajadores \ncontemplada en este artículo cuando se produzca alguna de las siguientes circunstancias: \nque el objeto de los contratos de servicios entre las empresas se limite a una mera puesta a \ndisposición de los trabajadores de la empresa cedente a la empresa cesionaria, o que la \nempresa cedente carezca de una actividad o de una organización propia y estable, o no \ncuente con los medios necesarios para el desarrollo de su actividad, o no ejerza las \nfunciones inherentes a su condición de empresario.\n3. Los empresarios, cedente y cesionario, que infrinjan lo señalado en los apartados \nanteriores responderán solidariamente de las obligaciones contraídas con los trabajadores y \ncon la Seguridad Social, sin perjuicio de las demás responsabilidades, incluso penales, que \nprocedan por dichos actos.\n4. Los trabajadores sometidos al tráfico prohibido tendrán derecho a adquirir la condición']","['conservará respecto de cada uno, individualmente, sus derechos y deberes.']","Si el empresario diera un trabajo en común a un grupo de sus trabajadores, conservará respecto de cada uno, individualmente, sus derechos y deberes."
¿Qué efectos despliega un contrato con un grupo de trabajadores?," Un contrato formativo es una modalidad de contrato por tiempo indefinido que puede utilizarse en la suscripción de contratos de trabajo a tiempo parcial. El contrato a tiempo parcial se entiende como un contrato de trabajo durante un número de horas inferior a la jornada de un trabajador a tiempo completo comparable. Esta modalidad de contratación puede concertarse por tiempo indefinido o por duración determinada según sea lo que permita legalmente. Los efectos del contrato con un grupo de trabajadores incluyen el derecho al conocimiento de si las personas a las que se pretende contratar han estado previamente contratadas bajo esta modalidad y la duración de estas contrataciones, información que es liberadora para evitar exceder la duración máxima de este contrato.","['contratos formativos en contratos por tiempo indefinido.\n7. Las empresas que pretendan suscribir contratos formativos, podrán solicitar por \nescrito al servicio público de empleo competente, información relativa a si las personas a las \nque pretenden contratar han estado previamente contratadas bajo dicha modalidad y la \nduración de estas contrataciones. Dicha información deberá ser trasladada a la \nrepresentación legal de las personas trabajadoras y tendrá valor liberatorio a efectos de no \nexceder la duración máxima de este contrato.\nArtículo 12.  Contrato a tiempo parcial y contrato de relevo.\n1. El contrato de trabajo se entenderá celebrado a tiempo parcial cuando se haya \nacordado la prestación de servicios durante un número de horas al día, a la semana, al mes \no al año, inferior a la jornada de trabajo de un trabajador a tiempo completo comparable.\nA efectos de lo dispuesto en el párrafo anterior, se entenderá por «trabajador a tiempo'
 'A efectos de lo dispuesto en el párrafo anterior, se entenderá por «trabajador a tiempo \ncompleto comparable» a un trabajador a tiempo completo de la misma empresa y centro de \ntrabajo, con el mismo tipo de contrato de trabajo y que realice un trabajo idéntico o similar. Si \nen la empresa no hubiera ningún trabajador comparable a tiempo completo, se considerará \nla jornada a tiempo completo prevista en el convenio colectivo de aplicación o, en su defecto, \nla jornada máxima legal.\n2. El contrato a tiempo parcial podrá concertarse por tiempo indefinido o por duración \ndeterminada en los supuestos en los que legalmente se permita la utilización de esta \nmodalidad de contratación.\n3. (Derogado)\n4. El contrato a tiempo parcial se regirá por las siguientes reglas:\na) El contrato, conforme a lo dispuesto en el artículo 8.2, se deberá formalizar \nnecesariamente por escrito. En el contrato deberá figurar el número de horas ordinarias de'
 'contraprestaciones establecidas en la parte no válida del contrato, el órgano de la \njurisdicción social que a instancia de parte declare la nulidad hará el debido pronunciamiento \nsobre la subsistencia o supresión en todo o en parte de dichas condiciones o retribuciones.\n2. En caso de que el contrato resultase nulo, el trabajador podrá exigir, por el trabajo que \nya hubiese prestado, la remuneración consiguiente a un contrato válido.\n3. En caso de nulidad por discriminación salarial por razón de sexo, el trabajador tendrá \nderecho a la retribución correspondiente al trabajo igual o de igual valor.\nSección 4.ª Modalidades del contrato de trabajo\nArtículo 10.  Trabajo en común y contrato de grupo.\n1. Si el empresario diera un trabajo en común a un grupo de sus trabajadores, \nconservará respecto de cada uno, individualmente, sus derechos y deberes.\n2. Si el empresario hubiese celebrado un contrato con un grupo de trabajadores']","['no tendrá frente a cada uno de sus miembros los derechos y deberes que como tal le competen. El jefe del grupo ostentará la representación de los que lo integren, respondiendo de las obligaciones inherentes a dicha representación.']","Si el empresario hubiese celebrado un contrato con un grupo de trabajadores considerado en su totalidad, no tendrá frente a cada uno de sus miembros los derechos y deberes que como tal le competen. El jefe del grupo ostentará la representación de los que lo integren, respondiendo de las obligaciones inherentes a dicha representación."
¿Con quién se puede concertar un contrato en prácticas?," El contrato de prácticas se puede concertar con quienes tengan la condición de trabajador a tiempo completo comparable en la misma empresa y centro de trabajo, con el mismo tipo de contrato de trabajo y que realicen un trabajo idéntico o similar. Si no hay ningún trabajador comparable a tiempo completo, se puede utilizar la jornada a tiempo completo prevista en el convenio colectivo de aplicación o la jornada máxima legal.","['A efectos de lo dispuesto en el párrafo anterior, se entenderá por «trabajador a tiempo \ncompleto comparable» a un trabajador a tiempo completo de la misma empresa y centro de \ntrabajo, con el mismo tipo de contrato de trabajo y que realice un trabajo idéntico o similar. Si \nen la empresa no hubiera ningún trabajador comparable a tiempo completo, se considerará \nla jornada a tiempo completo prevista en el convenio colectivo de aplicación o, en su defecto, \nla jornada máxima legal.\n2. El contrato a tiempo parcial podrá concertarse por tiempo indefinido o por duración \ndeterminada en los supuestos en los que legalmente se permita la utilización de esta \nmodalidad de contratación.\n3. (Derogado)\n4. El contrato a tiempo parcial se regirá por las siguientes reglas:\na) El contrato, conforme a lo dispuesto en el artículo 8.2, se deberá formalizar \nnecesariamente por escrito. En el contrato deberá figurar el número de horas ordinarias de'
 'y dirección de otro y el que lo recibe a cambio de una retribución a aquel.\n2. Deberán constar por escrito los contratos de trabajo cuando así lo exija una \ndisposición legal y, en todo caso, los de prácticas y para la formación y el aprendizaje, los \ncontratos a tiempo parcial, fijos-discontinuos y de relevo y los contratos para la realización de \nuna obra o servicio determinado; también constarán por escrito los contratos por tiempo \ndeterminado cuya duración sea superior a cuatro semanas.\nDeberán constar igualmente por escrito los contratos de trabajo de los pescadores, de \nlos trabajadores que trabajen a distancia y de los trabajadores contratados en España al \nservicio de empresas españolas en el extranjero.\nDe no observarse la exigencia de forma escrita, el contrato de trabajo se presumirá \ncelebrado por tiempo indefinido y a jornada completa, salvo prueba en contrario que acredite \nsu naturaleza temporal o el carácter a tiempo parcial de los servicios.'
 'Asimismo, el contrato de sustitución podrá concertarse para completar la jornada \nreducida por otra persona trabajadora, cuando dicha reducción se ampare en causas \nlegalmente establecidas o reguladas en el convenio colectivo y se especifique en el contrato \nel nombre de la persona sustituida y la causa de la sustitución.\nEl contrato de sustitución podrá ser también celebrado para la cobertura temporal de un \npuesto de trabajo durante el proceso de selección o promoción para su cobertura definitiva \nmediante contrato fijo, sin que su duración pueda ser en este caso superior a tres meses, o \nel plazo inferior recogido en convenio colectivo, ni pueda celebrarse un nuevo contrato con el \nmismo objeto una vez superada dicha duración máxima.\n4. Las personas contratadas incumpliendo lo establecido en este artículo adquirirán la \ncondición de fijas.BOLETÍN OFICIAL DEL ESTADO\nLEGISLACIÓN CONSOLIDADA\nPágina 21']","['con quienes estuvieren en posesión de título universitario o de formación profesional de grado medio o superior o títulos oficialmente reconocidos como equivalentes,']","El contrato de trabajo en prácticas podrá concertarse con quienes estuvieren en posesión de título universitario o de formación profesional de grado medio o superior o títulos oficialmente reconocidos como equivalentes, de acuerdo con las leyes reguladoras del sistema educativo vigente, o de certificado de profesionalidad de acuerdo con lo previsto en la Ley Orgánica 5/2002, de 19 de junio, de las Cualificaciones y de la Formación Profesional, que habiliten para el ejercicio profesional, dentro de los cinco años, o de siete años cuando el contrato se concierte con un trabajador con discapacidad, siguientes a la terminación de los correspondientes estudios."
¿Cuáles son las especificidades de un contrato en prácticas? ¿Cuáles son las reglas del contrato en prácticas?,"1. Un contrato en prácticas es un contrato temporal que se celebra entre una empresa y una persona trabajadora para realizar labores auxiliares o de formación profesional.
2. Las especificidades del contrato en prácticas incluyen la información sobre el puesto de trabajo vacante, los derechos de acceso a las iniciativas de formación, la no discriminación y la protección contra la desaconsejabilidad.
3. Las reglas del contrato en prácticas incluyen la proporcionalidad y transparencia en el proceso de selección y promoción, la consideración de colectivo prioritario para los trabajadores fijos-discontinuos durante periodos de inactividad, la sustitución del puesto de trabajo y el cumplimiento de lo establecido en el artículo 17 sobre no discriminación en las relaciones laborales.
4. Las disposiciones transitorias especifican que los contratos celebrados antes de la entrada en vigor de la ley continúan siendo de aplicación a las normas específicas aplicables a cada modalidad contractual, con ciertas derogaciones y excepciones.","['proporcionalidad y transparencia.\n7. La empresa deberá informar a las personas fijas-discontinuas y a la representación \nlegal de las personas trabajadoras sobre la existencia de puestos de trabajo vacantes de \ncarácter fijo ordinario, de manera que aquellas puedan formular solicitudes de conversión \nvoluntaria, de conformidad con los procedimientos que establezca el convenio colectivo \nsectorial o, en su defecto, el acuerdo de empresa.\n8. Las personas trabajadoras fijas-discontinuas tendrán la consideración de colectivo \nprioritario para el acceso a las iniciativas de formación del sistema de formación profesional \npara el empleo en el ámbito laboral durante los periodos de inactividad.\nSección 2.ª Derechos y deberes derivados del contrato\nArtículo 17.  No discriminación en las relaciones laborales.\n1. Se entenderán nulos y sin efecto los preceptos reglamentarios, las cláusulas de los \nconvenios colectivos, los pactos individuales y las decisiones unilaterales del empresario que'
 'Asimismo, el contrato de sustitución podrá concertarse para completar la jornada \nreducida por otra persona trabajadora, cuando dicha reducción se ampare en causas \nlegalmente establecidas o reguladas en el convenio colectivo y se especifique en el contrato \nel nombre de la persona sustituida y la causa de la sustitución.\nEl contrato de sustitución podrá ser también celebrado para la cobertura temporal de un \npuesto de trabajo durante el proceso de selección o promoción para su cobertura definitiva \nmediante contrato fijo, sin que su duración pueda ser en este caso superior a tres meses, o \nel plazo inferior recogido en convenio colectivo, ni pueda celebrarse un nuevo contrato con el \nmismo objeto una vez superada dicha duración máxima.\n4. Las personas contratadas incumpliendo lo establecido en este artículo adquirirán la \ncondición de fijas.BOLETÍN OFICIAL DEL ESTADO\nLEGISLACIÓN CONSOLIDADA\nPágina 21'
 'Disposición transitoria primera.  Contratos celebrados antes de la entrada en vigor de esta \nley.\nContinuarán siendo de aplicación a los contratos celebrados antes de la entrada en vigor \nde esta ley las normas específicas aplicables a cada una de las modalidades contractuales \nque estuvieran vigentes en el momento en que dichos contratos se concertaron, salvo que \notra cosa se hubiera establecido legalmente.\nDisposición transitoria segunda.  Contratos para la formación y el aprendizaje.\n1. (Derogado).\n2. Las referencias realizadas en las disposiciones legales, reglamentarias o en los \nconvenios colectivos al contrato para la formación deberán entenderse realizadas, a partir \ndel 31 de agosto de 2011, al contrato para la formación y el aprendizaje a que se refiere el \nartículo 11.2 en la medida en que no se opongan o contradigan lo establecido en el mismo.\nDisposición transitoria tercera.  Contratos a tiempo parcial por jubilación parcial y de \nrelevo y edad de jubilación.']","['a) El puesto de trabajo deberá permitir la obtención de la práctica profesional adecuada al nivel de estudios o de formación cursados. \nb) La duración del contrato no podrá ser inferior a seis meses ni exceder de dos años, dentro de cuyos límites los convenios colectivos de ámbito sectorial estatal o, en su defecto, los convenios colectivos sectoriales de ámbito inferior podrán determinar la duración del contrato, atendiendo a las características del sector y de las prácticas a realizar.\nc) Ningún trabajador podrá estar contratado en prácticas en la misma o distinta empresa por tiempo superior a dos años en virtud de la misma titulación o certificado de profesionalidad.\nd) Salvo lo dispuesto en convenio colectivo, el periodo de prueba no podrá ser superior a un mes para los contratos en prácticas celebrados con trabajadores que estén en posesión de título de grado medio o de certificado de profesionalidad de nivel 1 o 2, ni a dos meses para los contratos en prácticas celebrados con trabajadores que estén en posesión de título de grado superior o de certificado de profesionalidad de nivel 3.\n\ne) La retribución del trabajador será la fijada en convenio colectivo para los trabajadores en prácticas, sin que, en su defecto, pueda ser inferior al sesenta o al setenta y cinco por ciento durante el primero o el segundo año de vigencia del contrato, respectivamente, del salario fijado en convenio para un trabajador que desempeñe el mismo o equivalente puesto de trabajo.\n\nf) Si al término del contrato el trabajador continuase en la empresa no podrá concertarse un nuevo periodo de prueba, computándose la duración de las prácticas a efecto de antigüedad en la empresa.']","a) El puesto de trabajo deberá permitir la obtención de la práctica profesional adecuada al nivel de estudios o de formación cursados. Mediante convenio colectivo de ámbito sectorial estatal o, en su defecto, en los convenios colectivos sectoriales de ámbito inferior, se podrán determinar los puestos de trabajo o grupos profesionales objeto de este contrato.

b) La duración del contrato no podrá ser inferior a seis meses ni exceder de dos años, dentro de cuyos límites los convenios colectivos de ámbito sectorial estatal o, en su defecto, los convenios colectivos sectoriales de ámbito inferior podrán determinar la duración del contrato, atendiendo a las características del sector y de las prácticas a realizar.

Las situaciones de incapacidad temporal, riesgo durante el embarazo, maternidad, adopción, guarda con fines de adopción, acogimiento, riesgo durante la lactancia y paternidad interrumpirán el cómputo de la duración del contrato.

c) Ningún trabajador podrá estar contratado en prácticas en la misma o distinta empresa por tiempo superior a dos años en virtud de la misma titulación o certificado de profesionalidad.

Tampoco se podrá estar contratado en prácticas en la misma empresa para el mismo puesto de trabajo por tiempo superior a dos años, aunque se trate de distinta titulación o distinto certificado de profesionalidad.

A los efectos de este artículo, los títulos de grado, máster y, en su caso, doctorado, correspondientes a los estudios universitarios no se considerarán la misma titulación, salvo que al ser contratado por primera vez mediante un contrato en prácticas el trabajador estuviera ya en posesión del título superior de que se trate.

d) Salvo lo dispuesto en convenio colectivo, el periodo de prueba no podrá ser superior a un mes para los contratos en prácticas celebrados con trabajadores que estén en posesión de título de grado medio o de certificado de profesionalidad de nivel 1 o 2, ni a dos meses para los contratos en prácticas celebrados con trabajadores que estén en posesión de título de grado superior o de certificado de profesionalidad de nivel 3.

e) La retribución del trabajador será la fijada en convenio colectivo para los trabajadores en prácticas, sin que, en su defecto, pueda ser inferior al sesenta o al setenta y cinco por ciento durante el primero o el segundo año de vigencia del contrato, respectivamente, del salario fijado en convenio para un trabajador que desempeñe el mismo o equivalente puesto de trabajo.

f) Si al término del contrato el trabajador continuase en la empresa no podrá concertarse un nuevo periodo de prueba, computándose la duración de las prácticas a efecto de antigüedad en la empresa."
¿Qué es un contrato para la formación y el aprendizaje?," Un contrato para la formación y el aprendizaje es un contrato que se celebra con personas carecedoras de la cualificación profesional reconocida por titulaciones o certificados requeridos, con objeto de compatibilizar la actividad laboral retribuida con los procesos formativos en el ámbito de la formación profesional, los estudios universitarios o del Catálogo de especialidades formativas del Sistema Nacional de Empleo. Los contratos se suscriben según diversas reglas establecidas, como por ejemplo, no podrán celebrarse con personas mayores de 30 años en el caso de contratos relacionados con certificados de profesionalidad de nivel 1 y 2, o programa públicos o privados de formación en alternancia de empleo-formación que forman parte del Catálogo de especialidades formativas del Sistema Nacional de Empleo. Deberán constar por escrito los contratos de trabajo cuando así lo exija una disposición legal, incluyendo los contratos a tiempo parcial y de relevo, entre otros.","['2. El contrato de formación en alternancia, que tendrá por objeto compatibilizar la \nactividad laboral retribuida con los correspondientes procesos formativos en el ámbito de la \nformación profesional, los estudios universitarios o del Catálogo de especialidades \nformativas del Sistema Nacional de Empleo, se realizará de acuerdo con las siguientes \nreglas:BOLETÍN OFICIAL DEL ESTADO\nLEGISLACIÓN CONSOLIDADA\nPágina 13'
 'a) Se podrá celebrar con personas que carezcan de la cualificación profesional \nreconocida por las titulaciones o certificados requeridos para concertar un contrato formativo \npara la obtención de práctica profesional regulada en el apartado 3.\nSin perjuicio de lo anterior, se podrán realizar contratos vinculados a estudios de \nformación profesional o universitaria con personas que posean otra titulación siempre que no \nhaya tenido otro contrato formativo previo en una formación del mismo nivel formativo y del \nmismo sector productivo.\nb) En el supuesto de que el contrato se suscriba en el marco de certificados de \nprofesionalidad de nivel 1 y 2, y programas públicos o privados de formación en alternancia \nde empleo–formación, que formen parte del Catálogo de especialidades formativas del \nSistema Nacional de Empleo, el contrato solo podrá ser concertado con personas de hasta \ntreinta años.\nc) La actividad desempeñada por la persona trabajadora en la empresa deberá estar'
 'y dirección de otro y el que lo recibe a cambio de una retribución a aquel.\n2. Deberán constar por escrito los contratos de trabajo cuando así lo exija una \ndisposición legal y, en todo caso, los de prácticas y para la formación y el aprendizaje, los \ncontratos a tiempo parcial, fijos-discontinuos y de relevo y los contratos para la realización de \nuna obra o servicio determinado; también constarán por escrito los contratos por tiempo \ndeterminado cuya duración sea superior a cuatro semanas.\nDeberán constar igualmente por escrito los contratos de trabajo de los pescadores, de \nlos trabajadores que trabajen a distancia y de los trabajadores contratados en España al \nservicio de empresas españolas en el extranjero.\nDe no observarse la exigencia de forma escrita, el contrato de trabajo se presumirá \ncelebrado por tiempo indefinido y a jornada completa, salvo prueba en contrario que acredite \nsu naturaleza temporal o el carácter a tiempo parcial de los servicios.']",['tendrá por objeto la cualificación profesional de los trabajadores en un régimen de alternancia de actividad laboral retribuida en una empresa con actividad formativa recibida en el marco del sistema de formación profesional para el empleo o del sistema educativo.'],"El contrato para la formación y el aprendizaje tendrá por objeto la cualificación profesional de los trabajadores en un régimen de alternancia de actividad laboral retribuida en una empresa con actividad formativa recibida en el marco del sistema de formación profesional para el empleo o del sistema educativo. 1. El límite de edad y de duración para los contratos para la formación y el aprendizaje establecidos en las letras a) y b) del artículo 11.2 no será de aplicación cuando se suscriban en el marco de los programas públicos de empleo y formación contemplados en el texto refundido de la Ley de Empleo.

Asimismo, en estos contratos las situaciones de incapacidad temporal, riesgo durante el embarazo, maternidad, adopción, guarda con fines de adopción, acogimiento, riesgo durante la lactancia y paternidad no interrumpirán el cómputo de la duración del contrato."
¿Cuáles son las reglas por las que se rige el contrato para la formación y el aprendizaje?,"1. Las personas contratadas con un contrato de formación para obtención de prácticas profesionales no pueden realizar horas extraordinarias, salvo en determinados casos.
2. La retribución por tiempo de trabajo efectivo debe ser la fijada en el convenio colectivo aplicable en la empresa o en su defecto la del grupo profesional y nivel retributivo correspondiente a las funciones desempeñadas, sin poder ser inferior a ciertos mínimos establecidos.
3. Al finalizar el contrato, la persona trabajadora tendrá derecho a la certificación del contenido de la práctica realizada.
4. Reglamentariamente se desarrollará el alcance de la formación correspondiente al contrato de formación para la obtención de prácticas profesionales.
5. Excepcionalmente, cuando la tasa de ocupación de las mujeres trabajadoras por cuenta ajena sea inferior al 20% en determinadas actividades económicas, el límite de edad para contratos de formación puede rebajarse hasta la edad ordinaria de jubilación.
6. Todo lo establecido sobre los contratos de formación en disposiciones legales, reglamentarias o en convenios colectivos deberá entenderse realizado a partir del 31 de agosto de 2011 al contrato para la formación y el aprendizaje.
7. Las normas específicas aplicables a cada modalidad contractual vigente en el momento en que se celebraron los contratos antes de la entrada en vigor de la ley continúan siendo de aplicación, salvo que otra cosa se hubiera establecido legalmente.","['g) A la finalización del contrato la persona trabajadora tendrá derecho a la certificación \ndel contenido de la práctica realizada.\nh) Las personas contratadas con contrato de formación para la obtención de práctica \nprofesional no podrán realizar horas extraordinarias, salvo en el supuesto previsto en el \nartículo 35.3.\ni) La retribución por el tiempo de trabajo efectivo será la fijada en el convenio colectivo \naplicable en la empresa para estos contratos o en su defecto la del grupo profesional y nivel \nretributivo correspondiente a las funciones desempeñadas. En ningún caso la retribución \npodrá ser inferior a la retribución mínima establecida para el contrato para la formación en \nalternancia ni al salario mínimo interprofesional en proporción al tiempo de trabajo efectivo.\nj) Reglamentariamente se desarrollará el alcance de la formación correspondiente al \ncontrato de formación para la obtención de prácticas profesionales, particularmente, en el'
 '2. Excepcionalmente, con el objetivo de alcanzar la igualdad real y efectiva entre mujeres \ny hombres coadyuvando a superar la segregación ocupacional por género, el límite del \napartado anterior podrá rebajarse hasta la edad ordinaria de jubilación fijada por la normativa \nde Seguridad Social cuando la tasa de ocupación de las mujeres trabajadoras por cuenta \najena afiliadas a la Seguridad Social en alguna de las actividades económicas \ncorrespondientes al ámbito funcional del convenio sea inferior al 20 por ciento de las \npersonas ocupadas en las mismas.\nLas actividades económicas que se tomarán como referencia para determinar el \ncumplimiento de esta condición estará definida por los códigos de la Clasificación Nacional \nde Actividades Económicas (CNAE) en vigor en cada momento, incluidos en el ámbito del \nconvenio aplicable según los datos facilitados al realizar su inscripción en el Registro y \ndepósito de convenios y acuerdos colectivos de trabajo y planes de igualdad (REGCON), de'
 'Disposición transitoria primera.  Contratos celebrados antes de la entrada en vigor de esta \nley.\nContinuarán siendo de aplicación a los contratos celebrados antes de la entrada en vigor \nde esta ley las normas específicas aplicables a cada una de las modalidades contractuales \nque estuvieran vigentes en el momento en que dichos contratos se concertaron, salvo que \notra cosa se hubiera establecido legalmente.\nDisposición transitoria segunda.  Contratos para la formación y el aprendizaje.\n1. (Derogado).\n2. Las referencias realizadas en las disposiciones legales, reglamentarias o en los \nconvenios colectivos al contrato para la formación deberán entenderse realizadas, a partir \ndel 31 de agosto de 2011, al contrato para la formación y el aprendizaje a que se refiere el \nartículo 11.2 en la medida en que no se opongan o contradigan lo establecido en el mismo.\nDisposición transitoria tercera.  Contratos a tiempo parcial por jubilación parcial y de \nrelevo y edad de jubilación.']","['a) Se podrá celebrar con trabajadores mayores de dieciséis y menores de veinticinco años que carezcan de la cualificación profesional reconocida por el sistema de formación profesional para el empleo o del sistema educativo requerida para concertar un contrato en prácticas. \nEl límite máximo de edad no será de aplicación cuando el contrato se concierte con personas con discapacidad ni con los colectivos en situación de exclusión social \nb) La duración mínima del contrato será de un año y la máxima de tres. No obstante, mediante convenio colectivo podrán establecerse distintas duraciones del contrato,\nEn caso de que el contrato se hubiera concertado por una duración inferior a la máxima legal o convencionalmente establecida, podrá prorrogarse mediante acuerdo de las partes, hasta por dos veces, sin que la duración de cada prórroga pueda ser inferior a seis meses y sin que la duración total del contrato pueda exceder de dicha duración máxima.']","El contrato para la formación y el aprendizaje se regirá por las siguientes reglas:

a) Se podrá celebrar con trabajadores mayores de dieciséis y menores de veinticinco años que carezcan de la cualificación profesional reconocida por el sistema de formación profesional para el empleo o del sistema educativo requerida para concertar un contrato en prácticas. Se podrán acoger a esta modalidad contractual los trabajadores que cursen formación profesional del sistema educativo.

El límite máximo de edad no será de aplicación cuando el contrato se concierte con personas con discapacidad ni con los colectivos en situación de exclusión social previstos en la Ley 44/2007, de 13 de diciembre, para la regulación del régimen de las empresas de inserción, en los casos en que sean contratados por parte de empresas de inserción que estén cualificadas y activas en el registro administrativo correspondiente.

b) La duración mínima del contrato será de un año y la máxima de tres. No obstante, mediante convenio colectivo podrán establecerse distintas duraciones del contrato, en función de las necesidades organizativas o productivas de las empresas, sin que la duración mínima pueda ser inferior a seis meses ni la máxima superior a tres años.

En caso de que el contrato se hubiera concertado por una duración inferior a la máxima legal o convencionalmente establecida, podrá prorrogarse mediante acuerdo de las partes, hasta por dos veces, sin que la duración de cada prórroga pueda ser inferior a seis meses y sin que la duración total del contrato pueda exceder de dicha duración máxima.

Las situaciones de incapacidad temporal, riesgo durante el embarazo, maternidad, adopción, guarda con fines de adopción, acogimiento, riesgo durante la lactancia y paternidad interrumpirán el cómputo de la duración del contrato.

c) Expirada la duración del contrato para la formación y el aprendizaje, el trabajador no podrá ser contratado bajo esta modalidad por la misma o distinta empresa, salvo que la formación inherente al nuevo contrato tenga por objeto la obtención de distinta cualificación profesional.

No se podrán celebrar contratos para la formación y el aprendizaje cuando el puesto de trabajo correspondiente al contrato haya sido desempeñado con anterioridad por el trabajador en la misma empresa por tiempo superior a doce meses.

d) El trabajador deberá recibir la formación inherente al contrato para la formación y el aprendizaje directamente en un centro formativo de la red a que se refiere la disposición adicional quinta de la Ley Orgánica 5/2002, de 19 de junio, de las Cualificaciones y de la Formación Profesional, previamente reconocido para ello por el Sistema Nacional de Empleo. No obstante, también podrá recibir dicha formación en la propia empresa cuando la misma dispusiera de las instalaciones y el personal adecuados a los efectos de la acreditación de la competencia o cualificación profesional a que se refiere la letra e), sin perjuicio de la necesidad, en su caso, de la realización de periodos de formación complementarios en los centros de la red mencionada.

La actividad laboral desempeñada por el trabajador en la empresa deberá estar relacionada con las actividades formativas. La impartición de esta formación deberá justificarse a la finalización del contrato.

Reglamentariamente se desarrollará el sistema de impartición y las características de la formación de los trabajadores en los centros formativos y en las empresas, así como su reconocimiento, en un régimen de alternancia con el trabajo efectivo para favorecer una mayor relación entre este y la formación y el aprendizaje del trabajador. Las actividades formativas podrán incluir formación complementaria no referida al Catálogo Nacional de Cualificaciones Profesionales para adaptarse tanto a las necesidades de los trabajadores como de las empresas.

Asimismo serán objeto de desarrollo reglamentario los aspectos relacionados con la financiación de la actividad formativa.

e) La cualificación o competencia profesional adquirida a través del contrato para la formación y el aprendizaje será objeto de acreditación en los términos previstos en la Ley Orgánica 5/2002, de 19 de junio, de las Cualificaciones y de la Formación Profesional, y en su normativa de desarrollo. Conforme a lo establecido en dicha regulación, el trabajador podrá solicitar de la Administración pública competente la expedición del correspondiente certificado de profesionalidad, título de formación profesional o, en su caso, acreditación parcial acumulable.

f) El tiempo de trabajo efectivo, que habrá de ser compatible con el tiempo dedicado a las actividades formativas, no podrá ser superior al setenta y cinco por ciento, durante el primer año, o al ochenta y cinco por ciento, durante el segundo y tercer año, de la jornada máxima prevista en el convenio colectivo o, en su defecto, a la jornada máxima legal. Los trabajadores no podrán realizar horas extraordinarias, salvo en el supuesto previsto en el artículo 35.3. Tampoco podrán realizar trabajos nocturnos ni trabajo a turnos.

g) La retribución del trabajador contratado para la formación y el aprendizaje se fijará en proporción al tiempo de trabajo efectivo, de acuerdo con lo establecido en convenio colectivo.

En ningún caso, la retribución podrá ser inferior al salario mínimo interprofesional en proporción al tiempo de trabajo efectivo.

h) La acción protectora de la Seguridad Social del trabajador contratado para la formación y el aprendizaje comprenderá todas las contingencias protegibles y prestaciones, incluido el desempleo. Asimismo, se tendrá derecho a la cobertura del Fondo de Garantía Salarial.

i) En el supuesto de que el trabajador continuase en la empresa al término del contrato se estará a lo establecido en el apartado 1.f)."
¿Qué se entiende por contrato a tiempo parcial?," El contrato a tiempo parcial se entiende por un contrato de trabajo en el que se acuerda la prestación de servicios durante un número de horas por día, semana, mes o año menor a la jornada de trabajo de un trabajador a tiempo completo comparable. Los contratos a tiempo parcial pueden ser por tiempo indefinido o determinado y deberán constar por escrito.","['A efectos de lo dispuesto en el párrafo anterior, se entenderá por «trabajador a tiempo \ncompleto comparable» a un trabajador a tiempo completo de la misma empresa y centro de \ntrabajo, con el mismo tipo de contrato de trabajo y que realice un trabajo idéntico o similar. Si \nen la empresa no hubiera ningún trabajador comparable a tiempo completo, se considerará \nla jornada a tiempo completo prevista en el convenio colectivo de aplicación o, en su defecto, \nla jornada máxima legal.\n2. El contrato a tiempo parcial podrá concertarse por tiempo indefinido o por duración \ndeterminada en los supuestos en los que legalmente se permita la utilización de esta \nmodalidad de contratación.\n3. (Derogado)\n4. El contrato a tiempo parcial se regirá por las siguientes reglas:\na) El contrato, conforme a lo dispuesto en el artículo 8.2, se deberá formalizar \nnecesariamente por escrito. En el contrato deberá figurar el número de horas ordinarias de'
 'contratos formativos en contratos por tiempo indefinido.\n7. Las empresas que pretendan suscribir contratos formativos, podrán solicitar por \nescrito al servicio público de empleo competente, información relativa a si las personas a las \nque pretenden contratar han estado previamente contratadas bajo dicha modalidad y la \nduración de estas contrataciones. Dicha información deberá ser trasladada a la \nrepresentación legal de las personas trabajadoras y tendrá valor liberatorio a efectos de no \nexceder la duración máxima de este contrato.\nArtículo 12.  Contrato a tiempo parcial y contrato de relevo.\n1. El contrato de trabajo se entenderá celebrado a tiempo parcial cuando se haya \nacordado la prestación de servicios durante un número de horas al día, a la semana, al mes \no al año, inferior a la jornada de trabajo de un trabajador a tiempo completo comparable.\nA efectos de lo dispuesto en el párrafo anterior, se entenderá por «trabajador a tiempo'
 'y dirección de otro y el que lo recibe a cambio de una retribución a aquel.\n2. Deberán constar por escrito los contratos de trabajo cuando así lo exija una \ndisposición legal y, en todo caso, los de prácticas y para la formación y el aprendizaje, los \ncontratos a tiempo parcial, fijos-discontinuos y de relevo y los contratos para la realización de \nuna obra o servicio determinado; también constarán por escrito los contratos por tiempo \ndeterminado cuya duración sea superior a cuatro semanas.\nDeberán constar igualmente por escrito los contratos de trabajo de los pescadores, de \nlos trabajadores que trabajen a distancia y de los trabajadores contratados en España al \nservicio de empresas españolas en el extranjero.\nDe no observarse la exigencia de forma escrita, el contrato de trabajo se presumirá \ncelebrado por tiempo indefinido y a jornada completa, salvo prueba en contrario que acredite \nsu naturaleza temporal o el carácter a tiempo parcial de los servicios.']","['cuando se haya acordado la prestación de servicios durante un número de horas al día, a la semana, al mes o al año, inferior a la jornada de trabajo de un trabajador a tiempo completo comparable.\nse entenderá por «trabajador a tiempo completo comparable» a un trabajador a tiempo completo de la misma empresa y centro de trabajo, con el mismo tipo de contrato de trabajo y que realice un trabajo idéntico o similar.']","El contrato de trabajo se entenderá celebrado a tiempo parcial cuando se haya acordado la prestación de servicios durante un número de horas al día, a la semana, al mes o al año, inferior a la jornada de trabajo de un trabajador a tiempo completo comparable.

A efectos de lo dispuesto en el párrafo anterior, se entenderá por «trabajador a tiempo completo comparable» a un trabajador a tiempo completo de la misma empresa y centro de trabajo, con el mismo tipo de contrato de trabajo y que realice un trabajo idéntico o similar. Si en la empresa no hubiera ningún trabajador comparable a tiempo completo, se considerará la jornada a tiempo completo prevista en el convenio colectivo de aplicación o, en su defecto, la jornada máxima legal."
¿Durante cuánto tiempo puede concertarse un contrato a tiempo parcial?," El contrato a tiempo parcial puede concertarse por tiempo indefinido o por duración determinada, y su duración máxima no se especifica en este contexto.","['contratos formativos en contratos por tiempo indefinido.\n7. Las empresas que pretendan suscribir contratos formativos, podrán solicitar por \nescrito al servicio público de empleo competente, información relativa a si las personas a las \nque pretenden contratar han estado previamente contratadas bajo dicha modalidad y la \nduración de estas contrataciones. Dicha información deberá ser trasladada a la \nrepresentación legal de las personas trabajadoras y tendrá valor liberatorio a efectos de no \nexceder la duración máxima de este contrato.\nArtículo 12.  Contrato a tiempo parcial y contrato de relevo.\n1. El contrato de trabajo se entenderá celebrado a tiempo parcial cuando se haya \nacordado la prestación de servicios durante un número de horas al día, a la semana, al mes \no al año, inferior a la jornada de trabajo de un trabajador a tiempo completo comparable.\nA efectos de lo dispuesto en el párrafo anterior, se entenderá por «trabajador a tiempo'
 'A efectos de lo dispuesto en el párrafo anterior, se entenderá por «trabajador a tiempo \ncompleto comparable» a un trabajador a tiempo completo de la misma empresa y centro de \ntrabajo, con el mismo tipo de contrato de trabajo y que realice un trabajo idéntico o similar. Si \nen la empresa no hubiera ningún trabajador comparable a tiempo completo, se considerará \nla jornada a tiempo completo prevista en el convenio colectivo de aplicación o, en su defecto, \nla jornada máxima legal.\n2. El contrato a tiempo parcial podrá concertarse por tiempo indefinido o por duración \ndeterminada en los supuestos en los que legalmente se permita la utilización de esta \nmodalidad de contratación.\n3. (Derogado)\n4. El contrato a tiempo parcial se regirá por las siguientes reglas:\na) El contrato, conforme a lo dispuesto en el artículo 8.2, se deberá formalizar \nnecesariamente por escrito. En el contrato deberá figurar el número de horas ordinarias de'
 'y dirección de otro y el que lo recibe a cambio de una retribución a aquel.\n2. Deberán constar por escrito los contratos de trabajo cuando así lo exija una \ndisposición legal y, en todo caso, los de prácticas y para la formación y el aprendizaje, los \ncontratos a tiempo parcial, fijos-discontinuos y de relevo y los contratos para la realización de \nuna obra o servicio determinado; también constarán por escrito los contratos por tiempo \ndeterminado cuya duración sea superior a cuatro semanas.\nDeberán constar igualmente por escrito los contratos de trabajo de los pescadores, de \nlos trabajadores que trabajen a distancia y de los trabajadores contratados en España al \nservicio de empresas españolas en el extranjero.\nDe no observarse la exigencia de forma escrita, el contrato de trabajo se presumirá \ncelebrado por tiempo indefinido y a jornada completa, salvo prueba en contrario que acredite \nsu naturaleza temporal o el carácter a tiempo parcial de los servicios.']",['podrá concertarse por tiempo indefinido o por duración determinada en los supuestos en los que legalmente se permita \nexcepto en el contrato para la formación y el aprendizaje.'],"El contrato a tiempo parcial podrá concertarse por tiempo indefinido o por duración determinada en los supuestos en los que legalmente se permita la utilización de esta modalidad de contratación, excepto en el contrato para la formación y el aprendizaje."
¿Cuándo se entiende que el contrato a tiempo parcial se celebra por tiempo indefinido?," El contrato a tiempo parcial se considera como por tiempo indefinido cuando no se establece otra duración determinada en él, y legalmente es posible la utilización de esta modalidad de contratación.","['A efectos de lo dispuesto en el párrafo anterior, se entenderá por «trabajador a tiempo \ncompleto comparable» a un trabajador a tiempo completo de la misma empresa y centro de \ntrabajo, con el mismo tipo de contrato de trabajo y que realice un trabajo idéntico o similar. Si \nen la empresa no hubiera ningún trabajador comparable a tiempo completo, se considerará \nla jornada a tiempo completo prevista en el convenio colectivo de aplicación o, en su defecto, \nla jornada máxima legal.\n2. El contrato a tiempo parcial podrá concertarse por tiempo indefinido o por duración \ndeterminada en los supuestos en los que legalmente se permita la utilización de esta \nmodalidad de contratación.\n3. (Derogado)\n4. El contrato a tiempo parcial se regirá por las siguientes reglas:\na) El contrato, conforme a lo dispuesto en el artículo 8.2, se deberá formalizar \nnecesariamente por escrito. En el contrato deberá figurar el número de horas ordinarias de'
 'contratos formativos en contratos por tiempo indefinido.\n7. Las empresas que pretendan suscribir contratos formativos, podrán solicitar por \nescrito al servicio público de empleo competente, información relativa a si las personas a las \nque pretenden contratar han estado previamente contratadas bajo dicha modalidad y la \nduración de estas contrataciones. Dicha información deberá ser trasladada a la \nrepresentación legal de las personas trabajadoras y tendrá valor liberatorio a efectos de no \nexceder la duración máxima de este contrato.\nArtículo 12.  Contrato a tiempo parcial y contrato de relevo.\n1. El contrato de trabajo se entenderá celebrado a tiempo parcial cuando se haya \nacordado la prestación de servicios durante un número de horas al día, a la semana, al mes \no al año, inferior a la jornada de trabajo de un trabajador a tiempo completo comparable.\nA efectos de lo dispuesto en el párrafo anterior, se entenderá por «trabajador a tiempo'
 'y dirección de otro y el que lo recibe a cambio de una retribución a aquel.\n2. Deberán constar por escrito los contratos de trabajo cuando así lo exija una \ndisposición legal y, en todo caso, los de prácticas y para la formación y el aprendizaje, los \ncontratos a tiempo parcial, fijos-discontinuos y de relevo y los contratos para la realización de \nuna obra o servicio determinado; también constarán por escrito los contratos por tiempo \ndeterminado cuya duración sea superior a cuatro semanas.\nDeberán constar igualmente por escrito los contratos de trabajo de los pescadores, de \nlos trabajadores que trabajen a distancia y de los trabajadores contratados en España al \nservicio de empresas españolas en el extranjero.\nDe no observarse la exigencia de forma escrita, el contrato de trabajo se presumirá \ncelebrado por tiempo indefinido y a jornada completa, salvo prueba en contrario que acredite \nsu naturaleza temporal o el carácter a tiempo parcial de los servicios.']",['cuando se concierte para realizar trabajos fijos y periódicos dentro del volumen normal de actividad de la empresa.'],El contrato a tiempo parcial se entenderá celebrado por tiempo indefinido cuando se concierte para realizar trabajos fijos y periódicos dentro del volumen normal de actividad de la empresa.
¿Cuáles son las especificidades de un contrato a tiempo parcial? ¿Cuáles son las reglas del contrato a tiempo parcial?,"1. Un contrato a tiempo parcial se define por la prestación de servicios durante un número de horas inferiores a la jornada completa de un trabajador. La jornada completa comparativa se establece según el tipo de trabajo y la empresa, y si no hay ningún trabajador comparable a tiempo completo, se toma como referencia la jornada máxima legal o la jornada prevista en el convenio colectivo.
2. El contrato a tiempo parcial puede establecerse por tiempo indefinido o determinado, según lo que sea permitido legalmente.
3. Los contratos de trabajo se consideran celebrados por escrito cuando así lo requieran las disposiciones legales y, en todo caso, para los contratos de prácticas, formación, aprendizaje, fijos-discontinuos, relevo, para una obra o servicio determinado, de cuatro semanas o más, de pescadores, trabajadores a distancia y trabajadores españoles que brinden servicios en el extranjero a empresas españolas. Si no se cumple la exigencia de forma escrita, el contrato de trabajo se presume celebrado por tiempo indefinido y a jornada completa, excepto prueba en contrario.","['contratos formativos en contratos por tiempo indefinido.\n7. Las empresas que pretendan suscribir contratos formativos, podrán solicitar por \nescrito al servicio público de empleo competente, información relativa a si las personas a las \nque pretenden contratar han estado previamente contratadas bajo dicha modalidad y la \nduración de estas contrataciones. Dicha información deberá ser trasladada a la \nrepresentación legal de las personas trabajadoras y tendrá valor liberatorio a efectos de no \nexceder la duración máxima de este contrato.\nArtículo 12.  Contrato a tiempo parcial y contrato de relevo.\n1. El contrato de trabajo se entenderá celebrado a tiempo parcial cuando se haya \nacordado la prestación de servicios durante un número de horas al día, a la semana, al mes \no al año, inferior a la jornada de trabajo de un trabajador a tiempo completo comparable.\nA efectos de lo dispuesto en el párrafo anterior, se entenderá por «trabajador a tiempo'
 'A efectos de lo dispuesto en el párrafo anterior, se entenderá por «trabajador a tiempo \ncompleto comparable» a un trabajador a tiempo completo de la misma empresa y centro de \ntrabajo, con el mismo tipo de contrato de trabajo y que realice un trabajo idéntico o similar. Si \nen la empresa no hubiera ningún trabajador comparable a tiempo completo, se considerará \nla jornada a tiempo completo prevista en el convenio colectivo de aplicación o, en su defecto, \nla jornada máxima legal.\n2. El contrato a tiempo parcial podrá concertarse por tiempo indefinido o por duración \ndeterminada en los supuestos en los que legalmente se permita la utilización de esta \nmodalidad de contratación.\n3. (Derogado)\n4. El contrato a tiempo parcial se regirá por las siguientes reglas:\na) El contrato, conforme a lo dispuesto en el artículo 8.2, se deberá formalizar \nnecesariamente por escrito. En el contrato deberá figurar el número de horas ordinarias de'
 'y dirección de otro y el que lo recibe a cambio de una retribución a aquel.\n2. Deberán constar por escrito los contratos de trabajo cuando así lo exija una \ndisposición legal y, en todo caso, los de prácticas y para la formación y el aprendizaje, los \ncontratos a tiempo parcial, fijos-discontinuos y de relevo y los contratos para la realización de \nuna obra o servicio determinado; también constarán por escrito los contratos por tiempo \ndeterminado cuya duración sea superior a cuatro semanas.\nDeberán constar igualmente por escrito los contratos de trabajo de los pescadores, de \nlos trabajadores que trabajen a distancia y de los trabajadores contratados en España al \nservicio de empresas españolas en el extranjero.\nDe no observarse la exigencia de forma escrita, el contrato de trabajo se presumirá \ncelebrado por tiempo indefinido y a jornada completa, salvo prueba en contrario que acredite \nsu naturaleza temporal o el carácter a tiempo parcial de los servicios.']","['se deberá formalizar necesariamente por escrito.deberá figurar el número de horas ordinarias de trabajo al día, a la semana, al mes o al año contratadas, así como el modo de su distribución según lo previsto en convenio colectivo.\nDe no observarse estas exigencias, el contrato se presumirá celebrado a jornada completa, salvo prueba en contrario \nb) Cuando el contrato a tiempo parcial conlleve la ejecución de una jornada diaria inferior a la de los trabajadores a tiempo completo y esta se realice de forma partida, solo será posible efectuar una única interrupción en dicha jornada diaria, \nc) Los trabajadores a tiempo parcial no podrán realizar horas extraordinarias, salvo en los supuestos a los que se refiere el artículo 35.3.\nla suma de las horas ordinarias y complementarias, incluidas las previamente pactadas y las voluntarias, no podrá exceder del límite legal del trabajo a tiempo parcial \nse registrará día a día y se totalizará mensualmente, entregando copia al trabajador, junto con el recibo de salarios, del resumen de todas las horas realizadas en cada mes, \nEl empresario deberá conservar los resúmenes mensuales de los registros de jornada durante un periodo mínimo de cuatro años.\n\nEn caso de incumplimiento de las referidas obligaciones de registro, el contrato se presumirá celebrado a jornada completa, salvo prueba en contrario \nd) Los trabajadores a tiempo parcial tendrán los mismos derechos que los trabajadores a tiempo completo. \ne) La conversión de un trabajo a tiempo completo en un trabajo parcial y viceversa tendrá siempre carácter voluntario para el trabajador y no se podrá imponer de forma unilateral o como consecuencia de una modificación sustancial de condiciones de trabajo\nEl trabajador no podrá ser despedido ni sufrir ningún otro tipo de sanción o efecto perjudicial por el hecho de rechazar esta conversión,']","El contrato a tiempo parcial se regirá por las siguientes reglas:

a) El contrato, conforme a lo dispuesto en el artículo 8.2, se deberá formalizar necesariamente por escrito. En el contrato deberá figurar el número de horas ordinarias de trabajo al día, a la semana, al mes o al año contratadas, así como el modo de su distribución según lo previsto en convenio colectivo.

De no observarse estas exigencias, el contrato se presumirá celebrado a jornada completa, salvo prueba en contrario que acredite el carácter parcial de los servicios.

b) Cuando el contrato a tiempo parcial conlleve la ejecución de una jornada diaria inferior a la de los trabajadores a tiempo completo y esta se realice de forma partida, solo será posible efectuar una única interrupción en dicha jornada diaria, salvo que se disponga otra cosa mediante convenio colectivo.

c) Los trabajadores a tiempo parcial no podrán realizar horas extraordinarias, salvo en los supuestos a los que se refiere el artículo 35.3.

La realización de horas complementarias se regirá por lo dispuesto en el apartado 5.

En todo caso, la suma de las horas ordinarias y complementarias, incluidas las previamente pactadas y las voluntarias, no podrá exceder del límite legal del trabajo a tiempo parcial definido en el apartado 1.

A estos efectos, la jornada de los trabajadores a tiempo parcial se registrará día a día y se totalizará mensualmente, entregando copia al trabajador, junto con el recibo de salarios, del resumen de todas las horas realizadas en cada mes, tanto las ordinarias como las complementarias a que se refiere el apartado 5.

El empresario deberá conservar los resúmenes mensuales de los registros de jornada durante un periodo mínimo de cuatro años.

En caso de incumplimiento de las referidas obligaciones de registro, el contrato se presumirá celebrado a jornada completa, salvo prueba en contrario que acredite el carácter parcial de los servicios.

d) Los trabajadores a tiempo parcial tendrán los mismos derechos que los trabajadores a tiempo completo. Cuando corresponda en atención a su naturaleza, tales derechos serán reconocidos en las disposiciones legales y reglamentarias y en los convenios colectivos de manera proporcional, en función del tiempo trabajado.

e) La conversión de un trabajo a tiempo completo en un trabajo parcial y viceversa tendrá siempre carácter voluntario para el trabajador y no se podrá imponer de forma unilateral o como consecuencia de una modificación sustancial de condiciones de trabajo al amparo de lo dispuesto en el artículo 41.1.a). El trabajador no podrá ser despedido ni sufrir ningún otro tipo de sanción o efecto perjudicial por el hecho de rechazar esta conversión, sin perjuicio de las medidas que, de conformidad con lo dispuesto en los artículos 51 y 52.c), puedan adoptarse por causas económicas, técnicas, organizativas o de producción.

A fin de posibilitar la movilidad voluntaria en el trabajo a tiempo parcial, el empresario deberá informar a los trabajadores de la empresa sobre la existencia de puestos de trabajo vacantes, de manera que aquellos puedan formular solicitudes de conversión voluntaria de un trabajo a tiempo completo en un trabajo a tiempo parcial y viceversa, o para el incremento del tiempo de trabajo de los trabajadores a tiempo parcial, todo ello de conformidad con los procedimientos que se establezcan en convenio colectivo.

Con carácter general, las solicitudes a que se refiere el párrafo anterior deberán ser tomadas en consideración, en la medida de lo posible, por el empresario. La denegación de la solicitud deberá ser notificada por el empresario al trabajador por escrito y de manera motivada.

f) Los convenios colectivos establecerán medidas para facilitar el acceso efectivo de los trabajadores a tiempo parcial a la formación profesional continua, a fin de favorecer su progresión y movilidad profesionales."
¿Qué se entiende por horas complementarias?," Horas complementarias son aquellas horas de trabajo que se realizan después del límite máximo establecido para la jornada ordinaria. Son consideradas como horas extraordinarias y pueden ser compensadas en dinero o tiempo equivalente de descanso. El límite anual de horas complementarias es de 80 horas, aunque puede ser superior si se dispone en el apartado 3 del artículo 35. No se pueden realizar horas complementarias a trabajadores a tiempo parcial salvo en ciertos casos específicos.","['La empresa conservará los registros a que se refiere este precepto durante cuatro años \ny permanecerán a disposición de las personas trabajadoras, de sus representantes legales y \nde la Inspección de Trabajo y Seguridad Social.\nArtículo 35.  Horas extraordinarias.\n1. Tendrán la consideración de horas extraordinarias aquellas horas de trabajo que se \nrealicen sobre la duración máxima de la jornada ordinaria de trabajo, fijada de acuerdo con el \nartículo anterior. Mediante convenio colectivo o, en su defecto, contrato individual, se optará \nentre abonar las horas extraordinarias en la cuantía que se fije, que en ningún caso podrá \nser inferior al valor de la hora ordinaria, o compensarlas por tiempos equivalentes de \ndescanso retribuido. En ausencia de pacto al respecto, se entenderá que las horas \nextraordinarias realizadas deberán ser compensadas mediante descanso dentro de los \ncuatro meses siguientes a su realización.\n2. El número de horas extraordinarias no podrá ser superior a ochenta al año, salvo lo'
 '2. El número de horas extraordinarias no podrá ser superior a ochenta al año, salvo lo \nprevisto en el apartado 3. Para los trabajadores que por la modalidad o duración de su \ncontrato realizasen una jornada en cómputo anual inferior a la jornada general en la \nempresa, el número máximo anual de horas extraordinarias se reducirá en la misma \nproporción que exista entre tales jornadas.\nA los efectos de lo dispuesto en el párrafo anterior, no se computarán las horas \nextraordinarias que hayan sido compensadas mediante descanso dentro de los cuatro \nmeses siguientes a su realización.\nEl Gobierno podrá suprimir o reducir el número máximo de horas extraordinarias por \ntiempo determinado, con carácter general o para ciertas ramas de actividad o ámbitos BOLETÍN OFICIAL DEL ESTADO\nLEGISLACIÓN CONSOLIDADA\nPágina 34'
 'necesariamente por escrito. En el contrato deberá figurar el número de horas ordinarias de \ntrabajo al día, a la semana, al mes o al año contratadas, así como el modo de su distribución \nsegún lo previsto en convenio colectivo.\nDe no observarse estas exigencias, el contrato se presumirá celebrado a jornada \ncompleta, salvo prueba en contrario que acredite el carácter parcial de los servicios.\nb) Cuando el contrato a tiempo parcial conlleve la ejecución de una jornada diaria inferior \na la de los trabajadores a tiempo completo y esta se realice de forma partida, solo será \nposible efectuar una única interrupción en dicha jornada diaria, salvo que se disponga otra \ncosa mediante convenio colectivo.\nc) Los trabajadores a tiempo parcial no podrán realizar horas extraordinarias, salvo en \nlos supuestos a los que se refiere el artículo 35.3.\nLa realización de horas complementarias se regirá por lo dispuesto en el apartado 5.\nEn todo caso, la suma de las horas ordinarias y complementarias, incluidas las']",['Se consideran horas complementarias las realizadas como adición a las horas ordinarias pactadas en el contrato a tiempo parcial.'],Se consideran horas complementarias las realizadas como adición a las horas ordinarias pactadas en el contrato a tiempo parcial.
¿Cuáles son las reglas de las horas complementarias?," Las horas complementarias deben respetar los límites en materia de jornada y descansos establecidos. Se deberán retribuir como ordinarias, se debe recoger el número y la retribución de las horas complementarias realizadas en el recibo individual de salarios y en los documentos de cotización a la Seguridad Social. Para acceder a la jubilación parcial, deberá acordar con su empresa una reducción de jornada y de trabajo a turnos. Se les dan igual prioridad aplicativa en estas materias los convenios colectivos para un grupo de empresas o una pluralidad de empresas vinculadas por razones organizativas o productivas. El pacto de horas complementarias y las condiciones de realización de las mismas estarán sujetos a las reglas previstas en estas disposiciones, y la negativa del trabajador a la realización de las horas complementarias, si se han pactado, no constituirá conducta laboral sancionable.","['Estas horas complementarias no se computarán a efectos de los porcentajes de horas \ncomplementarias pactadas que se establecen en la letra c).\nh) La realización de horas complementarias habrá de respetar, en todo caso, los límites \nen materia de jornada y descansos establecidos en los artículos 34.3 y 4; 36.1 y 37.1.\ni) Las horas complementarias efectivamente realizadas se retribuirán como ordinarias, \ncomputándose a efectos de bases de cotización a la Seguridad Social y periodos de \ncarencia y bases reguladoras de las prestaciones. A tal efecto, el número y retribución de las \nhoras complementarias realizadas se deberá recoger en el recibo individual de salarios y en \nlos documentos de cotización a la Seguridad Social.\n6. Para que el trabajador pueda acceder a la jubilación parcial, en los términos \nestablecidos en el texto refundido de la Ley General de la Seguridad Social y demás \ndisposiciones concordantes, deberá acordar con su empresa una reducción de jornada y de'
 'trabajo a turnos.\nb) El horario y la distribución del tiempo de trabajo, el régimen de trabajo a turnos y la \nplanificación anual de las vacaciones.\nc) La adaptación al ámbito de la empresa del sistema de clasificación profesional de las \npersonas trabajadoras.\nd) La adaptación de los aspectos de las modalidades de contratación que se atribuyen \npor esta ley a los convenios de empresa.\ne) Las medidas para favorecer la corresponsabilidad y la conciliación entre la vida \nlaboral, familiar y personal.\nf) Aquellas otras que dispongan los acuerdos y convenios colectivos a que se refiere el \nartículo 83.2.\nIgual prioridad aplicativa tendrán en estas materias los convenios colectivos para un \ngrupo de empresas o una pluralidad de empresas vinculadas por razones organizativas o \nproductivas y nominativamente identificadas a que se refiere el artículo 87.1.\nLos acuerdos y convenios colectivos a que se refiere el artículo 83.2 no podrán disponer \nde la prioridad aplicativa prevista en este apartado.'
 'f) El pacto de horas complementarias y las condiciones de realización de las mismas \nestarán sujetos a las reglas previstas en las letras anteriores. En caso de incumplimiento de \ntales reglas, la negativa del trabajador a la realización de las horas complementarias, pese a \nhaber sido pactadas, no constituirá conducta laboral sancionable.\ng) Sin perjuicio del pacto de horas complementarias, en los contratos a tiempo parcial de \nduración indefinida con una jornada de trabajo no inferior a diez horas semanales en \ncómputo anual, el empresario podrá, en cualquier momento, ofrecer al trabajador la \nrealización de horas complementarias de aceptación voluntaria, cuyo número no podrá \nsuperar el quince por ciento, ampliables al treinta por ciento por convenio colectivo, de las \nhoras ordinarias objeto del contrato. La negativa del trabajador a la realización de estas \nhoras no constituirá conducta laboral sancionable.\nEstas horas complementarias no se computarán a efectos de los porcentajes de horas']","['a) El empresario solo podrá exigir la realización de horas complementarias cuando así lo hubiera pactado expresamente con el trabajador. El pacto sobre horas complementarias  \nse formalizará necesariamente por escrito.\n\nb) Solo se podrá formalizar un pacto de horas complementarias en el caso de contratos a tiempo parcial con una jornada de trabajo no inferior a diez horas semanales en cómputo anual.\n\nc) El pacto de horas complementarias deberá recoger el número de horas complementarias cuya realización podrá ser requerida por el empresario.\n\nEl número de horas complementarias pactadas no podrá exceder del treinta por ciento de las horas ordinarias de trabajo objeto del contrato.\n\nd) El trabajador deberá conocer el día y la hora de realización de las horas complementarias pactadas con un preaviso mínimo de tres días, \n\ne) El pacto de horas complementarias podrá quedar sin efecto por renuncia del trabajador, mediante un preaviso de quince días, una vez cumplido un año desde su celebración, \ncircunstancias:\n1.ª La atención de las responsabilidades familiares \n2.ª Necesidades formativas, \n3.ª Incompatibilidad con otro contrato a tiempo parcial.\nf) El pacto de horas complementarias y las condiciones de realización de las mismas estarán sujetos a las reglas previstas en las letras anteriores.  en los contratos a tiempo parcial de duración indefinida con una jornada de trabajo no inferior a diez horas semanales en cómputo anual, el empresario podrá, en cualquier momento, ofrecer al trabajador la realización de horas complementarias de aceptación voluntaria, cuyo número no podrá superar el quince por ciento, ampliables al treinta por ciento por convenio colectivo, de las horas ordinarias objeto del contrato.  \nh) La realización de horas complementarias habrá de respetar, en todo caso, los límites en materia de jornada y descansos \n\ni) Las horas complementarias efectivamente realizadas se retribuirán como ordinarias, computándose a efectos de bases de cotización a la Seguridad Social y periodos de carencia y bases reguladoras de las prestaciones.']","a) El empresario solo podrá exigir la realización de horas complementarias cuando así lo hubiera pactado expresamente con el trabajador. El pacto sobre horas complementarias podrá acordarse en el momento de la celebración del contrato a tiempo parcial o con posterioridad al mismo, pero constituirá, en todo caso, un pacto específico respecto al contrato. El pacto se formalizará necesariamente por escrito.

b) Solo se podrá formalizar un pacto de horas complementarias en el caso de contratos a tiempo parcial con una jornada de trabajo no inferior a diez horas semanales en cómputo anual.

c) El pacto de horas complementarias deberá recoger el número de horas complementarias cuya realización podrá ser requerida por el empresario.

El número de horas complementarias pactadas no podrá exceder del treinta por ciento de las horas ordinarias de trabajo objeto del contrato. Los convenios colectivos podrán establecer otro porcentaje máximo, que, en ningún caso, podrá ser inferior al citado treinta por ciento ni exceder del sesenta por ciento de las horas ordinarias contratadas.

d) El trabajador deberá conocer el día y la hora de realización de las horas complementarias pactadas con un preaviso mínimo de tres días, salvo que el convenio establezca un plazo de preaviso inferior.

e) El pacto de horas complementarias podrá quedar sin efecto por renuncia del trabajador, mediante un preaviso de quince días, una vez cumplido un año desde su celebración, cuando concurra alguna de las siguientes circunstancias:

1.ª La atención de las responsabilidades familiares enunciadas en el artículo 37.6.

2.ª Necesidades formativas, siempre que se acredite la incompatibilidad horaria.

3.ª Incompatibilidad con otro contrato a tiempo parcial.

f) El pacto de horas complementarias y las condiciones de realización de las mismas estarán sujetos a las reglas previstas en las letras anteriores. En caso de incumplimiento de tales reglas, la negativa del trabajador a la realización de las horas complementarias, pese a haber sido pactadas, no constituirá conducta laboral sancionable.

g) Sin perjuicio del pacto de horas complementarias, en los contratos a tiempo parcial de duración indefinida con una jornada de trabajo no inferior a diez horas semanales en cómputo anual, el empresario podrá, en cualquier momento, ofrecer al trabajador la realización de horas complementarias de aceptación voluntaria, cuyo número no podrá superar el quince por ciento, ampliables al treinta por ciento por convenio colectivo, de las horas ordinarias objeto del contrato. La negativa del trabajador a la realización de estas horas no constituirá conducta laboral sancionable.

Estas horas complementarias no se computarán a efectos de los porcentajes de horas complementarias pactadas que se establecen en la letra c).

h) La realización de horas complementarias habrá de respetar, en todo caso, los límites en materia de jornada y descansos establecidos en los artículos 34.3 y 4; 36.1 y 37.1.

i) Las horas complementarias efectivamente realizadas se retribuirán como ordinarias, computándose a efectos de bases de cotización a la Seguridad Social y periodos de carencia y bases reguladoras de las prestaciones. A tal efecto, el número y retribución de las horas complementarias realizadas se deberá recoger en el recibo individual de salarios y en los documentos de cotización a la Seguridad Social."
¿Cuándo puede un trabajador acceder a la jubilación parcial?," Un trabajador puede acceder a la jubilación parcial cuando el contrato de trabajo que celebra sea a tiempo parcial y sea compatible con la pensión reconocida por la Seguridad Social en concepto de jubilación parcial. La relación laboral se extiende hasta la jubilación total del trabajador. La duración del contrato de relevo, que puede ser como resultado de una jubilación parcial, debe ser indefinida o al menos igual al tiempo que falte al trabajador sustituido para alcanzar la edad de jubilación ordinaria.","['Seguridad Social.\nLa ejecución de este contrato de trabajo a tiempo parcial y su retribución serán \ncompatibles con la pensión que la Seguridad Social reconozca al trabajador en concepto de \njubilación parcial.\nLa relación laboral se extinguirá al producirse la jubilación total del trabajador.\n7. El contrato de relevo se ajustará a las siguientes reglas:\na) Se celebrará con un trabajador en situación de desempleo o que tuviese concertado \ncon la empresa un contrato de duración determinada.\nb) Salvo lo establecido en los dos párrafos siguientes, la duración del contrato de relevo \nque se celebre como consecuencia de una jubilación parcial tendrá que ser indefinida o, \ncomo mínimo, igual al tiempo que falte al trabajador sustituido para alcanzar la edad de \njubilación ordinaria que corresponda conforme a lo establecido en el texto refundido de la \nLey General de la Seguridad Social. Si, al cumplir dicha edad, el trabajador jubilado'
 'manera proporcional, en función del tiempo trabajado.\nCuando un determinado derecho o condición de trabajo esté atribuido en las \ndisposiciones legales o reglamentarias y en los convenios colectivos en función de una \nprevia antigüedad de la persona trabajadora, esta deberá computarse según los mismos \ncriterios para todas las personas trabajadoras, cualquiera que sea su modalidad de \ncontratación.\n7. La empresa deberá informar a las personas con contratos de duración determinada o \ntemporales, incluidos los contratos formativos, sobre la existencia de puestos de trabajo \nvacantes, a fin de garantizarles las mismas oportunidades de acceder a puestos \npermanentes que las demás personas trabajadoras. Esta información podrá facilitarse \nmediante un anuncio público en un lugar adecuado de la empresa o centro de trabajo, o \nmediante otros medios previstos en la negociación colectiva, que aseguren la transmisión de \nla información.'
 'contratos formativos en contratos por tiempo indefinido.\n7. Las empresas que pretendan suscribir contratos formativos, podrán solicitar por \nescrito al servicio público de empleo competente, información relativa a si las personas a las \nque pretenden contratar han estado previamente contratadas bajo dicha modalidad y la \nduración de estas contrataciones. Dicha información deberá ser trasladada a la \nrepresentación legal de las personas trabajadoras y tendrá valor liberatorio a efectos de no \nexceder la duración máxima de este contrato.\nArtículo 12.  Contrato a tiempo parcial y contrato de relevo.\n1. El contrato de trabajo se entenderá celebrado a tiempo parcial cuando se haya \nacordado la prestación de servicios durante un número de horas al día, a la semana, al mes \no al año, inferior a la jornada de trabajo de un trabajador a tiempo completo comparable.\nA efectos de lo dispuesto en el párrafo anterior, se entenderá por «trabajador a tiempo']","['Para que el trabajador pueda acceder a la jubilación parcial,  deberá acordar con su empresa una reducción de jornada y de salario de entre un mínimo del veinticinco por ciento y un máximo del cincuenta por ciento y la empresa deberá concertar simultáneamente un contrato de relevo,\nLa reducción de jornada y de salario podrá alcanzar el setenta y cinco por ciento cuando el contrato de relevo se concierte a jornada completa y con duración indefinida, \nLa ejecución de este contrato de trabajo a tiempo parcial y su retribución serán compatibles con la pensión que la Seguridad Social reconozca al trabajador en concepto de jubilación parcial.\n\nLa relación laboral se extinguirá al producirse la jubilación total del trabajador.']","Para que el trabajador pueda acceder a la jubilación parcial, en los términos establecidos en el texto refundido de la Ley General de la Seguridad Social y demás disposiciones concordantes, deberá acordar con su empresa una reducción de jornada y de salario de entre un mínimo del veinticinco por ciento y un máximo del cincuenta por ciento y la empresa deberá concertar simultáneamente un contrato de relevo, de acuerdo con lo establecido en el apartado siguiente, con objeto de sustituir la jornada de trabajo dejada vacante por el trabajador que se jubila parcialmente. También se podrá concertar el contrato de relevo para sustituir a los trabajadores que se jubilen parcialmente después de haber cumplido la edad de jubilación ordinaria que corresponda conforme a lo establecido en el texto refundido de la Ley General de la Seguridad Social.

La reducción de jornada y de salario podrá alcanzar el setenta y cinco por ciento cuando el contrato de relevo se concierte a jornada completa y con duración indefinida, siempre que el trabajador cumpla los requisitos establecidos en el texto refundido de la Ley General de la Seguridad Social.

La ejecución de este contrato de trabajo a tiempo parcial y su retribución serán compatibles con la pensión que la Seguridad Social reconozca al trabajador en concepto de jubilación parcial.

La relación laboral se extinguirá al producirse la jubilación total del trabajador."
¿Cuáles son las reglas del contrato de relevo?,"1. El contrato de relevo tiene reglas sobre la prevision de nuevos contratos (incluyendo contratos a tiempo parcial), horas complementarias, y subcontratación.
2. Las empresas deben informar a los trabajadores sobre puestos de trabajo vacantes de carácter fijo ordinario.
3. Las personas trabajadoras fijas-discontinuas tienen derecho a la consideración de colectivo prioritario para el acceso a iniciativas de formación profesional en períodos de inactividad.
4. No discriminación en las relaciones laborales.
5. El relevante hereda el mismo puesto del trabajador sustituido, siempre que exista correspondencia entre las bases de cotización de ambos, según la Ley General de Seguridad Social.
6. Las medidas para impulsar la celebración de contratos de relevo se pueden establecer en negociaciones colectivas.
7. Las personas trabajadoras pueden prestar trabajo a distancia en los términos previstos por la Ley 10/2021 de trabajo a distancia.
8. El contrato puede contener un periodo de prueba, sujeto a limitaciones establecidas por la ley.","['el empleo, así como sobre la producción y ventas, incluido el programa de producción.\nc) Sobre las previsiones del empresario de celebración de nuevos contratos, con \nindicación del número de estos y de las modalidades y tipos que serán utilizados, incluidos \nlos contratos a tiempo parcial, la realización de horas complementarias por los trabajadores \ncontratados a tiempo parcial y de los supuestos de subcontratación.BOLETÍN OFICIAL DEL ESTADO\nLEGISLACIÓN CONSOLIDADA\nPágina 66'
 'proporcionalidad y transparencia.\n7. La empresa deberá informar a las personas fijas-discontinuas y a la representación \nlegal de las personas trabajadoras sobre la existencia de puestos de trabajo vacantes de \ncarácter fijo ordinario, de manera que aquellas puedan formular solicitudes de conversión \nvoluntaria, de conformidad con los procedimientos que establezca el convenio colectivo \nsectorial o, en su defecto, el acuerdo de empresa.\n8. Las personas trabajadoras fijas-discontinuas tendrán la consideración de colectivo \nprioritario para el acceso a las iniciativas de formación del sistema de formación profesional \npara el empleo en el ámbito laboral durante los periodos de inactividad.\nSección 2.ª Derechos y deberes derivados del contrato\nArtículo 17.  No discriminación en las relaciones laborales.\n1. Se entenderán nulos y sin efecto los preceptos reglamentarios, las cláusulas de los \nconvenios colectivos, los pactos individuales y las decisiones unilaterales del empresario que'
 'la jornada deberá ser, como mínimo, igual a la reducción de jornada acordada por el \ntrabajador sustituido. El horario de trabajo del trabajador relevista podrá completar el del \ntrabajador sustituido o simultanearse con él.\nd) El puesto de trabajo del trabajador relevista podrá ser el mismo del trabajador \nsustituido. En todo caso, deberá existir una correspondencia entre las bases de cotización de \nambos, en los términos previstos en el texto refundido de la Ley General de la Seguridad \nSocial.\ne) En la negociación colectiva se podrán establecer medidas para impulsar la \ncelebración de contratos de relevo.\nArtículo 13.  Trabajo a distancia.\nLas personas trabajadoras podrán prestar trabajo a distancia en los términos previstos \nen la Ley 10/2021 de trabajo a distancia.\nCAPÍTULO II\nContenido del contrato de trabajo\nSección 1.ª Duración del contrato\nArtículo 14.  Periodo de prueba.\n1. Podrá concertarse por escrito un periodo de prueba, con sujeción a los límites de']","['a) Se celebrará con un trabajador en situación de desempleo o que tuviese concertado con la empresa un contrato de duración determinada.\nla duración del contrato de relevo que se celebre como consecuencia de una jubilación parcial tendrá que ser indefinida o, como mínimo, igual al tiempo que falte al trabajador sustituido para alcanzar la edad de jubilación ordinaria \nSi, al cumplir dicha edad, el trabajador jubilado parcialmente continuase en la empresa, el contrato de relevo que se hubiera celebrado por duración determinada podrá prorrogarse mediante acuerdo con las partes por periodos anuales, extinguiéndose en todo caso al finalizar el periodo correspondiente al año en el que se produzca la jubilación total del trabajador relevado.\nEn el caso del trabajador jubilado parcialmente después de haber cumplido la edad de jubilación ordinaria \n la duración del contrato de relevo que podrá celebrar la empresa para sustituir la parte de jornada dejada vacante por el mismo podrá ser indefinida o anual. En este segundo supuesto, el contrato se prorrogará automáticamente por periodos anuales, extinguiéndose en todo caso al finalizar el periodo correspondiente al año en que se produzca la jubilación total del trabajador relevado.\nd) El puesto de trabajo del trabajador relevista podrá ser el mismo del trabajador sustituido. En todo caso, deberá existir una correspondencia entre las bases de cotización de ambos,']","El contrato de relevo se ajustará a las siguientes reglas:

a) Se celebrará con un trabajador en situación de desempleo o que tuviese concertado con la empresa un contrato de duración determinada.

b) Salvo lo establecido en los dos párrafos siguientes, la duración del contrato de relevo que se celebre como consecuencia de una jubilación parcial tendrá que ser indefinida o, como mínimo, igual al tiempo que falte al trabajador sustituido para alcanzar la edad de jubilación ordinaria que corresponda conforme a lo establecido en el texto refundido de la Ley General de la Seguridad Social. Si, al cumplir dicha edad, el trabajador jubilado parcialmente continuase en la empresa, el contrato de relevo que se hubiera celebrado por duración determinada podrá prorrogarse mediante acuerdo con las partes por periodos anuales, extinguiéndose en todo caso al finalizar el periodo correspondiente al año en el que se produzca la jubilación total del trabajador relevado.

En el supuesto previsto en el párrafo segundo del apartado 6, el contrato de relevo deberá alcanzar al menos una duración igual al resultado de sumar dos años al tiempo que le falte al trabajador sustituido para alcanzar la edad de jubilación ordinaria que corresponda conforme al texto refundido de la Ley General de la Seguridad Social. En el supuesto de que el contrato se extinga antes de alcanzar la duración mínima indicada, el empresario estará obligado a celebrar un nuevo contrato en los mismos términos del extinguido, por el tiempo restante.

En el caso del trabajador jubilado parcialmente después de haber cumplido la edad de jubilación ordinaria prevista en el texto refundido de la Ley General de la Seguridad Social, la duración del contrato de relevo que podrá celebrar la empresa para sustituir la parte de jornada dejada vacante por el mismo podrá ser indefinida o anual. En este segundo supuesto, el contrato se prorrogará automáticamente por periodos anuales, extinguiéndose en todo caso al finalizar el periodo correspondiente al año en que se produzca la jubilación total del trabajador relevado.

c) Salvo en el supuesto previsto en el párrafo segundo del apartado 6, el contrato de relevo podrá celebrarse a jornada completa o a tiempo parcial. En todo caso, la duración de la jornada deberá ser, como mínimo, igual a la reducción de jornada acordada por el trabajador sustituido. El horario de trabajo del trabajador relevista podrá completar el del trabajador sustituido o simultanearse con él.

d) El puesto de trabajo del trabajador relevista podrá ser el mismo del trabajador sustituido. En todo caso, deberá existir una correspondencia entre las bases de cotización de ambos, en los términos previstos en el texto refundido de la Ley General de la Seguridad Social.

e) En la negociación colectiva se podrán establecer medidas para impulsar la celebración de contratos de relevo."
¿Qué se entiende por trabajo a distancia?," El trabajo a distancia se refiere al contrato de trabajo realizado por un trabajador fuera del lugar de trabajo habitual de la empresa, generalmente utilizando herramientas y tecnologías electrónicas para realizar el trabajo. Este concepto es igual a un trabajo a tiempo completo comparable, con el mismo tipo de contrato de trabajo y realizando el mismo trabajo, pero en menos horas que la jornada laboral completa. El contrato a distancia se regirá por las mismas reglas que el contrato a tiempo parcial, y debe formalizarse por escrito.","['A efectos de lo dispuesto en el párrafo anterior, se entenderá por «trabajador a tiempo \ncompleto comparable» a un trabajador a tiempo completo de la misma empresa y centro de \ntrabajo, con el mismo tipo de contrato de trabajo y que realice un trabajo idéntico o similar. Si \nen la empresa no hubiera ningún trabajador comparable a tiempo completo, se considerará \nla jornada a tiempo completo prevista en el convenio colectivo de aplicación o, en su defecto, \nla jornada máxima legal.\n2. El contrato a tiempo parcial podrá concertarse por tiempo indefinido o por duración \ndeterminada en los supuestos en los que legalmente se permita la utilización de esta \nmodalidad de contratación.\n3. (Derogado)\n4. El contrato a tiempo parcial se regirá por las siguientes reglas:\na) El contrato, conforme a lo dispuesto en el artículo 8.2, se deberá formalizar \nnecesariamente por escrito. En el contrato deberá figurar el número de horas ordinarias de'
 'contratos formativos en contratos por tiempo indefinido.\n7. Las empresas que pretendan suscribir contratos formativos, podrán solicitar por \nescrito al servicio público de empleo competente, información relativa a si las personas a las \nque pretenden contratar han estado previamente contratadas bajo dicha modalidad y la \nduración de estas contrataciones. Dicha información deberá ser trasladada a la \nrepresentación legal de las personas trabajadoras y tendrá valor liberatorio a efectos de no \nexceder la duración máxima de este contrato.\nArtículo 12.  Contrato a tiempo parcial y contrato de relevo.\n1. El contrato de trabajo se entenderá celebrado a tiempo parcial cuando se haya \nacordado la prestación de servicios durante un número de horas al día, a la semana, al mes \no al año, inferior a la jornada de trabajo de un trabajador a tiempo completo comparable.\nA efectos de lo dispuesto en el párrafo anterior, se entenderá por «trabajador a tiempo'
 'el empleo, así como sobre la producción y ventas, incluido el programa de producción.\nc) Sobre las previsiones del empresario de celebración de nuevos contratos, con \nindicación del número de estos y de las modalidades y tipos que serán utilizados, incluidos \nlos contratos a tiempo parcial, la realización de horas complementarias por los trabajadores \ncontratados a tiempo parcial y de los supuestos de subcontratación.BOLETÍN OFICIAL DEL ESTADO\nLEGISLACIÓN CONSOLIDADA\nPágina 66']","['aquel en que la prestación de la actividad laboral se realice de manera preponderante en el domicilio del trabajador o en el lugar libremente elegido por este, de modo alternativo a su desarrollo presencial en el centro de trabajo de la empresa.']","Tendrá la consideración de trabajo a distancia aquel en que la prestación de la actividad laboral se realice de manera preponderante en el domicilio del trabajador o en el lugar libremente elegido por este, de modo alternativo a su desarrollo presencial en el centro de trabajo de la empresa."
¿Qué requisitos tiene el contrato a distancia?," El contrato a distancia requiere constar por escrito, según la ley. Debe especificarse el número de horas ordinarias de jornada en el contrato y pueden durar indefinidamente o tener una duración determinada en los supuestos legales que permiten utilizar esta modalidad de contratación.","['y dirección de otro y el que lo recibe a cambio de una retribución a aquel.\n2. Deberán constar por escrito los contratos de trabajo cuando así lo exija una \ndisposición legal y, en todo caso, los de prácticas y para la formación y el aprendizaje, los \ncontratos a tiempo parcial, fijos-discontinuos y de relevo y los contratos para la realización de \nuna obra o servicio determinado; también constarán por escrito los contratos por tiempo \ndeterminado cuya duración sea superior a cuatro semanas.\nDeberán constar igualmente por escrito los contratos de trabajo de los pescadores, de \nlos trabajadores que trabajen a distancia y de los trabajadores contratados en España al \nservicio de empresas españolas en el extranjero.\nDe no observarse la exigencia de forma escrita, el contrato de trabajo se presumirá \ncelebrado por tiempo indefinido y a jornada completa, salvo prueba en contrario que acredite \nsu naturaleza temporal o el carácter a tiempo parcial de los servicios.'
 'A efectos de lo dispuesto en el párrafo anterior, se entenderá por «trabajador a tiempo \ncompleto comparable» a un trabajador a tiempo completo de la misma empresa y centro de \ntrabajo, con el mismo tipo de contrato de trabajo y que realice un trabajo idéntico o similar. Si \nen la empresa no hubiera ningún trabajador comparable a tiempo completo, se considerará \nla jornada a tiempo completo prevista en el convenio colectivo de aplicación o, en su defecto, \nla jornada máxima legal.\n2. El contrato a tiempo parcial podrá concertarse por tiempo indefinido o por duración \ndeterminada en los supuestos en los que legalmente se permita la utilización de esta \nmodalidad de contratación.\n3. (Derogado)\n4. El contrato a tiempo parcial se regirá por las siguientes reglas:\na) El contrato, conforme a lo dispuesto en el artículo 8.2, se deberá formalizar \nnecesariamente por escrito. En el contrato deberá figurar el número de horas ordinarias de'
 'jornada.\ng) Si al término del contrato la persona continuase en la empresa, no podrá concertarse \nun nuevo periodo de prueba, computándose la duración del contrato formativo a efectos de \nantigüedad en la empresa.\nh) Los contratos formativos celebrados en fraude de ley o aquellos respecto de los \ncuales la empresa incumpla sus obligaciones formativas se entenderán concertados como \ncontratos indefinidos de carácter ordinario.\ni) Reglamentariamente se establecerán, previa consulta con las administraciones \ncompetentes en la formación objeto de realización mediante contratos formativos, los \nrequisitos que deben cumplirse para la celebración de los mismos, tales como el número de \ncontratos por tamaño de centro de trabajo, las personas en formación por tutor o tutora, o las \nexigencias en relación con la estabilidad de la plantilla.BOLETÍN OFICIAL DEL ESTADO\nLEGISLACIÓN CONSOLIDADA\nPágina 16']","['se formalizará por escrito. \n3. Los trabajadores a distancia tendrán los mismos derechos que los que prestan sus servicios en el centro de trabajo de la empresa, salvo aquellos que sean inherentes a la realización de la prestación laboral en el mismo de manera presencial. En especial, el trabajador a distancia tendrá derecho a percibir, como mínimo, la retribución total establecida conforme a su grupo profesional y funciones.\n\n5. Los trabajadores a distancia podrán ejercer los derechos de representación colectiva conforme a lo previsto en esta ley.']","2. El acuerdo por el que se establezca el trabajo a distancia se formalizará por escrito. Tanto si el acuerdo se estableciera en el contrato inicial como si fuera posterior, le serán de aplicación las reglas contenidas en el artículo 8.4 para la copia básica del contrato de trabajo.

3. Los trabajadores a distancia tendrán los mismos derechos que los que prestan sus servicios en el centro de trabajo de la empresa, salvo aquellos que sean inherentes a la realización de la prestación laboral en el mismo de manera presencial. En especial, el trabajador a distancia tendrá derecho a percibir, como mínimo, la retribución total establecida conforme a su grupo profesional y funciones.

El empresario deberá establecer los medios necesarios para asegurar el acceso efectivo de estos trabajadores a la formación profesional para el empleo, a fin de favorecer su promoción profesional. Asimismo, a fin de posibilitar la movilidad y promoción, deberá informar a los trabajadores a distancia de la existencia de puestos de trabajo vacantes para su desarrollo presencial en sus centros de trabajo.

4. Los trabajadores a distancia tienen derecho a una adecuada protección en materia de seguridad y salud resultando de aplicación, en todo caso, lo establecido en la Ley 31/1995, de 8 de noviembre, de Prevención de Riesgos Laborales, y su normativa de desarrollo.

5. Los trabajadores a distancia podrán ejercer los derechos de representación colectiva conforme a lo previsto en esta ley. A estos efectos dichos trabajadores deberán estar adscritos a un centro de trabajo concreto de la empresa."
¿Es posible establecer un periodo de prueba?," Sí, es posible establecer un periodo de prueba según lo estipulado en el artículo 14 del Capítulo II de la norma indicada. El periodo de prueba puede ser concertado por escrito y está sujeto a ciertos límites de datos como los que se indican en las altas efectivas de las personas fijas discontinuas una vez se produzcan. En caso de no cumplimiento relacionado con el llamamiento, las personas fijas-discontinuas podrán ejercer las acciones que procedan iniciándose el plazo para ello desde el momento de la falta de este o desde el momento en que la conociesen.","['la jornada deberá ser, como mínimo, igual a la reducción de jornada acordada por el \ntrabajador sustituido. El horario de trabajo del trabajador relevista podrá completar el del \ntrabajador sustituido o simultanearse con él.\nd) El puesto de trabajo del trabajador relevista podrá ser el mismo del trabajador \nsustituido. En todo caso, deberá existir una correspondencia entre las bases de cotización de \nambos, en los términos previstos en el texto refundido de la Ley General de la Seguridad \nSocial.\ne) En la negociación colectiva se podrán establecer medidas para impulsar la \ncelebración de contratos de relevo.\nArtículo 13.  Trabajo a distancia.\nLas personas trabajadoras podrán prestar trabajo a distancia en los términos previstos \nen la Ley 10/2021 de trabajo a distancia.\nCAPÍTULO II\nContenido del contrato de trabajo\nSección 1.ª Duración del contrato\nArtículo 14.  Periodo de prueba.\n1. Podrá concertarse por escrito un periodo de prueba, con sujeción a los límites de'
 'datos de las altas efectivas de las personas fijas discontinuas una vez se produzcan.\nLas personas fijas-discontinuas podrán ejercer las acciones que procedan en caso de \nincumplimientos relacionados con el llamamiento, iniciándose el plazo para ello desde el \nmomento de la falta de este o desde el momento en que la conociesen.\n4. Cuando la contratación fija-discontinua se justifique por la celebración de contratas, \nsubcontratas o con motivo de concesiones administrativas en los términos de este artículo, \nlos periodos de inactividad solo podrán producirse como plazos de espera de recolocación \nentre subcontrataciones.\nEn estos supuestos, los convenios colectivos sectoriales podrán determinar un plazo \nmáximo de inactividad entre subcontratas, que, en defecto de previsión convencional, será \nde tres meses. Una vez cumplido dicho plazo, la empresa adoptará las medidas \ncoyunturales o definitivas que procedan, en los términos previstos en esta norma.'
 'acción individual. La interposición del conflicto colectivo paralizará la tramitación de las \nacciones individuales iniciadas, hasta su resolución.\n4. En cualquier momento durante la vigencia de la medida de reducción de jornada o \nsuspensión de contratos basada en causas económicas, organizativas, técnicas o de \nproducción, la empresa podrá comunicar a la representación de las personas trabajadoras \ncon la que hubiera desarrollado el periodo de consultas una propuesta de prórroga de la \nmedida. La necesidad de esta prórroga deberá ser tratada en un periodo de consultas de \nduración máxima de cinco días, y la decisión empresarial será comunicada a la autoridad \nlaboral en un plazo de siete días, surtiendo efectos desde el día siguiente a la finalización del \nperiodo inicial de reducción de jornada o suspensión de la relación laboral.\nSalvo en los plazos señalados, resultarán de aplicación a este periodo de consultas las \nprevisiones recogidas en el apartado 3.']","['Podrá concertarse por escrito un periodo de prueba, con sujeción a los límites de duración que, en su caso, se establezcan en los convenios colectivos.']","Podrá concertarse por escrito un periodo de prueba, con sujeción a los límites de duración que, en su caso, se establezcan en los convenios colectivos."
¿Cuál es la duración máxima del periodo de prueba?," El período máximo de duración para una suspensión del contrato o reducción de jornada es doce meses, ya que se trata de un periodo temporal de regulación de empleo.","['año y con un máximo de doce mensualidades.\n5. Para hacer efectivo su derecho de protección a la salud, los trabajadores con \ndiscapacidad que acrediten la necesidad de recibir fuera de su localidad un tratamiento de BOLETÍN OFICIAL DEL ESTADO\nLEGISLACIÓN CONSOLIDADA\nPágina 41'
 'b) La empresa junto con la notificación, comunicación o solicitud, según proceda, a la \nautoridad laboral sobre su decisión de reducir la jornada de trabajo o suspender los contratos \nde trabajo, a que se refieren los apartados 3, 4, 5 y 6, comunicará, a través de los \nprocedimientos automatizados que se establezcan:\n1.º El período dentro del cual se va a llevar a cabo la aplicación de la suspensión del \ncontrato o la reducción de jornada.\n2.º La identificación de las personas trabajadoras incluidas en el expediente de \nregulación temporal de empleo.\n3.º El tipo de medida a aplicar respecto de cada una de las personas trabajadoras y el \nporcentaje máximo de reducción de jornada o el número máximo de días de suspensión de \ncontrato a aplicar.\nc) Durante el periodo de aplicación del expediente, la empresa podrá desafectar y afectar \na las personas trabajadoras en función de las alteraciones de las circunstancias señaladas'
 'acción individual. La interposición del conflicto colectivo paralizará la tramitación de las \nacciones individuales iniciadas, hasta su resolución.\n4. En cualquier momento durante la vigencia de la medida de reducción de jornada o \nsuspensión de contratos basada en causas económicas, organizativas, técnicas o de \nproducción, la empresa podrá comunicar a la representación de las personas trabajadoras \ncon la que hubiera desarrollado el periodo de consultas una propuesta de prórroga de la \nmedida. La necesidad de esta prórroga deberá ser tratada en un periodo de consultas de \nduración máxima de cinco días, y la decisión empresarial será comunicada a la autoridad \nlaboral en un plazo de siete días, surtiendo efectos desde el día siguiente a la finalización del \nperiodo inicial de reducción de jornada o suspensión de la relación laboral.\nSalvo en los plazos señalados, resultarán de aplicación a este periodo de consultas las \nprevisiones recogidas en el apartado 3.']","['En defecto de pacto en convenio, la duración del periodo de prueba no podrá exceder de seis meses para los técnicos titulados, ni de dos meses para los demás trabajadores. En las empresas de menos de veinticinco trabajadores el periodo de prueba no podrá exceder de tres meses para los trabajadores que no sean técnicos titulados.']","En defecto de pacto en convenio, la duración del periodo de prueba no podrá exceder de seis meses para los técnicos titulados, ni de dos meses para los demás trabajadores. En las empresas de menos de veinticinco trabajadores el periodo de prueba no podrá exceder de tres meses para los trabajadores que no sean técnicos titulados.

En el supuesto de los contratos temporales de duración determinada del artículo 15 concertados por tiempo no superior a seis meses, el periodo de prueba no podrá exceder de un mes, salvo que se disponga otra cosa en convenio colectivo."
¿Puede establecerse un periodo de prueba con las mismas funciones que ha relizado anteriormente en la empresa?," Si el trabajador sustituido ha tenido una jornada establecida por tiempo superior a seis meses en el mismo puesto de trabajo y la empresa está considerando establecer un periodo de prueba con las mismas funciones para otro trabajador, no podrá celebrarse un contrato formativo en alternancia debido a que ya ha sido desempeñado con anterioridad por el trabajador sustituido. En tales casos, la retribución será la establecida para esos contratos y no se podrá establecer periodo de prueba.","['la jornada deberá ser, como mínimo, igual a la reducción de jornada acordada por el \ntrabajador sustituido. El horario de trabajo del trabajador relevista podrá completar el del \ntrabajador sustituido o simultanearse con él.\nd) El puesto de trabajo del trabajador relevista podrá ser el mismo del trabajador \nsustituido. En todo caso, deberá existir una correspondencia entre las bases de cotización de \nambos, en los términos previstos en el texto refundido de la Ley General de la Seguridad \nSocial.\ne) En la negociación colectiva se podrán establecer medidas para impulsar la \ncelebración de contratos de relevo.\nArtículo 13.  Trabajo a distancia.\nLas personas trabajadoras podrán prestar trabajo a distancia en los términos previstos \nen la Ley 10/2021 de trabajo a distancia.\nCAPÍTULO II\nContenido del contrato de trabajo\nSección 1.ª Duración del contrato\nArtículo 14.  Periodo de prueba.\n1. Podrá concertarse por escrito un periodo de prueba, con sujeción a los límites de'
 'j) No se podrán celebrar contratos formativos en alternancia cuando la actividad o puesto \nde trabajo correspondiente al contrato haya sido desempeñado con anterioridad por la \npersona trabajadora en la misma empresa bajo cualquier modalidad por tiempo superior a \nseis meses.\nk) Las personas contratadas con contrato de formación en alternancia no podrán realizar \nhoras complementarias ni horas extraordinarias, salvo en el supuesto previsto en el artículo \n35.3. Tampoco podrán realizar trabajos nocturnos ni trabajo a turnos.\nExcepcionalmente, podrán realizarse actividades laborales en los citados periodos \ncuando las actividades formativas para la adquisición de los aprendizajes previstos en el \nplan formativo no puedan desarrollarse en otros periodos, debido a la naturaleza de la \nactividad.\nl) No podrá establecerse periodo de prueba en estos contratos.\nm) La retribución será la establecida para estos contratos en el convenio colectivo de'
 'También adquirirán la condición de fijas las personas trabajadoras temporales que no \nhubieran sido dadas de alta en la Seguridad Social una vez transcurrido un plazo igual al que \nlegalmente se hubiera podido fijar para el periodo de prueba.\n5. Sin perjuicio de lo anterior, las personas trabajadoras que en un periodo de \nveinticuatro meses hubieran estado contratadas durante un plazo superior a dieciocho \nmeses, con o sin solución de continuidad, para el mismo o diferente puesto de trabajo con la \nmisma empresa o grupo de empresas, mediante dos o más contratos por circunstancias de \nla producción, sea directamente o a través de su puesta a disposición por empresas de \ntrabajo temporal, adquirirán la condición de personas trabajadoras fijas. Esta previsión \ntambién será de aplicación cuando se produzcan supuestos de sucesión o subrogación \nempresarial conforme a lo dispuesto legal o convencionalmente.\nAsimismo, adquirirá la condición de fija la persona que ocupe un puesto de trabajo que']","['Será nulo el pacto que establezca un periodo de prueba cuando el trabajador haya ya desempeñado las mismas funciones con anterioridad en la empresa, bajo cualquier modalidad de contratación.']","Será nulo el pacto que establezca un periodo de prueba cuando el trabajador haya ya desempeñado las mismas funciones con anterioridad en la empresa, bajo cualquier modalidad de contratación."
¿Qué derechos y obligaciones tiene un trabajador en periodo de prueba?," Un trabajador en periodo de prueba no tiene derecho a la seguridad colectiva, el descanso dominical ni las vacaciones. Tampoco tiene derecho al régimen de jubilación ni al derecho a las indemnizaciones. En caso de término anticipado del periodo de prueba, no se le tiene que pagar indemnización alguna salvo en caso de causa justificada que lo disponga. Debe destacarse que el contrato de trabajo durante el periodo de prueba puede ser tácito y no necesariamente escrito.","['Artículo 7.  Capacidad para contratar.\nPodrán contratar la prestación de su trabajo:\na) Quienes tengan plena capacidad de obrar conforme a lo dispuesto en el Código Civil.\nb) Los menores de dieciocho y mayores de dieciséis años, que vivan de forma \nindependiente, con consentimiento de sus padres o tutores, o con autorización de la persona \no institución que les tenga a su cargo.\nSi el representante legal de una persona de capacidad limitada la autoriza expresa o \ntácitamente para realizar un trabajo, queda esta también autorizada para ejercitar los \nderechos y cumplir los deberes que se derivan de su contrato y para su cesación.\nc) Los extranjeros, de acuerdo con lo dispuesto en la legislación específica sobre la \nmateria.\nArtículo 8.  Forma del contrato.\n1. El contrato de trabajo se podrá celebrar por escrito o de palabra. Se presumirá \nexistente entre todo el que presta un servicio por cuenta y dentro del ámbito de organización \ny dirección de otro y el que lo recibe a cambio de una retribución a aquel.'
 'contraprestaciones establecidas en la parte no válida del contrato, el órgano de la \njurisdicción social que a instancia de parte declare la nulidad hará el debido pronunciamiento \nsobre la subsistencia o supresión en todo o en parte de dichas condiciones o retribuciones.\n2. En caso de que el contrato resultase nulo, el trabajador podrá exigir, por el trabajo que \nya hubiese prestado, la remuneración consiguiente a un contrato válido.\n3. En caso de nulidad por discriminación salarial por razón de sexo, el trabajador tendrá \nderecho a la retribución correspondiente al trabajo igual o de igual valor.\nSección 4.ª Modalidades del contrato de trabajo\nArtículo 10.  Trabajo en común y contrato de grupo.\n1. Si el empresario diera un trabajo en común a un grupo de sus trabajadores, \nconservará respecto de cada uno, individualmente, sus derechos y deberes.\n2. Si el empresario hubiese celebrado un contrato con un grupo de trabajadores'
 'Asimismo, podrán establecer un periodo mínimo de llamamiento anual y una cuantía por \nfin de llamamiento a satisfacer por las empresas a las personas trabajadoras, cuando este \ncoincida con la terminación de la actividad y no se produzca, sin solución de continuidad, un \nnuevo llamamiento.\n6. Las personas trabajadoras fijas-discontinuas no podrán sufrir perjuicios por el ejercicio \nde los derechos de conciliación, ausencias con derecho a reserva de puesto de trabajo y \notras causas justificadas en base a derechos reconocidos en la ley o los convenios \ncolectivos.\nLas personas trabajadoras fijas-discontinuas tienen derecho a que su antigüedad se \ncalcule teniendo en cuenta toda la duración de la relación laboral y no el tiempo de servicios \nefectivamente prestados, con la excepción de aquellas condiciones que exijan otro \ntratamiento en atención a su naturaleza y siempre que responda a criterios de objetividad, \nproporcionalidad y transparencia.']","['Durante el periodo de prueba, el trabajador tendrá los derechos y obligaciones correspondientes al puesto de trabajo que desempeñe como si fuera de plantilla, excepto los derivados de la resolución de la relación laboral,']","Durante el periodo de prueba, el trabajador tendrá los derechos y obligaciones correspondientes al puesto de trabajo que desempeñe como si fuera de plantilla, excepto los derivados de la resolución de la relación laboral, que podrá producirse a instancia de cualquiera de las partes durante su transcurso."
¿Qué sucede si tanscurre el periodo de prueba sin desestimiento?," Si transcurre el periodo de prueba sin desestimiento, no se pueden imponer sanciones que reduzcan la duración de las vacaciones o otra minoración de los derechos al descanso del trabajador o multa. Las acciones derivadas del contrato de trabajo que no tengan plazo especial prescribirán al año de su terminación, a menos que se haya dado continuidad por prórroga expresa o tácita. El ejercicio de la acción contra el despido o resolución de contratos temporales caducará a los 20 días siguientes de aquel en que se hubiera producido, excepto cuando se presente una solicitud de conciliación ante el órgano público competente.","['3. No se podrán imponer sanciones que consistan en la reducción de la duración de las \nvacaciones u otra minoración de los derechos al descanso del trabajador o multa de haber.\nCAPÍTULO V\nPlazos de prescripción\nSección 1.ª Prescripción de acciones derivadas del contrato\nArtículo 59.  Prescripción y caducidad.\n1. Las acciones derivadas del contrato de trabajo que no tengan señalado plazo especial \nprescribirán al año de su terminación.\nA estos efectos, se considerará terminado el contrato:\na) El día en que expire el tiempo de duración convenido o fijado por disposición legal o \nconvenio colectivo.\nb) El día en que termine la prestación de servicios continuados, cuando se haya dado \nesta continuidad por virtud de prórroga expresa o tácita.\n2. Si la acción se ejercita para exigir percepciones económicas o para el cumplimiento de \nobligaciones de tracto único, que no puedan tener lugar después de extinguido el contrato, el \nplazo de un año se computará desde el día en que la acción pudiera ejercitarse.'
 'del plazo máximo señalado para dicho periodo.\nCuando el periodo de consultas finalice con acuerdo se presumirá que concurren las \ncausas justificativas a que alude el apartado 1 y solo podrá ser impugnado ante la \njurisdicción social por la existencia de fraude, dolo, coacción o abuso de derecho en su \nconclusión. Ello sin perjuicio del derecho de los trabajadores afectados a ejercitar la opción \nprevista en el párrafo segundo del apartado 3.\n5. La decisión sobre la modificación colectiva de las condiciones de trabajo será \nnotificada por el empresario a los trabajadores una vez finalizado el periodo de consultas sin \nacuerdo y surtirá efectos en el plazo de los siete días siguientes a su notificación.\nContra las decisiones a que se refiere el presente apartado se podrá reclamar en \nconflicto colectivo, sin perjuicio de la acción individual prevista en el apartado 3. La BOLETÍN OFICIAL DEL ESTADO\nLEGISLACIÓN CONSOLIDADA\nPágina 44'
 'plazo de un año se computará desde el día en que la acción pudiera ejercitarse.\n3. El ejercicio de la acción contra el despido o resolución de contratos temporales \ncaducará a los veinte días siguientes de aquel en que se hubiera producido. Los días serán \nhábiles y el plazo de caducidad a todos los efectos.\nEl plazo de caducidad quedará interrumpido por la presentación de la solicitud de \nconciliación ante el órgano público de mediación, arbitraje y conciliación competente.\n4. Lo previsto en el apartado anterior será de aplicación a las acciones contra las \ndecisiones empresariales en materia de movilidad geográfica y modificación sustancial de \ncondiciones de trabajo. El plazo se computará desde el día siguiente a la fecha de \nnotificación de la decisión empresarial, tras la finalización, en su caso, del periodo de \nconsultas.\nSección 2.ª Prescripción de las infracciones y faltas\nArtículo 60.  Prescripción.\n1. Las infracciones cometidas por el empresario prescribirán conforme a lo establecido']","['Transcurrido el periodo de prueba sin que se haya producido el desistimiento, el contrato producirá plenos efectos, computándose el tiempo de los servicios prestados en la antigüedad']","Transcurrido el periodo de prueba sin que se haya producido el desistimiento, el contrato producirá plenos efectos, computándose el tiempo de los servicios prestados en la antigüedad del trabajador en la empresa."
¿Qué situaciones interrumpen el periodo de prueba?," El periodo de prueba no puede ser establecido si el trabajador ya ha desempeñado las mismas funciones con anterioridad en la empresa. Durante este período, la persona trabajadora tiene los derechos y obligaciones correspondientes al puesto de trabajo que desempeña, excepto los derivados de la resolución de la relación laboral que podrá producirse a instancia de cualquiera de las partes durante su transcurso. Sin embargo, la resolución a instancia empresarial será nula en el caso de las trabajadoras por razón de embarazo o maternidad, salvo que concurran motivos no relacionados con el embarazo o maternidad.","['siguientes materias:\na) Jornada de trabajo.\nb) Horario y distribución del tiempo de trabajo.\nc) Régimen de trabajo a turnos.BOLETÍN OFICIAL DEL ESTADO\nLEGISLACIÓN CONSOLIDADA\nPágina 77'
 '3. No se podrán imponer sanciones que consistan en la reducción de la duración de las \nvacaciones u otra minoración de los derechos al descanso del trabajador o multa de haber.\nCAPÍTULO V\nPlazos de prescripción\nSección 1.ª Prescripción de acciones derivadas del contrato\nArtículo 59.  Prescripción y caducidad.\n1. Las acciones derivadas del contrato de trabajo que no tengan señalado plazo especial \nprescribirán al año de su terminación.\nA estos efectos, se considerará terminado el contrato:\na) El día en que expire el tiempo de duración convenido o fijado por disposición legal o \nconvenio colectivo.\nb) El día en que termine la prestación de servicios continuados, cuando se haya dado \nesta continuidad por virtud de prórroga expresa o tácita.\n2. Si la acción se ejercita para exigir percepciones económicas o para el cumplimiento de \nobligaciones de tracto único, que no puedan tener lugar después de extinguido el contrato, el \nplazo de un año se computará desde el día en que la acción pudiera ejercitarse.'
 'Será nulo el pacto que establezca un periodo de prueba cuando el trabajador haya ya \ndesempeñado las mismas funciones con anterioridad en la empresa, bajo cualquier \nmodalidad de contratación.\n2. Durante el periodo de prueba, la persona trabajadora tendrá los derechos y \nobligaciones correspondientes al puesto de trabajo que desempeñe como si fuera de \nplantilla, excepto los derivados de la resolución de la relación laboral, que podrá producirse a \ninstancia de cualquiera de las partes durante su transcurso.\nLa resolución a instancia empresarial será nula en el caso de las trabajadoras por razón \nde embarazo, desde la fecha de inicio del embarazo hasta el comienzo del período de \nsuspensión a que se refiere el artículo 48.4, o maternidad, salvo que concurran motivos no \nrelacionados con el embarazo o maternidad.\n3. Transcurrido el periodo de prueba sin que se haya producido el desistimiento, el \ncontrato producirá plenos efectos, computándose el tiempo de los servicios prestados en la']","['Las situaciones de incapacidad temporal, riesgo durante el embarazo, maternidad, adopción, guarda con fines de adopción, acogimiento, riesgo durante la lactancia y paternidad, que afecten al trabajador durante el periodo de prueba, interrumpen el cómputo del mismo siempre que se produzca acuerdo entre ambas partes.']","Las situaciones de incapacidad temporal, riesgo durante el embarazo, maternidad, adopción, guarda con fines de adopción, acogimiento, riesgo durante la lactancia y paternidad, que afecten al trabajador durante el periodo de prueba, interrumpen el cómputo del mismo siempre que se produzca acuerdo entre ambas partes."
¿Qué tipos de trabajo se pueden realizar respecto a la duración del contrato?,"1. Tipos de contratos que pueden ser realizados respecto a la duración del contrato son contrato a tiempo parcial y contrato de relevo, contrato por tiempo indefinido, contrato formativo y contrato de subcontratación.
2. La empresa comunicará al autoridad laboral sobre su decisión de reducir la jornada o suspender los contratos, incluyendo el período dentro del cual se aplicará la suspensión o reducción de jornada, identificación de las personas afectadas y tipo de medida para cada una.
3. La información relativa a si las personas han estado previamente contratadas bajo modalidad formativa tendrá valor liberatorio para no exceder la duración máxima del contrato en caso de nuevas contrataciones formativas.","['el empleo, así como sobre la producción y ventas, incluido el programa de producción.\nc) Sobre las previsiones del empresario de celebración de nuevos contratos, con \nindicación del número de estos y de las modalidades y tipos que serán utilizados, incluidos \nlos contratos a tiempo parcial, la realización de horas complementarias por los trabajadores \ncontratados a tiempo parcial y de los supuestos de subcontratación.BOLETÍN OFICIAL DEL ESTADO\nLEGISLACIÓN CONSOLIDADA\nPágina 66'
 'contratos formativos en contratos por tiempo indefinido.\n7. Las empresas que pretendan suscribir contratos formativos, podrán solicitar por \nescrito al servicio público de empleo competente, información relativa a si las personas a las \nque pretenden contratar han estado previamente contratadas bajo dicha modalidad y la \nduración de estas contrataciones. Dicha información deberá ser trasladada a la \nrepresentación legal de las personas trabajadoras y tendrá valor liberatorio a efectos de no \nexceder la duración máxima de este contrato.\nArtículo 12.  Contrato a tiempo parcial y contrato de relevo.\n1. El contrato de trabajo se entenderá celebrado a tiempo parcial cuando se haya \nacordado la prestación de servicios durante un número de horas al día, a la semana, al mes \no al año, inferior a la jornada de trabajo de un trabajador a tiempo completo comparable.\nA efectos de lo dispuesto en el párrafo anterior, se entenderá por «trabajador a tiempo'
 'b) La empresa junto con la notificación, comunicación o solicitud, según proceda, a la \nautoridad laboral sobre su decisión de reducir la jornada de trabajo o suspender los contratos \nde trabajo, a que se refieren los apartados 3, 4, 5 y 6, comunicará, a través de los \nprocedimientos automatizados que se establezcan:\n1.º El período dentro del cual se va a llevar a cabo la aplicación de la suspensión del \ncontrato o la reducción de jornada.\n2.º La identificación de las personas trabajadoras incluidas en el expediente de \nregulación temporal de empleo.\n3.º El tipo de medida a aplicar respecto de cada una de las personas trabajadoras y el \nporcentaje máximo de reducción de jornada o el número máximo de días de suspensión de \ncontrato a aplicar.\nc) Durante el periodo de aplicación del expediente, la empresa podrá desafectar y afectar \na las personas trabajadoras en función de las alteraciones de las circunstancias señaladas']",['El contrato de trabajo podrá concertarse por tiempo indefinido o por una duración determinada.'],El contrato de trabajo podrá concertarse por tiempo indefinido o por una duración determinada.
¿Cuándo se pueden realizar contratos de duración determinada?," Contratos de duración determinada se pueden celebrar en todos los casos menos cuando el trabajo o puesto correspondiente ha sido desempeñado por la persona trabajadora en la misma empresa durante más de seis meses bajo cualquier modalidad. Los contratos formativos en alternancia no se pueden realizar en horas complementarias, extraordinarias, nocturnas ni a turnos, excepto en determinados casos excepcionales. También no puede establecerse periodo de prueba y la retribución será establecida en el convenio colectivo proporcionalmente en función del tiempo trabajado. Los derechos o condiciones de trabajo que estén atribuidos legal, reglamentaria o colectiva deberán computarse según los mismos criterios para todas las personas trabajadoras, independientemente de su modalidad de contratación. En caso de reducción de jornada o suspensión de contratos, las empresas pueden desarrollar acciones formativas para mejorar la competencia profesional y empleabilidad de los trabajadores afectados.","['j) No se podrán celebrar contratos formativos en alternancia cuando la actividad o puesto \nde trabajo correspondiente al contrato haya sido desempeñado con anterioridad por la \npersona trabajadora en la misma empresa bajo cualquier modalidad por tiempo superior a \nseis meses.\nk) Las personas contratadas con contrato de formación en alternancia no podrán realizar \nhoras complementarias ni horas extraordinarias, salvo en el supuesto previsto en el artículo \n35.3. Tampoco podrán realizar trabajos nocturnos ni trabajo a turnos.\nExcepcionalmente, podrán realizarse actividades laborales en los citados periodos \ncuando las actividades formativas para la adquisición de los aprendizajes previstos en el \nplan formativo no puedan desarrollarse en otros periodos, debido a la naturaleza de la \nactividad.\nl) No podrá establecerse periodo de prueba en estos contratos.\nm) La retribución será la establecida para estos contratos en el convenio colectivo de'
 'manera proporcional, en función del tiempo trabajado.\nCuando un determinado derecho o condición de trabajo esté atribuido en las \ndisposiciones legales o reglamentarias y en los convenios colectivos en función de una \nprevia antigüedad de la persona trabajadora, esta deberá computarse según los mismos \ncriterios para todas las personas trabajadoras, cualquiera que sea su modalidad de \ncontratación.\n7. La empresa deberá informar a las personas con contratos de duración determinada o \ntemporales, incluidos los contratos formativos, sobre la existencia de puestos de trabajo \nvacantes, a fin de garantizarles las mismas oportunidades de acceder a puestos \npermanentes que las demás personas trabajadoras. Esta información podrá facilitarse \nmediante un anuncio público en un lugar adecuado de la empresa o centro de trabajo, o \nmediante otros medios previstos en la negociación colectiva, que aseguren la transmisión de \nla información.'
 'medidas adicionales que permitan la consecución de dicho objetivo, general o sectorial, para \nsu discusión y eventual acuerdo con los interlocutores sociales.\nDisposición adicional vigesimoquinta.  Acciones formativas en los expedientes de \nregulación temporal de empleo regulados en los artículos 47 y 47 bis.\nDurante las reducciones de jornada de trabajo o suspensiones de contratos de trabajo a \nlas que se refieren los artículos 47 y 47 bis, las empresas podrán desarrollar acciones \nformativas para cada una de las personas afectadas, que tendrán como objetivo la mejora de \nlas competencias profesionales y la empleabilidad de las personas trabajadoras.\nA través de estas acciones se priorizará el desarrollo de acciones formativas dirigidas a \natender las necesidades formativas reales de las empresas y los trabajadores incluyendo las \nvinculadas a la adquisición de competencias digitales, así como aquellas que permitan']","['a) Cuando se contrate al trabajador para la realización de una obra o servicio determinados, con autonomía y sustantividad propia dentro de la actividad de la empresa y cuya ejecución, aunque limitada en el tiempo, sea en principio de duración incierta.\nno podrán tener una duración superior a tres años ampliable hasta doce meses más por convenio colectivo de ámbito sectorial \nTranscurridos estos plazos, los trabajadores adquirirán la condición de trabajadores fijos de la empresa.\nb) Cuando las circunstancias del mercado, acumulación de tareas o exceso de pedidos así lo exigieran, aun tratándose de la actividad normal de la empresa. En tales casos, los contratos podrán tener una duración máxima de seis meses, dentro de un periodo de doce meses, contados a partir del momento en que se produzcan dichas causas. Por convenio colectivo de ámbito sectorial estatal o, en su defecto, por convenio colectivo sectorial de ámbito inferior, podrá modificarse la duración máxima de estos contratos y el periodo dentro del cual se puedan realizar en atención al carácter estacional de la actividad en que dichas circunstancias se puedan producir. En tal supuesto, el periodo máximo dentro del cual se podrán realizar será de dieciocho meses, no pudiendo superar la duración del contrato las tres cuartas partes del periodo de referencia establecido ni, como máximo, doce meses.\n\nEn caso de que el contrato se hubiera concertado por una duración inferior a la máxima legal o convencionalmente establecida, podrá prorrogarse mediante acuerdo de las partes, por una única vez, sin que la duración total del contrato pueda exceder de dicha duración máxima.\nc) Cuando se trate de sustituir a trabajadores con derecho a reserva del puesto de trabajo, siempre que en el contrato de trabajo se especifique el nombre del sustituido y la causa de sustitución.']","Podrán celebrarse contratos de duración determinada en los siguientes supuestos:

a) Cuando se contrate al trabajador para la realización de una obra o servicio determinados, con autonomía y sustantividad propia dentro de la actividad de la empresa y cuya ejecución, aunque limitada en el tiempo, sea en principio de duración incierta. Estos contratos no podrán tener una duración superior a tres años ampliable hasta doce meses más por convenio colectivo de ámbito sectorial estatal o, en su defecto, por convenio colectivo sectorial de ámbito inferior. Transcurridos estos plazos, los trabajadores adquirirán la condición de trabajadores fijos de la empresa.

Los convenios colectivos sectoriales estatales y de ámbito inferior, incluidos los convenios de empresa, podrán identificar aquellos trabajos o tareas con sustantividad propia dentro de la actividad normal de la empresa que puedan cubrirse con contratos de esta naturaleza.

b) Cuando las circunstancias del mercado, acumulación de tareas o exceso de pedidos así lo exigieran, aun tratándose de la actividad normal de la empresa. En tales casos, los contratos podrán tener una duración máxima de seis meses, dentro de un periodo de doce meses, contados a partir del momento en que se produzcan dichas causas. Por convenio colectivo de ámbito sectorial estatal o, en su defecto, por convenio colectivo sectorial de ámbito inferior, podrá modificarse la duración máxima de estos contratos y el periodo dentro del cual se puedan realizar en atención al carácter estacional de la actividad en que dichas circunstancias se puedan producir. En tal supuesto, el periodo máximo dentro del cual se podrán realizar será de dieciocho meses, no pudiendo superar la duración del contrato las tres cuartas partes del periodo de referencia establecido ni, como máximo, doce meses.

En caso de que el contrato se hubiera concertado por una duración inferior a la máxima legal o convencionalmente establecida, podrá prorrogarse mediante acuerdo de las partes, por una única vez, sin que la duración total del contrato pueda exceder de dicha duración máxima.

Por convenio colectivo se podrán determinar las actividades en las que puedan contratarse trabajadores eventuales, así como fijar criterios generales relativos a la adecuada relación entre el volumen de esta modalidad contractual y la plantilla total de la empresa.

c) Cuando se trate de sustituir a trabajadores con derecho a reserva del puesto de trabajo, siempre que en el contrato de trabajo se especifique el nombre del sustituido y la causa de sustitución."
¿Qué efecto tiene un contrato temporal celebrado en fraude de ley?," El contrato temporal celebrado en fraude de ley no tiene efecto válido y se considerará como un contrato fijo. Esta situación puede ocurrir si, por ejemplo, el contrato no está formalizado por escrito o no cumple con las regulaciones legales establecidas en relación con el tiempo de trabajo.","['A efectos de lo dispuesto en el párrafo anterior, se entenderá por «trabajador a tiempo \ncompleto comparable» a un trabajador a tiempo completo de la misma empresa y centro de \ntrabajo, con el mismo tipo de contrato de trabajo y que realice un trabajo idéntico o similar. Si \nen la empresa no hubiera ningún trabajador comparable a tiempo completo, se considerará \nla jornada a tiempo completo prevista en el convenio colectivo de aplicación o, en su defecto, \nla jornada máxima legal.\n2. El contrato a tiempo parcial podrá concertarse por tiempo indefinido o por duración \ndeterminada en los supuestos en los que legalmente se permita la utilización de esta \nmodalidad de contratación.\n3. (Derogado)\n4. El contrato a tiempo parcial se regirá por las siguientes reglas:\na) El contrato, conforme a lo dispuesto en el artículo 8.2, se deberá formalizar \nnecesariamente por escrito. En el contrato deberá figurar el número de horas ordinarias de'
 'Asimismo, el contrato de sustitución podrá concertarse para completar la jornada \nreducida por otra persona trabajadora, cuando dicha reducción se ampare en causas \nlegalmente establecidas o reguladas en el convenio colectivo y se especifique en el contrato \nel nombre de la persona sustituida y la causa de la sustitución.\nEl contrato de sustitución podrá ser también celebrado para la cobertura temporal de un \npuesto de trabajo durante el proceso de selección o promoción para su cobertura definitiva \nmediante contrato fijo, sin que su duración pueda ser en este caso superior a tres meses, o \nel plazo inferior recogido en convenio colectivo, ni pueda celebrarse un nuevo contrato con el \nmismo objeto una vez superada dicha duración máxima.\n4. Las personas contratadas incumpliendo lo establecido en este artículo adquirirán la \ncondición de fijas.BOLETÍN OFICIAL DEL ESTADO\nLEGISLACIÓN CONSOLIDADA\nPágina 21'
 'y dirección de otro y el que lo recibe a cambio de una retribución a aquel.\n2. Deberán constar por escrito los contratos de trabajo cuando así lo exija una \ndisposición legal y, en todo caso, los de prácticas y para la formación y el aprendizaje, los \ncontratos a tiempo parcial, fijos-discontinuos y de relevo y los contratos para la realización de \nuna obra o servicio determinado; también constarán por escrito los contratos por tiempo \ndeterminado cuya duración sea superior a cuatro semanas.\nDeberán constar igualmente por escrito los contratos de trabajo de los pescadores, de \nlos trabajadores que trabajen a distancia y de los trabajadores contratados en España al \nservicio de empresas españolas en el extranjero.\nDe no observarse la exigencia de forma escrita, el contrato de trabajo se presumirá \ncelebrado por tiempo indefinido y a jornada completa, salvo prueba en contrario que acredite \nsu naturaleza temporal o el carácter a tiempo parcial de los servicios.']",['Se presumirán por tiempo indefinido los contratos temporales celebrados en fraude de ley.'],Se presumirán por tiempo indefinido los contratos temporales celebrados en fraude de ley.
¿Cuándo se deben notificar los contratos determinados a la representación legal de los trabajadores?," Los contratos determinados a la representación legal de los trabajadores deben notificarse cuando no exista obligación legal de entregar copia básica del mismo. También deben notificarse los contratos realizados de acuerdo con las modalidades de contratación por tiempo determinado previstas en el artículo, y cuando el empresario entregue a la representación legal de los trabajadores una copia básica de todos los contratos que deban celebrarse por escrito.","['su naturaleza temporal o el carácter a tiempo parcial de los servicios.\nCualquiera de las partes podrá exigir que el contrato se formalice por escrito, incluso \ndurante el transcurso de la relación laboral.\n3. El empresario está obligado a comunicar a la oficina pública de empleo, en el plazo de \nlos diez días siguientes a su concertación y en los términos que reglamentariamente se \ndeterminen, el contenido de los contratos de trabajo que celebre o las prórrogas de los \nmismos, deban o no formalizarse por escrito.\n4. El empresario entregará a la representación legal de los trabajadores una copia básica \nde todos los contratos que deban celebrarse por escrito, a excepción de los contratos de \nrelación laboral especial de alta dirección sobre los que se establece el deber de notificación \na la representación legal de los trabajadores.\nCon el fin de comprobar la adecuación del contenido del contrato a la legalidad vigente, \nesta copia básica contendrá todos los datos del contrato a excepción del número del'
 'la información.\nDicha información será trasladada, además, a la representación legal de las personas \ntrabajadoras.\nLas empresas habrán de notificar, asimismo a la representación legal de las personas \ntrabajadoras los contratos realizados de acuerdo con las modalidades de contratación por \ntiempo determinado previstas en este artículo, cuando no exista obligación legal de entregar \ncopia básica de los mismos.\n8. Los convenios colectivos podrán establecer planes de reducción de la temporalidad, \nasí como fijar criterios generales relativos a la adecuada relación entre el volumen de la \ncontratación de carácter temporal y la plantilla total de la empresa, criterios objetivos de \nconversión de los contratos de duración determinada o temporales en indefinidos, así como \nfijar porcentajes máximos de temporalidad y las consecuencias derivadas del incumplimiento \nde los mismos.\nAsimismo, los convenios colectivos podrán establecer criterios de preferencia entre las'
 'adecuado en el que puedan desarrollar sus actividades y comunicarse con los trabajadores, \nasí como uno o varios tablones de anuncios. La representación legal de los trabajadores de \nlas empresas contratistas y subcontratistas que compartan de forma continuada centro de \ntrabajo podrán hacer uso de dichos locales en los términos que acuerden con la empresa. \nLas posibles discrepancias se resolverán por la autoridad laboral, previo informe de la \nInspección de Trabajo y Seguridad Social.\nTÍTULO III\nDe la negociación colectiva y de los convenios colectivos\nCAPÍTULO I\nDisposiciones generales\nSección 1.ª Naturaleza y efectos de los convenios\nArtículo 82.  Concepto y eficacia.\n1. Los convenios colectivos, como resultado de la negociación desarrollada por los \nrepresentantes de los trabajadores y de los empresarios, constituyen la expresión del \nacuerdo libremente adoptado por ellos en virtud de su autonomía colectiva.\n2. Mediante los convenios colectivos, y en su ámbito correspondiente, los trabajadores y']",['Los empresarios habrán de notificar a la representación legal de los trabajadores en las empresas los contratos realizados de acuerdo con las modalidades de contratación por tiempo determinado previstas en este artículo cuando no exista obligación legal de entregar copia básica de los mismos.'],Los empresarios habrán de notificar a la representación legal de los trabajadores en las empresas los contratos realizados de acuerdo con las modalidades de contratación por tiempo determinado previstas en este artículo cuando no exista obligación legal de entregar copia básica de los mismos.
¿Qué derechos tiene un trabajador con un contrato temporal?," Un trabajador con un contrato temporal tiene los derechos establecidos en la legislación específica sobre el trabajo, como la capacidad para contratar (Artículo 7), y tiene derecho a un contrato por escrito o de palabra (Artículo 8.1). Puede ser un contrato a tiempo parcial (Artículo 12.1) o tener una duración determinada en los supuestos en que se permita la utilización de esta modalidad de contratación. El contrato a tiempo parcial puede regirse por las mismas normas que un contrato a tiempo completo, como la jornada máxima legal (Artículo 12.1 y 12.2).","['Artículo 7.  Capacidad para contratar.\nPodrán contratar la prestación de su trabajo:\na) Quienes tengan plena capacidad de obrar conforme a lo dispuesto en el Código Civil.\nb) Los menores de dieciocho y mayores de dieciséis años, que vivan de forma \nindependiente, con consentimiento de sus padres o tutores, o con autorización de la persona \no institución que les tenga a su cargo.\nSi el representante legal de una persona de capacidad limitada la autoriza expresa o \ntácitamente para realizar un trabajo, queda esta también autorizada para ejercitar los \nderechos y cumplir los deberes que se derivan de su contrato y para su cesación.\nc) Los extranjeros, de acuerdo con lo dispuesto en la legislación específica sobre la \nmateria.\nArtículo 8.  Forma del contrato.\n1. El contrato de trabajo se podrá celebrar por escrito o de palabra. Se presumirá \nexistente entre todo el que presta un servicio por cuenta y dentro del ámbito de organización \ny dirección de otro y el que lo recibe a cambio de una retribución a aquel.'
 'contratos formativos en contratos por tiempo indefinido.\n7. Las empresas que pretendan suscribir contratos formativos, podrán solicitar por \nescrito al servicio público de empleo competente, información relativa a si las personas a las \nque pretenden contratar han estado previamente contratadas bajo dicha modalidad y la \nduración de estas contrataciones. Dicha información deberá ser trasladada a la \nrepresentación legal de las personas trabajadoras y tendrá valor liberatorio a efectos de no \nexceder la duración máxima de este contrato.\nArtículo 12.  Contrato a tiempo parcial y contrato de relevo.\n1. El contrato de trabajo se entenderá celebrado a tiempo parcial cuando se haya \nacordado la prestación de servicios durante un número de horas al día, a la semana, al mes \no al año, inferior a la jornada de trabajo de un trabajador a tiempo completo comparable.\nA efectos de lo dispuesto en el párrafo anterior, se entenderá por «trabajador a tiempo'
 'A efectos de lo dispuesto en el párrafo anterior, se entenderá por «trabajador a tiempo \ncompleto comparable» a un trabajador a tiempo completo de la misma empresa y centro de \ntrabajo, con el mismo tipo de contrato de trabajo y que realice un trabajo idéntico o similar. Si \nen la empresa no hubiera ningún trabajador comparable a tiempo completo, se considerará \nla jornada a tiempo completo prevista en el convenio colectivo de aplicación o, en su defecto, \nla jornada máxima legal.\n2. El contrato a tiempo parcial podrá concertarse por tiempo indefinido o por duración \ndeterminada en los supuestos en los que legalmente se permita la utilización de esta \nmodalidad de contratación.\n3. (Derogado)\n4. El contrato a tiempo parcial se regirá por las siguientes reglas:\na) El contrato, conforme a lo dispuesto en el artículo 8.2, se deberá formalizar \nnecesariamente por escrito. En el contrato deberá figurar el número de horas ordinarias de']","['Los trabajadores con contratos temporales y de duración determinada tendrán los mismos derechos que los trabajadores con contratos de duración indefinida, sin perjuicio de las particularidades específicas de cada una de las modalidades contractuales en materia de extinción del contrato y de aquellas expresamente previstas en la ley en relación con los contratos formativos. \nEl empresario deberá informar a los trabajadores de la empresa con contratos de duración determinada o temporales, incluidos los contratos formativos, sobre la existencia de puestos de trabajo vacantes, a fin de garantizarles las mismas oportunidades de acceder a puestos permanentes que los demás trabajadores.']","Los trabajadores con contratos temporales y de duración determinada tendrán los mismos derechos que los trabajadores con contratos de duración indefinida, sin perjuicio de las particularidades específicas de cada una de las modalidades contractuales en materia de extinción del contrato y de aquellas expresamente previstas en la ley en relación con los contratos formativos. Cuando corresponda en atención a su naturaleza, tales derechos serán reconocidos en las disposiciones legales y reglamentarias y en los convenios colectivos de manera proporcional, en función del tiempo trabajado.

Cuando un determinado derecho o condición de trabajo esté atribuido en las disposiciones legales o reglamentarias y en los convenios colectivos en función de una previa antigüedad del trabajador, esta deberá computarse según los mismos criterios para todos los trabajadores, cualquiera que sea su modalidad de contratación.
El empresario deberá informar a los trabajadores de la empresa con contratos de duración determinada o temporales, incluidos los contratos formativos, sobre la existencia de puestos de trabajo vacantes, a fin de garantizarles las mismas oportunidades de acceder a puestos permanentes que los demás trabajadores. Esta información podrá facilitarse mediante un anuncio público en un lugar adecuado de la empresa o centro de trabajo, o mediante otros medios previstos en la negociación colectiva, que aseguren la transmisión de la información."
¿Qué derechos tiene un trabajador con un contrato de duración determinada?," Un trabajador con un contrato de duración determinada (contrato por tiempo determinado) tiene derecho a que la empresa informe sobre su empleo previo en esa modalidad y la duración de esas contrataciones, para evitar exceder la duración máxima del contrato. Además, el contrato de trabajo se entenderá celebrado a tiempo parcial cuando se haya acordado la prestación de servicios durante un número de horas inferior al trabajo a tiempo completo comparable. El contrato a tiempo parcial puede ser por duración determinada si legalmente se permite la utilización de esta modalidad de contratación. Debe constar por escrito los contratos de trabajo en muchos casos, y de no observarse la exigencia de forma escrita, el contrato de trabajo se presumirá celebrado por tiempo indefinido y a jornada completa, salvo prueba en contrario que acredite su naturaleza temporal o el carácter a tiempo parcial de los servicios.","['contratos formativos en contratos por tiempo indefinido.\n7. Las empresas que pretendan suscribir contratos formativos, podrán solicitar por \nescrito al servicio público de empleo competente, información relativa a si las personas a las \nque pretenden contratar han estado previamente contratadas bajo dicha modalidad y la \nduración de estas contrataciones. Dicha información deberá ser trasladada a la \nrepresentación legal de las personas trabajadoras y tendrá valor liberatorio a efectos de no \nexceder la duración máxima de este contrato.\nArtículo 12.  Contrato a tiempo parcial y contrato de relevo.\n1. El contrato de trabajo se entenderá celebrado a tiempo parcial cuando se haya \nacordado la prestación de servicios durante un número de horas al día, a la semana, al mes \no al año, inferior a la jornada de trabajo de un trabajador a tiempo completo comparable.\nA efectos de lo dispuesto en el párrafo anterior, se entenderá por «trabajador a tiempo'
 'A efectos de lo dispuesto en el párrafo anterior, se entenderá por «trabajador a tiempo \ncompleto comparable» a un trabajador a tiempo completo de la misma empresa y centro de \ntrabajo, con el mismo tipo de contrato de trabajo y que realice un trabajo idéntico o similar. Si \nen la empresa no hubiera ningún trabajador comparable a tiempo completo, se considerará \nla jornada a tiempo completo prevista en el convenio colectivo de aplicación o, en su defecto, \nla jornada máxima legal.\n2. El contrato a tiempo parcial podrá concertarse por tiempo indefinido o por duración \ndeterminada en los supuestos en los que legalmente se permita la utilización de esta \nmodalidad de contratación.\n3. (Derogado)\n4. El contrato a tiempo parcial se regirá por las siguientes reglas:\na) El contrato, conforme a lo dispuesto en el artículo 8.2, se deberá formalizar \nnecesariamente por escrito. En el contrato deberá figurar el número de horas ordinarias de'
 'y dirección de otro y el que lo recibe a cambio de una retribución a aquel.\n2. Deberán constar por escrito los contratos de trabajo cuando así lo exija una \ndisposición legal y, en todo caso, los de prácticas y para la formación y el aprendizaje, los \ncontratos a tiempo parcial, fijos-discontinuos y de relevo y los contratos para la realización de \nuna obra o servicio determinado; también constarán por escrito los contratos por tiempo \ndeterminado cuya duración sea superior a cuatro semanas.\nDeberán constar igualmente por escrito los contratos de trabajo de los pescadores, de \nlos trabajadores que trabajen a distancia y de los trabajadores contratados en España al \nservicio de empresas españolas en el extranjero.\nDe no observarse la exigencia de forma escrita, el contrato de trabajo se presumirá \ncelebrado por tiempo indefinido y a jornada completa, salvo prueba en contrario que acredite \nsu naturaleza temporal o el carácter a tiempo parcial de los servicios.']","['Los trabajadores con contratos temporales y de duración determinada tendrán los mismos derechos que los trabajadores con contratos de duración indefinida, sin perjuicio de las particularidades específicas de cada una de las modalidades contractuales en materia de extinción del contrato y de aquellas expresamente previstas en la ley en relación con los contratos formativos. \nCuando un determinado derecho o condición de trabajo esté atribuido en las disposiciones legales o reglamentarias y en los convenios colectivos en función de una previa antigüedad del trabajador, esta deberá computarse según los mismos criterios para todos los trabajadores, cualquiera que sea su modalidad de contratación.']","Los trabajadores con contratos temporales y de duración determinada tendrán los mismos derechos que los trabajadores con contratos de duración indefinida, sin perjuicio de las particularidades específicas de cada una de las modalidades contractuales en materia de extinción del contrato y de aquellas expresamente previstas en la ley en relación con los contratos formativos. Cuando corresponda en atención a su naturaleza, tales derechos serán reconocidos en las disposiciones legales y reglamentarias y en los convenios colectivos de manera proporcional, en función del tiempo trabajado.

Cuando un determinado derecho o condición de trabajo esté atribuido en las disposiciones legales o reglamentarias y en los convenios colectivos en función de una previa antigüedad del trabajador, esta deberá computarse según los mismos criterios para todos los trabajadores, cualquiera que sea su modalidad de contratación.
El empresario deberá informar a los trabajadores de la empresa con contratos de duración determinada o temporales, incluidos los contratos formativos, sobre la existencia de puestos de trabajo vacantes, a fin de garantizarles las mismas oportunidades de acceder a puestos permanentes que los demás trabajadores. Esta información podrá facilitarse mediante un anuncio público en un lugar adecuado de la empresa o centro de trabajo, o mediante otros medios previstos en la negociación colectiva, que aseguren la transmisión de la información."
¿Qué características tiene un contrato fijo-discontinuo?," Un contrato fijo-discontinuo (o contrato a tiempo parcial) tiene las siguientes características:

1. El contrato puede ser celebrado por tiempo indefinido o determinado, en los supuestos legales que lo permitan.
2. Debe formalizarse por escrito y deberá especificar el número de horas ordinarias de trabajo.
3. También se pueden concertar contratos de sustitución para completar una jornada reducida, siempre que se justifique legalmente o esté regulado en el convenio colectivo y se especifique el nombre de la persona sustituida y la causa de la sustitución.
4. Los contratos formativos pueden ser celebrados bajo esta modalidad.
5. Las empresas pueden solicitar información del servicio público de empleo sobre si las personas a las que pretenden contratar han estado previamente contratadas bajo esta modalidad y la duración de estas contrataciones. Esta información tiene valor liberatorio para no exceder la duración máxima de este contrato.
6. El contrato se entiende celebrado a tiempo parcial cuando se acuerda la prestación de servicios durante un número de horas al día, a la semana, al mes o al año inferior a la jornada de trabajo de un trabajador a tiempo completo comparable.","['A efectos de lo dispuesto en el párrafo anterior, se entenderá por «trabajador a tiempo \ncompleto comparable» a un trabajador a tiempo completo de la misma empresa y centro de \ntrabajo, con el mismo tipo de contrato de trabajo y que realice un trabajo idéntico o similar. Si \nen la empresa no hubiera ningún trabajador comparable a tiempo completo, se considerará \nla jornada a tiempo completo prevista en el convenio colectivo de aplicación o, en su defecto, \nla jornada máxima legal.\n2. El contrato a tiempo parcial podrá concertarse por tiempo indefinido o por duración \ndeterminada en los supuestos en los que legalmente se permita la utilización de esta \nmodalidad de contratación.\n3. (Derogado)\n4. El contrato a tiempo parcial se regirá por las siguientes reglas:\na) El contrato, conforme a lo dispuesto en el artículo 8.2, se deberá formalizar \nnecesariamente por escrito. En el contrato deberá figurar el número de horas ordinarias de'
 'Asimismo, el contrato de sustitución podrá concertarse para completar la jornada \nreducida por otra persona trabajadora, cuando dicha reducción se ampare en causas \nlegalmente establecidas o reguladas en el convenio colectivo y se especifique en el contrato \nel nombre de la persona sustituida y la causa de la sustitución.\nEl contrato de sustitución podrá ser también celebrado para la cobertura temporal de un \npuesto de trabajo durante el proceso de selección o promoción para su cobertura definitiva \nmediante contrato fijo, sin que su duración pueda ser en este caso superior a tres meses, o \nel plazo inferior recogido en convenio colectivo, ni pueda celebrarse un nuevo contrato con el \nmismo objeto una vez superada dicha duración máxima.\n4. Las personas contratadas incumpliendo lo establecido en este artículo adquirirán la \ncondición de fijas.BOLETÍN OFICIAL DEL ESTADO\nLEGISLACIÓN CONSOLIDADA\nPágina 21'
 'contratos formativos en contratos por tiempo indefinido.\n7. Las empresas que pretendan suscribir contratos formativos, podrán solicitar por \nescrito al servicio público de empleo competente, información relativa a si las personas a las \nque pretenden contratar han estado previamente contratadas bajo dicha modalidad y la \nduración de estas contrataciones. Dicha información deberá ser trasladada a la \nrepresentación legal de las personas trabajadoras y tendrá valor liberatorio a efectos de no \nexceder la duración máxima de este contrato.\nArtículo 12.  Contrato a tiempo parcial y contrato de relevo.\n1. El contrato de trabajo se entenderá celebrado a tiempo parcial cuando se haya \nacordado la prestación de servicios durante un número de horas al día, a la semana, al mes \no al año, inferior a la jornada de trabajo de un trabajador a tiempo completo comparable.\nA efectos de lo dispuesto en el párrafo anterior, se entenderá por «trabajador a tiempo']","['1. El contrato por tiempo indefinido fijo-discontinuo se concertará para realizar trabajos que tengan el carácter de fijos-discontinuos y no se repitan en fechas ciertas, dentro del volumen normal de actividad de la empresa.\n\nA los supuestos de trabajos discontinuos que se repitan en fechas ciertas les será de aplicación la regulación del contrato a tiempo parcial celebrado por tiempo indefinido.\n\n2. Los trabajadores fijos-discontinuos serán llamados en el orden y la forma que se determine en los respectivos convenios colectivos, pudiendo el trabajador, en caso de incumplimiento, reclamar en procedimiento de despido ante la jurisdicción social, iniciándose el plazo para ello desde el momento en que tuviese conocimiento de la falta de convocatoria.\n\n3. Este contrato se deberá formalizar necesariamente por escrito en el modelo que se establezca y en él deberá figurar una indicación sobre la duración estimada de la actividad, así como sobre la forma y orden de llamamiento que establezca el convenio colectivo aplicable, haciendo constar igualmente, de manera orientativa, la jornada laboral estimada y su distribución horaria.\n\n4. Los convenios colectivos de ámbito sectorial podrán acordar, cuando las peculiaridades de la actividad del sector así lo justifiquen, la celebración a tiempo parcial de los contratos fijos-discontinuos, así como los requisitos y especialidades para la conversión de contratos temporales en contratos fijos-discontinuos.']","1. El contrato por tiempo indefinido fijo-discontinuo se concertará para realizar trabajos que tengan el carácter de fijos-discontinuos y no se repitan en fechas ciertas, dentro del volumen normal de actividad de la empresa.

A los supuestos de trabajos discontinuos que se repitan en fechas ciertas les será de aplicación la regulación del contrato a tiempo parcial celebrado por tiempo indefinido.

2. Los trabajadores fijos-discontinuos serán llamados en el orden y la forma que se determine en los respectivos convenios colectivos, pudiendo el trabajador, en caso de incumplimiento, reclamar en procedimiento de despido ante la jurisdicción social, iniciándose el plazo para ello desde el momento en que tuviese conocimiento de la falta de convocatoria.

3. Este contrato se deberá formalizar necesariamente por escrito en el modelo que se establezca y en él deberá figurar una indicación sobre la duración estimada de la actividad, así como sobre la forma y orden de llamamiento que establezca el convenio colectivo aplicable, haciendo constar igualmente, de manera orientativa, la jornada laboral estimada y su distribución horaria.

4. Los convenios colectivos de ámbito sectorial podrán acordar, cuando las peculiaridades de la actividad del sector así lo justifiquen, la celebración a tiempo parcial de los contratos fijos-discontinuos, así como los requisitos y especialidades para la conversión de contratos temporales en contratos fijos-discontinuos."
¿Es posible la discriminación en las relaciones laborales?," Si una empresa está obligada por ley a establecer planes de igualdad y puede establecer reservas y preferencias en las condiciones de contratación para ayudar a superar la segregación ocupacional por género, y si los acuerdos y convenios colectivos pueden establecer medidas en materias como clasificación profesional, promoción y formación para favorecer el acceso al grupo profesional o puesto de trabajo, sí es posible la discriminación en las relaciones laborales, pero solo con el objetivo de alcanzar la igualdad real y efectiva entre mujeres y hombres.","['2. Excepcionalmente, con el objetivo de alcanzar la igualdad real y efectiva entre mujeres \ny hombres coadyuvando a superar la segregación ocupacional por género, el límite del \napartado anterior podrá rebajarse hasta la edad ordinaria de jubilación fijada por la normativa \nde Seguridad Social cuando la tasa de ocupación de las mujeres trabajadoras por cuenta \najena afiliadas a la Seguridad Social en alguna de las actividades económicas \ncorrespondientes al ámbito funcional del convenio sea inferior al 20 por ciento de las \npersonas ocupadas en las mismas.\nLas actividades económicas que se tomarán como referencia para determinar el \ncumplimiento de esta condición estará definida por los códigos de la Clasificación Nacional \nde Actividades Económicas (CNAE) en vigor en cada momento, incluidos en el ámbito del \nconvenio aplicable según los datos facilitados al realizar su inscripción en el Registro y \ndepósito de convenios y acuerdos colectivos de trabajo y planes de igualdad (REGCON), de'
 'las profesiones. A tal efecto podrá establecer reservas y preferencias en las condiciones de \ncontratación de modo que, en igualdad de condiciones de idoneidad, tengan preferencia \npara ser contratadas las personas del sexo menos representado en el grupo profesional de \nque se trate.\nAsimismo, la negociación colectiva podrá establecer este tipo de medidas en las \ncondiciones de clasificación profesional, promoción y formación, de modo que, en igualdad \nde condiciones de idoneidad, tengan preferencia las personas del sexo menos representado \npara favorecer su acceso al grupo profesional o puesto de trabajo de que se trate.\n5. El establecimiento de planes de igualdad en las empresas se ajustará a lo dispuesto \nen esta ley y en la Ley Orgánica 3/2007, de 22 de marzo, para la igualdad efectiva de \nmujeres y hombres.\nArtículo 18.  Inviolabilidad de la persona del trabajador.\nSolo podrán realizarse registros sobre la persona del trabajador, en sus taquillas y'
 'trabajo a turnos.\nb) El horario y la distribución del tiempo de trabajo, el régimen de trabajo a turnos y la \nplanificación anual de las vacaciones.\nc) La adaptación al ámbito de la empresa del sistema de clasificación profesional de las \npersonas trabajadoras.\nd) La adaptación de los aspectos de las modalidades de contratación que se atribuyen \npor esta ley a los convenios de empresa.\ne) Las medidas para favorecer la corresponsabilidad y la conciliación entre la vida \nlaboral, familiar y personal.\nf) Aquellas otras que dispongan los acuerdos y convenios colectivos a que se refiere el \nartículo 83.2.\nIgual prioridad aplicativa tendrán en estas materias los convenios colectivos para un \ngrupo de empresas o una pluralidad de empresas vinculadas por razones organizativas o \nproductivas y nominativamente identificadas a que se refiere el artículo 87.1.\nLos acuerdos y convenios colectivos a que se refiere el artículo 83.2 no podrán disponer \nde la prioridad aplicativa prevista en este apartado.']","['Se entenderán nulos y sin efecto los preceptos reglamentarios, las cláusulas de los convenios colectivos, los pactos individuales y las decisiones unilaterales del empresario que den lugar en el empleo, así como en materia de retribuciones, jornada y demás condiciones de trabajo, a situaciones de discriminación directa o indirecta \n\nSerán igualmente nulas las órdenes de discriminar y las decisiones del empresario que supongan un trato desfavorable de los trabajadores como reacción ante una reclamación efectuada en la empresa o ante una acción administrativa o judicial destinada a exigir el cumplimiento del principio de igualdad de trato y no discriminación.                                                                     \nEl empresario está obligado a pagar por la prestación de un trabajo de igual valor la misma retribución, satisfecha directa o indirectamente, y cualquiera que sea la naturaleza de la misma, salarial o extrasalarial, sin que pueda producirse discriminación alguna por razón de sexo en ninguno de los elementos o condiciones de aquella.']","Se entenderán nulos y sin efecto los preceptos reglamentarios, las cláusulas de los convenios colectivos, los pactos individuales y las decisiones unilaterales del empresario que den lugar en el empleo, así como en materia de retribuciones, jornada y demás condiciones de trabajo, a situaciones de discriminación directa o indirecta desfavorables por razón de edad o discapacidad o a situaciones de discriminación directa o indirecta por razón de sexo, origen, incluido el racial o étnico, estado civil, condición social, religión o convicciones, ideas políticas, orientación o condición sexual, adhesión o no a sindicatos y a sus acuerdos, vínculos de parentesco con personas pertenecientes a o relacionadas con la empresa y lengua dentro del Estado español.

Serán igualmente nulas las órdenes de discriminar y las decisiones del empresario que supongan un trato desfavorable de los trabajadores como reacción ante una reclamación efectuada en la empresa o ante una acción administrativa o judicial destinada a exigir el cumplimiento del principio de igualdad de trato y no discriminación.                                                                     
El empresario está obligado a pagar por la prestación de un trabajo de igual valor la misma retribución, satisfecha directa o indirectamente, y cualquiera que sea la naturaleza de la misma, salarial o extrasalarial, sin que pueda producirse discriminación alguna por razón de sexo en ninguno de los elementos o condiciones de aquella."
¿Es posible la discriminación en las relaciones laborales?," Sí, es posible la discriminación laboral en ciertas circunstancias pero con fines específicos para promover la igualdad de género y superar la segregación ocupacional. Se permite establecer reservas y preferencias en las condiciones de contratación, clasificación profesional, promoción y formación siempre que sean en igualdad de condiciones de idoneidad, con preferencia para personas del sexo menos representado en el grupo profesional o puesto de trabajo. La ley regula también la inviolabilidad de la persona del trabajador, la adaptación al ámbito de la empresa del sistema de clasificación profesional y las medidas para favorecer la conciliación entre vida laboral, familiar y personal. Estas disposiciones se ajustan a la Ley Orgánica 3/2007, de Igualdad Efectiva de Mujeres y Hombres.","['2. Excepcionalmente, con el objetivo de alcanzar la igualdad real y efectiva entre mujeres \ny hombres coadyuvando a superar la segregación ocupacional por género, el límite del \napartado anterior podrá rebajarse hasta la edad ordinaria de jubilación fijada por la normativa \nde Seguridad Social cuando la tasa de ocupación de las mujeres trabajadoras por cuenta \najena afiliadas a la Seguridad Social en alguna de las actividades económicas \ncorrespondientes al ámbito funcional del convenio sea inferior al 20 por ciento de las \npersonas ocupadas en las mismas.\nLas actividades económicas que se tomarán como referencia para determinar el \ncumplimiento de esta condición estará definida por los códigos de la Clasificación Nacional \nde Actividades Económicas (CNAE) en vigor en cada momento, incluidos en el ámbito del \nconvenio aplicable según los datos facilitados al realizar su inscripción en el Registro y \ndepósito de convenios y acuerdos colectivos de trabajo y planes de igualdad (REGCON), de'
 'las profesiones. A tal efecto podrá establecer reservas y preferencias en las condiciones de \ncontratación de modo que, en igualdad de condiciones de idoneidad, tengan preferencia \npara ser contratadas las personas del sexo menos representado en el grupo profesional de \nque se trate.\nAsimismo, la negociación colectiva podrá establecer este tipo de medidas en las \ncondiciones de clasificación profesional, promoción y formación, de modo que, en igualdad \nde condiciones de idoneidad, tengan preferencia las personas del sexo menos representado \npara favorecer su acceso al grupo profesional o puesto de trabajo de que se trate.\n5. El establecimiento de planes de igualdad en las empresas se ajustará a lo dispuesto \nen esta ley y en la Ley Orgánica 3/2007, de 22 de marzo, para la igualdad efectiva de \nmujeres y hombres.\nArtículo 18.  Inviolabilidad de la persona del trabajador.\nSolo podrán realizarse registros sobre la persona del trabajador, en sus taquillas y'
 'trabajo a turnos.\nb) El horario y la distribución del tiempo de trabajo, el régimen de trabajo a turnos y la \nplanificación anual de las vacaciones.\nc) La adaptación al ámbito de la empresa del sistema de clasificación profesional de las \npersonas trabajadoras.\nd) La adaptación de los aspectos de las modalidades de contratación que se atribuyen \npor esta ley a los convenios de empresa.\ne) Las medidas para favorecer la corresponsabilidad y la conciliación entre la vida \nlaboral, familiar y personal.\nf) Aquellas otras que dispongan los acuerdos y convenios colectivos a que se refiere el \nartículo 83.2.\nIgual prioridad aplicativa tendrán en estas materias los convenios colectivos para un \ngrupo de empresas o una pluralidad de empresas vinculadas por razones organizativas o \nproductivas y nominativamente identificadas a que se refiere el artículo 87.1.\nLos acuerdos y convenios colectivos a que se refiere el artículo 83.2 no podrán disponer \nde la prioridad aplicativa prevista en este apartado.']","['Se entenderán nulos y sin efecto los preceptos reglamentarios, las cláusulas de los convenios colectivos, los pactos individuales y las decisiones unilaterales del empresario que den lugar en el empleo, así como en materia de retribuciones, jornada y demás condiciones de trabajo, a situaciones de discriminación directa o indirecta \n\nSerán igualmente nulas las órdenes de discriminar y las decisiones del empresario que supongan un trato desfavorable de los trabajadores como reacción ante una reclamación efectuada en la empresa o ante una acción administrativa o judicial destinada a exigir el cumplimiento del principio de igualdad de trato y no discriminación.                                                                     \nEl empresario está obligado a pagar por la prestación de un trabajo de igual valor la misma retribución, satisfecha directa o indirectamente, y cualquiera que sea la naturaleza de la misma, salarial o extrasalarial, sin que pueda producirse discriminación alguna por razón de sexo en ninguno de los elementos o condiciones de aquella.']","Se entenderán nulos y sin efecto los preceptos reglamentarios, las cláusulas de los convenios colectivos, los pactos individuales y las decisiones unilaterales del empresario que den lugar en el empleo, así como en materia de retribuciones, jornada y demás condiciones de trabajo, a situaciones de discriminación directa o indirecta desfavorables por razón de edad o discapacidad o a situaciones de discriminación directa o indirecta por razón de sexo, origen, incluido el racial o étnico, estado civil, condición social, religión o convicciones, ideas políticas, orientación o condición sexual, adhesión o no a sindicatos y a sus acuerdos, vínculos de parentesco con personas pertenecientes a o relacionadas con la empresa y lengua dentro del Estado español.

Serán igualmente nulas las órdenes de discriminar y las decisiones del empresario que supongan un trato desfavorable de los trabajadores como reacción ante una reclamación efectuada en la empresa o ante una acción administrativa o judicial destinada a exigir el cumplimiento del principio de igualdad de trato y no discriminación.                                                                     
El empresario está obligado a pagar por la prestación de un trabajo de igual valor la misma retribución, satisfecha directa o indirectamente, y cualquiera que sea la naturaleza de la misma, salarial o extrasalarial, sin que pueda producirse discriminación alguna por razón de sexo en ninguno de los elementos o condiciones de aquella."
¿Es posible realizar registros sobre el trabajador?," Sí, es posible realizar registros sobre el trabajador, incluyendo su empleo, producción y ventas. El empleador también debe informar a la empresa o sus delegados sobre las previsiones de celebración de nuevos contratos, incluido el número de estos y los modales utilizados, así como sobre las horas complementarias y la subcontratación. Además, se pueden establecer registros sobre la promoción económica del trabajador en función del trabajo desarrollado.","['podrá efectuarlo el empresario en moneda de curso legal o mediante cheque u otra \nmodalidad de pago similar a través de entidades de crédito, previo informe al comité de \nempresa o delegados de personal.\nArtículo 30.  Imposibilidad de la prestación.\nSi el trabajador no pudiera prestar sus servicios una vez vigente el contrato porque el \nempresario se retrasare en darle trabajo por impedimentos imputables al mismo y no al \ntrabajador, este conservará el derecho a su salario, sin que pueda hacérsele compensar el \nque perdió con otro trabajo realizado en otro tiempo.BOLETÍN OFICIAL DEL ESTADO\nLEGISLACIÓN CONSOLIDADA\nPágina 29'
 'el empleo, así como sobre la producción y ventas, incluido el programa de producción.\nc) Sobre las previsiones del empresario de celebración de nuevos contratos, con \nindicación del número de estos y de las modalidades y tipos que serán utilizados, incluidos \nlos contratos a tiempo parcial, la realización de horas complementarias por los trabajadores \ncontratados a tiempo parcial y de los supuestos de subcontratación.BOLETÍN OFICIAL DEL ESTADO\nLEGISLACIÓN CONSOLIDADA\nPágina 66'
 'como indirecta, entre mujeres y hombres, pudiendo establecerse medidas de acción positiva \ndirigidas a eliminar o compensar situaciones de discriminación.\nArtículo 25.  Promoción económica.\n1. El trabajador, en función del trabajo desarrollado, podrá tener derecho a una \npromoción económica en los términos fijados en convenio colectivo o contrato individual.\n2. Lo dispuesto en el apartado anterior se entiende sin perjuicio de los derechos \nadquiridos o en curso de adquisición en el tramo temporal correspondiente.BOLETÍN OFICIAL DEL ESTADO\nLEGISLACIÓN CONSOLIDADA\nPágina 27']","['Solo podrán realizarse registros sobre la persona del trabajador, en sus taquillas y efectos particulares, cuando sean necesarios para la protección del patrimonio empresarial y del de los demás trabajadores de la empresa, dentro del centro de trabajo y en horas de trabajo.']","Solo podrán realizarse registros sobre la persona del trabajador, en sus taquillas y efectos particulares, cuando sean necesarios para la protección del patrimonio empresarial y del de los demás trabajadores de la empresa, dentro del centro de trabajo y en horas de trabajo. En su realización se respetará al máximo la dignidad e intimidad del trabajador y se contará con la asistencia de un representante legal de los trabajadores o, en su ausencia del centro de trabajo, de otro trabajador de la empresa, siempre que ello fuera posible."
¿Qué derechos y obligaciones tiene un trabajador en materia de seguridad y salud en el trabajo?," El trabajador tiene derecho a una protección eficaz en materia de seguridad y salud en el trabajo (Artículo 19.1). Tiene la obligación de observar las medidas legales y reglamentarias de seguridad y salud en el trabajo (Artículo 19.2). El empresario puede adoptar medidas de vigilancia y control para verificar el cumplimiento por el trabajador de sus obligaciones laborales, manteniendo en cuenta la dignidad y la intimidad del trabajador (Artículo no especificado). Además, el empresario solo puede realizar registros sobre la persona del trabajador cuando sea necesario para proteger el patrimonio empresarial y el de los demás trabajadores de la empresa. En su realización se respetará al máximo la dignidad e intimidad del trabajador (Artículo no especificado).","['1.º De vigilancia en el cumplimiento de las normas vigentes en materia laboral, de \nseguridad social y de empleo, así como del resto de los pactos, condiciones y usos de \nempresa en vigor, formulando, en su caso, las acciones legales oportunas ante el \nempresario y los organismos o tribunales competentes.\n2.º De vigilancia y control de las condiciones de seguridad y salud en el desarrollo del \ntrabajo en la empresa, con las particularidades previstas en este orden por el artículo 19.\n3.º De vigilancia del respeto y aplicación del principio de igualdad de trato y de \noportunidades entre mujeres y hombres, especialmente en materia salarial.\nb) Participar, como se determine por convenio colectivo, en la gestión de obras sociales \nestablecidas en la empresa en beneficio de los trabajadores o de sus familiares.\nc) Colaborar con la dirección de la empresa para conseguir el establecimiento de \ncuantas medidas procuren el mantenimiento y el incremento de la productividad, así como la'
 '2. En el cumplimiento de la obligación de trabajar asumida en el contrato, el trabajador \ndebe al empresario la diligencia y la colaboración en el trabajo que marquen las \ndisposiciones legales, los convenios colectivos y las órdenes o instrucciones adoptadas por \naquel en el ejercicio regular de sus facultades de dirección y, en su defecto, por los usos y \ncostumbres. En cualquier caso, el trabajador y el empresario se someterán en sus \nprestaciones recíprocas a las exigencias de la buena fe.\n3. El empresario podrá adoptar las medidas que estime más oportunas de vigilancia y \ncontrol para verificar el cumplimiento por el trabajador de sus obligaciones y deberes \nlaborales, guardando en su adopción y aplicación la consideración debida a su dignidad y \nteniendo en cuenta, en su caso, la capacidad real de los trabajadores con discapacidad.\n4. El empresario podrá verificar el estado de salud del trabajador que sea alegado por'
 'Solo podrán realizarse registros sobre la persona del trabajador, en sus taquillas y \nefectos particulares, cuando sean necesarios para la protección del patrimonio empresarial y \ndel de los demás trabajadores de la empresa, dentro del centro de trabajo y en horas de \ntrabajo. En su realización se respetará al máximo la dignidad e intimidad del trabajador y se \ncontará con la asistencia de un representante legal de los trabajadores o, en su ausencia del \ncentro de trabajo, de otro trabajador de la empresa, siempre que ello fuera posible.\nArtículo 19.  Seguridad y salud en el trabajo.\n1. El trabajador, en la prestación de sus servicios, tendrá derecho a una protección eficaz \nen materia de seguridad y salud en el trabajo.\n2. El trabajador está obligado a observar en su trabajo las medidas legales y \nreglamentarias de seguridad y salud en el trabajo.\n3. En la inspección y control de dichas medidas que sean de observancia obligada por el']","['1. El trabajador, en la prestación de sus servicios, tendrá derecho a una protección eficaz en materia de seguridad y salud en el trabajo.\n\n2. El trabajador está obligado a observar en su trabajo las medidas legales y reglamentarias de seguridad y salud en el trabajo.\n\n3. En la inspección y control de dichas medidas que sean de observancia obligada por el empresario, el trabajador tiene derecho a participar por medio de sus representantes legales en el centro de trabajo, si no se cuenta con órganos o centros especializados competentes en la materia a tenor de la legislación vigente.']","1. El trabajador, en la prestación de sus servicios, tendrá derecho a una protección eficaz en materia de seguridad y salud en el trabajo.

2. El trabajador está obligado a observar en su trabajo las medidas legales y reglamentarias de seguridad y salud en el trabajo.

3. En la inspección y control de dichas medidas que sean de observancia obligada por el empresario, el trabajador tiene derecho a participar por medio de sus representantes legales en el centro de trabajo, si no se cuenta con órganos o centros especializados competentes en la materia a tenor de la legislación vigente."
¿Es obligatorio realizar formación acerca de Prevención de Riesgos Laborales?,"¡Sí, es obligatorio realizar formación acerca de Prevención de Riesgos Laborales para todos los trabajadores. El empleador tiene que garantizar que cada trabajador reciba una formación teórica y práctica adecuada en materia preventiva tanto al momento de su contratación como cuando se produzcan cambios en las funciones que desempeñe o se introduzcan nuevas tecnologías o cambios en los equipos de trabajo. Los trabajadores están obligados a seguir la formación y realizar las prácticas. Todo ello en los términos señalados en la Ley 31/1995, de 8 de noviembre, de Prevención de Riesgos Laborales, y en sus normas de desarrollo, en cuanto les sean de aplicación.","['3. En la inspección y control de dichas medidas que sean de observancia obligada por el \nempresario, el trabajador tiene derecho a participar por medio de sus representantes legales \nen el centro de trabajo, si no se cuenta con órganos o centros especializados competentes \nen la materia a tenor de la legislación vigente.\n4. El empresario está obligado a garantizar que cada trabajador reciba una formación \nteórica y práctica, suficiente y adecuada, en materia preventiva tanto en el momento de su \ncontratación, cualquiera que sea la modalidad o duración de esta, como cuando se \nproduzcan cambios en las funciones que desempeñe o se introduzcan nuevas tecnologías o \ncambios en los equipos de trabajo. El trabajador está obligado a seguir la formación y a \nrealizar las prácticas. Todo ello en los términos señalados en la Ley 31/1995, de 8 de \nnoviembre, de Prevención de Riesgos Laborales, y en sus normas de desarrollo, en cuanto \nles sean de aplicación.'
 'Sección 3.ª Elementos y eficacia del contrato de trabajo\nArtículo 6.  Trabajo de los menores.\n1. Se prohíbe la admisión al trabajo a los menores de dieciséis años.\n2. Los trabajadores menores de dieciocho años no podrán realizar trabajos nocturnos ni \naquellas actividades o puestos de trabajo respecto a los que se establezcan limitaciones a \nsu contratación conforme a lo dispuesto en la Ley 31/1995, de 8 de noviembre, de \nPrevención de Riesgos Laborales, y en las normas reglamentarias aplicables.\n3. Se prohíbe realizar horas extraordinarias a los menores de dieciocho años.\n4. La intervención de los menores de dieciséis años en espectáculos públicos solo se \nautorizará en casos excepcionales por la autoridad laboral, siempre que no suponga peligro \npara su salud ni para su formación profesional y humana. El permiso deberá constar por \nescrito y para actos determinados.\nArtículo 7.  Capacidad para contratar.\nPodrán contratar la prestación de su trabajo:'
 'primera del texto refundido de la Ley General de la Seguridad Social, y tendrán la \nconsideración de colectivo prioritario para el acceso a las iniciativas de formación del sistema \nde formación profesional para el empleo en el ámbito laboral.\nc) La Inspección de Trabajo y Seguridad Social y el Servicio Público de Empleo Estatal \ncolaborarán para el desarrollo de actuaciones efectivas de control de la aplicación del \nMecanismo, mediante la programación de actuaciones periódicas y de ejecución continuada.BOLETÍN OFICIAL DEL ESTADO\nLEGISLACIÓN CONSOLIDADA\nPágina 53']","['El empresario está obligado a garantizar que cada trabajador reciba una formación teórica y práctica, suficiente y adecuada, en materia preventiva tanto en el momento de su contratación, cualquiera que sea la modalidad o duración de esta, como cuando se produzcan cambios en las funciones que desempeñe o se introduzcan nuevas tecnologías o cambios en los equipos de trabajo.']","El empresario está obligado a garantizar que cada trabajador reciba una formación teórica y práctica, suficiente y adecuada, en materia preventiva tanto en el momento de su contratación, cualquiera que sea la modalidad o duración de esta, como cuando se produzcan cambios en las funciones que desempeñe o se introduzcan nuevas tecnologías o cambios en los equipos de trabajo. El trabajador está obligado a seguir la formación y a realizar las prácticas. Todo ello en los términos señalados en la Ley 31/1995, de 8 de noviembre, de Prevención de Riesgos Laborales, y en sus normas de desarrollo, en cuanto les sean de aplicación."
¿Cuál es la obligación de los delegados de prevención o representantes legales de los trabajadores en materia de seguridad y salud en el trabajo?," Los delegados o representantes legales de los trabajadores tienen la obligación de vigilar el cumplimiento de las normas laborales en seguridad y salud, controlar las condiciones de trabajo, colaborar en la gestión de obras sociales, participar en la creación de medidas que mejoran la productividad y sostenibilidad ambiental, cooperar en el establecimiento de medidas de conciliación, informar a sus representados sobre temas relevantes en las relaciones laborales, y participar en la inspección y control de las medidas obligatorias para el empleador. También tienen derecho a participar en la inspección y control de tales medidas cuando no existan órganos competentes en la materia según la legislación vigente. El trabajador tiene derecho a recibir una formación teórica y práctica adecuada en materia preventiva tanto al momento del contrato como cuando se produzcan cambios en las funciones o se introduzcan nuevas tecnologías o equipos de trabajo, en cumplimiento con la Ley 31/1995, de Prevención de Riesgos Laborales.","['1.º De vigilancia en el cumplimiento de las normas vigentes en materia laboral, de \nseguridad social y de empleo, así como del resto de los pactos, condiciones y usos de \nempresa en vigor, formulando, en su caso, las acciones legales oportunas ante el \nempresario y los organismos o tribunales competentes.\n2.º De vigilancia y control de las condiciones de seguridad y salud en el desarrollo del \ntrabajo en la empresa, con las particularidades previstas en este orden por el artículo 19.\n3.º De vigilancia del respeto y aplicación del principio de igualdad de trato y de \noportunidades entre mujeres y hombres, especialmente en materia salarial.\nb) Participar, como se determine por convenio colectivo, en la gestión de obras sociales \nestablecidas en la empresa en beneficio de los trabajadores o de sus familiares.\nc) Colaborar con la dirección de la empresa para conseguir el establecimiento de \ncuantas medidas procuren el mantenimiento y el incremento de la productividad, así como la'
 'cuantas medidas procuren el mantenimiento y el incremento de la productividad, así como la \nsostenibilidad ambiental de la empresa, si así está pactado en los convenios colectivos.\nd) Colaborar con la dirección de la empresa en el establecimiento y puesta en marcha de \nmedidas de conciliación.\ne) Informar a sus representados en todos los temas y cuestiones señalados en este \nartículo en cuanto directa o indirectamente tengan o puedan tener repercusión en las \nrelaciones laborales.\n8. Lo dispuesto en el presente artículo se entenderá sin perjuicio de las disposiciones \nespecíficas previstas en otros artículos de esta ley o en otras normas legales o \nreglamentarias.\n9. Respetando lo establecido legal o reglamentariamente, en los convenios colectivos se \npodrán establecer disposiciones específicas relativas al contenido y a las modalidades de \nejercicio de los derechos de información y consulta previstos en este artículo, así como al \nnivel de representación más adecuado para ejercerlos.'
 '3. En la inspección y control de dichas medidas que sean de observancia obligada por el \nempresario, el trabajador tiene derecho a participar por medio de sus representantes legales \nen el centro de trabajo, si no se cuenta con órganos o centros especializados competentes \nen la materia a tenor de la legislación vigente.\n4. El empresario está obligado a garantizar que cada trabajador reciba una formación \nteórica y práctica, suficiente y adecuada, en materia preventiva tanto en el momento de su \ncontratación, cualquiera que sea la modalidad o duración de esta, como cuando se \nproduzcan cambios en las funciones que desempeñe o se introduzcan nuevas tecnologías o \ncambios en los equipos de trabajo. El trabajador está obligado a seguir la formación y a \nrealizar las prácticas. Todo ello en los términos señalados en la Ley 31/1995, de 8 de \nnoviembre, de Prevención de Riesgos Laborales, y en sus normas de desarrollo, en cuanto \nles sean de aplicación.']","['Los delegados de prevención y, en su defecto, los representantes legales de los trabajadores en el centro de trabajo, que aprecien una probabilidad seria y grave de accidente por la inobservancia de la legislación aplicable en la materia, requerirán al empresario por escrito para que adopte las medidas oportunas que hagan desaparecer el estado de riesgo; si la petición no fuese atendida en un plazo de cuatro días, se dirigirán a la autoridad competente; \n\nSi el riesgo de accidente fuera inminente, la paralización de las actividades podrá ser acordada por los representantes de los trabajadores, por mayoría de sus miembros. \nEl acuerdo será comunicado de inmediato a la empresa y a la autoridad laboral, la cual, en veinticuatro horas, anulará o ratificará la paralización acordada.']","Los delegados de prevención y, en su defecto, los representantes legales de los trabajadores en el centro de trabajo, que aprecien una probabilidad seria y grave de accidente por la inobservancia de la legislación aplicable en la materia, requerirán al empresario por escrito para que adopte las medidas oportunas que hagan desaparecer el estado de riesgo; si la petición no fuese atendida en un plazo de cuatro días, se dirigirán a la autoridad competente; esta, si apreciase las circunstancias alegadas, mediante resolución fundada, requerirá al empresario para que adopte las medidas de seguridad apropiadas o que suspenda sus actividades en la zona o local de trabajo o con el material en peligro. También podrá ordenar, con los informes técnicos precisos, la paralización inmediata del trabajo si se estima un riesgo grave de accidente.

Si el riesgo de accidente fuera inminente, la paralización de las actividades podrá ser acordada por los representantes de los trabajadores, por mayoría de sus miembros. Tal acuerdo podrá ser adoptado por decisión mayoritaria de los delegados de prevención cuando no resulte posible reunir con la urgencia requerida al órgano de representación del personal. El acuerdo será comunicado de inmediato a la empresa y a la autoridad laboral, la cual, en veinticuatro horas, anulará o ratificará la paralización acordada."
¿Cuáles son los poderes de dirección y control del empresario en la actividad laboral?," Los poderes del empresario en la actividad laboral incluyen dirigir y controlar a sus trabajadores, cumpliendo con las reglas de buena fe y diligencia. La dirección implica establecer objetivos, planear cómo alcanzarlos, asignar tareas y coordinar esfuerzos para que se realicen correctamente. El control consiste en asegurarse de que los trabajadores cumplen con sus responsabilidades en el plazo establecido y que se adherezca al plan de dirección. Sin embargo, las restricciones legales deben ser respetadas, como la prohibición de cesión ilegal de trabajadores y las obligaciones colectivas establecidas por los convenios colectivos en su ámbito correspondiente. Los trabajadores tienen derecho a cumplir con sus obligaciones básicas como cumplir con las reglas del buen trabajo, observar medidas de prevención de riesgos laborales y contribuir a la mejora de la productividad.","['2. En todo caso, se entiende que se incurre en la cesión ilegal de trabajadores \ncontemplada en este artículo cuando se produzca alguna de las siguientes circunstancias: \nque el objeto de los contratos de servicios entre las empresas se limite a una mera puesta a \ndisposición de los trabajadores de la empresa cedente a la empresa cesionaria, o que la \nempresa cedente carezca de una actividad o de una organización propia y estable, o no \ncuente con los medios necesarios para el desarrollo de su actividad, o no ejerza las \nfunciones inherentes a su condición de empresario.\n3. Los empresarios, cedente y cesionario, que infrinjan lo señalado en los apartados \nanteriores responderán solidariamente de las obligaciones contraídas con los trabajadores y \ncon la Seguridad Social, sin perjuicio de las demás responsabilidades, incluso penales, que \nprocedan por dichos actos.\n4. Los trabajadores sometidos al tráfico prohibido tendrán derecho a adquirir la condición'
 'adecuado en el que puedan desarrollar sus actividades y comunicarse con los trabajadores, \nasí como uno o varios tablones de anuncios. La representación legal de los trabajadores de \nlas empresas contratistas y subcontratistas que compartan de forma continuada centro de \ntrabajo podrán hacer uso de dichos locales en los términos que acuerden con la empresa. \nLas posibles discrepancias se resolverán por la autoridad laboral, previo informe de la \nInspección de Trabajo y Seguridad Social.\nTÍTULO III\nDe la negociación colectiva y de los convenios colectivos\nCAPÍTULO I\nDisposiciones generales\nSección 1.ª Naturaleza y efectos de los convenios\nArtículo 82.  Concepto y eficacia.\n1. Los convenios colectivos, como resultado de la negociación desarrollada por los \nrepresentantes de los trabajadores y de los empresarios, constituyen la expresión del \nacuerdo libremente adoptado por ellos en virtud de su autonomía colectiva.\n2. Mediante los convenios colectivos, y en su ámbito correspondiente, los trabajadores y'
 'g) Al ejercicio individual de las acciones derivadas de su contrato de trabajo.\nh) A cuantos otros se deriven específicamente del contrato de trabajo.\nArtículo 5.  Deberes laborales.\nLos trabajadores tienen como deberes básicos:\na) Cumplir con las obligaciones concretas de su puesto de trabajo, de conformidad con \nlas reglas de la buena fe y diligencia.\nb) Observar las medidas de prevención de riesgos laborales que se adopten.\nc) Cumplir las órdenes e instrucciones del empresario en el ejercicio regular de sus \nfacultades directivas.\nd) No concurrir con la actividad de la empresa, en los términos fijados en esta ley.\ne) Contribuir a la mejora de la productividad.\nf) Cuantos se deriven, en su caso, de los respectivos contratos de trabajo.BOLETÍN OFICIAL DEL ESTADO\nLEGISLACIÓN CONSOLIDADA\nPágina 11']","['1. El trabajador estará obligado a realizar el trabajo convenido bajo la dirección del empresario o persona en quien este delegue.\n\n el trabajador debe al empresario la diligencia y la colaboración en el trabajo que marquen las disposiciones legales, los convenios colectivos y las órdenes o instrucciones adoptadas por aquel en el ejercicio regular de sus facultades de dirección y, en su defecto, por los usos y costumbres. \n3. El empresario podrá adoptar las medidas que estime más oportunas de vigilancia y control para verificar el cumplimiento por el trabajador de sus obligaciones y deberes laborales, \n4. El empresario podrá verificar el estado de salud del trabajador que sea alegado por este para justificar sus faltas de asistencia al trabajo, mediante reconocimiento a cargo de personal médico. La negativa del trabajador a dichos reconocimientos podrá determinar la suspensión de los derechos económicos que pudieran existir a cargo del empresario por dichas situaciones.']","1. El trabajador estará obligado a realizar el trabajo convenido bajo la dirección del empresario o persona en quien este delegue.

2. En el cumplimiento de la obligación de trabajar asumida en el contrato, el trabajador debe al empresario la diligencia y la colaboración en el trabajo que marquen las disposiciones legales, los convenios colectivos y las órdenes o instrucciones adoptadas por aquel en el ejercicio regular de sus facultades de dirección y, en su defecto, por los usos y costumbres. En cualquier caso, el trabajador y el empresario se someterán en sus prestaciones recíprocas a las exigencias de la buena fe.

3. El empresario podrá adoptar las medidas que estime más oportunas de vigilancia y control para verificar el cumplimiento por el trabajador de sus obligaciones y deberes laborales, guardando en su adopción y aplicación la consideración debida a su dignidad y teniendo en cuenta, en su caso, la capacidad real de los trabajadores con discapacidad.

4. El empresario podrá verificar el estado de salud del trabajador que sea alegado por este para justificar sus faltas de asistencia al trabajo, mediante reconocimiento a cargo de personal médico. La negativa del trabajador a dichos reconocimientos podrá determinar la suspensión de los derechos económicos que pudieran existir a cargo del empresario por dichas situaciones."
¿Puede el trabajador tener una prestación laboral para diferentes empresarios?," Sí, un trabajador puede tener una prestación laboral para diferentes empresarios, pero solo si se trata de contratos de formación en alternancia. Este tipo de contrato permite que el empleado combine su educación y la realización de una actividad laboral. Por otra parte, el empleador tiene derechos y obligaciones respecto al grupo de trabajadores en caso de haberse celebrado un contrato con ellos como tal.","['2. Si el empresario hubiese celebrado un contrato con un grupo de trabajadores \nconsiderado en su totalidad, no tendrá frente a cada uno de sus miembros los derechos y \ndeberes que como tal le competen. El jefe del grupo ostentará la representación de los que \nlo integren, respondiendo de las obligaciones inherentes a dicha representación.\n3. Si el trabajador, conforme a lo pactado por escrito, asociare a su trabajo un auxiliar o \nayudante, el empresario de aquel lo será también de este.\nArtículo 11.  Contrato formativo.\n1. El contrato formativo tendrá por objeto la formación en alternancia con el trabajo \nretribuido por cuenta ajena en los términos establecidos en el apartado 2, o el desempeño de \nuna actividad laboral destinada a adquirir una práctica profesional adecuada a los \ncorrespondientes niveles de estudios, en los términos establecidos en el apartado 3.\n2. El contrato de formación en alternancia, que tendrá por objeto compatibilizar la'
 'podrá efectuarlo el empresario en moneda de curso legal o mediante cheque u otra \nmodalidad de pago similar a través de entidades de crédito, previo informe al comité de \nempresa o delegados de personal.\nArtículo 30.  Imposibilidad de la prestación.\nSi el trabajador no pudiera prestar sus servicios una vez vigente el contrato porque el \nempresario se retrasare en darle trabajo por impedimentos imputables al mismo y no al \ntrabajador, este conservará el derecho a su salario, sin que pueda hacérsele compensar el \nque perdió con otro trabajo realizado en otro tiempo.BOLETÍN OFICIAL DEL ESTADO\nLEGISLACIÓN CONSOLIDADA\nPágina 29'
 'treinta años.\nc) La actividad desempeñada por la persona trabajadora en la empresa deberá estar \ndirectamente relacionada con las actividades formativas que justifican la contratación laboral, \ncoordinándose e integrándose en un programa de formación común, elaborado en el marco \nde los acuerdos y convenios de cooperación suscritos por las autoridades laborales o \neducativas de formación profesional o Universidades con empresas y entidades \ncolaboradoras.\nd) La persona contratada contará con una persona tutora designada por el centro o \nentidad de formación y otra designada por la empresa. Esta última, que deberá contar con la \nformación o experiencia adecuadas para tales tareas, tendrá como función dar seguimiento \nal plan formativo individual en la empresa, según lo previsto en el acuerdo de cooperación \nconcertado con el centro o entidad formativa. Dicho centro o entidad deberá, a su vez, \ngarantizar la coordinación con la persona tutora en la empresa.']","['No podrá efectuarse la prestación laboral de un trabajador para diversos empresarios cuando se estime concurrencia desleal o cuando se pacte la plena dedicación mediante compensación económica expresa, en los términos que al efecto se convengan.']","No podrá efectuarse la prestación laboral de un trabajador para diversos empresarios cuando se estime concurrencia desleal o cuando se pacte la plena dedicación mediante compensación económica expresa, en los términos que al efecto se convengan."
¿Cuáles son las características de un pacto de no concurrencia posterior a la extinción del contrato?,"1. Un pacto de no concurrencia posterior a la extinción del contrato no puede imponer sanciones que consistan en la reducción de la duración de las vacaciones u otra minoración de los derechos al descanso del trabajador o multa.
2. Las acciones derivadas del contrato de trabajo que no tengan plazo especial prescribirán al año de su terminación, excepto si se ejercitan para exigir percepciones económicas o cumplimiento de obligaciones de tracto único, en cuyo caso el plazo se computará desde el día en que la acción pudiera ejercitarse.
3. Los convenios colectivos se prorrogarán de año en año si no mediara denuncia expresa de las partes y pueden negociarse su revisión durante su vigencia.
4. En el caso de los expedientes de regulación de empleo para la extinción o suspensión de los contratos de trabajo o para la reducción de jornada, se regirán por la normativa vigente en el momento de su inicio (a partir del 12 de febrero de 2012) o cuando se dictó la resolución del expediente.
5. La indemnización por despido prevista en el artículo 56.1 será de aplicación a los contratos suscritos a partir del 12 de febrero de 2012, mientras que la indemnización por despido improcedente de los contratos formalizados con anterioridad al 12 de febrero de 2012 se calculará a razón de cuarenta y cinco días.","['3. No se podrán imponer sanciones que consistan en la reducción de la duración de las \nvacaciones u otra minoración de los derechos al descanso del trabajador o multa de haber.\nCAPÍTULO V\nPlazos de prescripción\nSección 1.ª Prescripción de acciones derivadas del contrato\nArtículo 59.  Prescripción y caducidad.\n1. Las acciones derivadas del contrato de trabajo que no tengan señalado plazo especial \nprescribirán al año de su terminación.\nA estos efectos, se considerará terminado el contrato:\na) El día en que expire el tiempo de duración convenido o fijado por disposición legal o \nconvenio colectivo.\nb) El día en que termine la prestación de servicios continuados, cuando se haya dado \nesta continuidad por virtud de prórroga expresa o tácita.\n2. Si la acción se ejercita para exigir percepciones económicas o para el cumplimiento de \nobligaciones de tracto único, que no puedan tener lugar después de extinguido el contrato, el \nplazo de un año se computará desde el día en que la acción pudiera ejercitarse.'
 'Artículo 86.  Vigencia.\n1. Corresponde a las partes negociadoras establecer la duración de los convenios, \npudiendo eventualmente pactarse distintos periodos de vigencia para cada materia o grupo \nhomogéneo de materias dentro del mismo convenio.\nDurante la vigencia del convenio colectivo, los sujetos que reúnan los requisitos de \nlegitimación previstos en los artículos 87 y 88 podrán negociar su revisión.\n2. Salvo pacto en contrario, los convenios colectivos se prorrogarán de año en año si no \nmediara denuncia expresa de las partes.\n3. La vigencia de un convenio colectivo, una vez denunciado y concluida la duración \npactada, se producirá en los términos que se hubiesen establecido en el propio convenio.\nDurante las negociaciones para la renovación de un convenio colectivo, en defecto de \npacto, se mantendrá su vigencia, si bien las cláusulas convencionales por las que se hubiera \nrenunciado a la huelga durante la vigencia de un convenio decaerán a partir de su denuncia.'
 '1. Los expedientes de regulación de empleo para la extinción o suspensión de los \ncontratos de trabajo  o para la reducción de jornada que estuvieran en tramitación a 12 de \nfebrero de 2012 se regirán por la normativa vigente en el momento de su inicio.\n2. Los expedientes de regulación de empleo para la extinción o la suspensión de los \ncontratos de trabajo o para la reducción de jornada resueltos por la autoridad laboral y con \nvigencia en su aplicación a 12 de febrero de 2012 se regirán por la normativa en vigor \ncuando se dictó la resolución del expediente.\nDisposición transitoria undécima.  Indemnizaciones por despido improcedente.\n1. La indemnización por despido prevista en el artículo 56.1 será de aplicación a los \ncontratos suscritos a partir del 12 de febrero de 2012.\n2. La indemnización por despido improcedente de los contratos formalizados con \nanterioridad al 12 de febrero de 2012 se calculará a razón de cuarenta y cinco días de']","['no podrá tener una duración superior a dos años para los técnicos y de seis meses para los demás trabajadores, solo será válido si concurren los requisitos siguientes:\n\na) Que el empresario tenga un efectivo interés industrial o comercial en ello.\n\nb) Que se satisfaga al trabajador una compensación económica adecuada.']","El pacto de no competencia para después de extinguido el contrato de trabajo, que no podrá tener una duración superior a dos años para los técnicos y de seis meses para los demás trabajadores, solo será válido si concurren los requisitos siguientes:

a) Que el empresario tenga un efectivo interés industrial o comercial en ello.

b) Que se satisfaga al trabajador una compensación económica adecuada."
¿Cuál es el régimen de la compensación económica por plena dedicación del trabajador?," El régimen de compensación económica por plena dedicación del trabajador se encuentra regulado en el artículo 26 de la Sección 4.ª Salarios y garantías salariales. La remuneración por el tiempo de trabajo efectivo está fijada en el convenio colectivo aplicable o, en su defecto, en el del grupo profesional y nivel retributivo correspondiente a las funciones desempeñadas. Debe ser al menos la retribución mínima establecida para el contrato de formación en alternancia ni al salario mínimo interprofesional en proporción al tiempo de trabajo efectivo. En otros casos, no se considera salario las cantidades percibidas por indemnizaciones, suplidos por gastos, prestaciones e indemnizaciones de la Seguridad Social. Las personas contratadas con contrato de formación para obtención de prácticas profesionales no pueden realizar horas extraordinarias, excepto en el caso previsto en el artículo 35.3. La retribución por el tiempo de trabajo efectivo en un contrato de relevo, que se celebra como consecuencia de una jubilación parcial, tiene que ser igual al tiempo que falte al trabajador sustituido para alcanzar la edad de jubilación ordinaria. El contrato de trabajo a tiempo parcial y su retribución son compatibles con la pensión que la Seguridad Social reconoce al trabajador en concepto de jubilación parcial, y la relación laboral se extinguirá al producirse la jubilación total del trabajador.","['Sección 4.ª Salarios y garantías salariales\nArtículo 26.  Del salario.\n1. Se considerará salario la totalidad de las percepciones económicas de los \ntrabajadores, en dinero o en especie, por la prestación profesional de los servicios laborales \npor cuenta ajena, ya retribuyan el trabajo efectivo, cualquiera que sea la forma de \nremuneración, o los periodos de descanso computables como de trabajo.\nEn ningún caso, incluidas las relaciones laborales de carácter especial a que se refiere el \nartículo 2, el salario en especie podrá superar el treinta por ciento de las percepciones \nsalariales del trabajador, ni dar lugar a la minoración de la cuantía íntegra en dinero del \nsalario mínimo interprofesional.\n2. No tendrán la consideración de salario las cantidades percibidas por el trabajador en \nconcepto de indemnizaciones o suplidos por los gastos realizados como consecuencia de su \nactividad laboral, las prestaciones e indemnizaciones de la Seguridad Social y las'
 'g) A la finalización del contrato la persona trabajadora tendrá derecho a la certificación \ndel contenido de la práctica realizada.\nh) Las personas contratadas con contrato de formación para la obtención de práctica \nprofesional no podrán realizar horas extraordinarias, salvo en el supuesto previsto en el \nartículo 35.3.\ni) La retribución por el tiempo de trabajo efectivo será la fijada en el convenio colectivo \naplicable en la empresa para estos contratos o en su defecto la del grupo profesional y nivel \nretributivo correspondiente a las funciones desempeñadas. En ningún caso la retribución \npodrá ser inferior a la retribución mínima establecida para el contrato para la formación en \nalternancia ni al salario mínimo interprofesional en proporción al tiempo de trabajo efectivo.\nj) Reglamentariamente se desarrollará el alcance de la formación correspondiente al \ncontrato de formación para la obtención de prácticas profesionales, particularmente, en el'
 'Seguridad Social.\nLa ejecución de este contrato de trabajo a tiempo parcial y su retribución serán \ncompatibles con la pensión que la Seguridad Social reconozca al trabajador en concepto de \njubilación parcial.\nLa relación laboral se extinguirá al producirse la jubilación total del trabajador.\n7. El contrato de relevo se ajustará a las siguientes reglas:\na) Se celebrará con un trabajador en situación de desempleo o que tuviese concertado \ncon la empresa un contrato de duración determinada.\nb) Salvo lo establecido en los dos párrafos siguientes, la duración del contrato de relevo \nque se celebre como consecuencia de una jubilación parcial tendrá que ser indefinida o, \ncomo mínimo, igual al tiempo que falte al trabajador sustituido para alcanzar la edad de \njubilación ordinaria que corresponda conforme a lo establecido en el texto refundido de la \nLey General de la Seguridad Social. Si, al cumplir dicha edad, el trabajador jubilado']","['el trabajador podrá rescindir el acuerdo y recuperar su libertad de trabajo en otro empleo, comunicándolo por escrito al empresario con un preaviso de treinta días, perdiéndose en este caso la compensación económica u otros derechos vinculados a la plena dedicación.']","En el supuesto de compensación económica por la plena dedicación, el trabajador podrá rescindir el acuerdo y recuperar su libertad de trabajo en otro empleo, comunicándolo por escrito al empresario con un preaviso de treinta días, perdiéndose en este caso la compensación económica u otros derechos vinculados a la plena dedicación."
¿Tendrá derecho el empresario a percibir una compensación económica por especialización profesional si se abandona el trabajo?, El empresario tendrá derecho a una indemnización de daños y perjuicios si el trabajador abandona su trabajo antes del plazo acordado para una especialización profesional que tuvo cargo al empresario. Este derecho se obtiene solo si se ha pactado formalmente por escrito un acuerdo que no dura más de dos años y se establece una compensación económica adecuada.,"['podrá efectuarlo el empresario en moneda de curso legal o mediante cheque u otra \nmodalidad de pago similar a través de entidades de crédito, previo informe al comité de \nempresa o delegados de personal.\nArtículo 30.  Imposibilidad de la prestación.\nSi el trabajador no pudiera prestar sus servicios una vez vigente el contrato porque el \nempresario se retrasare en darle trabajo por impedimentos imputables al mismo y no al \ntrabajador, este conservará el derecho a su salario, sin que pueda hacérsele compensar el \nque perdió con otro trabajo realizado en otro tiempo.BOLETÍN OFICIAL DEL ESTADO\nLEGISLACIÓN CONSOLIDADA\nPágina 29'
 'por escrito al empresario con un preaviso de treinta días, perdiéndose en este caso la \ncompensación económica u otros derechos vinculados a la plena dedicación.\n4. Cuando el trabajador haya recibido una especialización profesional con cargo al \nempresario para poner en marcha proyectos determinados o realizar un trabajo específico, \npodrá pactarse entre ambos la permanencia en dicha empresa durante cierto tiempo. El \nacuerdo no será de duración superior a dos años y se formalizará siempre por escrito. Si el \ntrabajador abandona el trabajo antes del plazo, el empresario tendrá derecho a una \nindemnización de daños y perjuicios.\nSección 3.ª Clasificación profesional y promoción en el trabajo\nArtículo 22.  Sistema de clasificación profesional.\n1. Mediante la negociación colectiva o, en su defecto, acuerdo entre la empresa y los \nrepresentantes de los trabajadores, se establecerá el sistema de clasificación profesional de \nlos trabajadores por medio de grupos profesionales.'
 'digitales.\nArtículo 21.  Pacto de no concurrencia y de permanencia en la empresa.\n1. No podrá efectuarse la prestación laboral de un trabajador para diversos empresarios \ncuando se estime concurrencia desleal o cuando se pacte la plena dedicación mediante \ncompensación económica expresa, en los términos que al efecto se convengan.\n2. El pacto de no competencia para después de extinguido el contrato de trabajo, que no \npodrá tener una duración superior a dos años para los técnicos y de seis meses para los \ndemás trabajadores, solo será válido si concurren los requisitos siguientes:\na) Que el empresario tenga un efectivo interés industrial o comercial en ello.\nb) Que se satisfaga al trabajador una compensación económica adecuada.\n3. En el supuesto de compensación económica por la plena dedicación, el trabajador \npodrá rescindir el acuerdo y recuperar su libertad de trabajo en otro empleo, comunicándolo \npor escrito al empresario con un preaviso de treinta días, perdiéndose en este caso la']","['El acuerdo no será de duración superior a dos años y se formalizará siempre por escrito. Si el trabajador abandona el trabajo antes del plazo, el empresario tendrá derecho a una indemnización de daños y perjuicios.']","Cuando el trabajador haya recibido una especialización profesional con cargo al empresario para poner en marcha proyectos determinados o realizar un trabajo específico, podrá pactarse entre ambos la permanencia en dicha empresa durante cierto tiempo. El acuerdo no será de duración superior a dos años y se formalizará siempre por escrito. Si el trabajador abandona el trabajo antes del plazo, el empresario tendrá derecho a una indemnización de daños y perjuicios."
¿Cuáles son las reglas del sistema de clasificación profesional?," Las reglas del sistema de clasificación profesional son:

1. El grupo profesional agrupa aptitudes, profesiones y funciones laborales de manera unitaria.
2. La definición de grupos profesionales se basa en un análisis correlacional entre sesgos de género, puestos de trabajo, criterios de encuadramiento y retribuciones.
3. El límite para la edad de jubilación puede ser rebajado hasta la edad ordinaria si el porcentaje de mujeres trabajadoras en un sector determinado es inferior al 20% de las personas ocupadas en ese sector.
4. Las actividades económicas que se utilizan para determinar el cumplimiento de esta condición están definidas por los códigos de la Clasificación Nacional de Actividades Económicas (CNAE).
5. El convenio colectivo aplicable puede incluir materias como el horario y régimen de trabajo, adaptación al ámbito de la empresa del sistema de clasificación profesional de las personas trabajadoras, medidas para favorecer la conciliación entre la vida laboral, familiar y personal, y otras que dispongan los acuerdos y convenios colectivos.
6. El convenio colectivo no puede tener prioridad aplicativa en estas materias si es elaborado por un grupo de empresas o una pluralidad de empresas vinculadas por razones organizativas o productivas y nominativamente identificadas.
7. Si el acuerdo o convenio colectivo incluye lo previsto en este apartado, no tendrá prioridad aplicativa la que se establece en este artículo.","['los trabajadores por medio de grupos profesionales.\n2. Se entenderá por grupo profesional el que agrupe unitariamente las aptitudes \nprofesionales, titulaciones y contenido general de la prestación, y podrá incluir distintas \ntareas, funciones, especialidades profesionales o responsabilidades asignadas al trabajador.\n3. La definición de los grupos profesionales se ajustará a criterios y sistemas que, \nbasados en un análisis correlacional entre sesgos de género, puestos de trabajo, criterios de \nencuadramiento y retribuciones, tengan como objeto garantizar la ausencia de BOLETÍN OFICIAL DEL ESTADO\nLEGISLACIÓN CONSOLIDADA\nPágina 26'
 '2. Excepcionalmente, con el objetivo de alcanzar la igualdad real y efectiva entre mujeres \ny hombres coadyuvando a superar la segregación ocupacional por género, el límite del \napartado anterior podrá rebajarse hasta la edad ordinaria de jubilación fijada por la normativa \nde Seguridad Social cuando la tasa de ocupación de las mujeres trabajadoras por cuenta \najena afiliadas a la Seguridad Social en alguna de las actividades económicas \ncorrespondientes al ámbito funcional del convenio sea inferior al 20 por ciento de las \npersonas ocupadas en las mismas.\nLas actividades económicas que se tomarán como referencia para determinar el \ncumplimiento de esta condición estará definida por los códigos de la Clasificación Nacional \nde Actividades Económicas (CNAE) en vigor en cada momento, incluidos en el ámbito del \nconvenio aplicable según los datos facilitados al realizar su inscripción en el Registro y \ndepósito de convenios y acuerdos colectivos de trabajo y planes de igualdad (REGCON), de'
 'trabajo a turnos.\nb) El horario y la distribución del tiempo de trabajo, el régimen de trabajo a turnos y la \nplanificación anual de las vacaciones.\nc) La adaptación al ámbito de la empresa del sistema de clasificación profesional de las \npersonas trabajadoras.\nd) La adaptación de los aspectos de las modalidades de contratación que se atribuyen \npor esta ley a los convenios de empresa.\ne) Las medidas para favorecer la corresponsabilidad y la conciliación entre la vida \nlaboral, familiar y personal.\nf) Aquellas otras que dispongan los acuerdos y convenios colectivos a que se refiere el \nartículo 83.2.\nIgual prioridad aplicativa tendrán en estas materias los convenios colectivos para un \ngrupo de empresas o una pluralidad de empresas vinculadas por razones organizativas o \nproductivas y nominativamente identificadas a que se refiere el artículo 87.1.\nLos acuerdos y convenios colectivos a que se refiere el artículo 83.2 no podrán disponer \nde la prioridad aplicativa prevista en este apartado.']","['1. Mediante la negociación colectiva o, en su defecto, acuerdo entre la empresa y los representantes de los trabajadores, se establecerá el sistema de clasificación profesional de los trabajadores por medio de grupos profesionales.\n\n2. Se entenderá por grupo profesional el que agrupe unitariamente las aptitudes profesionales, titulaciones y contenido general de la prestación, y podrá incluir distintas tareas, funciones, especialidades profesionales o responsabilidades asignadas al trabajador.\n\n3. La definición de los grupos profesionales se ajustará a criterios y sistemas que tengan como objeto garantizar la ausencia de discriminación, tanto directa como indirecta, entre mujeres y hombres.\n\n4. Por acuerdo entre el trabajador y el empresario se asignará al trabajador un grupo profesional y se establecerá como contenido de la prestación laboral objeto del contrato de trabajo la realización de todas las funciones correspondientes al grupo profesional asignado o solamente de alguna de ellas. Cuando se acuerde la polivalencia funcional o la realización de funciones propias de más de un grupo, la equiparación se realizará en virtud de las funciones que se desempeñen durante mayor tiempo.']","1. Mediante la negociación colectiva o, en su defecto, acuerdo entre la empresa y los representantes de los trabajadores, se establecerá el sistema de clasificación profesional de los trabajadores por medio de grupos profesionales.

2. Se entenderá por grupo profesional el que agrupe unitariamente las aptitudes profesionales, titulaciones y contenido general de la prestación, y podrá incluir distintas tareas, funciones, especialidades profesionales o responsabilidades asignadas al trabajador.

3. La definición de los grupos profesionales se ajustará a criterios y sistemas que tengan como objeto garantizar la ausencia de discriminación, tanto directa como indirecta, entre mujeres y hombres.

4. Por acuerdo entre el trabajador y el empresario se asignará al trabajador un grupo profesional y se establecerá como contenido de la prestación laboral objeto del contrato de trabajo la realización de todas las funciones correspondientes al grupo profesional asignado o solamente de alguna de ellas. Cuando se acuerde la polivalencia funcional o la realización de funciones propias de más de un grupo, la equiparación se realizará en virtud de las funciones que se desempeñen durante mayor tiempo."
¿Qué derechos tiene el trabajador respecto a la promoción y formación profesional en el trabajo?,"1. El trabajador tiene derecho a adaptar su jornada laboral para asistir a cursos de formación profesional y a recibir permisos adecuados para tal propósito.
2. La negociación colectiva reglamentará los términos del ejercicio de estos derechos, con criterios y sistemas sin discriminación entre hombres y mujeres.
3. Trabajadores que cumplen al menos un año en la empresa tienen derecho a 20 horas anuales de permiso retribuido para formación profesional vinculada a la actividad de la misma, acumulables durante un máximo de cinco años.
4. A los trabajadores les corresponde la formación necesaria para su adaptación al puesto de trabajo y a la modificación operada en el mismo, que será cubierta por la empresa sin perjuicio de créditos destinados a la formación. El tiempo destinado a la formación se considerará como tiempo laboral efectivo.
5. A los trabajadores con contrato de formación para la obtención de práctica profesional no les permiten realizar horas extraordinarias, salvo en ciertos casos específicos.
6. La retribución por el tiempo laboral efectivo se fijará en base al convenio colectivo aplicable o en su defecto, según la función desempeñada y el nivel retributivo correspondiente. Nunca podrá ser inferior a las mínimas establecidas para contratos de formación en alternancia ni al salario mínimo interprofesional.
7. Trabajadores con contrato de formación para la obtención de prácticas profesionales tendrán derecho a la certificación del contenido de su práctica realizada.
8. No se especifica derechos relativos a la finalización del contrato en el contexto brindado.","['preferencia a elegir turno de trabajo y a acceder al trabajo a distancia, si tal es el régimen \ninstaurado en la empresa, y el puesto o funciones son compatibles con esta forma de \nrealización del trabajo, cuando curse con regularidad estudios para la obtención de un título \nacadémico o profesional.\nb) A la adaptación de la jornada ordinaria de trabajo para la asistencia a cursos de \nformación profesional.\nc) A la concesión de los permisos oportunos de formación o perfeccionamiento \nprofesional con reserva del puesto de trabajo.\nd) A la formación necesaria para su adaptación a las modificaciones operadas en el \npuesto de trabajo. La misma correrá a cargo de la empresa, sin perjuicio de la posibilidad de \nobtener a tal efecto los créditos destinados a la formación. El tiempo destinado a la \nformación se considerará en todo caso tiempo de trabajo efectivo.\n2. En la negociación colectiva se pactarán los términos del ejercicio de estos derechos,'
 '2. En la negociación colectiva se pactarán los términos del ejercicio de estos derechos, \nque se acomodarán a criterios y sistemas que garanticen la ausencia de discriminación, \ntanto directa como indirecta, entre trabajadores de uno y otro sexo.\n3. Los trabajadores con al menos un año de antigüedad en la empresa tienen derecho a \nun permiso retribuido de veinte horas anuales de formación profesional para el empleo, \nvinculada a la actividad de la empresa, acumulables por un periodo de hasta cinco años. El \nderecho se entenderá cumplido en todo caso cuando el trabajador pueda realizar las \nacciones formativas dirigidas a la obtención de la formación profesional para el empleo en el \nmarco de un plan de formación desarrollado por iniciativa empresarial o comprometido por la \nnegociación colectiva. Sin perjuicio de lo anterior, no podrá comprenderse en el derecho a \nque se refiere este apartado la formación que deba obligatoriamente impartir la empresa a su'
 'g) A la finalización del contrato la persona trabajadora tendrá derecho a la certificación \ndel contenido de la práctica realizada.\nh) Las personas contratadas con contrato de formación para la obtención de práctica \nprofesional no podrán realizar horas extraordinarias, salvo en el supuesto previsto en el \nartículo 35.3.\ni) La retribución por el tiempo de trabajo efectivo será la fijada en el convenio colectivo \naplicable en la empresa para estos contratos o en su defecto la del grupo profesional y nivel \nretributivo correspondiente a las funciones desempeñadas. En ningún caso la retribución \npodrá ser inferior a la retribución mínima establecida para el contrato para la formación en \nalternancia ni al salario mínimo interprofesional en proporción al tiempo de trabajo efectivo.\nj) Reglamentariamente se desarrollará el alcance de la formación correspondiente al \ncontrato de formación para la obtención de prácticas profesionales, particularmente, en el']","['a) Al disfrute de los permisos necesarios para concurrir a exámenes, \ncuando curse con regularidad estudios para la obtención de un título académico o profesional.\n\nb) A la adaptación de la jornada ordinaria de trabajo para la asistencia a cursos de formación profesional.\n\nc) A la concesión de los permisos oportunos de formación o perfeccionamiento profesional con reserva del puesto de trabajo.\n\nd) A la formación necesaria para su adaptación a las modificaciones operadas en el puesto de trabajo. La misma correrá a cargo de la empresa, \nEl tiempo destinado a la formación se considerará en todo caso tiempo de trabajo efectivo.\n\n3. Los trabajadores con al menos un año de antigüedad en la empresa tienen derecho a un permiso retribuido de veinte horas anuales de formación profesional para el empleo, vinculada a la actividad de la empresa, acumulables por un periodo de hasta cinco años.']","1. El trabajador tendrá derecho:

a) Al disfrute de los permisos necesarios para concurrir a exámenes, así como a una preferencia a elegir turno de trabajo, si tal es el régimen instaurado en la empresa, cuando curse con regularidad estudios para la obtención de un título académico o profesional.

b) A la adaptación de la jornada ordinaria de trabajo para la asistencia a cursos de formación profesional.

c) A la concesión de los permisos oportunos de formación o perfeccionamiento profesional con reserva del puesto de trabajo.

d) A la formación necesaria para su adaptación a las modificaciones operadas en el puesto de trabajo. La misma correrá a cargo de la empresa, sin perjuicio de la posibilidad de obtener a tal efecto los créditos destinados a la formación. El tiempo destinado a la formación se considerará en todo caso tiempo de trabajo efectivo.

2. En la negociación colectiva se pactarán los términos del ejercicio de estos derechos, que se acomodarán a criterios y sistemas que garanticen la ausencia de discriminación, tanto directa como indirecta, entre trabajadores de uno y otro sexo.

3. Los trabajadores con al menos un año de antigüedad en la empresa tienen derecho a un permiso retribuido de veinte horas anuales de formación profesional para el empleo, vinculada a la actividad de la empresa, acumulables por un periodo de hasta cinco años. El derecho se entenderá cumplido en todo caso cuando el trabajador pueda realizar las acciones formativas dirigidas a la obtención de la formación profesional para el empleo en el marco de un plan de formación desarrollado por iniciativa empresarial o comprometido por la negociación colectiva. Sin perjuicio de lo anterior, no podrá comprenderse en el derecho a que se refiere este apartado la formación que deba obligatoriamente impartir la empresa a su cargo conforme a lo previsto en otras leyes. En defecto de lo previsto en convenio colectivo, la concreción del modo de disfrute del permiso se fijará de mutuo acuerdo entre trabajador y empresario."
¿Cómo se regulan los ascensos?," Los ascensos se regulan por medio de acuerdos y convenios colectivos que definen la adaptación al ámbito de la empresa del sistema de clasificación profesional de las personas trabajadoras. El grupo profesional agrupa unitariamente las aptitudes profesionales, titulaciones y contenido general de la prestación, y puede incluir distintas tareas, funciones, especialidades profesionales o responsabilidades asignadas al trabajador. La definición de los grupos profesionales se ajusta a criterios y sistemas que garanticen la ausencia de sesgos de género en los puestos de trabajo, criterios de encuadramiento y retribuciones.","['el empleo, así como sobre la producción y ventas, incluido el programa de producción.\nc) Sobre las previsiones del empresario de celebración de nuevos contratos, con \nindicación del número de estos y de las modalidades y tipos que serán utilizados, incluidos \nlos contratos a tiempo parcial, la realización de horas complementarias por los trabajadores \ncontratados a tiempo parcial y de los supuestos de subcontratación.BOLETÍN OFICIAL DEL ESTADO\nLEGISLACIÓN CONSOLIDADA\nPágina 66'
 'trabajo a turnos.\nb) El horario y la distribución del tiempo de trabajo, el régimen de trabajo a turnos y la \nplanificación anual de las vacaciones.\nc) La adaptación al ámbito de la empresa del sistema de clasificación profesional de las \npersonas trabajadoras.\nd) La adaptación de los aspectos de las modalidades de contratación que se atribuyen \npor esta ley a los convenios de empresa.\ne) Las medidas para favorecer la corresponsabilidad y la conciliación entre la vida \nlaboral, familiar y personal.\nf) Aquellas otras que dispongan los acuerdos y convenios colectivos a que se refiere el \nartículo 83.2.\nIgual prioridad aplicativa tendrán en estas materias los convenios colectivos para un \ngrupo de empresas o una pluralidad de empresas vinculadas por razones organizativas o \nproductivas y nominativamente identificadas a que se refiere el artículo 87.1.\nLos acuerdos y convenios colectivos a que se refiere el artículo 83.2 no podrán disponer \nde la prioridad aplicativa prevista en este apartado.'
 'los trabajadores por medio de grupos profesionales.\n2. Se entenderá por grupo profesional el que agrupe unitariamente las aptitudes \nprofesionales, titulaciones y contenido general de la prestación, y podrá incluir distintas \ntareas, funciones, especialidades profesionales o responsabilidades asignadas al trabajador.\n3. La definición de los grupos profesionales se ajustará a criterios y sistemas que, \nbasados en un análisis correlacional entre sesgos de género, puestos de trabajo, criterios de \nencuadramiento y retribuciones, tengan como objeto garantizar la ausencia de BOLETÍN OFICIAL DEL ESTADO\nLEGISLACIÓN CONSOLIDADA\nPágina 26']","['1. Los ascensos dentro del sistema de clasificación profesional se producirán conforme a lo que se establezca en convenio o, en su defecto, en acuerdo colectivo entre la empresa y los representantes de los trabajadores.\n\nteniendo en cuenta la formación, méritos, antigüedad del trabajador, así como las facultades organizativas del empresario.\n\n2. Los ascensos y la promoción profesional en la empresa se ajustarán a criterios y sistemas que tengan como objetivo garantizar la ausencia de discriminación, tanto directa como indirecta, entre mujeres y hombres, pudiendo establecerse medidas de acción positiva dirigidas a eliminar o compensar situaciones de discriminación.']","1. Los ascensos dentro del sistema de clasificación profesional se producirán conforme a lo que se establezca en convenio o, en su defecto, en acuerdo colectivo entre la empresa y los representantes de los trabajadores.

En todo caso los ascensos se producirán teniendo en cuenta la formación, méritos, antigüedad del trabajador, así como las facultades organizativas del empresario.

2. Los ascensos y la promoción profesional en la empresa se ajustarán a criterios y sistemas que tengan como objetivo garantizar la ausencia de discriminación, tanto directa como indirecta, entre mujeres y hombres, pudiendo establecerse medidas de acción positiva dirigidas a eliminar o compensar situaciones de discriminación."
¿Cómo se regula la promoción económica?," La promoción económica se regula en función del horario y la distribución del tiempo de trabajo, el régimen de trabajo a turnos y la planificación anual de las vacaciones, adaptación al ámbito de la empresa del sistema de clasificación profesional de las personas trabajadoras, asuntos de contratación y conciliación entre vida laboral, familiar y personal. También se consideran medidas para favorecer la corresponsabilidad y otras que dispongan los acuerdos y convenios colectivos. La prioridad aplicativa en estas materias tendrá igual importancia los convenios colectivos de una empresa o pluralidad de empresas vinculadas por razones organizativas o productivas. El sindical puede promover elecciones para renovar la representación en uno o varios ámbitos funcionales o territoriales y estos acuerdos deberán comunicarse a la autoridad laboral para su depósito y publicidad. También se pueden pactar condiciones especiales cuando un trabajador haya recibido una especialización profesional con cargo al empresario, pero no durará más de dos años y debe formalizarse por escrito. Además, se establece el sistema de clasificación profesional de los trabajadores a través de negociaciones colectivas o acuerdo entre la empresa y los representantes de los trabajadores.","['trabajo a turnos.\nb) El horario y la distribución del tiempo de trabajo, el régimen de trabajo a turnos y la \nplanificación anual de las vacaciones.\nc) La adaptación al ámbito de la empresa del sistema de clasificación profesional de las \npersonas trabajadoras.\nd) La adaptación de los aspectos de las modalidades de contratación que se atribuyen \npor esta ley a los convenios de empresa.\ne) Las medidas para favorecer la corresponsabilidad y la conciliación entre la vida \nlaboral, familiar y personal.\nf) Aquellas otras que dispongan los acuerdos y convenios colectivos a que se refiere el \nartículo 83.2.\nIgual prioridad aplicativa tendrán en estas materias los convenios colectivos para un \ngrupo de empresas o una pluralidad de empresas vinculadas por razones organizativas o \nproductivas y nominativamente identificadas a que se refiere el artículo 87.1.\nLos acuerdos y convenios colectivos a que se refiere el artículo 83.2 no podrán disponer \nde la prioridad aplicativa prevista en este apartado.'
 'Sindical, podrá promoverse la celebración de elecciones de manera generalizada en uno o \nvarios ámbitos funcionales o territoriales. Dichos acuerdos deberán comunicarse a la oficina \npública dependiente de la autoridad laboral para su depósito y publicidad.\nCuando se promuevan elecciones para renovar la representación por conclusión de la \nduración del mandato, tal promoción solo podrá efectuarse a partir de la fecha en que falten \ntres meses para el vencimiento del mandato.BOLETÍN OFICIAL DEL ESTADO\nLEGISLACIÓN CONSOLIDADA\nPágina 69'
 'por escrito al empresario con un preaviso de treinta días, perdiéndose en este caso la \ncompensación económica u otros derechos vinculados a la plena dedicación.\n4. Cuando el trabajador haya recibido una especialización profesional con cargo al \nempresario para poner en marcha proyectos determinados o realizar un trabajo específico, \npodrá pactarse entre ambos la permanencia en dicha empresa durante cierto tiempo. El \nacuerdo no será de duración superior a dos años y se formalizará siempre por escrito. Si el \ntrabajador abandona el trabajo antes del plazo, el empresario tendrá derecho a una \nindemnización de daños y perjuicios.\nSección 3.ª Clasificación profesional y promoción en el trabajo\nArtículo 22.  Sistema de clasificación profesional.\n1. Mediante la negociación colectiva o, en su defecto, acuerdo entre la empresa y los \nrepresentantes de los trabajadores, se establecerá el sistema de clasificación profesional de \nlos trabajadores por medio de grupos profesionales.']","['1. El trabajador, en función del trabajo desarrollado, podrá tener derecho a una promoción económica en los términos fijados en convenio colectivo o contrato individual.']","1. El trabajador, en función del trabajo desarrollado, podrá tener derecho a una promoción económica en los términos fijados en convenio colectivo o contrato individual.

2. Lo dispuesto en el apartado anterior se entiende sin perjuicio de los derechos adquiridos o en curso de adquisición en el tramo temporal correspondiente."
¿Qué se considera salario?," El salario se refiere a la remuneración por el trabajo prestado. Debe ser igual para los trabajos de igual valor, sin discriminación por razón de sexo. En caso de despido, el empresario podría tener que pagarle al empleado los salarios de tramitación mientras se procede con la demanda, y si la sentencia es favorable al trabajador tras noventa días hábiles, podrá reclamar del Estado el abono de la percepción económica correspondiente al tiempo que exceda. En caso de nulidad por discriminación salarial por razón de sexo, el trabajador tendría derecho a la retribución correspondiente al trabajo igual o de igual valor.","['sindical, la opción corresponderá siempre a este. De no efectuar la opción, se entenderá que \nlo hace por la readmisión. Cuando la opción, expresa o presunta, sea en favor de la \nreadmisión, esta será obligada. Tanto si opta por la indemnización como si lo hace por la \nreadmisión, tendrá derecho a los salarios de tramitación a los que se refiere el apartado 2.\n5. Cuando la sentencia que declare la improcedencia del despido se dicte transcurridos \nmás de noventa días hábiles desde la fecha en que se presentó la demanda, el empresario \npodrá reclamar del Estado el abono de la percepción económica a la que se refiere el \napartado 2, correspondiente al tiempo que exceda de dichos noventa días hábiles.\nEn los casos de despido en que, con arreglo a este apartado, sean por cuenta del \nEstado los salarios de tramitación, serán con cargo al mismo las cuotas de la Seguridad \nSocial correspondientes a dichos salarios.\nSección 5.ª Procedimiento concursal\nArtículo 57.  Procedimiento concursal.'
 'Artículo 28.  Igualdad de remuneración por razón de sexo.\n1. El empresario está obligado a pagar por la prestación de un trabajo de igual valor la \nmisma retribución, satisfecha directa o indirectamente, y cualquiera que sea la naturaleza de \nla misma, salarial o extrasalarial, sin que pueda producirse discriminación alguna por razón \nde sexo en ninguno de los elementos o condiciones de aquella.\nUn trabajo tendrá igual valor que otro cuando la naturaleza de las funciones o tareas \nefectivamente encomendadas, las condiciones educativas, profesionales o de formación \nexigidas para su ejercicio, los factores estrictamente relacionados con su desempeño y las \ncondiciones laborales en las que dichas actividades se llevan a cabo en realidad sean \nequivalentes.\n2. El empresario está obligado a llevar un registro con los valores medios de los salarios, \nlos complementos salariales y las percepciones extrasalariales de su plantilla, desagregados'
 'contraprestaciones establecidas en la parte no válida del contrato, el órgano de la \njurisdicción social que a instancia de parte declare la nulidad hará el debido pronunciamiento \nsobre la subsistencia o supresión en todo o en parte de dichas condiciones o retribuciones.\n2. En caso de que el contrato resultase nulo, el trabajador podrá exigir, por el trabajo que \nya hubiese prestado, la remuneración consiguiente a un contrato válido.\n3. En caso de nulidad por discriminación salarial por razón de sexo, el trabajador tendrá \nderecho a la retribución correspondiente al trabajo igual o de igual valor.\nSección 4.ª Modalidades del contrato de trabajo\nArtículo 10.  Trabajo en común y contrato de grupo.\n1. Si el empresario diera un trabajo en común a un grupo de sus trabajadores, \nconservará respecto de cada uno, individualmente, sus derechos y deberes.\n2. Si el empresario hubiese celebrado un contrato con un grupo de trabajadores']","['1. Se considerará salario la totalidad de las percepciones económicas de los trabajadores, en dinero o en especie, por la prestación profesional de los servicios laborales por cuenta ajena, ya retribuyan el trabajo efectivo, cualquiera que sea la forma de remuneración, o los periodos de descanso computables como de trabajo.\n\nEn ningún caso, incluidas las relaciones laborales de carácter especial a que se refiere el artículo 2, el salario en especie podrá superar el treinta por ciento de las percepciones salariales del trabajador, ni dar lugar a la minoración de la cuantía íntegra en dinero del salario mínimo interprofesional.\n\n2. No tendrán la consideración de salario las cantidades percibidas por el trabajador en concepto de indemnizaciones o suplidos por los gastos realizados como consecuencia de su actividad laboral, las prestaciones e indemnizaciones de la Seguridad Social y las indemnizaciones correspondientes a traslados, suspensiones o despidos.']","1. Se considerará salario la totalidad de las percepciones económicas de los trabajadores, en dinero o en especie, por la prestación profesional de los servicios laborales por cuenta ajena, ya retribuyan el trabajo efectivo, cualquiera que sea la forma de remuneración, o los periodos de descanso computables como de trabajo.

En ningún caso, incluidas las relaciones laborales de carácter especial a que se refiere el artículo 2, el salario en especie podrá superar el treinta por ciento de las percepciones salariales del trabajador, ni dar lugar a la minoración de la cuantía íntegra en dinero del salario mínimo interprofesional.

2. No tendrán la consideración de salario las cantidades percibidas por el trabajador en concepto de indemnizaciones o suplidos por los gastos realizados como consecuencia de su actividad laboral, las prestaciones e indemnizaciones de la Seguridad Social y las indemnizaciones correspondientes a traslados, suspensiones o despidos."
¿Qué debe comprender el salario?," El salario es la totalidad de las percepciones económicas que reciben los trabajadores por prestar servicios laborales por cuenta ajena. Esta cantidad incluye tanto pagos en dinero como pagos en especie, y se considera trabajo cualquier periodo de descanso computable como de trabajo. De acuerdo con el artículo 28, el empresario está obligado a pagar por la prestación de un trabajo de igual valor la misma retribución, sin discriminación alguna por razón de sexo en ninguno de los elementos o condiciones del mismo. La naturaleza de las funciones o tareas efectivamente encomendadas, las condiciones educativas, profesionales o de formación exigidas para su ejercicio, los factores estrictamente relacionados con su desempeño y las condiciones laborales en las que dichas actividades se llevan a cabo deben ser equivalentes.","['Artículo 28.  Igualdad de remuneración por razón de sexo.\n1. El empresario está obligado a pagar por la prestación de un trabajo de igual valor la \nmisma retribución, satisfecha directa o indirectamente, y cualquiera que sea la naturaleza de \nla misma, salarial o extrasalarial, sin que pueda producirse discriminación alguna por razón \nde sexo en ninguno de los elementos o condiciones de aquella.\nUn trabajo tendrá igual valor que otro cuando la naturaleza de las funciones o tareas \nefectivamente encomendadas, las condiciones educativas, profesionales o de formación \nexigidas para su ejercicio, los factores estrictamente relacionados con su desempeño y las \ncondiciones laborales en las que dichas actividades se llevan a cabo en realidad sean \nequivalentes.\n2. El empresario está obligado a llevar un registro con los valores medios de los salarios, \nlos complementos salariales y las percepciones extrasalariales de su plantilla, desagregados'
 'Resultará de aplicación a lo establecido en el párrafo segundo lo dispuesto en el artículo \n34.7 Igualmente, el Gobierno podrá establecer limitaciones y garantías adicionales a las \nprevistas en el presente artículo para la realización de trabajo nocturno en ciertas actividades \no por determinada categoría de trabajadores, en función de los riesgos que comporten para \nsu salud y seguridad.\n2. El trabajo nocturno tendrá una retribución específica que se determinará en la \nnegociación colectiva, salvo que el salario se haya establecido atendiendo a que el trabajo \nsea nocturno por su propia naturaleza o se haya acordado la compensación de este trabajo \npor descansos.\n3. Se considera trabajo a turnos toda forma de organización del trabajo en equipo según \nla cual los trabajadores ocupan sucesivamente los mismos puestos de trabajo, según un \ncierto ritmo, continuo o discontinuo, implicando para el trabajador la necesidad de prestar'
 'Sección 4.ª Salarios y garantías salariales\nArtículo 26.  Del salario.\n1. Se considerará salario la totalidad de las percepciones económicas de los \ntrabajadores, en dinero o en especie, por la prestación profesional de los servicios laborales \npor cuenta ajena, ya retribuyan el trabajo efectivo, cualquiera que sea la forma de \nremuneración, o los periodos de descanso computables como de trabajo.\nEn ningún caso, incluidas las relaciones laborales de carácter especial a que se refiere el \nartículo 2, el salario en especie podrá superar el treinta por ciento de las percepciones \nsalariales del trabajador, ni dar lugar a la minoración de la cuantía íntegra en dinero del \nsalario mínimo interprofesional.\n2. No tendrán la consideración de salario las cantidades percibidas por el trabajador en \nconcepto de indemnizaciones o suplidos por los gastos realizados como consecuencia de su \nactividad laboral, las prestaciones e indemnizaciones de la Seguridad Social y las']","['Mediante la negociación colectiva o, en su defecto, el contrato individual, se determinará la estructura del salario, que deberá comprender el salario base, como retribución fijada por unidad de tiempo o de obra y, en su caso, complementos salariales fijados en función de circunstancias relativas a las condiciones personales del trabajador, al trabajo realizado o a la situación y resultados de la empresa, que se calcularán conforme a los criterios que a tal efecto se pacten. Igualmente se pactará el carácter consolidable o no de dichos complementos salariales, no teniendo el carácter de consolidables, salvo acuerdo en contrario, los que estén vinculados al puesto de trabajo o a la situación y resultados de la empresa.']","Mediante la negociación colectiva o, en su defecto, el contrato individual, se determinará la estructura del salario, que deberá comprender el salario base, como retribución fijada por unidad de tiempo o de obra y, en su caso, complementos salariales fijados en función de circunstancias relativas a las condiciones personales del trabajador, al trabajo realizado o a la situación y resultados de la empresa, que se calcularán conforme a los criterios que a tal efecto se pacten. Igualmente se pactará el carácter consolidable o no de dichos complementos salariales, no teniendo el carácter de consolidables, salvo acuerdo en contrario, los que estén vinculados al puesto de trabajo o a la situación y resultados de la empresa."
¿Quién satisface las cargas fiscales y de Seguridad Social a cargo del trabajador?," La carga fiscal y de Seguridad Social a cargo del trabajador es satisfecha por el empresario. El Fondo de Garantía Salarial se encargará de reembolsar las cantidades satisfechas en caso de insolvencia del empresario, y se financia con las aportaciones efectuadas por todos los empresarios, tanto públicos como privados. El tipo de cotización se fija por el Gobierno sobre los salarios que sirvan de base para el cálculo de la cotización en la Seguridad Social.","['Sección 4.ª Salarios y garantías salariales\nArtículo 26.  Del salario.\n1. Se considerará salario la totalidad de las percepciones económicas de los \ntrabajadores, en dinero o en especie, por la prestación profesional de los servicios laborales \npor cuenta ajena, ya retribuyan el trabajo efectivo, cualquiera que sea la forma de \nremuneración, o los periodos de descanso computables como de trabajo.\nEn ningún caso, incluidas las relaciones laborales de carácter especial a que se refiere el \nartículo 2, el salario en especie podrá superar el treinta por ciento de las percepciones \nsalariales del trabajador, ni dar lugar a la minoración de la cuantía íntegra en dinero del \nsalario mínimo interprofesional.\n2. No tendrán la consideración de salario las cantidades percibidas por el trabajador en \nconcepto de indemnizaciones o suplidos por los gastos realizados como consecuencia de su \nactividad laboral, las prestaciones e indemnizaciones de la Seguridad Social y las'
 'Para el reembolso de las cantidades satisfechas, el Fondo de Garantía Salarial se \nsubrogará obligatoriamente en los derechos y acciones de los trabajadores, conservando el \ncarácter de créditos privilegiados que les confiere el artículo 32 de esta ley. Si dichos \ncréditos concurriesen con los que puedan conservar los trabajadores por la parte no \nsatisfecha por el Fondo, unos y otros se abonarán a prorrata de sus respectivos importes.\n5. El Fondo de Garantía Salarial se financiará con las aportaciones efectuadas por todos \nlos empresarios a que se refiere el artículo 1.2 de esta ley, tanto si son públicos como \nprivados.\nEl tipo de cotización se fijará por el Gobierno sobre los salarios que sirvan de base para \nel cálculo de la cotización para atender las contingencias derivadas de accidentes de trabajo, \nenfermedad profesional y desempleo en el sistema de la Seguridad Social.\n6. A los efectos de este artículo se entiende que existe insolvencia del empresario'
 'Asimismo, la Inspección de Trabajo y Seguridad Social tendrá acceso a los datos \nincorporados mediante procedimientos automatizados y aplicaciones que le permitan \nconocer los extremos relativos a la aplicación de los Mecanismos, las condiciones especiales \nen materia de cotización a la Seguridad Social para las empresas y prestaciones \ncorrespondientes, con el objetivo de desarrollar las debidas actuaciones de control.\n6. Se constituirá como fondo sin personalidad jurídica, adscrito al Ministerio de Trabajo y \nEconomía Social, un Fondo RED de Flexibilidad y Estabilización del Empleo, que tendrá \ncomo finalidad atender a las necesidades futuras de financiación derivadas de la modalidad \ncíclica y sectorial del Mecanismo RED en materia de prestaciones y exenciones a las \nempresas del pago de las cotizaciones a la Seguridad Social, incluidos los costes asociados \na la formación, en la forma y condiciones previstas en su normativa de desarrollo.']","['Todas las cargas fiscales y de Seguridad Social a cargo del trabajador serán satisfechas por el mismo, siendo nulo todo pacto en contrario.']","Todas las cargas fiscales y de Seguridad Social a cargo del trabajador serán satisfechas por el mismo, siendo nulo todo pacto en contrario."
¿Cómo se fija el Salario Mínimo Interprofesional?," El Salario Mínimo Interprofesional se fija anualmente por el Gobierno tras una consulta con las organizaciones sindicales y asociaciones empresariales más representativas. Este proceso tiene en cuenta el índice de precios de consumo, la productividad media nacional, la participación del trabajo en la renta nacional, y la coyuntura económica general. También se realiza una revisión semestral si no se cumplen las previsiones sobre el índice de precios citado.","['empresa.\n4. Todas las cargas fiscales y de Seguridad Social a cargo del trabajador serán \nsatisfechas por el mismo, siendo nulo todo pacto en contrario.\n5. Operará la compensación y absorción cuando los salarios realmente abonados, en su \nconjunto y cómputo anual, sean más favorables para los trabajadores que los fijados en el \norden normativo o convencional de referencia.\nArtículo 27.  Salario mínimo interprofesional.\n1. El Gobierno fijará, previa consulta con las organizaciones sindicales y asociaciones \nempresariales más representativas, anualmente, el salario mínimo interprofesional, teniendo \nen cuenta:\na) El índice de precios de consumo.\nb) La productividad media nacional alcanzada.\nc) El incremento de la participación del trabajo en la renta nacional.\nd) La coyuntura económica general.\nIgualmente se fijará una revisión semestral para el caso de que no se cumplan las \nprevisiones sobre el índice de precios citado.'
 'Resultará de aplicación a lo establecido en el párrafo segundo lo dispuesto en el artículo \n34.7 Igualmente, el Gobierno podrá establecer limitaciones y garantías adicionales a las \nprevistas en el presente artículo para la realización de trabajo nocturno en ciertas actividades \no por determinada categoría de trabajadores, en función de los riesgos que comporten para \nsu salud y seguridad.\n2. El trabajo nocturno tendrá una retribución específica que se determinará en la \nnegociación colectiva, salvo que el salario se haya establecido atendiendo a que el trabajo \nsea nocturno por su propia naturaleza o se haya acordado la compensación de este trabajo \npor descansos.\n3. Se considera trabajo a turnos toda forma de organización del trabajo en equipo según \nla cual los trabajadores ocupan sucesivamente los mismos puestos de trabajo, según un \ncierto ritmo, continuo o discontinuo, implicando para el trabajador la necesidad de prestar'
 'la jornada deberá ser, como mínimo, igual a la reducción de jornada acordada por el \ntrabajador sustituido. El horario de trabajo del trabajador relevista podrá completar el del \ntrabajador sustituido o simultanearse con él.\nd) El puesto de trabajo del trabajador relevista podrá ser el mismo del trabajador \nsustituido. En todo caso, deberá existir una correspondencia entre las bases de cotización de \nambos, en los términos previstos en el texto refundido de la Ley General de la Seguridad \nSocial.\ne) En la negociación colectiva se podrán establecer medidas para impulsar la \ncelebración de contratos de relevo.\nArtículo 13.  Trabajo a distancia.\nLas personas trabajadoras podrán prestar trabajo a distancia en los términos previstos \nen la Ley 10/2021 de trabajo a distancia.\nCAPÍTULO II\nContenido del contrato de trabajo\nSección 1.ª Duración del contrato\nArtículo 14.  Periodo de prueba.\n1. Podrá concertarse por escrito un periodo de prueba, con sujeción a los límites de']","['1. El Gobierno fijará, previa consulta con las organizaciones sindicales y asociaciones empresariales más representativas, anualmente, el salario mínimo interprofesional, \n\nIgualmente se fijará una revisión semestral para el caso de que no se cumplan las previsiones sobre el índice de precios citado.\n\nLa revisión del salario mínimo interprofesional no afectará a la estructura ni a la cuantía de los salarios profesionales cuando estos, en su conjunto y cómputo anual, fueran superiores a aquel.\n\n2. El salario mínimo interprofesional, en su cuantía, es inembargable.']","1. El Gobierno fijará, previa consulta con las organizaciones sindicales y asociaciones empresariales más representativas, anualmente, el salario mínimo interprofesional, teniendo en cuenta:

a) El índice de precios de consumo.

b) La productividad media nacional alcanzada.

c) El incremento de la participación del trabajo en la renta nacional.

d) La coyuntura económica general.

Igualmente se fijará una revisión semestral para el caso de que no se cumplan las previsiones sobre el índice de precios citado.

La revisión del salario mínimo interprofesional no afectará a la estructura ni a la cuantía de los salarios profesionales cuando estos, en su conjunto y cómputo anual, fueran superiores a aquel.

2. El salario mínimo interprofesional, en su cuantía, es inembargable."
¿Cómo se liquida y se paga el salario?," El salario se liquida y se paga al finalizar cada periodo de actividad para los trabajos con carácter fijo-discontinuo. En caso de despido, el Estado puede cobrar el salario de tramitación si está involucrado en el despido, y las cuotas de la Seguridad Social correspondientes a dichos salarios serán de su cargo. Las prestaciones de la Seguridad Social se pueden pagar mediante moneda legal o cheque. El Fondo de Garantía Salarial puede reembolsar las cantidades satisfechas y se financia con las aportaciones de los empresarios, tanto públicos como privados.","['sindical, la opción corresponderá siempre a este. De no efectuar la opción, se entenderá que \nlo hace por la readmisión. Cuando la opción, expresa o presunta, sea en favor de la \nreadmisión, esta será obligada. Tanto si opta por la indemnización como si lo hace por la \nreadmisión, tendrá derecho a los salarios de tramitación a los que se refiere el apartado 2.\n5. Cuando la sentencia que declare la improcedencia del despido se dicte transcurridos \nmás de noventa días hábiles desde la fecha en que se presentó la demanda, el empresario \npodrá reclamar del Estado el abono de la percepción económica a la que se refiere el \napartado 2, correspondiente al tiempo que exceda de dichos noventa días hábiles.\nEn los casos de despido en que, con arreglo a este apartado, sean por cuenta del \nEstado los salarios de tramitación, serán con cargo al mismo las cuotas de la Seguridad \nSocial correspondientes a dichos salarios.\nSección 5.ª Procedimiento concursal\nArtículo 57.  Procedimiento concursal.'
 'percepciones del trabajador, así como las deducciones que legalmente procedan.\nLa liquidación de los salarios que correspondan a quienes presten servicios en trabajos \nque tengan el carácter de fijos-discontinuos, en los supuestos de conclusión de cada periodo \nde actividad, se llevará a cabo con sujeción a los trámites y garantías establecidos en el \nartículo 49.2.\n2. El derecho al salario a comisión nacerá en el momento de realizarse y pagarse el \nnegocio, la colocación o venta en que hubiera intervenido el trabajador, liquidándose y \npagándose, salvo que se hubiese pactado otra cosa, al finalizar el año.\nEl trabajador y sus representantes legales pueden pedir en cualquier momento \ncomunicaciones de la parte de los libros referentes a tales devengos.\n3. El interés por mora en el pago del salario será el diez por ciento de lo adeudado.\n4. El salario, así como el pago delegado de las prestaciones de la Seguridad Social, \npodrá efectuarlo el empresario en moneda de curso legal o mediante cheque u otra'
 'Para el reembolso de las cantidades satisfechas, el Fondo de Garantía Salarial se \nsubrogará obligatoriamente en los derechos y acciones de los trabajadores, conservando el \ncarácter de créditos privilegiados que les confiere el artículo 32 de esta ley. Si dichos \ncréditos concurriesen con los que puedan conservar los trabajadores por la parte no \nsatisfecha por el Fondo, unos y otros se abonarán a prorrata de sus respectivos importes.\n5. El Fondo de Garantía Salarial se financiará con las aportaciones efectuadas por todos \nlos empresarios a que se refiere el artículo 1.2 de esta ley, tanto si son públicos como \nprivados.\nEl tipo de cotización se fijará por el Gobierno sobre los salarios que sirvan de base para \nel cálculo de la cotización para atender las contingencias derivadas de accidentes de trabajo, \nenfermedad profesional y desempleo en el sistema de la Seguridad Social.\n6. A los efectos de este artículo se entiende que existe insolvencia del empresario']",['1. La liquidación y el pago del salario se harán puntual y documentalmente en la fecha y lugar convenidos o conforme a los usos y costumbres. El periodo de tiempo a que se refiere el abono de las retribuciones periódicas y regulares no podrá exceder de un mes.\nLa documentación del salario se realizará mediante la entrega al trabajador de un recibo individual y justificativo del pago del mismo.'],"1. La liquidación y el pago del salario se harán puntual y documentalmente en la fecha y lugar convenidos o conforme a los usos y costumbres. El periodo de tiempo a que se refiere el abono de las retribuciones periódicas y regulares no podrá exceder de un mes.

El trabajador y, con su autorización, sus representantes legales, tendrán derecho a percibir, sin que llegue el día señalado para el pago, anticipos a cuenta del trabajo ya realizado.

La documentación del salario se realizará mediante la entrega al trabajador de un recibo individual y justificativo del pago del mismo. El recibo de salarios se ajustará al modelo que apruebe el Ministerio de Empleo y Seguridad Social, salvo que por convenio colectivo o, en su defecto, por acuerdo entre la empresa y los representantes de los trabajadores, se establezca otro modelo que contenga con la debida claridad y separación las diferentes percepciones del trabajador, así como las deducciones que legalmente procedan.

La liquidación de los salarios que correspondan a quienes presten servicios en trabajos que tengan el carácter de fijos-discontinuos, en los supuestos de conclusión de cada periodo de actividad, se llevará a cabo con sujeción a los trámites y garantías establecidos en el artículo 49.2.

2. El derecho al salario a comisión nacerá en el momento de realizarse y pagarse el negocio, la colocación o venta en que hubiera intervenido el trabajador, liquidándose y pagándose, salvo que se hubiese pactado otra cosa, al finalizar el año.

El trabajador y sus representantes legales pueden pedir en cualquier momento comunicaciones de la parte de los libros referentes a tales devengos.

3. El interés por mora en el pago del salario será el diez por ciento de lo adeudado.

4. El salario, así como el pago delegado de las prestaciones de la Seguridad Social, podrá efectuarlo el empresario en moneda de curso legal o mediante cheque u otra modalidad de pago similar a través de entidades de crédito, previo informe al comité de empresa o delegados de personal."
¿Cómo se regulan las gratificaciones extraordinarias?," La regulación de las gratificaciones extraordinarias se establece en los acuerdos colectivos y pueden ocurrir dos veces al año, una para las fiestas de Navidad y otra en un mes determinado por el convenio colectivo o por acuerdo entre el empleador y los representantes legales de los trabajadores. La cuantía de estas gratificaciones se fija en los convenios colectivos. Además, puede acordarse que las gratificaciones extraordinarias se prorrateen en las doce mensualidades.","['Artículo 31.  Gratificaciones extraordinarias.\nEl trabajador tiene derecho a dos gratificaciones extraordinarias al año, una de ellas con \nocasión de las fiestas de Navidad y la otra en el mes que se fije por convenio colectivo o por \nacuerdo entre el empresario y los representantes legales de los trabajadores. Igualmente se \nfijará por convenio colectivo la cuantía de tales gratificaciones.\nNo obstante, podrá acordarse en convenio colectivo que las gratificaciones \nextraordinarias se prorrateen en las doce mensualidades.\nArtículo 32.  Garantías del salario.\n1. Los créditos salariales por los últimos treinta días de trabajo y en cuantía que no \nsupere el doble del salario mínimo interprofesional gozarán de preferencia sobre cualquier \notro crédito, aunque este se encuentre garantizado por prenda o hipoteca.\n2. Los créditos salariales gozarán de preferencia sobre cualquier otro crédito respecto de \nlos objetos elaborados por los trabajadores mientras sean propiedad o estén en posesión del \nempresario.'
 'Sección 4.ª Salarios y garantías salariales\nArtículo 26.  Del salario.\n1. Se considerará salario la totalidad de las percepciones económicas de los \ntrabajadores, en dinero o en especie, por la prestación profesional de los servicios laborales \npor cuenta ajena, ya retribuyan el trabajo efectivo, cualquiera que sea la forma de \nremuneración, o los periodos de descanso computables como de trabajo.\nEn ningún caso, incluidas las relaciones laborales de carácter especial a que se refiere el \nartículo 2, el salario en especie podrá superar el treinta por ciento de las percepciones \nsalariales del trabajador, ni dar lugar a la minoración de la cuantía íntegra en dinero del \nsalario mínimo interprofesional.\n2. No tendrán la consideración de salario las cantidades percibidas por el trabajador en \nconcepto de indemnizaciones o suplidos por los gastos realizados como consecuencia de su \nactividad laboral, las prestaciones e indemnizaciones de la Seguridad Social y las'
 'trabajo a turnos.\nb) El horario y la distribución del tiempo de trabajo, el régimen de trabajo a turnos y la \nplanificación anual de las vacaciones.\nc) La adaptación al ámbito de la empresa del sistema de clasificación profesional de las \npersonas trabajadoras.\nd) La adaptación de los aspectos de las modalidades de contratación que se atribuyen \npor esta ley a los convenios de empresa.\ne) Las medidas para favorecer la corresponsabilidad y la conciliación entre la vida \nlaboral, familiar y personal.\nf) Aquellas otras que dispongan los acuerdos y convenios colectivos a que se refiere el \nartículo 83.2.\nIgual prioridad aplicativa tendrán en estas materias los convenios colectivos para un \ngrupo de empresas o una pluralidad de empresas vinculadas por razones organizativas o \nproductivas y nominativamente identificadas a que se refiere el artículo 87.1.\nLos acuerdos y convenios colectivos a que se refiere el artículo 83.2 no podrán disponer \nde la prioridad aplicativa prevista en este apartado.']","['El trabajador tiene derecho a dos gratificaciones extraordinarias al año, una de ellas con ocasión de las fiestas de Navidad y la otra en el mes que se fije por convenio colectivo o por acuerdo entre el empresario y los representantes legales de los trabajadores. Igualmente se fijará por convenio colectivo la cuantía de tales gratificaciones.\n\nNo obstante, podrá acordarse en convenio colectivo que las gratificaciones extraordinarias se prorrateen en las doce mensualidades.']","El trabajador tiene derecho a dos gratificaciones extraordinarias al año, una de ellas con ocasión de las fiestas de Navidad y la otra en el mes que se fije por convenio colectivo o por acuerdo entre el empresario y los representantes legales de los trabajadores. Igualmente se fijará por convenio colectivo la cuantía de tales gratificaciones.

No obstante, podrá acordarse en convenio colectivo que las gratificaciones extraordinarias se prorrateen en las doce mensualidades."
¿Cuáles son las garantías de las que goza el salario?," Los salarios están protegidos por varias garantías, como:
- El salario en dinero no puede superar el 70% de las percepciones salariales del trabajador (Artículo 26.1).
- Las horas complementarias realizadas se computan a efectos de cotización a la Seguridad Social y periodos de carencia y base reguladora de las prestaciones (Artículo 26.i).
- La jubilación parcial requiere que el trabajador acuerde una reducción de jornada con su empresa (Artículo 26.6).
- El Fondo de Garantía Salarial se subrogará obligatoriamente en los derechos y acciones de los trabajadores (Artículo 26.6).
- El Fondo de Garantía Salarial se financia con las aportaciones de todos los empresarios (Artículo 26.5).
- Si el empleador está en insolvencia, estos créditos tienen un carácter privilegiado (Artículo 26.6).","['Sección 4.ª Salarios y garantías salariales\nArtículo 26.  Del salario.\n1. Se considerará salario la totalidad de las percepciones económicas de los \ntrabajadores, en dinero o en especie, por la prestación profesional de los servicios laborales \npor cuenta ajena, ya retribuyan el trabajo efectivo, cualquiera que sea la forma de \nremuneración, o los periodos de descanso computables como de trabajo.\nEn ningún caso, incluidas las relaciones laborales de carácter especial a que se refiere el \nartículo 2, el salario en especie podrá superar el treinta por ciento de las percepciones \nsalariales del trabajador, ni dar lugar a la minoración de la cuantía íntegra en dinero del \nsalario mínimo interprofesional.\n2. No tendrán la consideración de salario las cantidades percibidas por el trabajador en \nconcepto de indemnizaciones o suplidos por los gastos realizados como consecuencia de su \nactividad laboral, las prestaciones e indemnizaciones de la Seguridad Social y las'
 'Estas horas complementarias no se computarán a efectos de los porcentajes de horas \ncomplementarias pactadas que se establecen en la letra c).\nh) La realización de horas complementarias habrá de respetar, en todo caso, los límites \nen materia de jornada y descansos establecidos en los artículos 34.3 y 4; 36.1 y 37.1.\ni) Las horas complementarias efectivamente realizadas se retribuirán como ordinarias, \ncomputándose a efectos de bases de cotización a la Seguridad Social y periodos de \ncarencia y bases reguladoras de las prestaciones. A tal efecto, el número y retribución de las \nhoras complementarias realizadas se deberá recoger en el recibo individual de salarios y en \nlos documentos de cotización a la Seguridad Social.\n6. Para que el trabajador pueda acceder a la jubilación parcial, en los términos \nestablecidos en el texto refundido de la Ley General de la Seguridad Social y demás \ndisposiciones concordantes, deberá acordar con su empresa una reducción de jornada y de'
 'Para el reembolso de las cantidades satisfechas, el Fondo de Garantía Salarial se \nsubrogará obligatoriamente en los derechos y acciones de los trabajadores, conservando el \ncarácter de créditos privilegiados que les confiere el artículo 32 de esta ley. Si dichos \ncréditos concurriesen con los que puedan conservar los trabajadores por la parte no \nsatisfecha por el Fondo, unos y otros se abonarán a prorrata de sus respectivos importes.\n5. El Fondo de Garantía Salarial se financiará con las aportaciones efectuadas por todos \nlos empresarios a que se refiere el artículo 1.2 de esta ley, tanto si son públicos como \nprivados.\nEl tipo de cotización se fijará por el Gobierno sobre los salarios que sirvan de base para \nel cálculo de la cotización para atender las contingencias derivadas de accidentes de trabajo, \nenfermedad profesional y desempleo en el sistema de la Seguridad Social.\n6. A los efectos de este artículo se entiende que existe insolvencia del empresario']","['1. Los créditos salariales por los últimos treinta días de trabajo y en cuantía que no supere el doble del salario mínimo interprofesional gozarán de preferencia sobre cualquier otro crédito, aunque este se encuentre garantizado por prenda o hipoteca.\n\n2. Los créditos salariales gozarán de preferencia sobre cualquier otro crédito\n\n3. Los créditos por salarios no protegidos en los apartados anteriores tendrán la condición de singularmente privilegiados en la cuantía que resulte de multiplicar el triple del salario mínimo interprofesional por el número de días del salario pendientes de pago, gozando de preferencia sobre cualquier otro crédito, excepto los créditos con derecho real, en los supuestos en los que estos, con arreglo a la ley, sean preferentes. La misma consideración tendrán las indemnizaciones por despido en la cuantía correspondiente al mínimo legal calculada sobre una base que no supere el triple del salario mínimo.\n\n4. El plazo para ejercitar los derechos de preferencia del crédito salarial es de un año, a contar desde el momento en que debió percibirse el salario, transcurrido el cual prescribirán tales derechos.']","1. Los créditos salariales por los últimos treinta días de trabajo y en cuantía que no supere el doble del salario mínimo interprofesional gozarán de preferencia sobre cualquier otro crédito, aunque este se encuentre garantizado por prenda o hipoteca.

2. Los créditos salariales gozarán de preferencia sobre cualquier otro crédito respecto de los objetos elaborados por los trabajadores mientras sean propiedad o estén en posesión del empresario.

3. Los créditos por salarios no protegidos en los apartados anteriores tendrán la condición de singularmente privilegiados en la cuantía que resulte de multiplicar el triple del salario mínimo interprofesional por el número de días del salario pendientes de pago, gozando de preferencia sobre cualquier otro crédito, excepto los créditos con derecho real, en los supuestos en los que estos, con arreglo a la ley, sean preferentes. La misma consideración tendrán las indemnizaciones por despido en la cuantía correspondiente al mínimo legal calculada sobre una base que no supere el triple del salario mínimo.

4. El plazo para ejercitar los derechos de preferencia del crédito salarial es de un año, a contar desde el momento en que debió percibirse el salario, transcurrido el cual prescribirán tales derechos.

5. Las preferencias reconocidas en los apartados precedentes serán de aplicación en todos los supuestos en los que, no hallándose el empresario declarado en concurso, los correspondientes créditos concurran con otro u otros sobre bienes de aquel. En caso de concurso, serán de aplicación las disposiciones de la Ley 22/2003, de 9 de julio, Concursal, relativas a la clasificación de los créditos y a las ejecuciones y apremios."
¿Qué es el Fondo de Garantía Salarial?," El Fondo de Garantía Salarial es un fondo financiado por las empresas que se utiliza para el reembolso de salarios no pagados a los trabajadores. Se financia con aportaciones de todos los empleadores, y su administración está regida por la Ley General de Seguridad Social. Los recursos del fondo proceden de excedentes de ingresos que financian las prestaciones por desempleo, aportaciones en los Presupuestos Generales del Estado, aportaciones de la Unión Europea dirigidas al cumplimiento del objetivo y fines del Fondo, y cualquier otro tipo de rendimientos generados por el fondo.","['Para el reembolso de las cantidades satisfechas, el Fondo de Garantía Salarial se \nsubrogará obligatoriamente en los derechos y acciones de los trabajadores, conservando el \ncarácter de créditos privilegiados que les confiere el artículo 32 de esta ley. Si dichos \ncréditos concurriesen con los que puedan conservar los trabajadores por la parte no \nsatisfecha por el Fondo, unos y otros se abonarán a prorrata de sus respectivos importes.\n5. El Fondo de Garantía Salarial se financiará con las aportaciones efectuadas por todos \nlos empresarios a que se refiere el artículo 1.2 de esta ley, tanto si son públicos como \nprivados.\nEl tipo de cotización se fijará por el Gobierno sobre los salarios que sirvan de base para \nel cálculo de la cotización para atender las contingencias derivadas de accidentes de trabajo, \nenfermedad profesional y desempleo en el sistema de la Seguridad Social.\n6. A los efectos de este artículo se entiende que existe insolvencia del empresario'
 'primera del texto refundido de la Ley General de la Seguridad Social, y tendrán la \nconsideración de colectivo prioritario para el acceso a las iniciativas de formación del sistema \nde formación profesional para el empleo en el ámbito laboral.\nc) La Inspección de Trabajo y Seguridad Social y el Servicio Público de Empleo Estatal \ncolaborarán para el desarrollo de actuaciones efectivas de control de la aplicación del \nMecanismo, mediante la programación de actuaciones periódicas y de ejecución continuada.BOLETÍN OFICIAL DEL ESTADO\nLEGISLACIÓN CONSOLIDADA\nPágina 53'
 'a la formación, en la forma y condiciones previstas en su normativa de desarrollo.\nSerán recursos de este Fondo los excedentes de ingresos que financian las prestaciones \npor desempleo en su nivel contributivo y asistencial, las aportaciones que se consignen en \nlos Presupuestos Generales del Estado, las aportaciones procedentes de los instrumentos \nde financiación de la Unión Europea orientados al cumplimiento del objeto y fines del Fondo, \nasí como los rendimientos de cualquier naturaleza que genere el Fondo.\nArtículo 48.  Suspensión con reserva de puesto de trabajo.\n1. Al cesar las causas legales de suspensión, el trabajador tendrá derecho a la \nreincorporación al puesto de trabajo reservado, en todos los supuestos a que se refiere el \nartículo 45.1 excepto en los señalados en las letras a) y b), en que se estará a lo pactado.\n2. En el supuesto de incapacidad temporal, producida la extinción de esta situación con \ndeclaración de incapacidad permanente en los grados de incapacidad permanente total para']","['1. El Fondo de Garantía Salarial, abonará a los trabajadores el importe de los salarios pendientes de pago a causa de insolvencia o concurso del empresario.\n\nA los anteriores efectos, se considerará salario la cantidad reconocida como tal en acto de conciliación o en resolución judicial por todos los conceptos a que se refiere el artículo 26.1, así como los salarios de tramitación en los supuestos en que legalmente procedan, sin que pueda el Fondo abonar, por uno u otro concepto, conjunta o separadamente, un importe superior a la cantidad resultante de multiplicar el doble del salario mínimo interprofesional diario, incluyendo la parte proporcional de las pagas extraordinarias, por el número de días de salario pendiente de pago, con un máximo de ciento veinte días.']","1. El Fondo de Garantía Salarial, organismo autónomo adscrito al Ministerio de Empleo y Seguridad Social, con personalidad jurídica y capacidad de obrar para el cumplimiento de sus fines, abonará a los trabajadores el importe de los salarios pendientes de pago a causa de insolvencia o concurso del empresario.

A los anteriores efectos, se considerará salario la cantidad reconocida como tal en acto de conciliación o en resolución judicial por todos los conceptos a que se refiere el artículo 26.1, así como los salarios de tramitación en los supuestos en que legalmente procedan, sin que pueda el Fondo abonar, por uno u otro concepto, conjunta o separadamente, un importe superior a la cantidad resultante de multiplicar el doble del salario mínimo interprofesional diario, incluyendo la parte proporcional de las pagas extraordinarias, por el número de días de salario pendiente de pago, con un máximo de ciento veinte días."
¿Cuáles son las características de la jornada de trabajo?,"1. La duración máxima de la jornada ordinaria de trabajo es de 40 horas semanales.
2. El diez por ciento de la jornada puede ser distribuido irregularmente a lo largo del año, con un preaviso mínimo de cinco días para el trabajador.
3. Los trabajadores tienen derecho a solicitar adaptaciones en la duración y distribución de la jornada de trabajo.
4. La compensación de las diferencias entre la jornada efectiva y la prevista puede ser establecida por medio de un convenio colectivo o acuerdo individual.
5. La empresa puede establecer modificaciones sustanciales en las condiciones de trabajo si existen razones económicas, técnicas, organizativas o de producción, teniendo en cuenta la competitividad y productividad de la empresa.
6. Modificaciones sustanciales que afectan a la jornada de trabajo, horario, distribución del tiempo de trabajo, régimen de trabajo a turnos requieren consultas previas con los representantes de los trabajadores.","['jornada diaria el trabajador se encuentre en su puesto de trabajo.\n6. Anualmente se elaborará por la empresa el calendario laboral, debiendo exponerse un \nejemplar del mismo en un lugar visible de cada centro de trabajo.\n7. El Gobierno, a propuesta de la persona titular del Ministerio de Trabajo, Migraciones y \nSeguridad Social y previa consulta a las organizaciones sindicales y empresariales más \nrepresentativas, podrá establecer ampliaciones o limitaciones en la ordenación y duración de \nla jornada de trabajo y de los descansos, así como especialidades en las obligaciones de \nregistro de jornada, para aquellos sectores, trabajos y categorías profesionales que por sus \npeculiaridades así lo requieran.\n8. Las personas trabajadoras tienen derecho a solicitar las adaptaciones de la duración y \ndistribución de la jornada de trabajo, en la ordenación del tiempo de trabajo y en la forma de \nprestación, incluida la prestación de su trabajo a distancia, para hacer efectivo su derecho a'
 'Sección 5.ª Tiempo de trabajo\nArtículo 34.  Jornada.\n1. La duración de la jornada de trabajo será la pactada en los convenios colectivos o \ncontratos de trabajo.\nLa duración máxima de la jornada ordinaria de trabajo será de cuarenta horas semanales \nde trabajo efectivo de promedio en cómputo anual.\n2. Mediante convenio colectivo o, en su defecto, por acuerdo entre la empresa y los \nrepresentantes de los trabajadores, se podrá establecer la distribución irregular de la jornada \na lo largo del año. En defecto de pacto, la empresa podrá distribuir de manera irregular a lo \nlargo del año el diez por ciento de la jornada de trabajo.\nDicha distribución deberá respetar en todo caso los periodos mínimos de descanso diario \ny semanal previstos en la ley y el trabajador deberá conocer con un preaviso mínimo de \ncinco días el día y la hora de la prestación de trabajo resultante de aquella.\nLa compensación de las diferencias, por exceso o por defecto, entre la jornada realizada'
 'los puestos de trabajo a que se refiere este artículo. Mediante convenio colectivo o acuerdo \nalcanzado durante el periodo de consultas se podrán establecer prioridades de permanencia \na favor de trabajadores de otros colectivos, tales como trabajadores con cargas familiares, \nmayores de determinada edad o personas con discapacidad.\nArtículo 41.  Modificaciones sustanciales de condiciones de trabajo.\n1. La dirección de la empresa podrá acordar modificaciones sustanciales de las \ncondiciones de trabajo cuando existan probadas razones económicas, técnicas, \norganizativas o de producción. Se considerarán tales las que estén relacionadas con la \ncompetitividad, productividad u organización técnica o del trabajo en la empresa.\nTendrán la consideración de modificaciones sustanciales de las condiciones de trabajo, \nentre otras, las que afecten a las siguientes materias:\na) Jornada de trabajo.\nb) Horario y distribución del tiempo de trabajo.\nc) Régimen de trabajo a turnos.']","['1. La duración de la jornada de trabajo será la pactada en los convenios colectivos o contratos de trabajo.\n\nLa duración máxima de la jornada ordinaria de trabajo será de cuarenta horas semanales de trabajo efectivo de promedio en cómputo anual.\n\n2. Mediante convenio colectivo o, en su defecto, por acuerdo entre la empresa y los representantes de los trabajadores, se podrá establecer la distribución irregular de la jornada a lo largo del año. En defecto de pacto, la empresa podrá distribuir de manera irregular a lo largo del año el diez por ciento de la jornada de trabajo.\n\n deberá respetar en todo caso los periodos mínimos de descanso diario y semanal previstos en la ley y el trabajador deberá conocer con un preaviso mínimo de cinco días el día y la hora de la prestación de trabajo resultante de aquella.\n\nLa compensación de las diferencias, por exceso o por defecto, entre la jornada realizada y la duración máxima de la jornada ordinaria de trabajo legal o pactada será exigible según lo acordado en convenio colectivo o, a falta de previsión al respecto, por acuerdo entre la empresa y los representantes de los trabajadores. En defecto de pacto, las diferencias derivadas de la distribución irregular de la jornada deberán quedar compensadas en el plazo de doce meses desde que se produzcan.\n\n3. Entre el final de una jornada y el comienzo de la siguiente mediarán, como mínimo, doce horas.\n\nEl número de horas ordinarias de trabajo efectivo no podrá ser superior a nueve diarias, salvo que por convenio colectivo o, en su defecto, acuerdo entre la empresa y los representantes de los trabajadores, se establezca otra distribución del tiempo de trabajo diario, respetando en todo caso el descanso entre jornadas.\n\nLos trabajadores menores de dieciocho años no podrán realizar más de ocho horas diarias de trabajo efectivo,\n\n4. Siempre que la duración de la jornada diaria continuada exceda de seis horas, deberá establecerse un periodo de descanso durante la misma de duración no inferior a quince minutos.']","1. La duración de la jornada de trabajo será la pactada en los convenios colectivos o contratos de trabajo.

La duración máxima de la jornada ordinaria de trabajo será de cuarenta horas semanales de trabajo efectivo de promedio en cómputo anual.

2. Mediante convenio colectivo o, en su defecto, por acuerdo entre la empresa y los representantes de los trabajadores, se podrá establecer la distribución irregular de la jornada a lo largo del año. En defecto de pacto, la empresa podrá distribuir de manera irregular a lo largo del año el diez por ciento de la jornada de trabajo.

Dicha distribución deberá respetar en todo caso los periodos mínimos de descanso diario y semanal previstos en la ley y el trabajador deberá conocer con un preaviso mínimo de cinco días el día y la hora de la prestación de trabajo resultante de aquella.

La compensación de las diferencias, por exceso o por defecto, entre la jornada realizada y la duración máxima de la jornada ordinaria de trabajo legal o pactada será exigible según lo acordado en convenio colectivo o, a falta de previsión al respecto, por acuerdo entre la empresa y los representantes de los trabajadores. En defecto de pacto, las diferencias derivadas de la distribución irregular de la jornada deberán quedar compensadas en el plazo de doce meses desde que se produzcan.

3. Entre el final de una jornada y el comienzo de la siguiente mediarán, como mínimo, doce horas.

El número de horas ordinarias de trabajo efectivo no podrá ser superior a nueve diarias, salvo que por convenio colectivo o, en su defecto, acuerdo entre la empresa y los representantes de los trabajadores, se establezca otra distribución del tiempo de trabajo diario, respetando en todo caso el descanso entre jornadas.

Los trabajadores menores de dieciocho años no podrán realizar más de ocho horas diarias de trabajo efectivo, incluyendo, en su caso, el tiempo dedicado a la formación y, si trabajasen para varios empleadores, las horas realizadas con cada uno de ellos.

4. Siempre que la duración de la jornada diaria continuada exceda de seis horas, deberá establecerse un periodo de descanso durante la misma de duración no inferior a quince minutos. Este periodo de descanso se considerará tiempo de trabajo efectivo cuando así esté establecido o se establezca por convenio colectivo o contrato de trabajo.

En el caso de los trabajadores menores de dieciocho años, el periodo de descanso tendrá una duración mínima de treinta minutos, y deberá establecerse siempre que la duración de la jornada diaria continuada exceda de cuatro horas y media."
"¿El trabajador tiene derecho a adaptar la jornada de trabajo para conciliar su vida personal, familiar y laboral?"," Sí, el trabajador tiene derecho a adaptar la jornada de trabajo para conciliar su vida personal y familiar, según lo estipulado en la Ley 36/2011. Este derecho se puede ejercer hasta que sus hijos o hijas cumplan doce años o cuando tiene necesidades de cuidado respecto a los menores de edad, familiares cercanos o pareja de hecho. Las adaptaciones deben ser razonables y proporcionadas en relación con las necesidades de la persona trabajadora y con las necesidades organizativas o productivas de la empresa. La resolución de discrepancias sobre la concreción horaria y determinación de los periodos de disfrute se realizará a través del procedimiento establecido en el artículo 139 de la citada Ley.","['jornada diaria el trabajador se encuentre en su puesto de trabajo.\n6. Anualmente se elaborará por la empresa el calendario laboral, debiendo exponerse un \nejemplar del mismo en un lugar visible de cada centro de trabajo.\n7. El Gobierno, a propuesta de la persona titular del Ministerio de Trabajo, Migraciones y \nSeguridad Social y previa consulta a las organizaciones sindicales y empresariales más \nrepresentativas, podrá establecer ampliaciones o limitaciones en la ordenación y duración de \nla jornada de trabajo y de los descansos, así como especialidades en las obligaciones de \nregistro de jornada, para aquellos sectores, trabajos y categorías profesionales que por sus \npeculiaridades así lo requieran.\n8. Las personas trabajadoras tienen derecho a solicitar las adaptaciones de la duración y \ndistribución de la jornada de trabajo, en la ordenación del tiempo de trabajo y en la forma de \nprestación, incluida la prestación de su trabajo a distancia, para hacer efectivo su derecho a'
 'finalizará el permiso de cuidado del lactante o la reducción de jornada.\nLas discrepancias surgidas entre empresario y trabajador sobre la concreción horaria y la \ndeterminación de los periodos de disfrute previstos en los apartados 4, 5 y 6 serán resueltas \npor la jurisdicción social a través del procedimiento establecido en el artículo 139 de la Ley \n36/2011, de 10 de octubre, Reguladora de la Jurisdicción Social.\n8. Las personas trabajadoras que tengan la consideración de víctimas de violencia de \ngénero, de violencia sexual o de víctimas del terrorismo tendrán derecho, para hacer efectiva \nsu protección o su derecho a la asistencia social integral, a la reducción de la jornada de \ntrabajo con disminución proporcional del salario o a la reordenación del tiempo de trabajo, a \ntravés de la adaptación del horario, de la aplicación del horario flexible o de otras formas de \nordenación del tiempo de trabajo que se utilicen en la empresa. También tendrán derecho a'
 'prestación, incluida la prestación de su trabajo a distancia, para hacer efectivo su derecho a \nla conciliación de la vida familiar y laboral. Dichas adaptaciones deberán ser razonables y \nproporcionadas en relación con las necesidades de la persona trabajadora y con las \nnecesidades organizativas o productivas de la empresa.\nEn el caso de que tengan hijos o hijas, las personas trabajadoras tienen derecho a \nefectuar dicha solicitud hasta que los hijos o hijas cumplan doce años.\nAsimismo, tendrán ese derecho aquellas que tengan necesidades de cuidado respecto \nde los hijos e hijas mayores de doce años, el cónyuge o pareja de hecho, familiares por \nconsanguinidad hasta el segundo grado de la persona trabajadora, así como de otras BOLETÍN OFICIAL DEL ESTADO\nLEGISLACIÓN CONSOLIDADA\nPágina 33']","['El trabajador tendrá derecho a adaptar la duración y distribución de la jornada de trabajo para hacer efectivo su derecho a la conciliación de la vida personal, familiar y laboral \n\nA tal fin, se promoverá la utilización de la jornada continuada, el horario flexible u otros modos de organización del tiempo de trabajo']","El trabajador tendrá derecho a adaptar la duración y distribución de la jornada de trabajo para hacer efectivo su derecho a la conciliación de la vida personal, familiar y laboral en los términos que se establezcan en la negociación colectiva o en el acuerdo a que llegue con el empresario respetando, en su caso, lo previsto en aquella.

A tal fin, se promoverá la utilización de la jornada continuada, el horario flexible u otros modos de organización del tiempo de trabajo y de los descansos que permitan la mayor compatibilidad entre el derecho a la conciliación de la vida personal, familiar y laboral de los trabajadores y la mejora de la productividad en las empresas."
¿Cómo se regulan las horas extraordinarias?," La cantidad máxima de horas extraordinarias autorizadas es de 80 por año. Esto puede cambiar según el contrato individual o colectivo de trabajo y la modalidad o duración del contrato del trabajador. El trabajo nocturno y a turnos está regulado en el artículo 36. Las horas extraordinarias deben ser registradas día a día y totalizadas al final de cada periodo de pago, y la empresa debe entregar una copia del resumen al trabajador en el recibo correspondiente. En ausencia de un acuerdo específico, las horas extraordinarias deben ser compensadas mediante descanso dentro de los cuatro meses siguientes a su realización. El Gobierno puede suprimir o reducir el número máximo de horas extraordinarias durante un período determinado.","['territoriales, para incrementar las oportunidades de colocación de los trabajadores en \nsituación de desempleo.\n3. No se tendrá en cuenta, a efectos de la duración máxima de la jornada ordinaria \nlaboral, ni para el cómputo del número máximo de las horas extraordinarias autorizadas, el \nexceso de las trabajadas para prevenir o reparar siniestros y otros daños extraordinarios y \nurgentes, sin perjuicio de su compensación como horas extraordinarias.\n4. La prestación de trabajo en horas extraordinarias será voluntaria, salvo que su \nrealización se haya pactado en convenio colectivo o contrato individual de trabajo, dentro de \nlos límites del apartado 2.\n5. A efectos del cómputo de horas extraordinarias, la jornada de cada trabajador se \nregistrará día a día y se totalizará en el periodo fijado para el abono de las retribuciones, \nentregando copia del resumen al trabajador en el recibo correspondiente.\nArtículo 36.  Trabajo nocturno, trabajo a turnos y ritmo de trabajo.'
 '2. El número de horas extraordinarias no podrá ser superior a ochenta al año, salvo lo \nprevisto en el apartado 3. Para los trabajadores que por la modalidad o duración de su \ncontrato realizasen una jornada en cómputo anual inferior a la jornada general en la \nempresa, el número máximo anual de horas extraordinarias se reducirá en la misma \nproporción que exista entre tales jornadas.\nA los efectos de lo dispuesto en el párrafo anterior, no se computarán las horas \nextraordinarias que hayan sido compensadas mediante descanso dentro de los cuatro \nmeses siguientes a su realización.\nEl Gobierno podrá suprimir o reducir el número máximo de horas extraordinarias por \ntiempo determinado, con carácter general o para ciertas ramas de actividad o ámbitos BOLETÍN OFICIAL DEL ESTADO\nLEGISLACIÓN CONSOLIDADA\nPágina 34'
 'La empresa conservará los registros a que se refiere este precepto durante cuatro años \ny permanecerán a disposición de las personas trabajadoras, de sus representantes legales y \nde la Inspección de Trabajo y Seguridad Social.\nArtículo 35.  Horas extraordinarias.\n1. Tendrán la consideración de horas extraordinarias aquellas horas de trabajo que se \nrealicen sobre la duración máxima de la jornada ordinaria de trabajo, fijada de acuerdo con el \nartículo anterior. Mediante convenio colectivo o, en su defecto, contrato individual, se optará \nentre abonar las horas extraordinarias en la cuantía que se fije, que en ningún caso podrá \nser inferior al valor de la hora ordinaria, o compensarlas por tiempos equivalentes de \ndescanso retribuido. En ausencia de pacto al respecto, se entenderá que las horas \nextraordinarias realizadas deberán ser compensadas mediante descanso dentro de los \ncuatro meses siguientes a su realización.\n2. El número de horas extraordinarias no podrá ser superior a ochenta al año, salvo lo']","['1. Tendrán la consideración de horas extraordinarias aquellas horas de trabajo que se realicen sobre la duración máxima de la jornada ordinaria de trabajo, fijada de acuerdo con el artículo anterior. Mediante convenio colectivo o, en su defecto, contrato individual, se optará entre abonar las horas extraordinarias en la cuantía que se fije, que en ningún caso podrá ser inferior al valor de la hora ordinaria, o compensarlas por tiempos equivalentes de descanso retribuido. En ausencia de pacto al respecto, se entenderá que las horas extraordinarias realizadas deberán ser compensadas mediante descanso dentro de los cuatro meses siguientes a su realización.\n\n2. El número de horas extraordinarias no podrá ser superior a ochenta al año, salvo lo previsto en el apartado 3. Para los trabajadores que por la modalidad o duración de su contrato realizasen una jornada en cómputo anual inferior a la jornada general en la empresa, el número máximo anual de horas extraordinarias se reducirá en la misma proporción que exista entre tales jornadas.\n\n no se computarán las horas extraordinarias que hayan sido compensadas mediante descanso dentro de los cuatro meses siguientes a su realización.\n\n\n3. No se tendrá en cuenta, a efectos de la duración máxima de la jornada ordinaria laboral, ni para el cómputo del número máximo de las horas extraordinarias autorizadas, el exceso de las trabajadas para prevenir o reparar siniestros y otros daños extraordinarios y urgentes, sin perjuicio de su compensación como horas extraordinarias.\n\n4. La prestación de trabajo en horas extraordinarias será voluntaria, salvo que su realización se haya pactado en convenio colectivo o contrato individual de trabajo,']","1. Tendrán la consideración de horas extraordinarias aquellas horas de trabajo que se realicen sobre la duración máxima de la jornada ordinaria de trabajo, fijada de acuerdo con el artículo anterior. Mediante convenio colectivo o, en su defecto, contrato individual, se optará entre abonar las horas extraordinarias en la cuantía que se fije, que en ningún caso podrá ser inferior al valor de la hora ordinaria, o compensarlas por tiempos equivalentes de descanso retribuido. En ausencia de pacto al respecto, se entenderá que las horas extraordinarias realizadas deberán ser compensadas mediante descanso dentro de los cuatro meses siguientes a su realización.

2. El número de horas extraordinarias no podrá ser superior a ochenta al año, salvo lo previsto en el apartado 3. Para los trabajadores que por la modalidad o duración de su contrato realizasen una jornada en cómputo anual inferior a la jornada general en la empresa, el número máximo anual de horas extraordinarias se reducirá en la misma proporción que exista entre tales jornadas.

A los efectos de lo dispuesto en el párrafo anterior, no se computarán las horas extraordinarias que hayan sido compensadas mediante descanso dentro de los cuatro meses siguientes a su realización.

El Gobierno podrá suprimir o reducir el número máximo de horas extraordinarias por tiempo determinado, con carácter general o para ciertas ramas de actividad o ámbitos territoriales, para incrementar las oportunidades de colocación de los trabajadores en situación de desempleo.

3. No se tendrá en cuenta, a efectos de la duración máxima de la jornada ordinaria laboral, ni para el cómputo del número máximo de las horas extraordinarias autorizadas, el exceso de las trabajadas para prevenir o reparar siniestros y otros daños extraordinarios y urgentes, sin perjuicio de su compensación como horas extraordinarias.

4. La prestación de trabajo en horas extraordinarias será voluntaria, salvo que su realización se haya pactado en convenio colectivo o contrato individual de trabajo, dentro de los límites del apartado 2.

5. A efectos del cómputo de horas extraordinarias, la jornada de cada trabajador se registrará día a día y se totalizará en el periodo fijado para el abono de las retribuciones, entregando copia del resumen al trabajador en el recibo correspondiente."
¿Qué se entiende como trabajo nocturno?," El trabajo nocturno es aquel que se realiza entre las 10 de la noche y las 6 de la mañana, como está estipulado en el artículo 36.1 de la ley en cuestión. Los trabajadores nocturnos no pueden tener jornada diaria mayor a ocho horas en un período de referencia de quince días y no podrán hacer horas extraordinarias. Además, para ser considerado como tal, el trabajador debe realizar normalmente en periodo nocturno una parte no inferior a tres horas de su jornada diaria de trabajo o una parte no inferior a un tercio de su jornada anual de trabajo.","['Resultará de aplicación a lo establecido en el párrafo segundo lo dispuesto en el artículo \n34.7 Igualmente, el Gobierno podrá establecer limitaciones y garantías adicionales a las \nprevistas en el presente artículo para la realización de trabajo nocturno en ciertas actividades \no por determinada categoría de trabajadores, en función de los riesgos que comporten para \nsu salud y seguridad.\n2. El trabajo nocturno tendrá una retribución específica que se determinará en la \nnegociación colectiva, salvo que el salario se haya establecido atendiendo a que el trabajo \nsea nocturno por su propia naturaleza o se haya acordado la compensación de este trabajo \npor descansos.\n3. Se considera trabajo a turnos toda forma de organización del trabajo en equipo según \nla cual los trabajadores ocupan sucesivamente los mismos puestos de trabajo, según un \ncierto ritmo, continuo o discontinuo, implicando para el trabajador la necesidad de prestar'
 'Artículo 36.  Trabajo nocturno, trabajo a turnos y ritmo de trabajo.\n1. A los efectos de lo dispuesto en esta ley, se considera trabajo nocturno el realizado \nentre las diez de la noche y las seis de la mañana. El empresario que recurra regularmente a \nla realización de trabajo nocturno deberá informar de ello a la autoridad laboral.\nLa jornada de trabajo de los trabajadores nocturnos no podrá exceder de ocho horas \ndiarias de promedio, en un periodo de referencia de quince días. Dichos trabajadores no \npodrán realizar horas extraordinarias.\nPara la aplicación de lo dispuesto en el párrafo anterior, se considerará trabajador \nnocturno a aquel que realice normalmente en periodo nocturno una parte no inferior a tres \nhoras de su jornada diaria de trabajo, así como a aquel que se prevea que puede realizar en \ntal periodo una parte no inferior a un tercio de su jornada de trabajo anual.\nResultará de aplicación a lo establecido en el párrafo segundo lo dispuesto en el artículo'
 'A efectos de lo dispuesto en el párrafo anterior, se entenderá por «trabajador a tiempo \ncompleto comparable» a un trabajador a tiempo completo de la misma empresa y centro de \ntrabajo, con el mismo tipo de contrato de trabajo y que realice un trabajo idéntico o similar. Si \nen la empresa no hubiera ningún trabajador comparable a tiempo completo, se considerará \nla jornada a tiempo completo prevista en el convenio colectivo de aplicación o, en su defecto, \nla jornada máxima legal.\n2. El contrato a tiempo parcial podrá concertarse por tiempo indefinido o por duración \ndeterminada en los supuestos en los que legalmente se permita la utilización de esta \nmodalidad de contratación.\n3. (Derogado)\n4. El contrato a tiempo parcial se regirá por las siguientes reglas:\na) El contrato, conforme a lo dispuesto en el artículo 8.2, se deberá formalizar \nnecesariamente por escrito. En el contrato deberá figurar el número de horas ordinarias de']",['Se considera trabajo nocturno el realizado entre las diez de la noche y las seis de la mañana.'],Se considera trabajo nocturno el realizado entre las diez de la noche y las seis de la mañana.
¿Cuáles son los requisitos en el caso de tener trabajadores nocturnos?,"Requisitos para tener trabajadores nocturnos:

* No puede celebrarse contrato formativo en alternancia si la persona trabajadora ha desempeñado el trabajo correspondiente con anterioridad por tiempo superior a 6 meses en la misma empresa. (punto j del contexto)
* Los trabajadores nocturnos no pueden realizar horas complementarias ni horas extraordinarias, ni trabajar a turnos. (punto k del contexto)
* No puede establecerse periodo de prueba en estos contratos. (punto l del contexto)
* La retribución será la establecida para estos contratos en el convenio colectivo. (punto m del contexto)","['3. El trabajador tendrá derecho a la retribución correspondiente a las funciones que \nefectivamente realice, salvo en los casos de encomienda de funciones inferiores, en los que \nmantendrá la retribución de origen. No cabrá invocar como causa de despido objetivo la \nineptitud sobrevenida o la falta de adaptación en los supuestos de realización de funciones \ndistintas de las habituales como consecuencia de la movilidad funcional.\n4. El cambio de funciones distintas de las pactadas no incluido en los supuestos \nprevistos en este artículo requerirá el acuerdo de las partes o, en su defecto, el sometimiento \na las reglas previstas para las modificaciones sustanciales de condiciones de trabajo o a las \nque a tal fin se hubieran establecido en convenio colectivo.\nArtículo 40.  Movilidad geográfica.\n1. El traslado de trabajadores que no hayan sido contratados específicamente para \nprestar sus servicios en empresas con centros de trabajo móviles o itinerantes a un centro'
 'j) No se podrán celebrar contratos formativos en alternancia cuando la actividad o puesto \nde trabajo correspondiente al contrato haya sido desempeñado con anterioridad por la \npersona trabajadora en la misma empresa bajo cualquier modalidad por tiempo superior a \nseis meses.\nk) Las personas contratadas con contrato de formación en alternancia no podrán realizar \nhoras complementarias ni horas extraordinarias, salvo en el supuesto previsto en el artículo \n35.3. Tampoco podrán realizar trabajos nocturnos ni trabajo a turnos.\nExcepcionalmente, podrán realizarse actividades laborales en los citados periodos \ncuando las actividades formativas para la adquisición de los aprendizajes previstos en el \nplan formativo no puedan desarrollarse en otros periodos, debido a la naturaleza de la \nactividad.\nl) No podrá establecerse periodo de prueba en estos contratos.\nm) La retribución será la establecida para estos contratos en el convenio colectivo de'
 'f) La de las personas que intervengan en operaciones mercantiles por cuenta de uno o \nmás empresarios sin asumir el riesgo y ventura de aquellas.\ng) La de los trabajadores con discapacidad que presten sus servicios en los centros \nespeciales de empleo.\nh) (Derogada)\ni) La de los menores sometidos a la ejecución de medidas de internamiento para el \ncumplimiento de su responsabilidad penal.\nj) La de residencia para la formación de especialistas en Ciencias de la Salud.\nk) La de los abogados que prestan servicios en despachos de abogados, individuales o \ncolectivos.\nl) Cualquier otro trabajo que sea expresamente declarado como relación laboral de \ncarácter especial por una ley.\n2. En todos los supuestos señalados en el apartado anterior, la regulación de dichas \nrelaciones laborales respetará los derechos básicos reconocidos por la Constitución.\nArtículo 3.  Fuentes de la relación laboral.\n1. Los derechos y obligaciones concernientes a la relación laboral se regulan:']","['El empresario que recurra regularmente a la realización de trabajo nocturno deberá informar de ello a la autoridad laboral.\n\nLa jornada de trabajo de los trabajadores nocturnos no podrá exceder de ocho horas diarias de promedio, en un periodo de referencia de quince días. Dichos trabajadores no podrán realizar horas extraordinarias.\n, se considerará trabajador nocturno a aquel que realice normalmente en periodo nocturno una parte no inferior a tres horas de su jornada diaria de trabajo, así como a aquel que se prevea que puede realizar en tal periodo una parte no inferior a un tercio de su jornada de trabajo anual.']","El empresario que recurra regularmente a la realización de trabajo nocturno deberá informar de ello a la autoridad laboral.

La jornada de trabajo de los trabajadores nocturnos no podrá exceder de ocho horas diarias de promedio, en un periodo de referencia de quince días. Dichos trabajadores no podrán realizar horas extraordinarias.

Para la aplicación de lo dispuesto en el párrafo anterior, se considerará trabajador nocturno a aquel que realice normalmente en periodo nocturno una parte no inferior a tres horas de su jornada diaria de trabajo, así como a aquel que se prevea que puede realizar en tal periodo una parte no inferior a un tercio de su jornada de trabajo anual.

Resultará de aplicación a lo establecido en el párrafo segundo lo dispuesto en el artículo 34.7 Igualmente, el Gobierno podrá establecer limitaciones y garantías adicionales a las previstas en el presente artículo para la realización de trabajo nocturno en ciertas actividades o por determinada categoría de trabajadores, en función de los riesgos que comporten para su salud y seguridad.

2. El trabajo nocturno tendrá una retribución específica que se determinará en la negociación colectiva, salvo que el salario se haya establecido atendiendo a que el trabajo sea nocturno por su propia naturaleza o se haya acordado la compensación de este trabajo por descansos."
¿Qué se considera trabajo a turnos?," El trabajo a turnos se considera una forma de organización del trabajo en equipo, según la cual los trabajadores ocupan sucesivamente los mismos puestos de trabajo, según un cierto ritmo. Esto implica para el trabajador la necesidad de prestar servicio en diferentes horas y días. Este concepto está regulado en el artículo 36 de la ley laboral establecida.","['Resultará de aplicación a lo establecido en el párrafo segundo lo dispuesto en el artículo \n34.7 Igualmente, el Gobierno podrá establecer limitaciones y garantías adicionales a las \nprevistas en el presente artículo para la realización de trabajo nocturno en ciertas actividades \no por determinada categoría de trabajadores, en función de los riesgos que comporten para \nsu salud y seguridad.\n2. El trabajo nocturno tendrá una retribución específica que se determinará en la \nnegociación colectiva, salvo que el salario se haya establecido atendiendo a que el trabajo \nsea nocturno por su propia naturaleza o se haya acordado la compensación de este trabajo \npor descansos.\n3. Se considera trabajo a turnos toda forma de organización del trabajo en equipo según \nla cual los trabajadores ocupan sucesivamente los mismos puestos de trabajo, según un \ncierto ritmo, continuo o discontinuo, implicando para el trabajador la necesidad de prestar'
 'A efectos de lo dispuesto en el párrafo anterior, se entenderá por «trabajador a tiempo \ncompleto comparable» a un trabajador a tiempo completo de la misma empresa y centro de \ntrabajo, con el mismo tipo de contrato de trabajo y que realice un trabajo idéntico o similar. Si \nen la empresa no hubiera ningún trabajador comparable a tiempo completo, se considerará \nla jornada a tiempo completo prevista en el convenio colectivo de aplicación o, en su defecto, \nla jornada máxima legal.\n2. El contrato a tiempo parcial podrá concertarse por tiempo indefinido o por duración \ndeterminada en los supuestos en los que legalmente se permita la utilización de esta \nmodalidad de contratación.\n3. (Derogado)\n4. El contrato a tiempo parcial se regirá por las siguientes reglas:\na) El contrato, conforme a lo dispuesto en el artículo 8.2, se deberá formalizar \nnecesariamente por escrito. En el contrato deberá figurar el número de horas ordinarias de'
 'Artículo 36.  Trabajo nocturno, trabajo a turnos y ritmo de trabajo.\n1. A los efectos de lo dispuesto en esta ley, se considera trabajo nocturno el realizado \nentre las diez de la noche y las seis de la mañana. El empresario que recurra regularmente a \nla realización de trabajo nocturno deberá informar de ello a la autoridad laboral.\nLa jornada de trabajo de los trabajadores nocturnos no podrá exceder de ocho horas \ndiarias de promedio, en un periodo de referencia de quince días. Dichos trabajadores no \npodrán realizar horas extraordinarias.\nPara la aplicación de lo dispuesto en el párrafo anterior, se considerará trabajador \nnocturno a aquel que realice normalmente en periodo nocturno una parte no inferior a tres \nhoras de su jornada diaria de trabajo, así como a aquel que se prevea que puede realizar en \ntal periodo una parte no inferior a un tercio de su jornada de trabajo anual.\nResultará de aplicación a lo establecido en el párrafo segundo lo dispuesto en el artículo']","['Se considera trabajo a turnos toda forma de organización del trabajo en equipo según la cual los trabajadores ocupan sucesivamente los mismos puestos de trabajo, según un cierto ritmo, continuo o discontinuo, implicando para el trabajador la necesidad de prestar sus servicios en horas diferentes en un periodo determinado de días o de semanas.']","Se considera trabajo a turnos toda forma de organización del trabajo en equipo según la cual los trabajadores ocupan sucesivamente los mismos puestos de trabajo, según un cierto ritmo, continuo o discontinuo, implicando para el trabajador la necesidad de prestar sus servicios en horas diferentes en un periodo determinado de días o de semanas.

En las empresas con procesos productivos continuos durante las veinticuatro horas del día, en la organización del trabajo de los turnos se tendrá en cuenta la rotación de los mismos y que ningún trabajador esté en el de noche más de dos semanas consecutivas, salvo adscripción voluntaria.

Las empresas que por la naturaleza de su actividad realicen el trabajo en régimen de turnos, incluidos los domingos y días festivos, podrán efectuarlo bien por equipos de trabajadores que desarrollen su actividad por semanas completas, o contratando personal para completar los equipos necesarios durante uno o más días a la semana."
¿Cuál es el régimen del descanso semanal?," El régimen de descanso semanal no está especificado en el contexto proporcionado. Sin embargo, según la ley española, cada trabajador tiene derecho a dos días de descanso continuo al mes (un domingo y un feriado), y si no se cumple este requisito, debe ser compensado económicamente. Además, el calendario de vacaciones se fija en cada empresa y el trabajador debe conocer las fechas que le corresponden dos meses antes.","['siguientes materias:\na) Jornada de trabajo.\nb) Horario y distribución del tiempo de trabajo.\nc) Régimen de trabajo a turnos.BOLETÍN OFICIAL DEL ESTADO\nLEGISLACIÓN CONSOLIDADA\nPágina 77'
 '2. El número de horas extraordinarias no podrá ser superior a ochenta al año, salvo lo \nprevisto en el apartado 3. Para los trabajadores que por la modalidad o duración de su \ncontrato realizasen una jornada en cómputo anual inferior a la jornada general en la \nempresa, el número máximo anual de horas extraordinarias se reducirá en la misma \nproporción que exista entre tales jornadas.\nA los efectos de lo dispuesto en el párrafo anterior, no se computarán las horas \nextraordinarias que hayan sido compensadas mediante descanso dentro de los cuatro \nmeses siguientes a su realización.\nEl Gobierno podrá suprimir o reducir el número máximo de horas extraordinarias por \ntiempo determinado, con carácter general o para ciertas ramas de actividad o ámbitos BOLETÍN OFICIAL DEL ESTADO\nLEGISLACIÓN CONSOLIDADA\nPágina 34'
 'En caso de desacuerdo entre las partes, la jurisdicción social fijará la fecha que para el \ndisfrute corresponda y su decisión será irrecurrible. El procedimiento será sumario y \npreferente.\n3. El calendario de vacaciones se fijará en cada empresa. El trabajador conocerá las \nfechas que le correspondan dos meses antes, al menos, del comienzo del disfrute.\nCuando el periodo de vacaciones fijado en el calendario de vacaciones de la empresa al \nque se refiere el párrafo anterior coincida en el tiempo con una incapacidad temporal \nderivada del embarazo, el parto o la lactancia natural o con el periodo de suspensión del \ncontrato de trabajo previsto en los apartados 4, 5 y 7 del artículo 48, se tendrá derecho a \ndisfrutar las vacaciones en fecha distinta a la de la incapacidad temporal o a la del disfrute \ndel permiso que por aplicación de dicho precepto le correspondiera, al finalizar el periodo de \nsuspensión, aunque haya terminado el año natural a que correspondan.']","['Los trabajadores tendrán derecho a un descanso mínimo semanal, acumulable por periodos de hasta catorce días, de día y medio ininterrumpido que, como regla general, comprenderá la tarde del sábado o, en su caso, la mañana del lunes y el día completo del domingo. La duración del descanso semanal de los menores de dieciocho años será, como mínimo, de dos días ininterrumpidos.']","Los trabajadores tendrán derecho a un descanso mínimo semanal, acumulable por periodos de hasta catorce días, de día y medio ininterrumpido que, como regla general, comprenderá la tarde del sábado o, en su caso, la mañana del lunes y el día completo del domingo. La duración del descanso semanal de los menores de dieciocho años será, como mínimo, de dos días ininterrumpidos."
¿Cuál es el régimen de las fiestas laborales?," El régimen de las fiestas laborales se refiere al horario y la distribución del tiempo de trabajo, el régimen de trabajo a turnos, y la planificación anual de vacaciones. También incluye medidas para favorecer la conciliación entre la vida laboral, familiar y personal. Además, se aplican otros acuerdos y convenios colectivos que dispongan sobre las materias mencionadas en el apartado 83.2, excepto la jornada de trabajo, que tiene su propio reglamento.","['trabajo a turnos.\nb) El horario y la distribución del tiempo de trabajo, el régimen de trabajo a turnos y la \nplanificación anual de las vacaciones.\nc) La adaptación al ámbito de la empresa del sistema de clasificación profesional de las \npersonas trabajadoras.\nd) La adaptación de los aspectos de las modalidades de contratación que se atribuyen \npor esta ley a los convenios de empresa.\ne) Las medidas para favorecer la corresponsabilidad y la conciliación entre la vida \nlaboral, familiar y personal.\nf) Aquellas otras que dispongan los acuerdos y convenios colectivos a que se refiere el \nartículo 83.2.\nIgual prioridad aplicativa tendrán en estas materias los convenios colectivos para un \ngrupo de empresas o una pluralidad de empresas vinculadas por razones organizativas o \nproductivas y nominativamente identificadas a que se refiere el artículo 87.1.\nLos acuerdos y convenios colectivos a que se refiere el artículo 83.2 no podrán disponer \nde la prioridad aplicativa prevista en este apartado.'
 'siguientes materias:\na) Jornada de trabajo.\nb) Horario y distribución del tiempo de trabajo.\nc) Régimen de trabajo a turnos.BOLETÍN OFICIAL DEL ESTADO\nLEGISLACIÓN CONSOLIDADA\nPágina 77'
 'el empleo, así como sobre la producción y ventas, incluido el programa de producción.\nc) Sobre las previsiones del empresario de celebración de nuevos contratos, con \nindicación del número de estos y de las modalidades y tipos que serán utilizados, incluidos \nlos contratos a tiempo parcial, la realización de horas complementarias por los trabajadores \ncontratados a tiempo parcial y de los supuestos de subcontratación.BOLETÍN OFICIAL DEL ESTADO\nLEGISLACIÓN CONSOLIDADA\nPágina 66']","['Las fiestas laborales, que tendrán carácter retribuido y no recuperable, no podrán exceder de catorce al año, de las cuales dos serán locales. En cualquier caso se respetarán como fiestas de ámbito nacional las de la Natividad del Señor, Año Nuevo, 1 de mayo, como Fiesta del Trabajo, y 12 de octubre, como Fiesta Nacional de España.\n el Gobierno podrá trasladar a los lunes todas las fiestas de ámbito nacional que tengan lugar entre semana, \nLas comunidades autónomas, dentro del límite anual de catorce días festivos, podrán señalar aquellas fiestas que por tradición les sean propias, sustituyendo para ello las de ámbito nacional que se determinen reglamentariamente y, en todo caso, las que se trasladen a lunes. Asimismo, podrán hacer uso de la facultad de traslado a lunes prevista en el párrafo anterior.']","Las fiestas laborales, que tendrán carácter retribuido y no recuperable, no podrán exceder de catorce al año, de las cuales dos serán locales. En cualquier caso se respetarán como fiestas de ámbito nacional las de la Natividad del Señor, Año Nuevo, 1 de mayo, como Fiesta del Trabajo, y 12 de octubre, como Fiesta Nacional de España.

Respetando las expresadas en el párrafo anterior, el Gobierno podrá trasladar a los lunes todas las fiestas de ámbito nacional que tengan lugar entre semana, siendo, en todo caso, objeto de traslado al lunes inmediatamente posterior el descanso laboral correspondiente a las fiestas que coincidan con domingo.

Las comunidades autónomas, dentro del límite anual de catorce días festivos, podrán señalar aquellas fiestas que por tradición les sean propias, sustituyendo para ello las de ámbito nacional que se determinen reglamentariamente y, en todo caso, las que se trasladen a lunes. Asimismo, podrán hacer uso de la facultad de traslado a lunes prevista en el párrafo anterior.

Si alguna comunidad autónoma no pudiera establecer una de sus fiestas tradicionales por no coincidir con domingo un suficiente número de fiestas nacionales podrá, en el año que así ocurra, añadir una fiesta más, con carácter de recuperable, al máximo de catorce."
¿Puede el trabajador ausentarse del trabajo con derecho a remuneración?," Si el trabajador no puede prestar sus servicios debido a impedimentos imputables al empresario, conserva derecho a su salario. Si el trabajador se ausenta voluntariamente o por razones forzosas, el plazo para solicitar excedencia voluntaria debe tener al menos una antigüedad en la empresa de un año. La excedencia forzosa da derecho a la conservación del puesto y al cómputo de la antigüedad de su vigencia.","['podrá efectuarlo el empresario en moneda de curso legal o mediante cheque u otra \nmodalidad de pago similar a través de entidades de crédito, previo informe al comité de \nempresa o delegados de personal.\nArtículo 30.  Imposibilidad de la prestación.\nSi el trabajador no pudiera prestar sus servicios una vez vigente el contrato porque el \nempresario se retrasare en darle trabajo por impedimentos imputables al mismo y no al \ntrabajador, este conservará el derecho a su salario, sin que pueda hacérsele compensar el \nque perdió con otro trabajo realizado en otro tiempo.BOLETÍN OFICIAL DEL ESTADO\nLEGISLACIÓN CONSOLIDADA\nPágina 29'
 'preferencia a elegir turno de trabajo y a acceder al trabajo a distancia, si tal es el régimen \ninstaurado en la empresa, y el puesto o funciones son compatibles con esta forma de \nrealización del trabajo, cuando curse con regularidad estudios para la obtención de un título \nacadémico o profesional.\nb) A la adaptación de la jornada ordinaria de trabajo para la asistencia a cursos de \nformación profesional.\nc) A la concesión de los permisos oportunos de formación o perfeccionamiento \nprofesional con reserva del puesto de trabajo.\nd) A la formación necesaria para su adaptación a las modificaciones operadas en el \npuesto de trabajo. La misma correrá a cargo de la empresa, sin perjuicio de la posibilidad de \nobtener a tal efecto los créditos destinados a la formación. El tiempo destinado a la \nformación se considerará en todo caso tiempo de trabajo efectivo.\n2. En la negociación colectiva se pactarán los términos del ejercicio de estos derechos,'
 'k) Excedencia forzosa.\nl) Ejercicio del derecho de huelga.\nm) Cierre legal de la empresa.\nn) Decisión de la trabajadora que se vea obligada a abandonar su puesto de trabajo \ncomo consecuencia de ser víctima de violencia de género o de violencia sexual.\no) Disfrute del permiso parental.\n2. La suspensión exonera de las obligaciones recíprocas de trabajar y remunerar el \ntrabajo.\nArtículo 46.  Excedencias.\n1. La excedencia podrá ser voluntaria o forzosa. La forzosa, que dará derecho a la \nconservación del puesto y al cómputo de la antigüedad de su vigencia, se concederá por la \ndesignación o elección para un cargo público que imposibilite la asistencia al trabajo. El \nreingreso deberá ser solicitado dentro del mes siguiente al cese en el cargo público.\n2. El trabajador con al menos una antigüedad en la empresa de un año tiene derecho a \nque se le reconozca la posibilidad de situarse en excedencia voluntaria por un plazo no']","['a) Quince días naturales en caso de matrimonio.\n\nb) Dos días por el nacimiento de hijo y por el fallecimiento, accidente o enfermedad graves, hospitalización o intervención quirúrgica sin hospitalización que precise reposo domiciliario, de parientes hasta el segundo grado de consanguinidad o afinidad. Cuando con tal motivo el trabajador necesite hacer un desplazamiento al efecto, el plazo será de cuatro días.\n\nc) Un día por traslado del domicilio habitual.\n\nd) Por el tiempo indispensable, para el cumplimiento de un deber inexcusable de carácter público y personal, comprendido el ejercicio del sufragio activo. Cuando conste en una norma legal o convencional un periodo determinado, se estará a lo que esta disponga en cuanto a duración de la ausencia y a su compensación económica.']","El trabajador, previo aviso y justificación, podrá ausentarse del trabajo, con derecho a remuneración, por alguno de los motivos y por el tiempo siguiente:

a) Quince días naturales en caso de matrimonio.

b) Dos días por el nacimiento de hijo y por el fallecimiento, accidente o enfermedad graves, hospitalización o intervención quirúrgica sin hospitalización que precise reposo domiciliario, de parientes hasta el segundo grado de consanguinidad o afinidad. Cuando con tal motivo el trabajador necesite hacer un desplazamiento al efecto, el plazo será de cuatro días.

c) Un día por traslado del domicilio habitual.

d) Por el tiempo indispensable, para el cumplimiento de un deber inexcusable de carácter público y personal, comprendido el ejercicio del sufragio activo. Cuando conste en una norma legal o convencional un periodo determinado, se estará a lo que esta disponga en cuanto a duración de la ausencia y a su compensación económica.

Cuando el cumplimiento del deber antes referido suponga la imposibilidad de la prestación del trabajo debido en más del veinte por ciento de las horas laborables en un periodo de tres meses, podrá la empresa pasar al trabajador afectado a la situación de excedencia regulada en el artículo 46.1.

En el supuesto de que el trabajador, por cumplimiento del deber o desempeño del cargo, perciba una indemnización, se descontará el importe de la misma del salario a que tuviera derecho en la empresa."
¿Cuál es el régimen de las vacaciones anuales?," Las vacaciones anuales retribuidas se pactan en convenio colectivo o contrato individual y no son sustituibles por compensación económica. La duración mínima es de treinta días naturales. El periodo y fecha de su disfrute se fija de acuerdo entre el empresario y el trabajador, con la posibilidad de que la jurisdicción social fije la fecha en caso de desacuerdo.","['2. El número de horas extraordinarias no podrá ser superior a ochenta al año, salvo lo \nprevisto en el apartado 3. Para los trabajadores que por la modalidad o duración de su \ncontrato realizasen una jornada en cómputo anual inferior a la jornada general en la \nempresa, el número máximo anual de horas extraordinarias se reducirá en la misma \nproporción que exista entre tales jornadas.\nA los efectos de lo dispuesto en el párrafo anterior, no se computarán las horas \nextraordinarias que hayan sido compensadas mediante descanso dentro de los cuatro \nmeses siguientes a su realización.\nEl Gobierno podrá suprimir o reducir el número máximo de horas extraordinarias por \ntiempo determinado, con carácter general o para ciertas ramas de actividad o ámbitos BOLETÍN OFICIAL DEL ESTADO\nLEGISLACIÓN CONSOLIDADA\nPágina 34'
 'Las personas trabajadoras tendrán derecho a que sean retribuidas las horas de ausencia \npor las causas previstas en el presente apartado equivalentes a cuatro días al año, conforme \na lo establecido en convenio colectivo o, en su defecto, en acuerdo entre la empresa y la \nrepresentación legal de las personas trabajadoras aportando las personas trabajadoras, en \nsu caso, acreditación del motivo de ausencia.\nArtículo 38.  Vacaciones anuales.\n1. El periodo de vacaciones anuales retribuidas, no sustituible por compensación \neconómica, será el pactado en convenio colectivo o contrato individual. En ningún caso la \nduración será inferior a treinta días naturales.\n2. El periodo o periodos de su disfrute se fijará de común acuerdo entre el empresario y \nel trabajador, de conformidad con lo establecido en su caso en los convenios colectivos \nsobre planificación anual de las vacaciones.\nEn caso de desacuerdo entre las partes, la jurisdicción social fijará la fecha que para el'
 'En caso de desacuerdo entre las partes, la jurisdicción social fijará la fecha que para el \ndisfrute corresponda y su decisión será irrecurrible. El procedimiento será sumario y \npreferente.\n3. El calendario de vacaciones se fijará en cada empresa. El trabajador conocerá las \nfechas que le correspondan dos meses antes, al menos, del comienzo del disfrute.\nCuando el periodo de vacaciones fijado en el calendario de vacaciones de la empresa al \nque se refiere el párrafo anterior coincida en el tiempo con una incapacidad temporal \nderivada del embarazo, el parto o la lactancia natural o con el periodo de suspensión del \ncontrato de trabajo previsto en los apartados 4, 5 y 7 del artículo 48, se tendrá derecho a \ndisfrutar las vacaciones en fecha distinta a la de la incapacidad temporal o a la del disfrute \ndel permiso que por aplicación de dicho precepto le correspondiera, al finalizar el periodo de \nsuspensión, aunque haya terminado el año natural a que correspondan.']","['1. El periodo de vacaciones anuales retribuidas, no sustituible por compensación económica, será el pactado en convenio colectivo o contrato individual. En ningún caso la duración será inferior a treinta días naturales.\n\n2. El periodo o periodos de su disfrute se fijará de común acuerdo entre el empresario y el trabajador, de conformidad con lo establecido en su caso en los convenios colectivos sobre planificación anual de las vacaciones.\n\n3. El calendario de vacaciones se fijará en cada empresa. El trabajador conocerá las fechas que le correspondan dos meses antes, al menos, del comienzo del disfrute.\n\nEn el supuesto de que el periodo de vacaciones coincida con una incapacidad temporal por contingencias distintas a las señaladas en el párrafo anterior que imposibilite al trabajador disfrutarlas, total o parcialmente, durante el año natural a que corresponden, el trabajador podrá hacerlo una vez finalice su incapacidad y siempre que no hayan transcurrido más de dieciocho meses a partir del final del año en que se hayan originado.']","1. El periodo de vacaciones anuales retribuidas, no sustituible por compensación económica, será el pactado en convenio colectivo o contrato individual. En ningún caso la duración será inferior a treinta días naturales.

2. El periodo o periodos de su disfrute se fijará de común acuerdo entre el empresario y el trabajador, de conformidad con lo establecido en su caso en los convenios colectivos sobre planificación anual de las vacaciones.

En caso de desacuerdo entre las partes, la jurisdicción social fijará la fecha que para el disfrute corresponda y su decisión será irrecurrible. El procedimiento será sumario y preferente.

3. El calendario de vacaciones se fijará en cada empresa. El trabajador conocerá las fechas que le correspondan dos meses antes, al menos, del comienzo del disfrute.

Cuando el periodo de vacaciones fijado en el calendario de vacaciones de la empresa al que se refiere el párrafo anterior coincida en el tiempo con una incapacidad temporal derivada del embarazo, el parto o la lactancia natural o con el periodo de suspensión del contrato de trabajo previsto en los apartados 4, 5 y 7 del artículo 48, se tendrá derecho a disfrutar las vacaciones en fecha distinta a la de la incapacidad temporal o a la del disfrute del permiso que por aplicación de dicho precepto le correspondiera, al finalizar el periodo de suspensión, aunque haya terminado el año natural a que correspondan.

En el supuesto de que el periodo de vacaciones coincida con una incapacidad temporal por contingencias distintas a las señaladas en el párrafo anterior que imposibilite al trabajador disfrutarlas, total o parcialmente, durante el año natural a que corresponden, el trabajador podrá hacerlo una vez finalice su incapacidad y siempre que no hayan transcurrido más de dieciocho meses a partir del final del año en que se hayan originado."
¿Cuál es el régimen de la movilidad funcional?," El régimen de movilidad funcional incluye la planificación anual de vacaciones, el régimen de trabajo a turnos, adaptación del sistema de clasificación profesional de las personas trabajadoras, adaptación de las modalidades de contratación, medidas para favorecer la conciliación entre vida laboral y personal, y otras medidas especificadas en los acuerdos y convenios colectivos. También incluye el concepto del contrato de sustitución, que se puede concertar para completar una jornada reducida o cubrir temporalmente un puesto de trabajo durante el proceso de selección o promoción.","['trabajo a turnos.\nb) El horario y la distribución del tiempo de trabajo, el régimen de trabajo a turnos y la \nplanificación anual de las vacaciones.\nc) La adaptación al ámbito de la empresa del sistema de clasificación profesional de las \npersonas trabajadoras.\nd) La adaptación de los aspectos de las modalidades de contratación que se atribuyen \npor esta ley a los convenios de empresa.\ne) Las medidas para favorecer la corresponsabilidad y la conciliación entre la vida \nlaboral, familiar y personal.\nf) Aquellas otras que dispongan los acuerdos y convenios colectivos a que se refiere el \nartículo 83.2.\nIgual prioridad aplicativa tendrán en estas materias los convenios colectivos para un \ngrupo de empresas o una pluralidad de empresas vinculadas por razones organizativas o \nproductivas y nominativamente identificadas a que se refiere el artículo 87.1.\nLos acuerdos y convenios colectivos a que se refiere el artículo 83.2 no podrán disponer \nde la prioridad aplicativa prevista en este apartado.'
 'Asimismo, el contrato de sustitución podrá concertarse para completar la jornada \nreducida por otra persona trabajadora, cuando dicha reducción se ampare en causas \nlegalmente establecidas o reguladas en el convenio colectivo y se especifique en el contrato \nel nombre de la persona sustituida y la causa de la sustitución.\nEl contrato de sustitución podrá ser también celebrado para la cobertura temporal de un \npuesto de trabajo durante el proceso de selección o promoción para su cobertura definitiva \nmediante contrato fijo, sin que su duración pueda ser en este caso superior a tres meses, o \nel plazo inferior recogido en convenio colectivo, ni pueda celebrarse un nuevo contrato con el \nmismo objeto una vez superada dicha duración máxima.\n4. Las personas contratadas incumpliendo lo establecido en este artículo adquirirán la \ncondición de fijas.BOLETÍN OFICIAL DEL ESTADO\nLEGISLACIÓN CONSOLIDADA\nPágina 21'
 'b) La empresa junto con la notificación, comunicación o solicitud, según proceda, a la \nautoridad laboral sobre su decisión de reducir la jornada de trabajo o suspender los contratos \nde trabajo, a que se refieren los apartados 3, 4, 5 y 6, comunicará, a través de los \nprocedimientos automatizados que se establezcan:\n1.º El período dentro del cual se va a llevar a cabo la aplicación de la suspensión del \ncontrato o la reducción de jornada.\n2.º La identificación de las personas trabajadoras incluidas en el expediente de \nregulación temporal de empleo.\n3.º El tipo de medida a aplicar respecto de cada una de las personas trabajadoras y el \nporcentaje máximo de reducción de jornada o el número máximo de días de suspensión de \ncontrato a aplicar.\nc) Durante el periodo de aplicación del expediente, la empresa podrá desafectar y afectar \na las personas trabajadoras en función de las alteraciones de las circunstancias señaladas']","['1. La movilidad funcional en la empresa se efectuará de acuerdo a las titulaciones académicas o profesionales precisas para ejercer la prestación laboral y con respeto a la dignidad del trabajador.\n\n2. La movilidad funcional para la realización de funciones, tanto superiores como inferiores, no correspondientes al grupo profesional solo será posible si existen, además, razones técnicas u organizativas que la justifiquen y por el tiempo imprescindible para su atención. El empresario deberá comunicar su decisión y las razones de esta a los representantes de los trabajadores.\n\nEn el caso de encomienda de funciones superiores a las del grupo profesional por un periodo superior a seis meses durante un año u ocho durante dos años, el trabajador podrá reclamar el ascenso, si a ello no obsta lo dispuesto en convenio colectivo o, en todo caso, la cobertura de la vacante correspondiente a las funciones por él realizadas conforme a las reglas en materia de ascensos aplicables en la empresa, sin perjuicio de reclamar la diferencia salarial correspondiente. Estas acciones serán acumulables. \n3. El trabajador tendrá derecho a la retribución correspondiente a las funciones que efectivamente realice, salvo en los casos de encomienda de funciones inferiores, en los que mantendrá la retribución de origen.\n4. El cambio de funciones distintas de las pactadas no incluido en los supuestos previstos en este artículo requerirá el acuerdo de las partes o, en su defecto, el sometimiento a las reglas previstas para las modificaciones sustanciales de condiciones de trabajo o a las que a tal fin se hubieran establecido en convenio colectivo.']","1. La movilidad funcional en la empresa se efectuará de acuerdo a las titulaciones académicas o profesionales precisas para ejercer la prestación laboral y con respeto a la dignidad del trabajador.

2. La movilidad funcional para la realización de funciones, tanto superiores como inferiores, no correspondientes al grupo profesional solo será posible si existen, además, razones técnicas u organizativas que la justifiquen y por el tiempo imprescindible para su atención. El empresario deberá comunicar su decisión y las razones de esta a los representantes de los trabajadores.

En el caso de encomienda de funciones superiores a las del grupo profesional por un periodo superior a seis meses durante un año u ocho durante dos años, el trabajador podrá reclamar el ascenso, si a ello no obsta lo dispuesto en convenio colectivo o, en todo caso, la cobertura de la vacante correspondiente a las funciones por él realizadas conforme a las reglas en materia de ascensos aplicables en la empresa, sin perjuicio de reclamar la diferencia salarial correspondiente. Estas acciones serán acumulables. Contra la negativa de la empresa, y previo informe del comité o, en su caso, de los delegados de personal, el trabajador podrá reclamar ante la jurisdicción social. Mediante la negociación colectiva se podrán establecer periodos distintos de los expresados en este artículo a efectos de reclamar la cobertura de vacantes.

3. El trabajador tendrá derecho a la retribución correspondiente a las funciones que efectivamente realice, salvo en los casos de encomienda de funciones inferiores, en los que mantendrá la retribución de origen. No cabrá invocar como causa de despido objetivo la ineptitud sobrevenida o la falta de adaptación en los supuestos de realización de funciones distintas de las habituales como consecuencia de la movilidad funcional.

4. El cambio de funciones distintas de las pactadas no incluido en los supuestos previstos en este artículo requerirá el acuerdo de las partes o, en su defecto, el sometimiento a las reglas previstas para las modificaciones sustanciales de condiciones de trabajo o a las que a tal fin se hubieran establecido en convenio colectivo."
¿Cuándo se puede trasladar a un trabajador que no haya sido contratado para prestar sus servicios con centros de trabajo móviles o itinerantes?," La persona trabajadora puede ser trasladada a centros de trabajo móviles o itinerantes siempre y cuando esté contratada para prestar sus servicios en esas condiciones, según el Artículo 16 del contrato por tiempo indefinido fijo-discontinuo. Este tipo de contrato se concierne a trabajos de naturaleza estacional o vinculados a actividades productivas de temporada, o para el desarrollo de aquellas que no tengan dicha naturaleza pero que, siendo de prestación intermitente, tengan periodos de ejecución ciertos, determinados o indeterminados. Sin embargo, si la persona no tiene un contrato por tiempo indefinido fijo-discontinuo, no puede ser trasladada a centros de trabajo móviles o itinerantes debido a que el Artículo 12 del contrato por tiempo parcial y contrato de relevo establece que el contrato de trabajo se entiende celebrado a tiempo completo.","['contratos formativos en contratos por tiempo indefinido.\n7. Las empresas que pretendan suscribir contratos formativos, podrán solicitar por \nescrito al servicio público de empleo competente, información relativa a si las personas a las \nque pretenden contratar han estado previamente contratadas bajo dicha modalidad y la \nduración de estas contrataciones. Dicha información deberá ser trasladada a la \nrepresentación legal de las personas trabajadoras y tendrá valor liberatorio a efectos de no \nexceder la duración máxima de este contrato.\nArtículo 12.  Contrato a tiempo parcial y contrato de relevo.\n1. El contrato de trabajo se entenderá celebrado a tiempo parcial cuando se haya \nacordado la prestación de servicios durante un número de horas al día, a la semana, al mes \no al año, inferior a la jornada de trabajo de un trabajador a tiempo completo comparable.\nA efectos de lo dispuesto en el párrafo anterior, se entenderá por «trabajador a tiempo'
 'En todo caso, la persona trabajadora podrá solicitar, por escrito al servicio público de \nempleo correspondiente un certificado de los contratos de duración determinada o \ntemporales celebrados, a los efectos de poder acreditar su condición de persona trabajadora \nfija en la empresa.\nEl Servicio Público de Empleo emitirá dicho documento y lo pondrá en conocimiento de \nla empresa en la que la persona trabajadora preste sus servicios y de la Inspección de \nTrabajo y Seguridad Social, si advirtiera que se han sobrepasado los límites máximos \ntemporales establecidos.\nArtículo 16.  Contrato fijo-discontinuo.\n1. El contrato por tiempo indefinido fijo-discontinuo se concertará para la realización de \ntrabajos de naturaleza estacional o vinculados a actividades productivas de temporada, o \npara el desarrollo de aquellos que no tengan dicha naturaleza pero que, siendo de \nprestación intermitente, tengan periodos de ejecución ciertos, determinados o \nindeterminados.'
 'y dirección de otro y el que lo recibe a cambio de una retribución a aquel.\n2. Deberán constar por escrito los contratos de trabajo cuando así lo exija una \ndisposición legal y, en todo caso, los de prácticas y para la formación y el aprendizaje, los \ncontratos a tiempo parcial, fijos-discontinuos y de relevo y los contratos para la realización de \nuna obra o servicio determinado; también constarán por escrito los contratos por tiempo \ndeterminado cuya duración sea superior a cuatro semanas.\nDeberán constar igualmente por escrito los contratos de trabajo de los pescadores, de \nlos trabajadores que trabajen a distancia y de los trabajadores contratados en España al \nservicio de empresas españolas en el extranjero.\nDe no observarse la exigencia de forma escrita, el contrato de trabajo se presumirá \ncelebrado por tiempo indefinido y a jornada completa, salvo prueba en contrario que acredite \nsu naturaleza temporal o el carácter a tiempo parcial de los servicios.']","['El traslado de trabajadores que no hayan sido contratados específicamente para prestar sus servicios en empresas con centros de trabajo móviles o itinerantes a un centro de trabajo distinto de la misma empresa que exija cambios de residencia requerirá la existencia de razones económicas, técnicas, organizativas o de producción que lo justifiquen. Se consideraran tales las que estén relacionadas con la competitividad, productividad u organización técnica o del trabajo en la empresa, así como las contrataciones referidas a la actividad empresarial.\n\nLa decisión de traslado deberá ser notificada por el empresario al trabajador, así como a sus representantes legales, con una antelación mínima de treinta días a la fecha de su efectividad.\n\nNotificada la decisión de traslado, el trabajador tendrá derecho a optar entre el traslado, percibiendo una compensación por gastos, o la extinción de su contrato, percibiendo una indemnización de veinte días de salario por año de servicio, prorrateándose por meses los periodos de tiempo inferiores a un año y con un máximo de doce mensualidades.']","El traslado de trabajadores que no hayan sido contratados específicamente para prestar sus servicios en empresas con centros de trabajo móviles o itinerantes a un centro de trabajo distinto de la misma empresa que exija cambios de residencia requerirá la existencia de razones económicas, técnicas, organizativas o de producción que lo justifiquen. Se consideraran tales las que estén relacionadas con la competitividad, productividad u organización técnica o del trabajo en la empresa, así como las contrataciones referidas a la actividad empresarial.

La decisión de traslado deberá ser notificada por el empresario al trabajador, así como a sus representantes legales, con una antelación mínima de treinta días a la fecha de su efectividad.

Notificada la decisión de traslado, el trabajador tendrá derecho a optar entre el traslado, percibiendo una compensación por gastos, o la extinción de su contrato, percibiendo una indemnización de veinte días de salario por año de servicio, prorrateándose por meses los periodos de tiempo inferiores a un año y con un máximo de doce mensualidades. La compensación a que se refiere el primer supuesto comprenderá tanto los gastos propios como los de los familiares a su cargo, en los términos que se convengan entre las partes, y nunca será inferior a los límites mínimos establecidos en los convenios colectivos."
¿Cuándo podrá acordar modificaciones sustanciales de las condiciones de trabajo la dirección de la empresa?," La empresa puede acordar modificaciones sustanciales de las condiciones de trabajo cuando existen razones económicas, técnicas, organizativas o de producción. Esto incluye la jornada de trabajo, el horario y distribución del tiempo de trabajo, y el régimen de trabajo a turnos. La empresa debe notificar al autoridad laboral y comunicar en forma automatizada al expediente de regulación temporal de empleo cuando sea necesario reducir la jornada de trabajo o suspender contratos de trabajo. Durante el periodo de aplicación del expediente, la empresa puede desafectar y afectar a las personas trabajadoras en función de las alteraciones de las circunstancias señaladas por parte del empresario de las decisiones adoptadas sobre las reestructuraciones de plantilla, ceses, reducciones de jornada, traslados de instalaciones, procesos de fusión o absorción, planes de formación profesional y sistemas organizativos. La información debe ser facilitada al comité de la empresa.","['los puestos de trabajo a que se refiere este artículo. Mediante convenio colectivo o acuerdo \nalcanzado durante el periodo de consultas se podrán establecer prioridades de permanencia \na favor de trabajadores de otros colectivos, tales como trabajadores con cargas familiares, \nmayores de determinada edad o personas con discapacidad.\nArtículo 41.  Modificaciones sustanciales de condiciones de trabajo.\n1. La dirección de la empresa podrá acordar modificaciones sustanciales de las \ncondiciones de trabajo cuando existan probadas razones económicas, técnicas, \norganizativas o de producción. Se considerarán tales las que estén relacionadas con la \ncompetitividad, productividad u organización técnica o del trabajo en la empresa.\nTendrán la consideración de modificaciones sustanciales de las condiciones de trabajo, \nentre otras, las que afecten a las siguientes materias:\na) Jornada de trabajo.\nb) Horario y distribución del tiempo de trabajo.\nc) Régimen de trabajo a turnos.'
 'b) La empresa junto con la notificación, comunicación o solicitud, según proceda, a la \nautoridad laboral sobre su decisión de reducir la jornada de trabajo o suspender los contratos \nde trabajo, a que se refieren los apartados 3, 4, 5 y 6, comunicará, a través de los \nprocedimientos automatizados que se establezcan:\n1.º El período dentro del cual se va a llevar a cabo la aplicación de la suspensión del \ncontrato o la reducción de jornada.\n2.º La identificación de las personas trabajadoras incluidas en el expediente de \nregulación temporal de empleo.\n3.º El tipo de medida a aplicar respecto de cada una de las personas trabajadoras y el \nporcentaje máximo de reducción de jornada o el número máximo de días de suspensión de \ncontrato a aplicar.\nc) Durante el periodo de aplicación del expediente, la empresa podrá desafectar y afectar \na las personas trabajadoras en función de las alteraciones de las circunstancias señaladas'
 'por parte del empresario de las decisiones adoptadas por este, sobre las siguientes \ncuestiones:\na) Las reestructuraciones de plantilla y ceses totales o parciales, definitivos o \ntemporales, de aquella.\nb) Las reducciones de jornada.\nc) El traslado total o parcial de las instalaciones.\nd) Los procesos de fusión, absorción o modificación del estatus jurídico de la empresa \nque impliquen cualquier incidencia que pueda afectar al volumen de empleo.\ne) Los planes de formación profesional en la empresa.\nf) La implantación y revisión de sistemas de organización y control del trabajo, estudios \nde tiempos, establecimiento de sistemas de primas e incentivos y valoración de puestos de \ntrabajo.\n6. La información se deberá facilitar por el empresario al comité de empresa, sin perjuicio \nde lo establecido específicamente en cada caso, en un momento, de una manera y con un \ncontenido apropiados, que permitan a los representantes de los trabajadores proceder a su']","['La dirección de la empresa podrá acordar modificaciones sustanciales de las condiciones de trabajo cuando existan probadas razones económicas, técnicas, organizativas o de producción. Se considerarán tales las que estén relacionadas con la competitividad, productividad u organización técnica o del trabajo en la empresa.']","La dirección de la empresa podrá acordar modificaciones sustanciales de las condiciones de trabajo cuando existan probadas razones económicas, técnicas, organizativas o de producción. Se considerarán tales las que estén relacionadas con la competitividad, productividad u organización técnica o del trabajo en la empresa."
¿Qué se entiende por modificación sustancial de las condiciones de trabajo?," La modificación sustancial de las condiciones de trabajo se refiere a cambios significativos en el trabajo que pueden ocurrir en razón económica, técnica, organizativa o de producción. Esto incluye modificaciones en la jornada de trabajo, horario y distribución del tiempo de trabajo, régimen de trabajo a turnos, entre otros. Estas modificaciones deben ser voluntarias para el trabajador y no pueden imponerse unilateralmente. Si un trabajador rechaza esta conversión, no puede ser despedido ni sufrir sanciones. Además, se debe comunicar al autoridad laboral sobre la decisión de reducir la jornada de trabajo o suspender contratos de trabajo, incluyendo el período y tipo de medida a aplicar respecto de cada trabajador.","['los puestos de trabajo a que se refiere este artículo. Mediante convenio colectivo o acuerdo \nalcanzado durante el periodo de consultas se podrán establecer prioridades de permanencia \na favor de trabajadores de otros colectivos, tales como trabajadores con cargas familiares, \nmayores de determinada edad o personas con discapacidad.\nArtículo 41.  Modificaciones sustanciales de condiciones de trabajo.\n1. La dirección de la empresa podrá acordar modificaciones sustanciales de las \ncondiciones de trabajo cuando existan probadas razones económicas, técnicas, \norganizativas o de producción. Se considerarán tales las que estén relacionadas con la \ncompetitividad, productividad u organización técnica o del trabajo en la empresa.\nTendrán la consideración de modificaciones sustanciales de las condiciones de trabajo, \nentre otras, las que afecten a las siguientes materias:\na) Jornada de trabajo.\nb) Horario y distribución del tiempo de trabajo.\nc) Régimen de trabajo a turnos.'
 'tendrá siempre carácter voluntario para el trabajador y no se podrá imponer de forma \nunilateral o como consecuencia de una modificación sustancial de condiciones de trabajo al \namparo de lo dispuesto en el artículo 41.1.a). El trabajador no podrá ser despedido ni sufrir \nningún otro tipo de sanción o efecto perjudicial por el hecho de rechazar esta conversión, sin \nperjuicio de las medidas que, de conformidad con lo dispuesto en los artículos 51 y 52.c), \npuedan adoptarse por causas económicas, técnicas, organizativas o de producción.\nA fin de posibilitar la movilidad voluntaria en el trabajo a tiempo parcial, el empresario \ndeberá informar a los trabajadores de la empresa sobre la existencia de puestos de trabajo \nvacantes, de manera que aquellos puedan formular solicitudes de conversión voluntaria de \nun trabajo a tiempo completo en un trabajo a tiempo parcial y viceversa, o para el incremento \ndel tiempo de trabajo de los trabajadores a tiempo parcial, todo ello de conformidad con los'
 'b) La empresa junto con la notificación, comunicación o solicitud, según proceda, a la \nautoridad laboral sobre su decisión de reducir la jornada de trabajo o suspender los contratos \nde trabajo, a que se refieren los apartados 3, 4, 5 y 6, comunicará, a través de los \nprocedimientos automatizados que se establezcan:\n1.º El período dentro del cual se va a llevar a cabo la aplicación de la suspensión del \ncontrato o la reducción de jornada.\n2.º La identificación de las personas trabajadoras incluidas en el expediente de \nregulación temporal de empleo.\n3.º El tipo de medida a aplicar respecto de cada una de las personas trabajadoras y el \nporcentaje máximo de reducción de jornada o el número máximo de días de suspensión de \ncontrato a aplicar.\nc) Durante el periodo de aplicación del expediente, la empresa podrá desafectar y afectar \na las personas trabajadoras en función de las alteraciones de las circunstancias señaladas']","['a) Jornada de trabajo.\n\nb) Horario y distribución del tiempo de trabajo.\n\nc) Régimen de trabajo a turnos.\n\nd) Sistema de remuneración y cuantía salarial.\n\ne) Sistema de trabajo y rendimiento.\n\nf) Funciones, cuando excedan de los límites que para la movilidad funcional prevé el artículo 39.']","Tendrán la consideración de modificaciones sustanciales de las condiciones de trabajo, entre otras, las que afecten a las siguientes materias:

a) Jornada de trabajo.

b) Horario y distribución del tiempo de trabajo.

c) Régimen de trabajo a turnos.

d) Sistema de remuneración y cuantía salarial.

e) Sistema de trabajo y rendimiento.

f) Funciones, cuando excedan de los límites que para la movilidad funcional prevé el artículo 39."
¿Es el empresario que contrata o subcontrata con otros la realización de obras o servicios responsable del pago de las cuotas de la Seguridad Social?," El empresario es responsable del pago de las cuotas de la Seguridad Social si contrata o subcontrata con otras empresas la realización de obras o servicios. Las personas trabajadoras de la contratista o subcontratista deben ser informadas por escrito sobre la identidad de la empresa principal para la cual estén prestando servicios y este deberá pagar una remuneración igual a cualquier otro trabajo de igual valor, sin discriminación alguna por razón de sexo. El registro de los valores medios de los salarios, complementos y percepciones extrasalariales debe llevarse a cabo en el caso del empresario.","['General de la Seguridad Social en los términos que reglamentariamente se determinen.\n4. Sin perjuicio de la información sobre previsiones en materia de subcontratación a la \nque se refiere el artículo 64, cuando la empresa concierte un contrato de prestación de obras \no servicios con una empresa contratista o subcontratista, deberá informar a la representación \nlegal de las personas trabajadoras sobre los siguientes extremos:\na) Nombre o razón social, domicilio y número de identificación fiscal de la empresa \ncontratista o subcontratista.\nb) Objeto y duración de la contrata.\nc) Lugar de ejecución de la contrata.\nd) En su caso, número de personas trabajadoras que serán ocupadas por la contrata o \nsubcontrata en el centro de trabajo de la empresa principal.\ne) Medidas previstas para la coordinación de actividades desde el punto de vista de la \nprevención de riesgos laborales.\nCuando las empresas principal, contratista o subcontratista compartan de forma'
 'No habrá responsabilidad por los actos de la contratista cuando la actividad contratada \nse refiera exclusivamente a la construcción o reparación que pueda contratar una persona \nrespecto de su vivienda, así como cuando el propietario o propietaria de la obra o industria \nno contrate su realización por razón de una actividad empresarial.\n3. Las personas trabajadoras de la contratista o subcontratista deberán ser informadas \npor escrito por su empresa de la identidad de la empresa principal para la cual estén \nprestando servicios en cada momento. Dicha información deberá facilitarse antes del inicio \nde la respectiva prestación de servicios e incluirá el nombre o razón social de la empresa \nprincipal, su domicilio social y su número de identificación fiscal. Asimismo, la contratista o \nsubcontratista deberán informar de la identidad de la empresa principal a la Tesorería \nGeneral de la Seguridad Social en los términos que reglamentariamente se determinen.'
 'Artículo 28.  Igualdad de remuneración por razón de sexo.\n1. El empresario está obligado a pagar por la prestación de un trabajo de igual valor la \nmisma retribución, satisfecha directa o indirectamente, y cualquiera que sea la naturaleza de \nla misma, salarial o extrasalarial, sin que pueda producirse discriminación alguna por razón \nde sexo en ninguno de los elementos o condiciones de aquella.\nUn trabajo tendrá igual valor que otro cuando la naturaleza de las funciones o tareas \nefectivamente encomendadas, las condiciones educativas, profesionales o de formación \nexigidas para su ejercicio, los factores estrictamente relacionados con su desempeño y las \ncondiciones laborales en las que dichas actividades se llevan a cabo en realidad sean \nequivalentes.\n2. El empresario está obligado a llevar un registro con los valores medios de los salarios, \nlos complementos salariales y las percepciones extrasalariales de su plantilla, desagregados']","['1. Los empresarios que contraten o subcontraten con otros la realización de obras o servicios correspondientes a la propia actividad de aquellos deberán comprobar que dichos contratistas están al corriente en el pago de las cuotas de la Seguridad Social. Al efecto, recabarán por escrito, con identificación de la empresa afectada, certificación negativa por descubiertos en la Tesorería General de la Seguridad Social, que deberá librar inexcusablemente dicha certificación en el término de treinta días improrrogables y en los términos que reglamentariamente se establezcan. Transcurrido este plazo, quedará exonerado de responsabilidad el empresario solicitante.\n\n2. El empresario principal, salvo el transcurso del plazo antes señalado respecto a la Seguridad Social, y durante los tres años siguientes a la terminación de su encargo, responderá solidariamente de las obligaciones referidas a la Seguridad Social contraídas por los contratistas y subcontratistas durante el periodo de vigencia de la contrata.']","1. Los empresarios que contraten o subcontraten con otros la realización de obras o servicios correspondientes a la propia actividad de aquellos deberán comprobar que dichos contratistas están al corriente en el pago de las cuotas de la Seguridad Social. Al efecto, recabarán por escrito, con identificación de la empresa afectada, certificación negativa por descubiertos en la Tesorería General de la Seguridad Social, que deberá librar inexcusablemente dicha certificación en el término de treinta días improrrogables y en los términos que reglamentariamente se establezcan. Transcurrido este plazo, quedará exonerado de responsabilidad el empresario solicitante.

2. El empresario principal, salvo el transcurso del plazo antes señalado respecto a la Seguridad Social, y durante los tres años siguientes a la terminación de su encargo, responderá solidariamente de las obligaciones referidas a la Seguridad Social contraídas por los contratistas y subcontratistas durante el periodo de vigencia de la contrata.

De las obligaciones de naturaleza salarial contraídas por los contratistas y subcontratistas con sus trabajadores responderá solidariamente durante el año siguiente a la finalización del encargo.

No habrá responsabilidad por los actos del contratista cuando la actividad contratada se refiera exclusivamente a la construcción o reparación que pueda contratar un cabeza de familia respecto de su vivienda, así como cuando el propietario de la obra o industria no contrate su realización por razón de una actividad empresarial."
¿Deben conocer los trabajadores del contratista o subcontratista la identidad de la empresa principal para la cual están prestando servicios?," Sí, los trabajadores del contratista o subcontratista deben conocer la identidad de la empresa principal para la cual están prestando servicios en cada momento. La información incluye el nombre o razón social de la empresa principal, su domicilio social y su número de identificación fiscal, y debe facilitarse antes del inicio de la respectiva prestación de servicios.","['No habrá responsabilidad por los actos de la contratista cuando la actividad contratada \nse refiera exclusivamente a la construcción o reparación que pueda contratar una persona \nrespecto de su vivienda, así como cuando el propietario o propietaria de la obra o industria \nno contrate su realización por razón de una actividad empresarial.\n3. Las personas trabajadoras de la contratista o subcontratista deberán ser informadas \npor escrito por su empresa de la identidad de la empresa principal para la cual estén \nprestando servicios en cada momento. Dicha información deberá facilitarse antes del inicio \nde la respectiva prestación de servicios e incluirá el nombre o razón social de la empresa \nprincipal, su domicilio social y su número de identificación fiscal. Asimismo, la contratista o \nsubcontratista deberán informar de la identidad de la empresa principal a la Tesorería \nGeneral de la Seguridad Social en los términos que reglamentariamente se determinen.'
 'General de la Seguridad Social en los términos que reglamentariamente se determinen.\n4. Sin perjuicio de la información sobre previsiones en materia de subcontratación a la \nque se refiere el artículo 64, cuando la empresa concierte un contrato de prestación de obras \no servicios con una empresa contratista o subcontratista, deberá informar a la representación \nlegal de las personas trabajadoras sobre los siguientes extremos:\na) Nombre o razón social, domicilio y número de identificación fiscal de la empresa \ncontratista o subcontratista.\nb) Objeto y duración de la contrata.\nc) Lugar de ejecución de la contrata.\nd) En su caso, número de personas trabajadoras que serán ocupadas por la contrata o \nsubcontrata en el centro de trabajo de la empresa principal.\ne) Medidas previstas para la coordinación de actividades desde el punto de vista de la \nprevención de riesgos laborales.\nCuando las empresas principal, contratista o subcontratista compartan de forma'
 '6. El convenio colectivo de aplicación para las empresas contratistas y subcontratistas \nserá el del sector de la actividad desarrollada en la contrata o subcontrata, con \nindependencia de su objeto social o forma jurídica, salvo que exista otro convenio sectorial \naplicable conforme a lo dispuesto en el título III.\nNo obstante, cuando la empresa contratista o subcontratista cuente con un convenio \npropio, se aplicará este, en los términos que resulten del artículo 84.\n7. Las personas trabajadoras de las empresas contratistas y subcontratistas, cuando no \ntengan representación legal, tendrán derecho a formular a la representación legal de \npersonas trabajadoras de la empresa principal cuestiones relativas a las condiciones de \nejecución de la actividad laboral, mientras compartan centro de trabajo y carezcan de \nrepresentación.\nLo dispuesto en el párrafo anterior no será de aplicación a las reclamaciones de la \npersona trabajadora respecto de la empresa de la que depende.']","['3. Los trabajadores del contratista o subcontratista deberán ser informados por escrito por su empresario de la identidad de la empresa principal para la cual estén prestando servicios en cada momento. Dicha información deberá facilitarse antes del inicio de la respectiva prestación de servicios e incluirá el nombre o razón social del empresario principal, su domicilio social y su número de identificación fiscal. \n cuando la empresa concierte un contrato de prestación de obras o servicios con una empresa contratista o subcontratista, deberá informar a los representantes legales de sus trabajadores sobre los siguientes extremos:\n\na) Nombre o razón social, domicilio y número de identificación fiscal de la empresa contratista o subcontratista.\n\nb) Objeto y duración de la contrata.\n\nc) Lugar de ejecución de la contrata.\n\nd) En su caso, número de trabajadores que serán ocupados por la contrata o subcontrata en el centro de trabajo de la empresa principal.\n\ne) Medidas previstas para la coordinación de actividades desde el punto de vista de la prevención de riesgos laborales.\n\nCuando las empresas principal, contratista o subcontratista compartan de forma continuada un mismo centro de trabajo, la primera deberá disponer de un libro registro en el que se refleje la información anterior respecto de todas las empresas citadas. Dicho libro estará a disposición de los representantes legales de los trabajadores.']","3. Los trabajadores del contratista o subcontratista deberán ser informados por escrito por su empresario de la identidad de la empresa principal para la cual estén prestando servicios en cada momento. Dicha información deberá facilitarse antes del inicio de la respectiva prestación de servicios e incluirá el nombre o razón social del empresario principal, su domicilio social y su número de identificación fiscal. Asimismo, el contratista o subcontratista deberán informar de la identidad de la empresa principal a la Tesorería General de la Seguridad Social en los términos que reglamentariamente se determinen.

4. Sin perjuicio de la información sobre previsiones en materia de subcontratación a la que se refiere el artículo 64, cuando la empresa concierte un contrato de prestación de obras o servicios con una empresa contratista o subcontratista, deberá informar a los representantes legales de sus trabajadores sobre los siguientes extremos:

a) Nombre o razón social, domicilio y número de identificación fiscal de la empresa contratista o subcontratista.

b) Objeto y duración de la contrata.

c) Lugar de ejecución de la contrata.

d) En su caso, número de trabajadores que serán ocupados por la contrata o subcontrata en el centro de trabajo de la empresa principal.

e) Medidas previstas para la coordinación de actividades desde el punto de vista de la prevención de riesgos laborales.

Cuando las empresas principal, contratista o subcontratista compartan de forma continuada un mismo centro de trabajo, la primera deberá disponer de un libro registro en el que se refleje la información anterior respecto de todas las empresas citadas. Dicho libro estará a disposición de los representantes legales de los trabajadores."
¿Cuál es la responsabilidad existente para el nuevo empresario en la sucesión de empresa?," La responsabilidad para el nuevo empresario en la sucesión de empresa incluye cumplir con las obligaciones nacidas con posterioridad a la transmisión, responder solidariamente si la cesión fue declarada delito. Las relaciones laborales de los trabajadores afectados por la sucesión seguirán rigiéndose por el convenio colectivo que fuera de aplicación en la empresa al momento de la transmisión hasta la fecha de expiración o entrada en vigor de otro convenio colectivo nuevo. Si la empresa, centro de trabajo o unidad productiva objeto de la transmisión conserve su autonomía, el cambio de titularidad no extinguirá las relaciones laborales existentes. También debe informar a las personas trabajadoras de la identidad de la empresa principal y facilitar esta información a la Tesorería General de la Seguridad Social. En algunos casos, el nuevo empresario puede ser exento de responsabilidad si la actividad contratada se refiere exclusivamente a la construcción o reparación de una vivienda.","['2. Excepcionalmente, con el objetivo de alcanzar la igualdad real y efectiva entre mujeres \ny hombres coadyuvando a superar la segregación ocupacional por género, el límite del \napartado anterior podrá rebajarse hasta la edad ordinaria de jubilación fijada por la normativa \nde Seguridad Social cuando la tasa de ocupación de las mujeres trabajadoras por cuenta \najena afiliadas a la Seguridad Social en alguna de las actividades económicas \ncorrespondientes al ámbito funcional del convenio sea inferior al 20 por ciento de las \npersonas ocupadas en las mismas.\nLas actividades económicas que se tomarán como referencia para determinar el \ncumplimiento de esta condición estará definida por los códigos de la Clasificación Nacional \nde Actividades Económicas (CNAE) en vigor en cada momento, incluidos en el ámbito del \nconvenio aplicable según los datos facilitados al realizar su inscripción en el Registro y \ndepósito de convenios y acuerdos colectivos de trabajo y planes de igualdad (REGCON), de'
 'El cedente y el cesionario también responderán solidariamente de las obligaciones \nnacidas con posterioridad a la transmisión, cuando la cesión fuese declarada delito.\n4. Salvo pacto en contrario, establecido mediante acuerdo de empresa entre el \ncesionario y los representantes de los trabajadores una vez consumada la sucesión, las \nrelaciones laborales de los trabajadores afectados por la sucesión seguirán rigiéndose por el \nconvenio colectivo que en el momento de la transmisión fuere de aplicación en la empresa, \ncentro de trabajo o unidad productiva autónoma transferida.\nEsta aplicación se mantendrá hasta la fecha de expiración del convenio colectivo de \norigen o hasta la entrada en vigor de otro convenio colectivo nuevo que resulte aplicable a la \nentidad económica transmitida.\n5. Cuando la empresa, el centro de trabajo o la unidad productiva objeto de la \ntransmisión conserve su autonomía, el cambio de titularidad del empresario no extinguirá por'
 'No habrá responsabilidad por los actos de la contratista cuando la actividad contratada \nse refiera exclusivamente a la construcción o reparación que pueda contratar una persona \nrespecto de su vivienda, así como cuando el propietario o propietaria de la obra o industria \nno contrate su realización por razón de una actividad empresarial.\n3. Las personas trabajadoras de la contratista o subcontratista deberán ser informadas \npor escrito por su empresa de la identidad de la empresa principal para la cual estén \nprestando servicios en cada momento. Dicha información deberá facilitarse antes del inicio \nde la respectiva prestación de servicios e incluirá el nombre o razón social de la empresa \nprincipal, su domicilio social y su número de identificación fiscal. Asimismo, la contratista o \nsubcontratista deberán informar de la identidad de la empresa principal a la Tesorería \nGeneral de la Seguridad Social en los términos que reglamentariamente se determinen.']","['El cambio de titularidad de una empresa, de un centro de trabajo o de una unidad productiva autónoma no extinguirá por sí mismo la relación laboral, quedando el nuevo empresario subrogado en los derechos y obligaciones laborales y de Seguridad Social del anterior, incluyendo los compromisos de pensiones, en los términos previstos en su normativa específica, y, en general, cuantas obligaciones en materia de protección social complementaria hubiere adquirido el cedente.']","El cambio de titularidad de una empresa, de un centro de trabajo o de una unidad productiva autónoma no extinguirá por sí mismo la relación laboral, quedando el nuevo empresario subrogado en los derechos y obligaciones laborales y de Seguridad Social del anterior, incluyendo los compromisos de pensiones, en los términos previstos en su normativa específica, y, en general, cuantas obligaciones en materia de protección social complementaria hubiere adquirido el cedente."
¿Qué se considera sucesión de empresa?," Se considera sucesión de empresa cuando una empresa transfiere sus activos, su patrimonio o sus derechos y obligaciones a otra empresa. Esto se establece en el contexto del Boletín Oficial del Estado, Legislación Consolidada Página 78. También cabe destacar que la modificación de condiciones de trabajo que no alcanza los umbrales señalados para las modificaciones colectivas se considera de carácter individual (Boletín Oficial del Estado, Legislación Consolidada Página 42). Además, hay medidas de acción positiva dirigidas a eliminar o compensar situaciones de discriminación entre mujeres y hombres en la promoción económica del trabajo (Artículo 25, BOE LC Página 27).","['finalizado con la inaplicación de condiciones de trabajo deberá ser comunicado a la \nautoridad laboral a los solos efectos de depósito.BOLETÍN OFICIAL DEL ESTADO\nLEGISLACIÓN CONSOLIDADA\nPágina 78'
 'c) Treinta trabajadores, en las empresas que ocupen más de trescientos trabajadores.\nSe considera de carácter individual la modificación que, en el periodo de referencia \nestablecido, no alcance los umbrales señalados para las modificaciones colectivas.BOLETÍN OFICIAL DEL ESTADO\nLEGISLACIÓN CONSOLIDADA\nPágina 42'
 'como indirecta, entre mujeres y hombres, pudiendo establecerse medidas de acción positiva \ndirigidas a eliminar o compensar situaciones de discriminación.\nArtículo 25.  Promoción económica.\n1. El trabajador, en función del trabajo desarrollado, podrá tener derecho a una \npromoción económica en los términos fijados en convenio colectivo o contrato individual.\n2. Lo dispuesto en el apartado anterior se entiende sin perjuicio de los derechos \nadquiridos o en curso de adquisición en el tramo temporal correspondiente.BOLETÍN OFICIAL DEL ESTADO\nLEGISLACIÓN CONSOLIDADA\nPágina 27']","['A los efectos de lo previsto en este artículo, se considerará que existe sucesión de empresa cuando la transmisión afecte a una entidad económica que mantenga su identidad, entendida como un conjunto de medios organizados a fin de llevar a cabo una actividad económica, esencial o accesoria.']","A los efectos de lo previsto en este artículo, se considerará que existe sucesión de empresa cuando la transmisión afecte a una entidad económica que mantenga su identidad, entendida como un conjunto de medios organizados a fin de llevar a cabo una actividad económica, esencial o accesoria."
¿Qué efectos tiene la sucesión de empresas?," La sucesión de empresas puede tener efectos sobre el empleo, producción y ventas, y los contratos a tiempo parcial. Puede llevar a una reducción del límite de edad para la igualdad real y efectiva entre mujeres y hombres en ciertas actividades económicas cuando la tasa de ocupación de las mujeres es inferior al 20%. También puede implicar la modificación del horario y la distribución del tiempo de trabajo, el régimen de trabajo a turnos, y la planificación anual de las vacaciones. Además, la sucesión de empresas puede requerir una adaptación al ámbito de la empresa del sistema de clasificación profesional de las personas trabajadoras y de los aspectos de las modalidades de contratación que se atribuyen por esta ley a los convenios de empresa. También pueden establecerse medidas para favorecer la corresponsabilidad y la conciliación entre la vida laboral, familiar y personal. Por último, pueden establecerse otras medidas conforme a lo dispuesto en los acuerdos y convenios colectivos aplicables según el artículo 83.2.","['el empleo, así como sobre la producción y ventas, incluido el programa de producción.\nc) Sobre las previsiones del empresario de celebración de nuevos contratos, con \nindicación del número de estos y de las modalidades y tipos que serán utilizados, incluidos \nlos contratos a tiempo parcial, la realización de horas complementarias por los trabajadores \ncontratados a tiempo parcial y de los supuestos de subcontratación.BOLETÍN OFICIAL DEL ESTADO\nLEGISLACIÓN CONSOLIDADA\nPágina 66'
 '2. Excepcionalmente, con el objetivo de alcanzar la igualdad real y efectiva entre mujeres \ny hombres coadyuvando a superar la segregación ocupacional por género, el límite del \napartado anterior podrá rebajarse hasta la edad ordinaria de jubilación fijada por la normativa \nde Seguridad Social cuando la tasa de ocupación de las mujeres trabajadoras por cuenta \najena afiliadas a la Seguridad Social en alguna de las actividades económicas \ncorrespondientes al ámbito funcional del convenio sea inferior al 20 por ciento de las \npersonas ocupadas en las mismas.\nLas actividades económicas que se tomarán como referencia para determinar el \ncumplimiento de esta condición estará definida por los códigos de la Clasificación Nacional \nde Actividades Económicas (CNAE) en vigor en cada momento, incluidos en el ámbito del \nconvenio aplicable según los datos facilitados al realizar su inscripción en el Registro y \ndepósito de convenios y acuerdos colectivos de trabajo y planes de igualdad (REGCON), de'
 'trabajo a turnos.\nb) El horario y la distribución del tiempo de trabajo, el régimen de trabajo a turnos y la \nplanificación anual de las vacaciones.\nc) La adaptación al ámbito de la empresa del sistema de clasificación profesional de las \npersonas trabajadoras.\nd) La adaptación de los aspectos de las modalidades de contratación que se atribuyen \npor esta ley a los convenios de empresa.\ne) Las medidas para favorecer la corresponsabilidad y la conciliación entre la vida \nlaboral, familiar y personal.\nf) Aquellas otras que dispongan los acuerdos y convenios colectivos a que se refiere el \nartículo 83.2.\nIgual prioridad aplicativa tendrán en estas materias los convenios colectivos para un \ngrupo de empresas o una pluralidad de empresas vinculadas por razones organizativas o \nproductivas y nominativamente identificadas a que se refiere el artículo 87.1.\nLos acuerdos y convenios colectivos a que se refiere el artículo 83.2 no podrán disponer \nde la prioridad aplicativa prevista en este apartado.']","['3. Sin perjuicio de lo establecido en la legislación de Seguridad Social, el cedente y el cesionario, en las transmisiones que tengan lugar por actos inter vivos, responderán solidariamente durante tres años de las obligaciones laborales nacidas con anterioridad a la transmisión y que no hubieran sido satisfechas.\n\nEl cedente y el cesionario también responderán solidariamente de las obligaciones nacidas con posterioridad a la transmisión, cuando la cesión fuese declarada delito.\n\n4. Salvo pacto en contrario, , las relaciones laborales de los trabajadores afectados por la sucesión seguirán rigiéndose por el convenio colectivo que en el momento de la transmisión fuere de aplicación en la empresa, centro de trabajo o unidad productiva autónoma transferida.\n\n5. Cuando la empresa, el centro de trabajo o la unidad productiva objeto de la transmisión conserve su autonomía, el cambio de titularidad del empresario no extinguirá por sí mismo el mandato de los representantes legales de los trabajadores, que seguirán ejerciendo sus funciones en los mismos términos y bajo las mismas condiciones que regían con anterioridad.\n\n6. El cedente y el cesionario deberán informar a los representantes legales de sus trabajadores respectivos afectados por el cambio de titularidad, de los siguientes extremos:\n\na) Fecha prevista de la transmisión.\n\nb) Motivos de la transmisión.\n\nc) Consecuencias jurídicas, económicas y sociales, para los trabajadores, de la transmisión.\n\nd) Medidas previstas respecto de los trabajadores.\n\n8. El cedente vendrá obligado a facilitar la información mencionada en los apartados anteriores con la suficiente antelación, antes de la realización de la transmisión. El cesionario estará obligado a comunicar estas informaciones con la suficiente antelación y, en todo caso, antes de que sus trabajadores se vean afectados en sus condiciones de empleo y de trabajo por la transmisión.\n\nEn los supuestos de fusión y escisión de sociedades, el cedente y el cesionario habrán de proporcionar la indicada información, en todo caso, al tiempo de publicarse la convocatoria de las juntas generales que han de adoptar los respectivos acuerdos.\n\n9. El cedente o el cesionario que previere adoptar, con motivo de la transmisión, medidas laborales en relación con sus trabajadores vendrá obligado a iniciar un periodo de consultas con los representantes legales de los trabajadores sobre las medidas previstas y sus consecuencias para los trabajadores. Dicho periodo de consultas habrá de celebrarse con la suficiente antelación, antes de que las medidas se lleven a efecto. Durante el periodo de consultas, las partes deberán negociar de buena fe, con vistas a la consecución de un acuerdo.']","3. Sin perjuicio de lo establecido en la legislación de Seguridad Social, el cedente y el cesionario, en las transmisiones que tengan lugar por actos inter vivos, responderán solidariamente durante tres años de las obligaciones laborales nacidas con anterioridad a la transmisión y que no hubieran sido satisfechas.

El cedente y el cesionario también responderán solidariamente de las obligaciones nacidas con posterioridad a la transmisión, cuando la cesión fuese declarada delito.

4. Salvo pacto en contrario, establecido mediante acuerdo de empresa entre el cesionario y los representantes de los trabajadores una vez consumada la sucesión, las relaciones laborales de los trabajadores afectados por la sucesión seguirán rigiéndose por el convenio colectivo que en el momento de la transmisión fuere de aplicación en la empresa, centro de trabajo o unidad productiva autónoma transferida.

Esta aplicación se mantendrá hasta la fecha de expiración del convenio colectivo de origen o hasta la entrada en vigor de otro convenio colectivo nuevo que resulte aplicable a la entidad económica transmitida.

5. Cuando la empresa, el centro de trabajo o la unidad productiva objeto de la transmisión conserve su autonomía, el cambio de titularidad del empresario no extinguirá por sí mismo el mandato de los representantes legales de los trabajadores, que seguirán ejerciendo sus funciones en los mismos términos y bajo las mismas condiciones que regían con anterioridad.

6. El cedente y el cesionario deberán informar a los representantes legales de sus trabajadores respectivos afectados por el cambio de titularidad, de los siguientes extremos:

a) Fecha prevista de la transmisión.

b) Motivos de la transmisión.

c) Consecuencias jurídicas, económicas y sociales, para los trabajadores, de la transmisión.

d) Medidas previstas respecto de los trabajadores.

7. De no haber representantes legales de los trabajadores, el cedente y el cesionario deberán facilitar la información mencionada en el apartado anterior a los trabajadores que pudieren resultar afectados por la transmisión.

8. El cedente vendrá obligado a facilitar la información mencionada en los apartados anteriores con la suficiente antelación, antes de la realización de la transmisión. El cesionario estará obligado a comunicar estas informaciones con la suficiente antelación y, en todo caso, antes de que sus trabajadores se vean afectados en sus condiciones de empleo y de trabajo por la transmisión.

En los supuestos de fusión y escisión de sociedades, el cedente y el cesionario habrán de proporcionar la indicada información, en todo caso, al tiempo de publicarse la convocatoria de las juntas generales que han de adoptar los respectivos acuerdos.

9. El cedente o el cesionario que previere adoptar, con motivo de la transmisión, medidas laborales en relación con sus trabajadores vendrá obligado a iniciar un periodo de consultas con los representantes legales de los trabajadores sobre las medidas previstas y sus consecuencias para los trabajadores. Dicho periodo de consultas habrá de celebrarse con la suficiente antelación, antes de que las medidas se lleven a efecto. Durante el periodo de consultas, las partes deberán negociar de buena fe, con vistas a la consecución de un acuerdo. Cuando las medidas previstas consistieren en traslados colectivos o en modificaciones sustanciales de las condiciones de trabajo de carácter colectivo, el procedimiento del periodo de consultas al que se refiere el párrafo anterior se ajustará a lo establecido en los artículos 40.2 y 41.4.

10. Las obligaciones de información y consulta establecidas en este artículo se aplicarán con independencia de que la decisión relativa a la transmisión haya sido adoptada por los empresarios cedente y cesionario o por las empresas que ejerzan el control sobre ellos. Cualquier justificación de aquellos basada en el hecho de que la empresa que tomó la decisión no les ha facilitado la información necesaria no podrá ser tomada en consideración a tal efecto."
¿Cuáles son las causas por las que puede suspenderse un contrato de trabajo?," Las causas por las que puede suspendse un contrato de trabajo pueden ser debidas a situaciones de incapacidad temporal (con acuerdo entre ambas partes), nacimiento, adopción, guarda con fines de adopción, acogimiento, riesgo durante el embarazo, riesgo durante la lactancia, violencia de género o circunstancias legales que lo justifiquen. También se puede suspender un contrato en caso de sustitución para completar una jornada reducida por otra persona trabajadora siempre y cuando esto se justifique legalmente y se especifique en el contrato el nombre de la persona sustituida y la causa de la sustitución. También se puede suspender el contrato durante el proceso de selección o promoción para cobertura temporal de un puesto de trabajo, siempre que no sobrepase los tres meses o el plazo inferior recogido en convenio colectivo y no se pueda celebrar un nuevo contrato con el mismo objeto una vez superada dicha duración máxima. Finalmente, el contrato puede suspenderse si las personas contratadas incumplen lo establecido en el artículo 15 de la legislación laboral española.","['Las situaciones de incapacidad temporal, nacimiento, adopción, guarda con fines de \nadopción, acogimiento, riesgo durante el embarazo, riesgo durante la lactancia, violencia de \ngénero, que afecten a la persona trabajadora durante el periodo de prueba, interrumpen el \ncómputo del mismo siempre que se produzca acuerdo entre ambas partes.\nArtículo 15.  Duración del contrato de trabajo.\n1. El contrato de trabajo se presume concertado por tiempo indefinido.\nEl contrato de trabajo de duración determinada solo podrá celebrarse por circunstancias \nde la producción o por sustitución de persona trabajadora.\nPara que se entienda que concurre causa justificada de temporalidad será necesario que \nse especifiquen con precisión en el contrato la causa habilitante de la contratación temporal, \nlas circunstancias concretas que la justifican y su conexión con la duración prevista.\n2. A efectos de lo previsto en este artículo, se entenderá por circunstancias de la'
 'Asimismo, el contrato de sustitución podrá concertarse para completar la jornada \nreducida por otra persona trabajadora, cuando dicha reducción se ampare en causas \nlegalmente establecidas o reguladas en el convenio colectivo y se especifique en el contrato \nel nombre de la persona sustituida y la causa de la sustitución.\nEl contrato de sustitución podrá ser también celebrado para la cobertura temporal de un \npuesto de trabajo durante el proceso de selección o promoción para su cobertura definitiva \nmediante contrato fijo, sin que su duración pueda ser en este caso superior a tres meses, o \nel plazo inferior recogido en convenio colectivo, ni pueda celebrarse un nuevo contrato con el \nmismo objeto una vez superada dicha duración máxima.\n4. Las personas contratadas incumpliendo lo establecido en este artículo adquirirán la \ncondición de fijas.BOLETÍN OFICIAL DEL ESTADO\nLEGISLACIÓN CONSOLIDADA\nPágina 21'
 'suspensión, aunque haya terminado el año natural a que correspondan.\nEn el supuesto de que el periodo de vacaciones coincida con una incapacidad temporal \npor contingencias distintas a las señaladas en el párrafo anterior que imposibilite al \ntrabajador disfrutarlas, total o parcialmente, durante el año natural a que corresponden, el \ntrabajador podrá hacerlo una vez finalice su incapacidad y siempre que no hayan \ntranscurrido más de dieciocho meses a partir del final del año en que se hayan originado.\nCAPÍTULO III\nModificación, suspensión y extinción del contrato de trabajo\nSección 1.ª Movilidad funcional y geográfica\nArtículo 39.  Movilidad funcional.\n1. La movilidad funcional en la empresa se efectuará de acuerdo a las titulaciones \nacadémicas o profesionales precisas para ejercer la prestación laboral y con respeto a la \ndignidad del trabajador.\n2. La movilidad funcional para la realización de funciones, tanto superiores como']","['a) Mutuo acuerdo de las partes.\n\nb) Las consignadas válidamente en el contrato.\n\nc) Incapacidad temporal de los trabajadores.\n\nd) Maternidad, paternidad, adopción, guarda con fines de adopción o acogimiento, de conformidad con el Código Civil o las leyes civiles de las Comunidades Autónomas que lo regulen, siempre que su duración no sea inferior a un año, de menores de seis años o de menores de edad que sean mayores de seis años cuando se trate de menores con discapacidad o que por sus circunstancias y experiencias personales o por provenir del extranjero, tengan especiales dificultades de inserción social y familiar debidamente acreditadas por los servicios sociales competentes.\n\ne) Riesgo durante el embarazo y riesgo durante la lactancia natural de un menor de nueve meses.\n\nf) Ejercicio de cargo público representativo.\n\ng) Privación de libertad del trabajador, mientras no exista sentencia condenatoria.\n\nh) Suspensión de empleo y sueldo, por razones disciplinarias.\n\ni) Fuerza mayor temporal.\n\nj) Causas económicas, técnicas, organizativas o de producción.\n\nk) Excedencia forzosa.\n\nl) Ejercicio del derecho de huelga.\n\nm) Cierre legal de la empresa.\n\nn) Decisión de la trabajadora que se vea obligada a abandonar su puesto de trabajo como consecuencia de ser víctima de violencia de género.']","1. El contrato de trabajo podrá suspenderse por las siguientes causas:

a) Mutuo acuerdo de las partes.

b) Las consignadas válidamente en el contrato.

c) Incapacidad temporal de los trabajadores.

d) Maternidad, paternidad, adopción, guarda con fines de adopción o acogimiento, de conformidad con el Código Civil o las leyes civiles de las Comunidades Autónomas que lo regulen, siempre que su duración no sea inferior a un año, de menores de seis años o de menores de edad que sean mayores de seis años cuando se trate de menores con discapacidad o que por sus circunstancias y experiencias personales o por provenir del extranjero, tengan especiales dificultades de inserción social y familiar debidamente acreditadas por los servicios sociales competentes.

e) Riesgo durante el embarazo y riesgo durante la lactancia natural de un menor de nueve meses.

f) Ejercicio de cargo público representativo.

g) Privación de libertad del trabajador, mientras no exista sentencia condenatoria.

h) Suspensión de empleo y sueldo, por razones disciplinarias.

i) Fuerza mayor temporal.

j) Causas económicas, técnicas, organizativas o de producción.

k) Excedencia forzosa.

l) Ejercicio del derecho de huelga.

m) Cierre legal de la empresa.

n) Decisión de la trabajadora que se vea obligada a abandonar su puesto de trabajo como consecuencia de ser víctima de violencia de género."
¿Qué efectos tiene la suspensión de un contrato de trabajo?," La suspensión de un contrato de trabajo tiene los siguientes efectos:
